2019,taxonomy threat categorization threat intelligence platform
2019,practical cybersecurity digital train
2019,categorization threat impact critical national infrastructure system
2019,management versus technical perspective threat
2019,virtual reality maritime archaeology 25d virtual dive flute wreck 1659 iceland
2018,enchantment technology
2016,utilizing twitter concept learning
2013,scada threat modern airport
1998,viability modelling socially organised activity
1996,deriving information requirement design mathematics workstation visually impaired student
1972,arbitrary character set
