2018,matrix capsule em routing
2018,illustrative language understanding large-scale visual grounding image search
2018,large scale distributed neural network training online distillation
2018,said modeling individual labelers improves classification
2017,dynamic routing capsule
2017,outrageously large neural network sparsely-gated mixture-of-experts layer
2017,distilling neural network soft decision tree
2017,regularizing neural network penalizing confident output distribution
2016,using fast weight attend recent past
2016,layer normalization
2016,attend infer repeat fast scene understanding generative model
2015,deep learning
2015,distilling knowledge neural network
2014,dropout simple way prevent neural network overfitting
2014,grammar foreign language
2014,feature come from
2014,application deep belief network natural language understanding
2014,autoregressive product multi-frame prediction improve accuracy hybrid model
2013,modeling document deep boltzmann machine
2013,vocal tract length perturbation vtlp improves speech recognition
2013,speech recognition deep recurrent neural network
2013,improving deep neural network lvcsr using rectified linear unit dropout
2013,rectified linear unit speech processing
2013,new type deep neural network learning speech recognition related application overview
2013,modeling natural image using gated mrfs
2013,importance momentum initialization deep learning
2013,tensor analyzer
2012,imagenet classification deep convolutional neural network
2012,better way pretrain deep boltzmann machine
2012,improving neural network preventing co-adaptation feature detector
2012,deep neural network acoustic modeling speech recognition
2012,efficient learning procedure deep boltzmann machine
2012,deep lambertian network
2012,learning label aerial image noisy data
2012,deep mixture factor analyser
2012,robust boltzmann machine recognition denoising
2012,understanding deep belief network perform acoustic modelling
2012,visualizing non-metric similarity multiple map
2012,acoustic modeling using deep belief network
2011,generating text recurrent neural network
2011,new way learn acoustic event
2011,conditional restricted boltzmann machine structured output prediction
2011,deep generative model application recognition
2011,modeling joint density two image variety transformation
2011,transforming auto-encoders
2011,using deep autoencoders content-based image retrieval
2011,learning better representation speech sound wave using restricted boltzmann machine
2011,deep belief network using discriminative feature phone recognition
2011,deep belief net natural language call-routing
2011,discovering binary code fast document retrieval learning deep generative model
2010,gated softmax classification
2010,generating realistic image using gated mrfs
2010,phone recognition mean-covariance restricted boltzmann machine
2010,learning combine foveal glimpse third-order boltzmann machine
2010,binary coding speech spectrogram using deep auto-encoder
2010,learning represent spatial transformation factored higher-order boltzmann machine
2010,rectified linear unit improve restricted boltzmann machine
2010,learning represent visual input
2010,learning detect road high-resolution aerial image
2010,temporal kernel recurrent neural network
2010,modeling pixel mean covariance using factored third-order boltzmann machine
2010,dynamic binary latent variable model 3d human pose tracking
2010,factored 3-way restricted boltzmann machine modeling natural image
2010,phone recognition using restricted boltzmann machine
2009,deep belief network phone recognition
2009,replicated softmax undirected topic model
2009,3-d object recognition deep belief net
2009,zero-shot learning semantic output code
2009,learning generative texture model extended fields-of-experts
2009,product hidden markov model take n>1 tango
2009,factored conditional restricted boltzmann machine modeling motion style
2009,using fast weight improve persistent contrastive divergence
2009,modeling pigeon behaviour using conditional restricted boltzmann machine
2009,deep boltzmann machine
2009,scalable hierarchical distributed language model
2009,implicit mixture restricted boltzmann machine
2009,using matrix model symbolic relationship
2009,recurrent temporal restricted boltzmann machine
2009,generative versus discriminative training rbms classification fmri image
2008,visualizing data using t-sne
2008,generating facial expression deep belief net
2008,analysis-by-synthesis learning invert generative black box
2008,improving statistical language model modulating effect context word
2008,deep narrow sigmoid belief network universal approximators
2008,modeling image patch directed hierarchy markov random field
2008,using deep belief net learn covariance kernel gaussian process
2007,learning multiple layer representation
2007,recognize shape first learn generate image
2007,boltzmann machine
2007,restricted boltzmann machine collaborative filtering
2007,three new graphical model statistical language modelling
2007,semantic hashing
2007,unsupervised learning image transformation
2007,learning non-linear embedding preserving class neighbourhood structure
2007,learning multilevel distributed representation high-dimensional sequence
2007,visualizing similarity data mixture map
2007,modeling human motion using binary latent variable
2006,reducing dimensionality data neural network
2006,unsupervised discovery non-linear structure using contrastive backpropagation
2006,fast learning algorithm deep belief net
2006,inferring motor program image handwritten digit
2006,topographic product model applied natural scene statistic
2005,learning causally linked markov random field
2005,kind graphical model brain
2005,learning unreliable constraint using contrastive divergence
2005,improving dimensionality reduction spectral gradient descent
2005,contrastive divergence learning
2005,neighborhood component analysis advance neural information processing system
2005,multiple relational embedding
2005,exponential family harmonium application information retrieval
2004,reinforcement learning factored state action
2004,distinguishing text graphic on-line handwritten ink
2004,wormhole improve contrastive divergence
2004,probabilistic sequential independent component analysis
2003,energy-based model sparse overcomplete representation
2003,stochastic neighbor embedding
2003,efficient parametric projection pursuit density estimation
2003,self-supervised boosting
2003,learning sparse topographic representation product student-t distribution
2003,ups down hebb synapsis
2002,training product expert minimizing contrastive divergence
2002,classical bayesian inference neuroimaging theory
2002,relative density net new way combine backpropagation hmms
2002,learning hierarchical structure linear relational embedding
2002,global coordination local linear model
2002,desktop input device interface interactive 3d character animation
2002,local physical model interactive character animation
2002,welling hinton g e new learning algorithm mean field boltzmann machine
2002,recognizing handwritten digit using hierarchical product
2001,new view ica
2001,discovering multiple constraint frequently approximately satisfied
2001,training many small hidden markov model
2001,product hidden markov model
2001,rate-coded restricted boltzmann machine face recognition
2001,using free energy represent q-values multiagent reinforcement learning task
2001,recognizing hand-written digit using hierarchical product expert
2000,training product expert minimizing contrastive divergence
2000,extracting distributed representation concept relation positive negative proposition
2000,modelling high-dimensional data combining simple expert
2000,learning distributed representation concept relational data using linear relational embedding
2000,spiking boltzmann machine
2000,learning parse image
2000,variational learning switching state-space model
2000,smem algorithm mixture model
2000,learning distributed representation mapping concept relation linear space
1999,supervised learning multilayer neural network
1999,training product expert maximizing contrastive likelihood
1999,product expert
1999,scaling hierarchical unsupervised network
1999,unsupervised learning
1999,variational learning nonlinear gaussian belief network
1998,view em algorithm justifies incremental sparse variant
1998,cascaded redundancy reduction
1998,coaching variable regression classification
1998,comparison statistical learning method gusto database
1998,hierarchical nonlinear factor analysis topographic map
1998,neuroanimator fast neural network emulation control physics-based model
1998,glove-talkii neural network interface map gesture parallel formant speech  synthesizer control
1997,hierarchical community expert
1997,instantiating deformable model neural net
1997,modeling manifold image handwritten digit
1997,using mixture factor analyzer segmentation pose estimation
1997,generative model discovering sparse distributed representation
1997,minimizing description length unsupervised neural network
1997,using em reinforcement learning
1997,mobile robot learns place
1997,efficient stochastic source coding application bayesian network source model
1997,gtm time
1996,wake-sleep algorithm learn good density estimators
1996,simple algorithm discovers efficient perceptual code
1996,variety helmholtz machine
1996,using pair data-points define split decision tree
1996,em algorithm mixture factor analyzer
1996,parameter estimation linear dynamical system
1996,free energy coding
1996,using generative model handwritten digit recognition
1995,recognizing handwritten digit using mixture linear model
1995,using neural net instantiate deformable model
1995,alternative model mixture expert
1995,glovetalkii mapping hand gesture speech using neural network
1995,learning population code minimizing description length
1995,wake-sleep algorithm unsupervised neural network
1995,helmholtz machine
1995,helmholtz machine time
1995,using neural network monitor rare failure
1994,autoencoders minimum description length helmholtz free energy
1994,developing population code minimizing description length
1994,modified gating network mixture expert architecture
1993,hand-printed digit recognition using deformable model
1993,using mixture deformable model capture variation shape hand-printed digit
1993,keeping neural network simple minimizing description length weight
1993,simulating brain damage
1993,learning mixture model spatial coherence
1993,soft decision-directed lm algorithm blind equalization
1993,feudal reinforcement learning
1992,glove-talk neural network interface data-glove speech synthesizer
1992,combining two method recognizing hand-printed digit
1992,adaptive elastic model character recognition
1992,simplifying neural network soft weight sharing
1992,self-organizing neural network discovers surface random-dot stereograms
1992,neural network learn experience
1991,adaptive mixture local expert
1991,evaluation adaptive mixture competing expert
1991,discovering viewpoint-invariant relationship characterize object
1991,lesioning attractor network investigation acquired dyslexia
1990,mean field network learn discriminate temporally distorted string
1990,traffic recognizing object using hierarchical reference frame transformation
1990,discovering higher-order feature mean field network
1990,dimensionality reduction prior knowledge e-set recognition
1990,deterministic boltzmann learning network asymmetric connectivity
1990,preface special issue connectionist symbol processing
1990,time-delay neural network architecture isolated word recognition
1990,mapping part-whole hierarchy connectionist network
1990,unsupervised learning procedure discovers surface random-dot stereograms
1990,bootstrap widrow-hoff rule cluster-formation algorithm
1989,deterministic boltzmann learning performs steepest descent weight-space
1989,phoneme recognition using time-delay neural network
1989,gemini gradient estimation matrix inversion noise injection
1989,connectionist learning procedure
1988,distributed connectionist production system
1988,scene-based viewer-centered representation comparing shape
1988,learning representation recirculation
1988,representing part-whole hierarchy connectionist network
1987,connectionist architecture artificial intelligence
1987,learning translation invariant recognition massively parallel network
1987,horizontal-vertical delusion
1987,using fast weight deblur old memory
1987,learning guide evolution
1987,learning set filter using back-propagation
1987,separating figure ground using boltzmann machine
1986,learning representation back-propagating error
1986,separating figure ground parallel network
1986,learning symmetry group hidden unit beyond perception
1986,learning distributed representation concept
1986,experiment learning back-propagation
1986,appeal parallel distributed processing
1986,general framework parallel distributed processing
1986,distributed representation
1986,learning relearning boltzmann machine
1986,learning internal representation error propagation
1986,parallel distributed model schema sequential thought process
1986,g-maximization unsupervised learning procedure discovering regularity
1985,learning algorithm boltzmann machine
1985,symbol among neuron detail connectionist inference architecture
1985,shape recognition illusory conjunction
1985,learning parallel network
1985,solving random-dot stereograms using heat equation
1984,parallel computation controlling arm
1984,boltzmann machine constraint satisfaction network learn
1984,island move
1984,evaluating interface document processor comparison expert judgement  user observation
1984,computational solution bernstein problem
1983,parallel visual computation
1983,optimal perceptual inference
1983,massively parallel architecture ai netl thistle boltzmann machine
1983,analyzing cooperative computation
1981,role spatial working memory shape perception
1981,parallel model associative memory
1981,model information processing brain
1981,implementing semantic network parallel hardware
1981,parallel computation assigns canonical object-based frame reference
1981,frame reference mental imagery
1981,shape representation parallel system
1979,demonstration effect structural description mental imagery
1979,imagery without array
1978,representation control vision
1978,respectively reconsidered
1978,relaxation role vision
1976,using relaxation find puppet