2019,efficient dissection bicomposite problem cryptanalytic application,n/a
2019,xerox day vulnerability,area espionage country infiltration covert channel used trigger silent malware installed network critical organization  outside world extremely dangerous target country security order prevent attacker establishing channel organization take various step secure network make establishment type covert channel challenging almost impractical achieve current state art method limited ineffective paper show even strong isolation technique air-gapping network circumvented using organizational multifunction printer  establish infiltration covert channel order communicate malware installed isolated organization outside show attacker leverage light sensitivity mfp use different light source infiltrate command malware organization analyze influence light intensity distance transmission rate ambient light wavelength covert channel addition demonstrate attack real organization using  laser attached tripod stand  laser carried drone  hijacked smart bulb even connected organization network accessed controlled attacker passing car prove locating scanner inner room inside organization prevent attacker establishing covert channel show covert channel established greater distance  higher transmission rate  bits/s method used infiltrate data organization even using invisible light 
2019,9 life bleichenbachers cat new cache attack tl implementation,crypto bleichenbacher published seminal paper described padding oracle attack rsa implementation follow pkcs # v standard last twenty year researcher implementors spent huge amount effort developing deploying numerous mitigation technique supposed plug possible source bleichenbacher-like leakage however show paper implementation still vulnerable several novel type attack based leakage various microarchitectural side channel nine popular implementation tl tested able break security seven implementation practical proof-of-concept attack demonstrate feasibility using cache-like atacks  perform downgrade attack tl connection vulnerable server using beast-like man browser attack main difficulty face perform thousand oracle query required browser imposed timeout  due use adaptive chosen ciphertext query attack seems inherently sequential describe new way parallelize bleichenbacher-like padding attack exploiting available number tl server share public key certificate improvement demonstrate feasibility downgrade attack could recover  bit rsa plaintext  five available tl server  second sequential-to-parallel transformation attack independent interest speeding facilitating side channel attack rsa implementation
2019,drone cryptanalysis - smashing cryptography flicker,open sky era drone fly among u new question arises tell whether passing drone used operator legitimate purpose  illegitimate purpose  year many method suggested detect presence drone specific location however since populated area longer limit drone flight previously suggested method detecting privacy invasion attack irrelevant paper present new method detect whether specific poi  video streamed drone show applying periodic physical stimulus target/victim video streamed drone cause watermark added encrypted video traffic sent drone operator watermark detected using interception based method present algorithm detecting privacy invasion attack analyze performance algorithm using four commercial drone  show method used  determine whether detected fpv  channel used video stream poi drone  locate spying drone space also demonstrate physical stimulus applied covertly addition present classification algorithm differentiates fpv transmission suspicious radio transmission implement algorithm new invasion attack detection system evaluate two use case  evaluation show privacy invasion attack detected system - second
2018,iot go nuclear creating zigbee chain reaction,article describe new type attack iot device exploit ad hoc networking capability via zigbee wireless protocol thus cannot monitored stopped standard internet-based protective mechanism developed verified attack using philip hue smart lamp platform exploiting major bug implementation zigbee light link protocol weakness firmware update process plugging single infected lamp anywhere city attacker create chain reaction worm jump lamp physical neighbor thus stealthily infect whole city density smart lamp high enough make possible turn city smart light brick use disrupt nearby wi-fi transmission
2018,pseudo constant time implementation tl pseudo secure,today  tl connection still using cbc-mode cipher suite despite long history attack availability better option  work present three new type attack four popular fully patched implementation tl  elected use pseudo constant time countermeasure lucky  attack cbc-mode attack combine several variant prime+probe cache timing technique new extension original lucky  attack apply cross-vm attack setting capable recovering plaintext whilst requiring moderate number tl connection along way uncovered additional serious  bug four tl implementation studied three case bug lead lucky  style attack mounted remotely access shared cache work show adopting pseudo constant time countermeasure sufficient attain real security tl implementation cbc mode
2018,improved key recovery attack reduced-round aes practical data memory complexity,determining security aes central problem cryptanalysis progress area slow handful cryptanalytic technique led significant advancement eurocrypt  grassi et al presented novel type distinguisher aes-like structure far published attack based distinguisher inferior previously known attack complexity paper combine technique grassi et al several technique obtain best known key recovery attack -round aes single-key model reducing overall complexity aboutto extending technique -round aes obtain best known attack aes- use practical amount data memory breaking record attack obtained  year ago classical square attack
2018,tight bound online checkpointing algorithm,n/a
2017,eat entropy optimal recovery strategy compromised rngs,n/a
2017,acoustic cryptanalysis,n/a
2016,physical key extraction attack pc,computer broadcast secret via inadvertent physical emanation easily measured exploited
2016,new second-preimage attack hash function,work present several new generic second-preimage attack hash function first attack based herding attack applies various merkle–damgård-based iterative hash function compared previously known long-message second-preimage attack attack offer flexibility choosing second-preimage message cost small computational overhead concretely attack allows adversary replace block original target message obtain second preimage result new attack applicable construction previously believed immune second-preimage attack among others include dithered hash proposal rivest shoup’s uowhf rox construction addition also suggest several time-memory-data tradeoff attack variant allowing faster online phase even finding second preimages shorter message extend attack sequence stronger one suggested rivest’s proposal end introduce kite generator new tool attack dithering sequence small alphabet additionally analyse second-preimage security basic tree hash construction also propose several second-preimage attack time-memory-data tradeoff variant finally show new previous second-preimage attack applied even efficiently multiple short message rather single long target message available
2016,key recovery attack iterated even-mansour encryption scheme,iterated even–mansour  encryption scheme  extensively studied recent year abstraction commonly used block cipher large amount previous work iterated em concentrated security information-theoretic model central question studied paper minimal number round resulting cipher indistinguishable ideal cipher paper study similar question computational model minimal number round assuring attack recover secret key faster trivial attack  study question two natural key scheduling variant considered previous paper identical subkeys variant independent subkeys variant identical subkeys variant improve best known attack additional round show thatr=rrounds insufficient assuring security devising key recovery attack whose running time aboutn/logntimes faster exhaustive search annn-bit key independent subkeys variant also extend known  one round show forr=r exists key recovery attack whose running time faster benchmark meet-in-the-middle attack despite generic nature show attack applied improve best known attack several concrete cipher including fullaesaes reduced-round led- 
2016,bug attack,paper present new kind cryptanalytic attack utilizes bug hardware implementation computer instruction best-known example bug intel division bug resulted slightly inaccurate  extremely rare input whereas application bug viewed minor nuisance show case rsa  pohlig–hellman elgamal encryption bug security disaster decrypting ciphertexts computer multiplies even one pair number incorrectly lead full leakage secret key sometimes single well-chosen ciphertext shown recent revelation top secret nsa document edward snowden intentional hardware modification method used usa weaken security commercial equipment sent targeted organization
2016,memory-efficient algorithm finding needle haystack,one common task cryptography cryptanalysis find interesting event  exponentially large collection  ofn=nnpossible event demonstrate event likely exist particular interested finding needle defined event happen unusually high probability ofp≫/nin haystack almost uniform distribution n possible event search algorithm sample value distribution best known time/memory tradeoff finding event requireso/mpotime given memoryin paper develop much faster needle searching algorithm common cryptographic setting distribution defined applying deterministic function f random input distribution modelled random directed graph n vertex almost vertex predecessor vertex looking unusually large number predecessor given constant amount memory propose new search methodology call nestedrho p increase random graph undergo several subtle phase transition thus log-log dependence time complexity p becomes piecewise linear curve bend four time new algorithm faster theo/potime complexity best previous algorithm full range of/n<p< particular improves previous time complexity significant factor ofn−−√nfor p rangen−<p<n−n given memory show combine nestedrho technique parallel collision search technique order reduce time complexity finally show apply new search technique complicated distribution multiple peak want find peak whose probability higher p
2016,extended functionality attack iot device case smart light,paper consider security aspect internet thing  device bridge physical virtual world propose new taxonomy attack classifies four broad category interesting category  us designed functionality iot device achieve totally different effect demonstrate type attack consider case smart light  show use achieve unrelated effect first attack use smart light covert lifi communication system exfiltrate data highly secure  office building implemented attack able read leaked data distance  meter using cheap readily available equipment another attack showed attacker strobe light frequency may trigger seizure people suffering photosensitive epilepsy  experiment tested high-end lower-end smart light system ranging expensive philip hue system cheap system manufactured limitlessled addition consider weakness system tested propose feasible remedy problem found
2015,almost universal forgery attack aes-based mac,message authentication code  computes  messagemmand keykka short authentication tag hard forge whenkkis unknown one popular way processmmin scheme use variant aes cbc mode derive tag final ciphertext block paper analyze security several proposal type show vulnerable new type attack call almost universal forgery easy generate correct tag given message attacker allowed change single block
2015,reflection slide twist attack,n/a
2015,slidex attack even-mansour encryption scheme,even–mansour cryptosystem developed  attempt obtain simplest possible block cipher using one publicly known random permutation two whitening key exact security remained open  year sense lower bound proof considered known plaintexts whereas best published attack  required chosen plaintexts paper solve open problem introducing new extended slide attack  match t=ω lower bound time number known plaintexts using tight security result show simplified single-key variant even–mansour scheme exactly security original two-key scheme show apply variant slidex attack several cryptosystems including even–mansour variant add rather xors whitening key de protected decorrelation module various flavor desx reduced-round version gost addition show apply slidex attack extreme scenario cryptanalyst given partial information plaintexts use tiny amount memory
2015,new attack idea least 6 round,n/a
2015,improved single-key attack 8-round aes-192 aes-256,aes widely used block cipher today security one important issue cryptanalysis  year analysis related-key attack recently found two flavor  however strong type attack universally accepted valid attack model standard single-key attack model  round two version currently attacked case -round aes- known attack  extremely marginal requiring evaluation essentially  possible plaintext/ciphertext pair order speed exhaustive key search factor  paper introduce three new cryptanalytic technique use get first non-marginal attack -round aes-  addition new technique reduce best known time complexity combination -round -round aes- aes-
2015,new attack feistel structure improved memory complexity,feistel structure extremely important extensively researched type cryptographic scheme paper describe improved attack feistel structure  round achieve new attack combine main benefit meet-in-the-middle attack  dissection attack  example -round feistel structure n-bit input seven independent round key n /  bit mitm attack use nn time memory dissection requires nn time memory new attack requires nn time memory using known plaintext/ciphertext pair allowed use known plaintexts develop new technique rely existence multicollisions differential property deep structure order reduce memory complexityour new attack theoretical generic construction — fact use improve best known attack several concrete cryptosystems round-reduced cast- reduce memory complexity fromto full deal- reduce memory complexity fromto without affecting time data complexity extension technique applies even non-feistel structure — example case fox reduce memory complexity best known attack factor
2015,improved top-down technique differential cryptanalysis,fundamental problem differential cryptanalysis find highest entry difference distribution table  given mapping f n-bit value particular find highest diagonal entry correspond best iterative characteristic f standard bottom-up approach problem consider internal component mapping along differential characteristic multiply transition probability however provide seriously distorted estimate since various event dependent huge number low probability characteristic contributing high probability entry paper use top-down approach considers given mapping black box us input/output relation order obtain direct experimental estimate ddt entry likely much accurate particular describe three new technique reduce time complexity three crucial aspect problem finding exact value diagonal entry ddt small value n approximating diagonal entry correspond low hamming weight difference large value n finding accurate approximation ddt entry whose large value obtained many small contribution demonstrate potential contribution new technique apply simon family block cipher show experimentally previously published bottom-up estimate probability various differential significant factor describe new differential property cover round roughly probability several member
2014,dissection new paradigm solving bicomposite search problem,combinatorial search problem usually described collection possible state list possible action map current state next state pair initial final state algorithmic problem find sequence action map given initial state desired final state paper introduce new notion bicomposite search problem show solved improved combination time space complexity using new algorithmic paradigm called dissection demonstrate broad applicability new paradigm show use order untangle rubiks cube solve typical np-complete partition problem algorithm better previously described algorithm problem
2014,improved practical attack round-reduced keccak,keccak hash function winner nist’s sha- competition far showed remarkable resistance practical collision finding attack several year cryptanalysis lot effort largest number keccak round actual collision found  paper develop improved collision finding technique enable u double number precisely find within minute single pc actual collision standard keccak- keccak- modification reduce number round  apply technique -round keccak get day near collision hamming distance  case keccak-  case keccak- new attack combine differential algebraic technique us fact round keccak quadratic mapping order efficiently find pair message follow high probability differential characteristic since full keccak  round attack threaten security hash function
2014,practical-time related-key attack kasumi cryptosystem used gsm 3g telephony,last  year privacy gsm phone conversation protected a/ a/ stream cipher repeatedly shown cryptographically weak replaced new a/ a/ algorithm based block cipher kasumi paper describe new type attack called sandwich attack use construct simple related-key distinguisher   round kasumi amazingly high probability − using distinguisher analyzing single remaining round derive complete -bit key full kasumi related-key attack us  related key  data  byte memory  time completely practical complexity experimentally verified performing attack le two hour single-core pc interestingly neither technique published attack break original misty block cipher  significantly faster exhaustive search  thus indicate modification made etsi’s sage group moving misty kasumi made extremely weak related-key attack allowed imply anything resistance single-key attack consequently indication way kasumi implemented gsm g network practically vulnerable realistic attack model
2014,cryptanalysis iterated even-mansour scheme two key,iterated even-mansour  scheme generalization original -round construction proposed  use one key two key completely independent key paper methodically analyze security possible iterated even-mansour scheme two n-bit key four round show none provides n-bit security attack based new cryptanalytic technique called multibridge split cipher different part novel way analyzed independently exploiting self-similarity property analysis part key suggestion efficiently joined using meet-in-the-middle procedureas demonstration multibridge technique devise new attack  step led- block cipher reducing time complexity best known attack scheme   furthermore show technique used generic key-recovery tool combined statistical distinguishers 
2014,eat entropy - optimal recovery strategy compromised rngs,study random number generator  input rngs regularly update internal state according auxiliary input additional randomness harvested environment formalize problem designing efficient recovery mechanism complete state compromise presence active attacker knew timing last compromise amount entropy gathered since could stop producing output state becomes truly random however challenge recover within time proportional optimal solution even hardest  case  know nothing timing last state compromise amount new entropy injected since state  premature production output lead total loss added entropy used rng word challenge develop recovery mechanism guaranteed save day quickly possible compromise even aware dilemma entropy used prematurely lost entropy kept unused delay recoveryafter formally modeling rngs input show nearly optimal construction secure strong model technique inspired design fortuna rng  non-trivially adapt much stronger adversarial setting along way formal treatment fortuna enables u improve entropy efficiency almost factor two show improved construction essentially tight proving rigorous lower bound possible efficiency recovery mechanism general model problem
2014,rsa key extraction via low-bandwidth acoustic cryptanalysis,many computer emit high-pitched noise operation due vibration electronic component acoustic emanation nuisance show paper leak key used cryptographic operation surprising since acoustic information low bandwidth  many order magnitude ghz-scale clock rate attacked computer describe new acoustic cryptanalysis attack extract full -bit rsa key popular gnupg software within hour using sound generated computer decryption chosen ciphertexts experimentally demonstrate attack using plain mobile phone placed next computer sensitive microphone placed  meter away
2014,dread pirate robert acquire protect bitcoin wealth,bitcoin scheme popular talked alternative payment scheme one active part bitcoin ecosystem silk road marketplace highly illegal substance service traded run person called dread pirate robert  whose bitcoin holding estimated worth hundred million dollar today’s exchange rate october -st  fbi arrested  year old person named ross william ulbricht claiming dpr seizing small fraction bitcoin wealth paper use publicly available record trace evolution holding order find acquired tried hide authority particular trace amount seemingly received amount seemingly transferred account show silk road commission month may june september  along numerous amount seized fbi analysis demonstrates power data mining technique analyzing large payment system especially publicly available transaction graph type provided bitcoin scheme
2014,improved linear sieving technique application step-reduced led-64,paper present advanced meet-in-the-middle  attack lightweight block cipher led- improving best known attack several step-reduced variant cipher single-key related-key model particular present known-plaintext attack -step led- complexity ofand related-key attack -step led- complexity case previously known attack complexity ie  time faster exhaustive key searchwhile attack applied specific scheme led- contain several general methodological contribution first present linear key sieve technique allows exploit linear dependency key bit obtain filtering condition mitm attack block cipher similar idea previously used domain hash function first time technique applied block cipher cryptanalysis second contribution demonstrate first time splice-and-cut attack  used known-plaintext model data complexity significantly code-book size finally extend differential mitm attack aes-based design apply independently two stage side cipher using linear key sieve enhancement
2014,using random error correcting code near-collision attack generic hash-functions,paper consider problem finding near- collision hamming distance bounded byrrin genericnn-bit hash function  lamberger rijmen proposed modified version pollard’s rho method  leurent improved memoryless algorithm using available memory store chain endpoint algorithm use perfect error correcting code change near-collisions full-collisions code rare small distance paper propose using randomly chosen linear code whose decoding made efficient using available memory store error-correction table compared leurent’s algorithm experimentally verified improvement ratio aboutin small example withn=nandr=rwhich implemented single pc mathematically predicted significant improvement ratio aboutin larger example withn=nandr=r usingmemory
2013,key recovery attack 3-round even-mansour 8-step led-128 full aes2,even-mansour  encryption scheme received lot attention last couple year due exceptional simplicity tight security proof original -round construction naturally generalized r-round structure one key two alternating key completely independent key paper describe first key recovery attack one-key -round version em asymptotically faster exhaustive search  rather n-bit key use new cryptanalytic technique order improve best known attack several concrete em-like scheme case led- best previously known attack could applied   step paper develop new attack increase number attacked step  slightly faster previous attack  step us thousand time le data finally describe first attack full aes   time faster standard meet-in-the-middle attack thus violating security claim
2013,quantitative analysis full bitcoin transaction graph,bitcoin scheme rare example large scale global payment system transaction publicly accessible  downloaded full history scheme analyzed many statistical property associated transaction graph paper answer first time variety interesting question typical behavior user acquire spend bitcoins balance bitcoins keep account move bitcoins various account order better protect privacy addition isolated large transaction system discovered almost closely related single large transaction took place november  even though associated user apparently tried hide fact many strange looking long chain fork-merge structure transaction graph
