2013,collision attack 5 round sha-3 using generalized internal differential,october -nd  nist announced selection keccak scheme new sha- hash standard paper present first published collision finding attack reduced-round version keccak- keccak- providing actual collision -round version describing attack istimes faster birthday attack -round keccak- keccak- increase number round attacked   based generalized internal differential attack  use map large number keccak input relatively small subset possible output surprisingly large probability squeeze attack easier find random collision reduced target subset standard birthday argument
2012,applying cube attack stream cipher realistic scenario,n/a
2012,information data security networked future,digital information revolution begin giant alan turing claude shannon john von neumann among many others recognize power digital representation programmable computer although rooted technology time vannevar bush portrait information revolution emerged fl ourished especially form world wide web resting atop global internetthe panelist explore specifi c digital information revolution notably theory practice securing authenticating maintaining integrity information  root modern cryptography current topic area  also gain insight long-term problem identifying fi nding assuring integrity digital object general sense term  finally look understanding computer science changing  evolution affect digital world spending increasing fraction daily life
2012,efficient dissection composite problem application cryptanalysis knapsack combinatorial search problem,paper show large class diverse problem bicomposite structure make possible solve new type algorithm called dissection much better time/memory tradeoff previously known algorithm typical example problem finding key multiple encryption scheme r independent n-bit key previous error-free attack required time memory satisfyingtm=rnt even “false negatives” allowed attack could achievetm<rn/t new technique yield first algorithm never errs find possible key smaller product tm ast=nttime andm=nmmemory breaking sequential execution ofr=rblock cipher improvement ratio obtain increase unbounded way r increase allow algorithm sometimes miss solution get even better tradeoff combining dissection technique parallel collision search demonstrate generality new dissection technique show use generic way order attack hash function rebound attack solve hard knapsack problem find shortest solution generalized version rubik’s cube better time complexity  best previously known algorithm
2012,minimalism cryptography even-mansour scheme revisited,paper consider following fundamental problem simplest possible construction block cipher provably secure formal sense problem motivated even mansour develop scheme  exact security remained open  year sense lower bound proof considered known plaintexts whereas best published attack  required chosen plaintexts paper solve open problem describing new slidex attack match t = ω lower bound time number known plaintexts obtain tight bound show original two-key even-mansour scheme minimal sense simplified single key scheme half many key bit provides exactly security argued simplest conceivable provably secure block cipher show comparable lower bound memory requirement attack developing new memoryless attack applied time complexity special case d =  n/ last part paper analyze security several variant even-mansour scheme showing provide level security others lower bound proof fails delicate reason
2012,improved attack full gost,gost well known block cipher developed soviet union ’s alternative us-developed de spite considerable cryptanalytic effort recently published single key attack full -round version faster  time complexity exhaustive search february  isobe used previously discovered reflection property order develop first attack requires  data  memory  time paper introduce new fixed point property better way attack -round gost order find improved attack full gost given  data reduce memory complexity impractical  practical  without changing  time complexity given  data simultaneously reduce time complexity  memory complexity 
2012,new attack keccak-224 keccak-256,keccak hash function one five finalist nist’s sha- competition far showed remarkable resistance practical collision finding attack several year cryptanalysis lot effort largest number keccak round actual collision found  paper develop improved collision finding technique enable u double number precisely find within minute single pc actual collision standard keccak- keccak- modification reduce number round  apply technique -round keccak get day excellent near collision hamming distance  case keccak-  case keccak- new attack combine differential algebraic technique us fact round keccak quadratic mapping order efficiently find pair message follow high probability differential characteristic
2011,rfid authentication efficient proactive information security within computational security,n/a
2011,experimentally verified attack full grain-128 using dedicated reconfigurable hardware,paper describe first single-key attack recover full key full version grain- arbitrary key algorithm significantly faster exhaustive search  based new version cube tester us improved choice dynamic variable eliminate previously made assumption ten particular key bit zero addition new attack much faster previous weak-key attack simpler key recovery process since extremely difficult mathematically analyze expected behavior attack implemented rivyera new massively parallel reconfigurable hardware tested main component dozen random key test experimentally verified correctness expected complexity attack finding significant bias new cube tester  key tested first time main component complex analytical attack successfully realized full-size cipher special-purpose machine moreover also first attack truly exploit configurable nature fpga-based cryptanalytical hardware
2011,improved algebraic attack hamsi-256,hamsi one  second-stage candidate nist’s sha- competition previous attack hash function marginal attack -bit version published thomas fuhr asiacrypt  better generic attack short message fewer  -bit block  time faster straightforward exhaustive search attack paper describe different algebraic attack le marginal better best known generic attack practical message size  outperforms exhaustive search factor least  attack based observation order discard possible second preimage suffices show one hashed output bit wrong since output bit compression function hamsi- described low degree polynomial actually faster compute small number output bit fast polynomial evaluation technique rather via official algorithm
2011,breaking grain-128 dynamic cube attack,present new variant cube attack called dynamic cube attack whereas standard cube attack  find key solving system linear equation key bit new attack recovers secret key exploiting distinguishers obtained cube tester dynamic cube attack create lower degree representation given cipher make possible attack scheme resist previously known attack paper concentrate well-known stream cipher grain-  best known key recovery attack  recover  key bit number initialization round decreased   first attack run practical time complexity recovers full -bit key number initialization round grain- reduced  second attack break grain- variant  initialization round faster exhaustive search factor  finally present attack full version grain- recover full key belongs large subset −  possible key attack faster exhaustive search  possible key factor  key recovery attack best known far correctness experimentally verified rather extrapolated smaller variant cipher first time cube attack shown effective full version well known cipher resisted previous attack
2010,efficient cache attack aes countermeasure,describe several software side-channel attack based inter-process leakage state cpu’s memory cache leakage reveals memory access pattern used cryptanalysis cryptographic primitive employ data-dependent table lookup attack allow unprivileged process attack process running parallel processor despite partitioning method memory protection sandboxing virtualization method require ability trigger service perform encryption mac using unknown key encrypted disk partition secure network link moreover demonstrate extremely strong type attack requires knowledge neither specific plaintexts ciphertexts work merely monitoring effect cryptographic process cache discus detail several attack aes experimentally demonstrate applicability real system openssl linux’s dm-crypt encrypted partition  finally discus variety countermeasure used mitigate attack
2010,structural cryptanalysis sasas,paper consider security block cipher contain alternate layer invertible s-boxes affine mapping  show five-layer scheme -bit plaintexts -bit s-boxes surprisingly weak call multiset attack even s-boxes affine mapping key dependent  tested multiset attack actual implementation required  chosen plaintexts second single pc find  bit information unknown element scheme
2010,comparative power analysis modular exponentiation algorithm,paper proposes new chosen-message power-analysis attack public-key cryptosystems based modular exponentiation specific input pair used generate collision squaring operation different location two power trace unlike previous attack kind new attack applied standard implementation exponentiation process namely binary  m-ary sliding window method proposed attack also circumvent typical countermeasure montgomery powering ladder double-add algorithm effectiveness attack demonstrated experiment hardware software implementation rsa fpga powerpc processor respectively addition new collision generation method highly accurate waveform matching technique introduced detecting collision even recorded signal noisy certain amount clock jitter
2010,fast exhaustive search polynomial system f2,analyze fast solve general system multivariate equation various low degree overff well known hard problem important part many type algebraic cryptanalysis compared standard exhaustive search technique improved approach efficient asymptotically practically implemented several optimized version technique cpu gpus technique run  time faster modern graphic card powerful cpu available today solve + quadratic equation  binary variable -dollar nvidia gtx  graphic card  minute level performance solving system equation supposed ensure security level  bit turn feasible practice modest budget clear demonstration computational power gpus solving many type combinatorial cryptanalytic problem
2010,key recovery attack practical complexity aes-256 variant 10 round,aes best known widely used block cipher three version  differ key size  number round  aes- known attack faster exhaustive search aes- aes- recently shown breakable attack require   time respectively complexity much faster exhaustive search completely non-practical seem pose real threat security aes-based systemsin paper aim increase understanding aes security concentrate attack practical complexity ie attack experimentally verified show attack reduced-round variant aes-  round complexity feasible one attack us two related key  time recover complete -bit key -round version aes-  another attack break -round version aes-  time us stronger type related subkey attack  full aes- cannot directly broken attack fact  round broken low complexity raise serious concern remaining safety margin offered aes-
2010,generic analysis small cryptographic leak,side channel attack typically divided two phase collection phase attacker try measure physical property implementation analysis phase try derive cryptographic key measured information field highly fragmented since many type leakage one usually requires different type analysis paper formalize general notion leakage attack iterated cryptosystems attacker collect  one bit information intermediate state encryption round since bit computed early round usually represented low degree multivariate polynomial plaintext key bit use recently discovered cube attack generic analysis phase applied principle type leaked data however original cube attack requires extremely clean data whereas information provided side channel attack quite noisy address problem develop paper new type robust cube attack recover key even leaked bit unreliable particular show exploit trivial equation  order correct fraction measurement error arbitrarily close  finally demonstrate approach describing efficient leakage attack serpent  aes  show make robust small additional complexity
2009,cube attack tweakable black box polynomial,almost cryptographic scheme described tweakable polynomial gf contain secret variable  public variable  cryptanalyst allowed tweak polynomial choosing arbitrary value public variable goal solve resultant system polynomial equation term common secret variable paper develop new technique  solving tweakable polynomial major improvement several previously published attack type example stream cipher trivium reduced number initialization round best previous attack  requires barely practical complexity  attack  initialization round whereas cube attack find complete key variant  bit operation  trivium  initialization round  broken  bit operation trivium  initialization round broken  bit operation complexity attack almost certainly reduced  bit operation whereas previous attack heuristic adapted cryptosystem general complexity bound expected succeed random looking polynomial cube attack provably successful applied random polynomial degree n secret variable whenever number public variable exceeds d + log n complexity  d −  n + n  bit operation polynomial n amazingly low small cube attack applied block cipher stream cipher mac provided black box  long least one output bit represented  polynomial relatively low degree secret public variable
2009,cube tester key recovery attack reduced-round md6 trivium,crypto  saw introduction hash function md cube attack type algebraic attack applicable cryptographic function low-degree algebraic normal form gf paper applies cube attack reduced round md finding full -bit key -round md complexity   best key recovery attack announced far md introduce new class attack called cube tester based efficient property-testing algorithm apply md stream cipher trivium unlike standard cube attack cube tester detect nonrandom behavior rather performing key extraction also attack cryptographic scheme described nonrandom polynomial relatively high degree applied md cube tester detect nonrandomness  round  complexity applied slightly modified version md compression function distinguish  round random  complexity cube tester give distinguishers trivium reduced  round random  complexity detect nonrandomness  round  improving original -round cube attack
2008,improved related-key attack desx desx+,n/a
2008,collision-based power analysis modular exponentiation using chosen-message pair,paper proposes new chosen-message power-analysis attack public-key cryptosystems based modular exponentiation use specific input pair generate collision squaring operation different location two power trace unlike previous attack kind new attack applied standard implementation exponentiation process binary  m-ary sliding window method spa countermeasure inserting dummy multiplication also defeated  using proposed attack effectiveness attack demonstrated actual experiment hardware software implementation rsa fpga powerpc processor respectively addition new collision generation method high-accuracy waveform matching technique introduced detect collision even recorded signal noisy clock jitter
2008,rsa-past present future, celebrating -th anniversary ches -th anniversary publication rsa paper cacm talk survey major rsa-related paper published ches last  year describe research security implementation issue introduce new attack make prediction future rsa
2008,second preimage attack dithered hash function,develop new generic long-message second preimage attack based combining technique second preimage attack dean  kelsey schneier  herding attack kelsey kohno  show generic attack apply hash function using merkle-damgård construction slightly work previously known attack allow enormously control content second preimage found additionally show new attack applies several hash function construction vulnerable previously known attack including dithered hash proposal rivest  shoup’s uowhf  rox hash construction  analyze property dithering sequence used  develop time-memory tradeoff allows u apply second preimage attack wide range dithering sequence including sequence much stronger rivest’s proposal finally show existing second preimage attack  new attack applied even efficiently multiple target message general given set many target message total  r message block second preimage attack find second preimage one target message work would necessary find second preimage single target message  r message block
2008,squash - new mac provable security property highly constrained device rfid tag,describe new function called squash  ideally suited challenge-response mac application highly constrained device rfid tag exceptionally simple requires source random bit efficiently implemented processor arbitrary word size unlike ad-hoc proposal security analysis squash provably least secure rabin’s public key encryption scheme application
2008,strength concatenated hash combiner hash function weak,crypto  joux showed novel attack concatenated hash combiner instantiated merkle-damgård iterated hash function method producing multicollisions design first recent line generic attack merkle-damgård construction paper joux raised open question concerning strength concatenated hash combiner asked whether attack improved attacker efficiently find collision underlying compression function solve open problem showing even powerful adversarial scenario first introduced liskov  underlying compression function fully inverted  collision concatenated hash cannot created using fewer n/ query expand result include double pipe hash construction luck asiacrypt  one intermediate  interest provides first streamable construction provably indifferentiable random oracle model
2007,length-based cryptanalysis case thompson group,n/a
2007,remote password extraction rfid tag,side-channel attack used cryptanalyst compromise implementation secure system one powerful class side-channel attack power analysis try extract cryptographic key password examining power consumption device examine applicability threat electromagnetically coupled rfid tag compared standard power analysis attack attack unique requires physical contact device attack power analysis carried even tag attacker passive transmit data making attack hard detect proof concept describe password extraction attack class  generation  epc tag also show privacy class  generation  tag compromised attack finally examine possible modification tag rf front end help protect power analysis attack
2007,cryptanalysis sflash signature scheme,sflash signature scheme proposed patarin goubin courtois   following design introduced   sflash reputed fast recommended nessie european consortium since  best known solution implementation low cost smart card  abstract present new attack general design proposed patarin et al  allows forge signature minute practical instantiation including sflash scheme recommended nessie 
2007,practical cryptanalysis sflash,paper present practical attack signature scheme sflash proposed patarin goubin courtois  following design introduced  attack need public key requires one second forge signature message one-time computation several minute applied sflashv accepted nessie well sflashv higher security version
2007,cryptanalysis group-based key agreement protocol using subgroup distance function,introduce new approach cryptanalysis key agreement protocol based noncommutative group approach us function estimate distance group element given subgroup test shpilrain-ushakov protocol based thompson’s group f show break half key within second single pc
2006,leak secret theory application ring signature,work formalize notion ring signature make possible specify set possible signer without revealing member actually produced signature unlike group signature ring signature group manager setup procedure revocation procedure coordination user choose set possible signer includes sign message using secret key others’ public key without getting approval assistance ring signature provide elegant way leak authoritative secret anonymous way sign casual email way verified intended recipient solve problem multiparty computationsour main contribution lie presentation efficient construction ring signature general concept  first introduced cramer et al  construction signature unconditionally signer-ambiguous secure random oracle model exceptionally efficient adding ring member increase cost signing verifying single modular multiplication single symmetric encryption also describe large number extension modification application ring signature published original version work 
2006,rigorous bound cryptanalytic time/memory tradeoff,paper formalize general model cryptanalytic time/memory tradeoff inversion random function f{ n–} ↦{ n–} model contains known tradeoff technique special case based new notion stateful random graph evolution path stateful random graph depends hidden state color rainbow scheme table number classical hellman scheme prove upper bound number image y=f f inverted derive lower bound number hidden state bound hold overwhelming majority function f proof based rigorous combinatorial analysis additional natural assumption behavior online phase scheme prove lower bound worst-case time complexityt=ωnmlnnt memory complexity finally describe new rainbow-based time/memory/data tradeoff new method improving time complexity online phase  performing deeper analysis preprocessing
2006,cache attack countermeasure case aes,describe several software side-channel attack based inter-process leakage state cpu’s memory cache leakage reveals memory access pattern used cryptanalysis cryptographic primitive employ data-dependent table lookup attack allow unprivileged process attack process running parallel processor despite partitioning method memory protection sandboxing virtualization method require ability trigger service perform encryption mac using unknown key encrypted disk partition secure network link moreover demonstrate extremely strong type attack requires knowledge neither specific plaintexts ciphertexts work merely monitoring effect cryptographic process cache discus detail several attack aes experimentally demonstrate applicability real system openssl linux’s dm-crypt encrypted partition  finally describe several countermeasure mitigating attack
2006,breaking ice - finding multicollisions iterated concatenated expanded ice hash function,security hash function recently become one hottest topic design analysis cryptographic primitive since almost hash function used today  iterated design important study general security property function crypto  joux showed iterated hash function relatively easy find exponential sized multicollisions thus concatenation several hash function increase security however proof essential message block used  nandi stinson extended technique handle iterated hash function message block used twice paper consider general case prove even allow iterated hash function scan input multiple time arbitrary expanded order concatenation stronger single function finally extend result tree-based hash function arbitrary tree structure
2005,cryptanalysis skipjack reduced 31 round using impossible differential,n/a
2005,scalable hardware sparse system linear equation application integer factorization,motivated goal factoring large integer using number field sieve several special-purpose hardware design recently proposed solving large sparse system linear equation finite field using wiedemann’s algorithm however context factoring large  integer proposal marginally practical due complexity wafer-scale design alternatively difficulty connecting smaller chip huge number extremely fast interconnectsin paper suggest new special-purpose hardware device  wiedemann algorithm based pipelined systolic architecture reminiscent twirl device new architecture offer simpler chip layout interconnection improved efficiency reduced cost easy testability greater flexibility using hardware solve sparse problem widely varying size density analysis indicates standard fab technology used practice carry linear algebra step factoring -bit rsa keysas part design also independent interest describe new error-detection scheme adaptable implementation wiedemann’s algorithm new scheme used detect computational error probability arbitrarily close  negligible cost
2005,new application t-functions block cipher hash function,t-function mapping n-bit word n-bit word  ≤ <n bit output word depend bit  input word boolean operation numeric operation modern processor t-functions composition also t-functions earlier paper subject dealt “crazy” t-functions invertible mapping  single cycle permutation  paper use theory t-functions construct new type primitive md mapping  self-synchronizing hash function 
