1991,differential cryptanalysis des-like cryptosystems,data encryption standard  best known widely used cryptosystem civilian application developed ibm adopted national bureau standard mid successfully withstood attack published far open literature paper develop new type cryptanalytic attack break reduced variant de eight round minute personal computer break reduced variant de  using le  operation chosen plaintexts new attack applied variety des-like substitution/permutation cryptosystems demonstrates crucial role  design rule
1991,differential cryptanalysis snefru khafre redoc-ii loki lucifer, introduced notion differential cryptanalysis based chosen plaintext attack  described application differential cryptanalysis feal extended method known plaintext attack paper apply differential cryptanalytic method hash function snefru cryptosystems khafre redoc-ii loki lucifer
1991,differential cryptanalysis feal n-hash, introduced notion differential cryptanalysis described application de  several variant paper show applicability differential cryptanalysis feal family encryption algorithm n-hash hash function
1991,fully parallelized multi prover protocol nexp-time extended abstract,major open problem theory multiprover protocol characterize language accepted fully parallelized protocol achieve exponentially low probability cheating single round problem motivated observation probability cheating n parallel execution multiprover protocol exponentially higher probability cheating n sequential execution protocol problem solved proving language nexp-time fully parallelized multiprover protocol combining result fully parallelized version protocol ben-or et al  one-round perfect zero-knowledge protocol  obtained every nexptime language< >
1990,publicly verifiable non-interactive zero-knowledge proof,paper construct first publicly verifiable non-interactive zero-knowledge proof np statement general assumption one way permutation exist prover polynomially bounded scheme based stronger assumption trapdoor permutation exist case assume p v common random string use prove single theorem 
1990,universality next bit test,next bit test shown yao universal test source unbiased independent bit aim paper provide rigorous methodology test property source whose output distribution necessarily uniform prove surprising result natural extension next bit test even simplest case biased independent bit longer universal construct source biased bit whose bit obviously dependent yet none bit predicted probability success greater bias overcome difficulty develop new universal test arbitrary model  source randomness
1990,multiple non-interactive zero knowledge proof based single random string extended abstract,author solve two major open problem associated noninteractive zero-knowledge proof enable polynomially many provers prove writing polynomially many theorem based basis single random string construct proof general  assumption construction used cryptographic application prover restricted polynomial time much simpler earlier  proposals<>
1990,discrete log discreet,
1990,witness indistinguishable witness hiding protocol,
1989,find battleship,n/a
1989,multi-oracle interactive protocol space bounded verifier,proved multiprover model ben-or et al  noisy oracle model u feige et al  finite-state verifier accept recursive language power verifier simultaneous time bound space bound considered well< >
1989,zero knowledge proof knowledge two round,construct constant round zkips np language sole assumption oneway function exist stronger certified discrete log assumption construction yield perfect zero knowledge protocol protocol rely two novel idea one constructing commitment scheme constructing subprotocols known zero knowl- edge yet proven reveal useful information
1989,efficient identification scheme based permuted kernel extended abstract, goldwasser micali rackoff proposed new type in- teractive proof system reveals knowledge whatsoever assertion except validity practical significance proof demonstrated  fiat shamir showed use efficient zero knowledge proof quadratic residuosity establish user identity digitally sign message paper propose new zero knowledge identification scheme even faster fiat-shamir scheme using small number communicated bit simple -bit arithmetic operation compact public private key security new scheme depends np-complete algebraic problem rather factoring thus widens basis public key cryptography become dangerously dependent difficulty single problem
1989,expected polynomial time simulation zero knowledge protocol,n/a
1989,planning learning permutation group,planning defined problem synthesizing desired behavior given basic operation learning defined dual problem analyzing given behavior determine unknown basic operation algorithm solving problem context invertible operation finite-state environment developed addition obvious artificial intelligence application algorithm efficiently find shortest way solve rubiks cube test ping-pong protocol solve system equation permutation groups< >
1988,zero-knowledge proof identity,paper extend notion interactive proof assertion interactive proof knowledge lead definition unrestricted input zero-knowledge proof knowledge prover demonstrates possession knowledge without revealing computational information whatsoever  show relevance notion identification scheme party prove identity demonstrating knowledge rather proving validity assertion describe novel scheme provably secure factoring difficult whose practical implementation two order magnitude faster rsa-based identification scheme advantage thinking term proof knowledge rather proof assertion demonstrated two efficient variant scheme unrestricted input zero-knowledge proof knowledge used construction scheme need directory version scheme based parallel interactive proof  proved secure observing identification protocol proof knowledge
1988,reconstructing truncated integer variable satisfying linear congruence,n/a
1988,improvement fiat-shamir identification signature scheme, fiat shamir exhibited zero-knowledge based identification digital signature scheme require   modular multiplication per party paper describe improvement scheme reduces verifier’s complexity le  modular multiplication leaf prover’s complexity unchangedthe new variant particularly useful central computer verify real time signed message thousand remote terminal signature repeatedly verified
1988,noisy oracle problem,describe model computationally bounded verifier consults computationally unbounded oracle presence malicious fault communication line require fairness condition essence say oracle’s message arrive uncorrupted show deterministic polynomial time verifier test membership language p-space cannot test membership language p-space even allowed toss random coin private discus zero knowledge aspect model demonstrate zero knowledge test membership language p-space
1987,video scrambling technique based space filling curve,paper propose video scrambling technique scan picture stored frame buffer along pseudo-random space filling curve describe several efficient method generating cryptographically strong curve show actually decrease bandwidth required transmit picture
1987,zero knowledge proof identity,paper extend notion zero knowledge proof membership  zero knowledge proof knowledge  formally defining notion show relevance identification scheme party prove identity demonstrating knowledge rather proving validity assertion describe novel scheme provably secure factoring difficult whose practical implementation two order magnitude faster rsa-based identification scheme last part paper consider question sequential versus parallel execution zero knowledge protocol define new notion “transferable information” prove parallel version identification scheme  secure since reveals transferable information
1986,polymorphic array novel vlsi layout systolic computer,n/a
1986,prove practical solution identification signature problem,paper describe simple identification signature scheme enable user prove identity authenticity message user without shared public key scheme provably secure known chosen message attack factoring difficult typical implementation require   number modular multiplication required rsa scheme due simplicity security speed scheme ideally suited microprocessor-based device smart card personal computer remote control system
1986,shear sort true two-dimensional sorting technique vlsi network,n/a
1986,optimal sorting algorithm mesh connected computer,
1985,number-theoretic function equivalent number divisor,n/a
1985,security ping-pong protocol implemented using rsa,security rsa implementation ping-pong protocol considered shown obvious rsa property “multiplicativity” endanger security ping-pong protocol namely ping-pong protocol secure general implementation using “ideal rsa” also secure
1985,security de,purpose note describe anomaly found structure s-boxes data encryption standard anomaly potentially dangerous far let successful cryptanalytic attack significance still unknown clearly demonstrate deficiency current certification technique need provably secure cryptosystems
1985,efficient factoring based partial information,many recently proposed cryptosystems based assumption factoring large composite integer computationally difficult paper examine assumption cryptanalyst “side information” available
1985,polymorphic array architecture programmable systolic machine,n/a
1985,cryptographic security truncated linearly related variable,paper describe polynomial time algorithm computing value variable x … xk bit linear relationship known algorithm essentially optimal use information sense applied soon value xi become uniquely determined constraint cryptanalytic significance demonstrated two application breaking linear congruential generator whose output truncated breaking blums protocol exchanging secret
1984,expose eavesdropper,
1984,cryptanalysis certain variant rabins signature scheme,n/a
1984,generalized write-once memory,storage medium digital optical disc prom punched card consist number write-once bit position  wit initially contains  may later irreversibly overwritten r rivest shamir shown write-once memory  reused efficiently generalized woms considered basic storage element two possible state legal state transition described arbitrary directed acyclic graph capability memory depend depth graph rather size decision problem associated generalized woms np-hard even  -ary symbol rewritten several time multiple value rewritten
1984,polynomial-time algorithm breaking basic merkle-hellman cryptosystem,merkle-hellman cryptosystem one two major public-key cryptosystems proposed far shown basic variant cryptosystem element public key modular multiple superincreasing sequence breakable polynomial time
1984,efficient signature scheme based polynomial equation,signature based polynomial equation modulo n introduced ong schnorr shamir  extend original binary quadratic oss-scheme algebraic integer far generalised scheme vulnerable recent algorithm pollard solving   + k   =  broken original scheme
1984,identity-based cryptosystems signature scheme,paper introduce novel type cryptographic scheme enables pair user communicate securely verify other’s signature without exchanging private public key without keeping key directory without using service third party scheme assumes existence trusted key generation center whose sole purpose give user personalized smart card first join network information embedded card enables user sign encrypt message sends decrypt verify message receives totally independent way regardless identity party previously issued card updated new user join network various center coordinate activity even keep user list center closed card issued network continue function completely decentralized way indefinite period
1984,efficient signature scheme based quadratic equation,electronic message document check must authenticated digital signature forgeable even recipient rsa system generate verify signature message requires hundred high precision modular multiplication implemented efficiently special purpose hardware paper propose new signature scheme easily implemented software microprocessor signature generation requires one modular multiplication one modular division signature verification requires three modular multiplication key size comparable rsa system new scheme based quadratic equation = + k  message signature k n publicly known key cannot prove security scheme equivalent factoring known method solving quadratic equation arbitrary k require extraction square root modulo n solution similar problem least hard factoring novel property new scheme legitimate user choose k way sign message even without knowing factorization n thus everyone use modulus one know factorization
1983,method obtaining digital signature public-key cryptosystems reprint,encryption method presented novel property publicly revealing encryption key thereby reveal corresponding decryption key two important consequence courier secure mean needed transmit key since message enciphered using encryption key publicly revealed intended recipient decipher message since know corresponding decryption key message “signed” using privately held decryption key anyone verify signature using corresponding publicly revealed encryption key signature cannot forged signer cannot later deny validity signature obvious application “electronic mail” “electronic fund transfer” system message encrypted representing number raising publicly specified power e taking remainder result divided publicly specified product n two large secret prime number p q decryption similar different secret power used e * =  *  security system rest part difficulty factoring published divisor n
1983,embedding cryptographic trapdoors arbitrary knapsack system,n/a
1983,generation cryptographically strong pseudorandom sequence,
1983,cryptographic security single rsa bit,ability “hide” one bit trapdoor function recently gained much interest cryptography research great importance many transaction protocol paper study cryptographic security rsa bit particular show unless cryptanalyst completely break rsa encryption heuristic us determine least significant bit cleartext must error probability greater /—ε similar result shown rabins encryption scheme
1982,reuse write-once memory,n/a
1982,polynomial time algorithm breaking basic merkle-hellman cryptosystem,cryptographic security merkle-hellman system  major open problem since  paper show element public key alan modular multiple superincreasing sequence  almost equation form∑=lnxiai=bxi∈{}can solved polynomia time thus cleartexts xlxn correspond given ciphertexts b easily found
1982,reuse write-once memory preliminary version,storage medium digital optical disk prom paper tape consist number -&-ldquowrite-once-&-rdquo bit position  wit initially contains -&-ldquo-&-rdquo may later irreversibly overwritten -&-ldquoi-&-rdquo demonstrate -&-ldquowrite-once memories-&-rdquo  -&-ldquorewritten-&-rdquo surprising degree example  wit suffice represent -bit value way later updated represent -bit value large k  k wit suffice represent k-bit value way similarly updated surprising allowing writes k-bit value requires + wit fixed k fixed approximately kt/log wit required k -&-rarr @@@@ n-wit wom shown -&-ldquocapacity-&-rdquo  nlog bit
1981,t=o2n/2 s=o2n/4 algorithm certain np-complete problem,n/a
1981,generation cryptographically strong pseudo-random sequence,n/a
1981,generation cryptographically strong pseudo-random sequence,paper show generate short random seed long sequence pseudo-random number ri problem computing one ri value given arbitrarily large subset value provably equivalent cryptanalysis associated rivest-shamir-adleman encryption function
1980,security merkle- hellman cryptographic scheme corresp,simplified version merkle-hellman public key cryptographic system breakable full-fledged system seems resistant cryptanalytic attack propose result suggests way security system enhanced
1980,power commutativity cryptography,every field need unifying idea applicable wide variety situation cryptography notion commutativity seems play role paper survey potential application generation common key challenge-and-response identification signature generation verification key-less communication remote game playing
1980,cryptographic security compact knapsack preliminary report, merkle hellman introduced knapsack-based public-key cryptosystem received widespread attention two major open problem concerning cryptosystem  security difficult merkle-hellman knapsack  efficiency huge key size reduced paper analyze cryptographic security knapsack problem small key develop new type algorithm solving use algorithm show certain assumption difficult find hidden trapdoors merkle-hellman knapsack solve general knapsack problem
1979,share secret,paper show divide data n piece way easily reconstructable k piece even complete knowledge k -  piece reveals absolutely information technique enables construction robust key management scheme cryptographic system function securely reliably even misfortune destroy half piece security breach expose one remaining piece
1979,factoring number olog n arithmetic step,n/a
1979,linear time algorithm finding minimum cutsets reducible graph,n/a
1979,s^2 = o2^n time/space tradeoff certain np-complete problem,paper develop general purpose algorithm solve number np-complete problem time = space = algorithm generalized family algorithm whose time space complexity related t·s = problem handle characterized decomposition axiom include knapsack problem exact satisfiability problem set covering problem etc new algorithm considerable cryptanalytic significance since break merkle-hellman public key cryptosystem whose recommended size n = 
1979,cryptocomplexity knapsack system,recent trend cryptographic system base encryption/decryption function np-complete problem particular knapsack problem analyze security system need complexity theory le worst-case oriented take account extra condition imposed problem make cryptographically useful paper consider two class one-to-one onto knapsack system analyze complexity recognizing solving instance introduce new complexity measure  show complexity inversely proportional density knapsack system tradeoff result based fast probabilistic knapsack solving algorithm applicable one-to-one system indicates knapsack-based cryptographic system one encrypt sign message relatively insecure end paper new  security specific knapsack system
1978,method obtaining digital signature public-key cryptosystems,encryption method presented novel property publicly revealing encryption key thereby reveal corresponding decryption key two important consequence  courier secure mean needed transmit key since message enciphered using encryption key publicly revealed intented recipient decipher message since know corresponding decryption key  message “signed” using privately held decryption key anyone verify signature using corresponding publicly revealed encryption key signature cannot forged signer cannot later deny validity signature obvious application “electronic mail” “electronic fund transfer” system message encrypted representing number raising publicly specified power e taking remainder result divided publicly specified product n two large secret primer number p q decryption similar different secret power used e * ≡  *  security system rest part difficulty factoring published divisor n
1978,convergence function fixedpoints recursive definition,n/a
1977,optimal approach recursive program,classical fixedpoint approach toward recursive program suggests choosing “least defined fixedpoint” appropriate solution recursive program new approach described introduces “optimal fixedpoint” contrast least defined fixedpoint embodies maximal amount valuable information embedded program practical implication approach discussed technique proving property optimal fixedpoints given presentation informal emphasis example
1977,data type object,paper present new approach semantics data type type incorporated element domain data object approach allows type subtypes allows genuinely polymorphic function give precise semantics recursive type definition  addition approach yield simple straight forward method proving type property recursive definition method include new fixedpoint rule permit case analysis
1976,theoretical aspect optimal fixed point,n/a
1976,complexity timetable multicommodity flow problem,n/a
1975,complexity timetable multi-commodity flow problem,primitive version gotliebs timetable problem shown np-complete therefore common timetable problem np-complete polynomial time algorithm case teacher binary shown theorem meeting function always exists teacher class time constraint proved multi-commodity integral flow problem shown np-complete even number commodity two true directed undirected case finally two commodity real flow problem undirected graph shown solvable polynomial time time bound
1975,optimal fixedpoint recursive program,paper new fixedpoint approach towards semantics recursive program presented fixedpoint defined recursive program semantics contains sense maximal amount “interesting” information extracted program optimal fixedpoint  may strictly defined program least fixedpoint consider theoretical computational aspect approach well technique proving property optimal fixedpoint given recursive program
