1977,terminal-oriented communication system,paper describes system full-duplex communication time-shared computer terminal system consists communication computer directly connected time-shared system number small remote computer terminal attached connecting medium speed telephone line service large number terminal various type overall system design presented along algorithm used solve three specific problem local echoing error detection correction telephone line multiplexing character output
1977,note design euclid,euclid language writing system program verified believe verification reliability closely related hard reason program using language feature difficult write program use properly paper discus number issue design euclid including topic scope name aliasing module type-checking confinement machine dependency give reason expectation programming euclid reliable  programming pascal euclid based
1976,reflection operating system design,main feature general purpose multiaccess operating system developed cdc  berkeley presented good bad point discussed appear retrospect distinctive feature design use capability protection organization system sequence layer building facility provided earlier one protecting malfunction later one serious problem maintaining protection layer level added memory hierarchy problem discussed new solution described
1975,synchronization introduction session chairman,discussion session centered around two aspect synchronization problem abstract model primarily local synchronization synchronization network long delay lost message duplication message crash communicating party two presentation abstract model  one network problem  supported several working paper presentation session 
1974,protection, model given reflect property existing mechanism enforcing protection access control together possible implementation property existing system explicated term model implementation
1974,redundancy robustness memory protection,control access memory major problem design protection mechanism especially system allow file mapped addressable memory use abstract model memory addressing explain space possible organization examine implication protection analysis access path data allows drawn amount redundancy memory addressing scheme possible consequence error integrity protection system
1974,transfer control context,describe single primitive mechanism transferring control one module another show mechanism together suitable facility record handling storage allocation used construct variety higher-level transfer discipline procedure function call coroutine linkage non-local gotos signal specified implemented compatible way convention storage allocation name binding associated control transfer also programmer control two new control discipline defined  generalization coroutines facility handling error unusual condition arise program execution example drawn modular programming language facility described implemented
1973,note confinement problem,onfining program execution cannot transmit information program except caller set example attempt stake boundary problem necessary condition solution stated informally justified
1969,dynamic protection structure,general problem pervades entire field operating system design construction protection mechanism come many different form ranging hardware prevents execution input/output instruction user program password scheme identifying customer log onto time-sharing system paper deal one aspect subject might called meta-theory protection system information specifies protection authorizes access protected manipulated thus example memory protection system decides whether program p allowed store location concerned p obtains permission pass program
1968,scheduling philosophy multiprocessing system,collection basic idea presented evolved various worker past four year provide suitable framework design analysis multiprocessing system notion process state vector discussed nature basic operation process considered connection process protection analyzed general approach priority-oriented scheduling described relationship conventional interrupt system explained aspect time-oriented scheduling considered implementation scheduling mechanism analyzed detail feasibility embodying hardware established finally several method interlocking execution independent process presented compared
1967,online editor,online interactive system text editing described detail remark theoretical experimental justification form emphasis throughout system providing maximum convenience power user notable feature ability handle piece text content-searching facility character-by-character editing operation editor programmed limited extent
