1977,isomorphism density np complete set,$np$ complete set isomorphic deterministic polynomial time mapping  $p  np$ ptape complete set p-isomorphic $p  {{ptape}}$ show $np$ complete set known  indeed p-isomorphic known ptape complete set show spite radically different origin attempted simplification set known $np$ complete set identical simple isomorphic coding computable deterministic polynomial timefurthermore $np$ complete set p-isomorphic must similar density example language single letter alphabet $np$ complete sparse language arbitrary alphabet $np$ complete show complete set exptime exptape cannot sparse therefore cannot single letter alphabet similarly show hardest context-sensitive language cannot sparse also relate existence sparse complete set existence simple combinatorial circuit corresponding truncated recognition problem language
1977,relation diagonalization proof system complexity gap preliminary version,paper study diagonal process time-bounded computation one-tape turing machine diagonalizing machine exist formal proof operate given time bound replaces traditional “clock” resource bounded diagonalization formal proof running time establishes close relation property proof system existence sharp time bound one-tape turing machine complexity class furthermore diagonalization method show gap theorem resource bounded computation hold complexity class consisting language accepted turing machine formally proven run required time bound
1977,polynomial time isomorphism complete set,note show recently discovered np complete set arising number theory ptape complete set arising game theory exptape complete set arising algebraic word problem polynomial time isomorphic previously known complete set corresponding category
1976,structure feasible computation,theory computational complexity study quantitative aspect computing active area computer science research year time computational complexity theory developed rapidly become principal part theoretical computer science one active research area computer science development computational complexity theory divided roughly two part first phase development established general property specific computational measure computation time memory used provided elegant axiomatic approach systematic investigation property common computational complexity measure purpose chapter give overview development study feasible computation give insight recent  well appreciation unity structure emerged area research achieve goal chapter treat selected set topic illustrate major idea show unity emerging understanding emphasize essential open problem
1976,effective speed-up long proof trivial theorem formal theory,note give simple proof show many interesting formal mathematical theory axiomatizable well decidable one every given formalization effectively find infinite subset trivially true theorem require long proof given formalism hardest theorem theory thus showing theory every formalism doomed blind triviality infinite set theorem found effectively furthermore follows  constructable tape time bound exist set whose recognition effectively speeded infinite subset set appear naturally thus showing many concrete problem every algorithm effectively sped-up infinite subset
1976,tape bound single letter alphabet language processing,paper show tape bounded complexity class language single letter alphabet  closed complementation use  show mean diagonalization exists infinite hierarchy tape bounded complexity class sla language log log n log n tape bound hand show power diagonalization sla input le log n tape limited proving every infinite sla language accepted using le log n tape contains infinite regular subset result immediately follows set prime unary notation p requires exactly log n tape recognition every infinite subset p requires least log n tape
1975,computational complexity formal translation,purpose paper define mathematical model study quantitative problem translation universal language investigate problem  derived paper deal efficiency translated algorithm optimality translation complexity translation process different language
1975,simple godel numbering translation,paper consider class goedel numbering viewed simple model programming language goedel numbering translated computationally simple mapping several class goedel numbering defined property investigated example one class studied class goedel numbering goedel numbering translated finite automaton mapping also compare class goedel numbering class optimal goedel numbering show translation optimal goedel numbering computationally arbitrarily complex thus indicating computer science point view optimal goedel numbering undesirable property
1975,note tape bound sla language processing,note show tape bounded complexity class language single letter alphabet closed complementation use result show exists infinite hierarchy tape bounded complexity class sla language log n log log n tape bound also show every infinite sla language recognizable le log n tape infinitely many different regular subset therefore set prime unary notation p requires exactly log n tape recognition every infinite subset p requires least log n tape
1974,power multiplication random access machine,consider random access machine multiplication operation added capability computing logical operation register considered integer vector bit arithmetic boolean operation may used register prove counting one operation unit time considering machine acceptor deterministic nondeterministic polynomial time acceptable language exactly language recognizable polynomial tape turing machine observe measure machine without multiplication polynomially related turing machine time-thus added computational power due multiplication random access machine equivalent computational power polynomially tape-bounded turing machine computation polynomially time-bounded computation therefore formulation harder multiply add ptape = ptime turing machine also discus instruction set random access machine computational power
1974,structure feasible computation,last four year research lower level computational complexity yielded rich set interesting  revealed deep unexpected connection various problem thus brought new unity area computer science work also yielded new technique insight likely application identified central problem quantitative theory computing purpose paper give reader overview development insight  application well appreciation unity structure emerged area research
1974,simple goedel numbering translation,paper consider class goedel numbering viewed simple model programming language goedel numbering translated computationally simple mapping several class goedel numbering defined property investigated example one class studied class goedel numbering goedel numbering translated finite automatic mapping also compare class goedel numbering class optimal goedel numbering show translation optimal goedel numbering computationally arbitrarily complex thus indicating computer science point view optimal goedel numbering undesirable property
1973,group theoretic characterization linear permutation automaton,paper characterize permutation automaton linearly realized field gf term group generated automaton group theoretic characterization linear permutation automaton derive among  complete characterization homomorphism linear automaton yield linearly realizable image automaton well several  structure linear automaton
1973,problem finding natural computational complexity measure,develop abstract theory deal quantitative aspect computing need deeper understanding define ``natural computational complexity measure axiomatically end paper summarizess principal property hold natural complexity measure measure proposed desirable property natural measure paper discus nature property study interrelation possible value towards defining natural computational complexity measure number open problem discussed direction research suggested
1972,non-determinancy simple computing device,summarythis paper study one-tape turing machine k read-only head restricted original input main result show set accepted -head non-deterministic turing machine accepted deterministic turing machine read-only head deterministic non-deterministic context-sensitive language identical several related  derived tantalizing open problem discussed
1971,overview theory computational complexity,purpose paper outline theory computational complexity emerged comprehensive theory last decade theory concerned quantitative aspect computation central theme measuring difficulty computing function paper concentrate study computational complexity measure defined computable function make attempt survey whole field exhaustively present material historical order rather present basic concept  technique computational complexity new point view idea easily understood fit together coherent whole
1971,use list study undecidable problem automaton theory,many problem automaton theory unsolvable classified intodegrees unsolvability relative difficulty note natural reference set presented belong complete degree level arithmetic hierarchy also question regarding list recursively enumerable set considered  resolve apparent peculiarity provide simple method determining degree unsolvability several well-known problem permit easy construction natural problem high degree unsolvability
1971,computational complexity random access stored program machine,paper explore computational complexity measure defined running time program random access stored program machine rasp purpose work study realistic complexity measure provide setting technique explore different computer organization interesting  paper obtained argument size computed function example show  exist arbitrarily complex function optimal rasp program whose running time cannot improved multiplicative constant show furthermore optimal program cannot fixed procedure determine difference computation speed fixed procedure self-modifying program technique used compare computation speed machine without built-in multiplication conclude paper look machine associative memory distributed logic machine
1971,complexity formal translation speed-up result,purpose paper give model study quantitative problem formal translation one programming language another well derive initial  speed program produced translation paper also contains new speed-up result show computational complexity measure exist function arbitrarily large speed-ups size speed-up program must grow non-computably fast
1970,make language theory problem undecidable,theory automaton formal language undecidability various property studied specific class language abstract essence various proof undecidability find wide class property general condition family language proof undecidability hold paper also illustrates manner degree undecidability property change consider complicated family language
1970,note one-way two-way automaton,purpose note show exist non-regular language whose memory requirement recognition one-way two-way automaton differ double exponential difference cannot exceeded
1970,r70-1 note computing time recognition context- free language single-tape turing machine,although considerable progress made understanding algebraic property context-free language quantitative aspect recognition parsing context- free language still far well understood shown kasami younger every context-free language exists multitape turing machine recognizes language us n  operation process input word length n one-tape turing machine hartmanis showed using younger algorithm every context-free language recognized n  operation result improved paper review shown careful implementation toriikasamiozaki algorithm one-tape turing machine every context-free language recognized n  operation like n  operation multitape result known good time bound hand author able show paper linear context-free language n  least-upper time bound recognition one-tape turing machine done showing every linear language n-recognizable recalling linear language whose recognition requires n operation one-tape machine
1969,automata-based computational complexity,automaton theory study abstract computing device organization structure computational power thus automaton theory necessarily linked part mathematics concerned constructability go study constructability investigating variety abstract computing device perform construction relating device algorithm execute characterizing simplicity operationan important goal automaton theory understand computational process relation various class problem theory must go beyond notion computability include measure difficulty computation difficulty related organization machine performs computationtwo natural measure computational difficulty computation time amount memory required perform computation given computing device measure yield rich computational complexity structure computable function variety  established complexity class ordering dependence organization computing device interesting application memory-limited computation achieved study context-free context-sensitive language several infinite hierarchy complexity class language obtained
1969,complexity undecidable problem automaton theory,general  hierarchy undecidable problem automaton theory given study described show property set accepted automaton  change decidable undecidable problem computational power automaton increased work also yield unified technique characterize different language large class undecidable problem
1969,two memory bound recognition prime automaton,paper establishes two bound rate growth memory automaton recognize set prime
1968,computational complexity one-tape turing machine computation,quantitative aspect one-tape turing machine computation considered shown instance exists sharp time bound must reached recognition nonregular set sequence shown computation time used characterize complexity recursive set sequence several  obtained classification  applied recognition speed context-free language shown among thing recursively undecidable much time required recognize nonregular context-free language one-tape turing machine several unsolved problem discussed
1968,recognition prime automaton,study problem recognizing set prime automaton presented simple algebraic condition derived show neither set prime infinite subset set prime accepted pushdown finite automatonin view result interesting open problem determine weakest automaton accept set prime shown linearly bounded automaton accept set prime conjectured automaton whose memory grows le rapidly recognize set prime one  show conjecture true cannot proved use argument distribution prime described prime number theorem relation established two classical conjecture number theory minimal rate memory growth automaton recognize set prime
1968,tape-reversal bounded turing machine computation,paper study classification recursive set number tape reversal required recognition two-tape turing machine one-way input tapethis measure yield rich hierarchy tape-reversal limited complexity class property ordering investigated striking difference previously studied complexity measure lie fact speed-up theorem hold slowly growing tape-reversal complexity class difference discussed several relation different complexity measure language established
1968,structure undecidable problem automaton theory,purpose paper gain better understanding structure undecidable problem automaton theory investigating degree unsolvability problem achieved using turing machine oracle define one undecidable problem reduced another establish infinite hierarchy  undecidable problem hierarchy used classify well-known undecidable problem various family automaton formal language study relation problem approach reveals well defined structuring undecidable problem permit systematic study problem relation various family automaton
1968,tape reversal complexity hierarchy,paper study classification recursive set number tape reversal required recognition two-tape turing machine one-way input tapethis measure yield rich hierarchy tape-reversal limited complexity class property ordering investigated striking difference previously studied complexity measure lie fact speed-up theorem hold slowly growing tape-reversal complexity class difference discussed several relation different complexity measure language established
1967,memory requirement context-free language recognition,purpose note show recursively undecidable much tape required turing machine recognize nonregular context-free language
1967,homomorphic image linear sequential machine,paper investigate homomorphism state behavior linear machine characterize homomorphic image  applied characterize nonlinear machine realized larger linear machine
1966,minimal feedback realization sequential machine,note define amount feedback realization sequential machine give simple algorithm compute minimal amount feedback present realization give canonical realization us minimal amount feedback
1965,two test linearity sequential machine,paper describes two test existence linear state assignment binary input sequential machine first test based ``transfer sequence map one stationary state machine onto another stationary state shown minimal transfer sequence machine one read directly linear assignment machine one exists second test us ``ignorance computation mean partition previously developed  sequential machine structure
1965,hierarchy memory limited computation,paper investigates computational complexity binary sequence measured rapidity generation multitape turing machine translational method escape limitation earlier approach lead refinement established hierarchy previous complexity class shown posse certain translational property related hierarchy complexity class monotonic function examined
1965,memory bound recognition context-free context-sensitive language,paper investigates computational complexity binary sequence measured rapidity generation multitape turing machine translational method escape limitation earlier approach lead refinement established hierarchy previous complexity class shown posse certain translational property related hierarchy complexity class monotonic function examined
1964,pair algebra application automaton theory,n/a
1964,computational complexity recursive sequence,paper investigate number function sequence classified according computational complexity computational complexity measured fast number function computed multitape computer  shown mean measure computational complexity number function submitted rigorous mathematical study number  obtained
1964,application pair algebra automaton theory,paper define discus generalization partition pair sequential machine object generalization suggest unified approach problem information flow machine structure
1963,regularity preserving modification regular expression,paper concerned problem determining whether set sequence r obtained given rule regular set sequence r regular set number problem solved paper basic technique used easy apply problem type technique yield explicit construction sequential machine recognizes sequence r r regular setamong thing shown  derivative regular set r respect set sequence w regular set although regular expression designating set cannot general computed  set sequence obtained regular set r removing “arbitrary halves” sequence r set removed “halves” regular set  set sequence obtained regular set r making k change consecutive digit sequence r regular  set sequence concatenated one one way sequence r regular
1963,result structure sequential machine,n/a
1963,study feedback error sequential machine,object paper study feedback sequential machine classify  analyze error arise state transition machine establish relation feedback error shown previously developed algebraic method supply necessary tool rigorous basis theory relate new  previously obtained  structure sequential machine example work yield necessary method detect existence decomposition machine component machine ``serious error computation occur isolated component machine lead possibility imposing selectively different reliability condition component machine achieve high over-all reliability realization
1962,loop-free structure sequential machine,object paper study realization sequential machine several smaller machine basic tool investigation partition substitution property partition pair shown every  realization sequential machine n smaller machine corresponds set n partition substitution property whose product zero partition conversely shown every set n partition corresponds realization given sequential machine n smaller machine natural ordering partition reflected information flow corresponding component machine algebraic operation defined partition corresponding realization govern modification realization finally shown amount information flowing component machine realization studied mean partition pair
1962,danger state reduction sequential machine,paper investigate negative effect state reduction realization sequential machine shown state reduction destroy realization given sequential machine set smaller machine thus lead sequential machine harder realizeto understand reason state reduction carried several  obtained describe change structure sequential machine state reduction seen undesirable effect state reduction closely associated failure certain distributive law hold partition used state reduction partition used realization unreduced machine
1962,maximal autonomous clock sequential machine,sequential machinies contain input-independent part therefore input-inependent machine  input-dependent machine necessary sufficient condition flow table obtained existence autonomous clock sequential machine property machine clock studied
1961,state assignment problem sequential machine,paper problem determining economical state assignment finite-state sequential machine studied fundamental idea study find method selection assignment binary variable describing new state depends variable old state possible general variable assignment dependence reduced yield economical implementation sequential machine assignment dependence reduced main tool used study partition substitution property set state sequential machine shown sequential machine existence assignment reduced dependence closely connected existence partition substitution property set state machine shown determine partition given sequential machine used obtain assignment reduced dependence
1961,state assignment problem sequential machine ii,object paper find state assignment internal state sequential machine logical equation representing machine relatively simple done finding assignment computation particular state variable depends previous value small subset variable chief tool concept partition pair describes  information going resulting evaluation state variable necessary sufficient condition existence assignment reduced dependence found term pair algebraic property worked handled generated shown method also used find input output assignment reduced dependence case ``dont care condition considered theory seen apply except failure algebraic property make weaker
1960,symbolic analysis decomposition information processing machine,paper study problem replacing  complex finite state sequential machine several simpler one operate parallel yield result first part give necessary mathematical   second part apply  derive necessary sufficient condition existence decomposition given machine decomposition exists required simpler machine connected parallel given
1959,application basic inequality entropy,paper part general study efficient information selection storage processing assumed information contained binary time series generated stochastic source main problem determine approximate statistical property information source lower order probability distributionsfirst determined restriction imposed known lower order probability distribution higher order distribution determined estimated study suggests optimal way estimate higher order distributionsin second part entropy change occur going lower higher order probability distribution studied upper lower bound entropy higher order distribution computed term entropy lower order distribution  allow computation “strength” condition imposed higher order distribution induced lower order one one compute importance knowing higher order probability distribution information processing   applied coding problem determine delay required encoding message order achieve prescribed fraction optimal comparison given shannon coding theorem
