2012,turing computational model,panel presentation discus beauty simplicity turing machine formulation previously elusive concept computability intuitively satisfying explanation power limitation computability also review turing machine model provided simple proof deep  logic including gödel’s incompleteness theorem panel also examine specifi c  computer science infl uenced turing machine model well shaped development computational complexity theory quantum computing discussed relationship classic turing machine model panel also discus alan turing might say inevitable fallibility software
2012,turing machine-inspired computer science result,paper discus turing machine model directly inspired guided development theoretical computer science particular turing machine model ideal creation computational complexity theory grown essential part theoretical computer science found application discipline machine operation count used define time-bounded computation tape square used defined tape memory-bounded computation definition exploration corresponding asymptotic complexity class followed naturally
2003,separation complexity class,computational complexity theory study quantitative law govern computing central topic study classification computational problem amount various computational resource required solution particularly find limit feasible computation computational complexity discovered  beautiful structure natural mathematically robust complexity class give intuitively satisfying classification feasibly near-feasibly computable problem complexity class defined bound computational resource natural complete problem problem class easily reduced also defined naturally noncomputational way expressive power various logical formalism emphasizing natural robust important mathematical object unfortunately notwithstanding considerable effort several decade proof class indeed different consider resolution separation question complexity class one important set open problem theoretical computer science solution separation problem essential deeper understanding nature computing limit feasible computation indirectly limit feasible  reasoning
2002,separation problem descriptional complexity,n/a
2001,computational complexity mathematical proof,paper discus howthe major computational complexity class p np pspace capture different computational property mathematical proof reveal newq uantitative aspect mathematics
1999,observation nature state computer science keynote address,observation computer science two year washington assistant director national science foundation computer information science engineering talk ass state computer science expanding research horizon shaping new “information technology twenty first century“ initiative role theoretical computer science setting
1998,innovation obstacle future computing,n/a
1995,weight computation,one grand challenge computer science understand feasibly computable recursive function theory clarified effectively computable process extended understanding goedel incompleteness  limit power formal mathematical method since computing universal encompasses power mathematics understanding limit feasibly computable could give deeper understanding limit rational intellectual process insight power limit scientific theory search feasibly computable two distinct aspect first determine  much kind computing power available foreseeable future problem determine kind problem solved available computing resource first problem technological assessment existing potential computing technology estimate kind much computing work machine able render problem lead u central question complexity theory intrinsic complexity important class problem wish solve clearly p=np=pspace problem among best known area consideration exponential function seems give crude upper limit feasibly computable may time memory weight requirement grow exponentially computation feasible know computation require exponential amount resource instance problem exponential complexity class require exponential resource even exact solution require exponential resource good approximation solution may indeed problem requires exponential resource clearly feasibly solvable already moderate size instance problem
1995,computing paradigm computational complexity,computational complexity theory study quantitative law govern computing since computing paradigm universal pervasive quantitative law computational complexity apply information processing numerical computation simulation logical reasoning formal theorem proving well process rational reasoningin view search feasibly computable take even deeper significance central problem theoretical computer science search limit feasibly computable search limit scientific theory possibly rational reasoning
1994,nature computer science,n/a
1994,random oracle hypothesis false,random oracle hypothesis attributed bennett gill essentially state relationship complexity class hold almost relativized world must also hold unrelativized case although paper first provide counterexample random oracle hypothesis provide compelling counterexample showing almost oracle ipa ≠ pspacea random oracle hypothesis true would contradict shamirs result ip = pspace fact shown almost oracle co-npa ⫋ ipa  extend multiprover proof system ben-or goldwasser killian wigderson addition paper show random oracle hypothesis sensitive small change definition class ipp similar ip defined surprisingly ipp = pspace result hold oracle world
1994,hausdorff topological dimension kolmogorov complexity real line,investigate kolmogorov complexity real number let k kolmogorov complexity function determine hausdorff dimension topological dimension graph k since dimension different graph kolmogorov complexity function real line form fractal sense mandelbrot also solve open problem razborov using exact bound topological dimension
1994,intellectual terrain around np,paper view p≟np problem symbolizes attempt understand feasibly computable paper shortly review history development gödels  letter asking computational complexity finding proof theorem computational complexity exploration complete problem np pspace  structural complexity recent insight interactive proof
1994,structure complexity computation guided tour complexity class,n/a
1993,broader research agenda theory,n/a
1993,computing future whither computer science engineering,computer science telecommunication board national research council recently released report entitled computing future broader agenda computer science engineering report intended first step developing vision computer science engineering carry discipline st century acknowledging fraying social compact supported scientific research since world war ii pressure academic science major change computer industry report put forward view intellectual boundary cs&e discipline expand discipline continue support traditionally considered “core” computer science engineering also learn embrace rather eschew computing problem arise domain outside traditional core problem domain include science area commercial economic significance broader agenda many benefit cs&e including rich set intellectually challenging problem greater social impact wider variety funding opportunity surprisingly vision field st century generated considerable controversy debate appropriate matter important panel briefly review major judgment priority recommendation report differing perspective report aired
1993,observation nature computer science,paper discus nature computer science science analyzing computer science comparing contrasting science particular compare contrast various aspect computer science physic astronomy mathematics analysis computer science comparison science primarily term ofthe role played experiment theory research paradigm problem area determined change relation interaction science engineering aspect comparing historical development study comparison conclude computer science differs known science deeply viewed new specie among science view justified observing theory experiment computer science play different role follow classic pattern physical science change research paradigm computer science often technology driven demo play role experiment furthermore science engineering aspect deeply interwoven computer science distance concept practical implementation far shorter discipline
1991,space bounded computation review new separation result,paper review key  space bounded complexity class discus central open problem outline prominent proof technique show slightly modified turing machine model low level deterministic nondeterministic space bounded complexity class different furthermore computation model show savitchs theorem immerman-szelepcsényi theorem hold range lg lg n lg n also present change computation model bring clarify importance space constructibility conclude enumerating open problem arise discussion
1991,one-way function nonisomorphism np-complete set,one-way conjecture state existence nonisomorphic np-complete set implies existence one-way function paper give relativized counterexample conjecture constructing relativized world nonisomorphic np-complete set lack one-way function
1990,unique staisfiability randomized reduction,n/a
1990,new development structural complexity theory,paper discus scope goal structural complexity theory describes working hypothesis field summarizes  recent development
1990,robust machine accept easy set,robust machine machine maintains computational property every oracle paper study robustly complementary robustly categorical robustly ∑∗-accepting robustly ∑∗-spanning machine prove robust machine squander powerful nondeterministic oracle access relativizations—relative oracle language property computed pnpa
1990,structural complexity theory recent surprise,paper review impact recent  research paradigm structural complexity theory
1989,cornell commission morris worm,careful examination evidence cornell commission publishes finding detailed report shed new light dispels myth robert morris internet worm
1989,structural complexity column,n/a
1989,boolean hierarchy ii application,boolean hierarchy structural property  pp  explores structure boolean hierarchy closure np respect boolean operation paper us boolean hierarchy tool extend explain three important  structural complexity theory hartmanis immerman sewelson  showed ${{e}} = {{ne}}$ ${{np}} - {{p}}$ contains sparse set paper shown reflects behavior boolean hierarchy ${{e}} = {{ne}}$ sparse set fall alternate level boolean hierarchy  furthermore shown capturable set  banished boolean hierarchy ${{e}} = {{ne}}{{e}} = {{ne}}$ implies ${{bh}} - {{p}}$ capturable set counting class natural candidate complete language level boolean hierarchy author show relativized world counting class complete level boolean hierarchy relatedly work blass gurevich  pp  extended concluded counting class weak relativized world karp lipton  showed np sparse oracle  polynomial hierarchy collapse ${{np}}^{{{np}}} $ author demonstrate cannot much improved relativized world np sparse oracle yet boolean hierarchy infinite thus proof relativizes show np sparse oracle implies polynomial hierarchy equal boolean hierarchythe  paper present new idea technique put previous  np ${{d}}^{{p}} $ richer perspective throughout emphasis structure boolean hierarchy relation common class
1989,complexity real line fractal,author investigate kolmogorov complexity real number determine hausdorff dimension topological dimension graph k kolmogorov complexity function conclude complexity graph fractal< >
1988,sparse oracle separating feasible complexity class,article clarifies oracle separate np p essence changing research paradigm study problem relativized two conflicting way study characterization class oracle achieving specified relativation  type potential yield deeper insight nature relativation problem focus attention new interesting class languagesa complete transparent characterization oracle separate np p would resolve long-standing p = np question settle central case fully characterize sparse oracle separating np p world p = np separating oracle exactly non-self-printable set equivalently set high self-referential kolmogorov complexity prove related  co-np pspace
1988,boolean hierarchy structural property,paper study complexity set formed boolean operation  np set set accepted tree hardware np predicate leaf together form boolean hierarchywe present many  structure boolean hierarchy separation immunity  natural complete language structural asymmetry complementary classeswe show relativized world boolean hierarchy infinite every k relativized world boolean hierarchy extends exactly k level prove natural language variation vertex cover complete various level boolean hierarchy show following structural asymmetry though set boolean hierarchy ${{d}}^{{p}} $-immune relativized world boolean hierarchy contains ${{cod}}^{{p}} $-immune setsthus paper explores structural property boolean hierarchy companion paper  appear us boolean hierarchy extend known  small circuit  sparse set np-p  counting class  pp 
1988,complexity class without machine complete language,paper develops technique studying complexity class covered known recursive enumeration machine counting class probabilistic class intersection class often lack enumeration concentrating counting class show relativizations upa complete language relativizations pb≠upb≠npb upb complete language among  show complete language exists set r p boolean formula one satisfying assignment sat∩r complete p ≠ exists set p boolean formula one satisfying assignment ∩ sat p p ≠ ∩ coup exists set p uniquely satisfiable boolean formula polynomial-time machine compute solution formula swe suggest wide applicability technique counting probabilistic class using examine probabilistic class bpp relativized word bppa complete language bpp complete language complete language form b ∩ majority where¦is true least half assignments} canonical pp-complete set
1987,structural complexity column sparse complete set np optimal collpase polynomial hierarchy,n/a
1987,one-way function robustness non-isomorphism np-complete set,paper  give relativized counterexample conjectured connection existence one-way function existence non-isomorphic np-complete set  establishes relativized world np-complete set non-isomorphic strong sense  prof robust machine squander powerful nondeterministic oracle access relativizations  resolve open question  extends knowledge non-isomorphic np-complete set  sharing proof technique   enriches nascent theory robustness present consequence limited combinatorial control machine
1987,observation np complete set,paper summarize extend recent  property np complete set related  structure feasible computation
1986,containment separation complete set immunity complexity class,n/a
1985,solvable problem conflicting relativizations,n/a
1985,sparse set np-p exptime versus nexptime,paper investigates structural property set np-p show computational difficulty lower density set np depends explicitly relation higher deterministic nondeterministic time-bounded complexity class paper exploit recently discovered upward separation method show example exist sparse set np-p exptime ≠ nexptime addition paper us relativization technique determine logical possibility limitation proof technique exhibit one first natural structural difference relativized np conp
1985,independence result context-free language lower bound,show axiomatizable sound formal system f exist instance natural problem context-free language lower bound computation p versus np provable f recursive representation problem previous independence  computer science proven specific representation problem exploiting ‘opaqueness’ turing machine name  rely complexity logical structure problem yield independence  depend representation problem show example exists nonregular context-free language l cf-grammar g l = l provable f “l regular” also show among  p np exists recursive oracle npa ≠ pa fact provable f recursive representation athe difference provable f well illustrated question polynomial time isomorphism  np-complete set show every np-complete set l representation l nondeterministic polynomial time machine prove l np-complete furthermore l p-isomorphic sat also provable f representation l hand exist np-complete set p-isomorphic sat exists np-complete set l independent representation proof f l p-isomorphic sat
1985,complete problem np$\cap$conp,known whether complete language exist np∩conp sipser shown relativizations np∩conp ≤ p -complete language paper show np∩conp ≤ p -complete language ≤ p -complete language furthermore show complete language l exists np∩conp np∩conp≠np reduction l ε np∩conp cannot effectively computed nt extend relativization  exhibiting oracle e pe≠npe∩conpe≠npe exist complete language intersection oracle reduction complete language effectively computed complementary pair machine  l=ln¯¯¯¯¯¯¯¯¯¯¯¯¯l hand also exist oracle f pf≠npf∩conpf≠npf intersection complete language reduction complete language cannot effectively computable complementary pair machine case reduction computed fromntnjproofthatln=ln¯¯¯¯¯¯¯¯¯¯¯¯¯=l¯
1984,non-isomorphic np complete set,n/a
1984,computation time np set different density,paper study computational complexity set different density np show deterministic computation time set np depend density collapse partial collapse corresponding higher nondeterministic deterministic time bounded complexity class show also np set different density exist complete set corresponding density polynomial time turing reduction finally show  interpreted  complexity theorem proving proof presentation axiomatized mathematical system interpretation relates fundamental question complexity intellectual tool basic structural problem p np conp pspace discussed paper
1983,sparse set np - p,main result note show exists sparse set np p exptime≠nexptime several  derived complexity sparse set np–p interpretation meaning  given term complexity solving ‘individual instances’ problem np–p
1983,gödel speed-up succinctness language representation,note discus similarity difference gödels result non-recursive shortening proof formal system additional axiom corresponding  succinctness different representation language
1983,generalized kolmogorov complexity structure feasible computation preliminary report,paper define generalized two-parameter kolmogorov complexity finite string measure much fast string compressed show string complexity measure efficient tool study computational complexity advantage approach classifies string random random measure amount randomness detectable given time permit study computation change amount randomness finite string thus establish direct link computational complexity generalized kolmogorov complexity string approach give new viewpoint computational complexity theory yield natural formulation new problem yield new  structure feasible computation
1982,note natural complete set gödel numbering,creative set complete recursively enumerable set play important role logic mathematics known recursively isomorphic therefore one hand complete set viewed equivalent hand intuitively perceive complete set ‘natural simpler’ others note try capture intuitive concept precisely defining complete set natural recursively enumerable set reduced computationally simple reduction show natural complete set isomorphic type computationally simple mapping idea applied define natural gödel numbering using natural gödel numbering show natural creative set coincide natural complete set
1981,observation development theoretical computer science,paper give personal account early development automaton theory initiation research computational complexity theory although account subjective deal primarily research area direct interest author discus underlying belief philosophy guided research well intellectual environment idea contact influenced attempt also made draw general computer science research discus nature theoretical computer science
1981,language simultaneously complete one-way two-way log-tape automaton,paper study language accepted nondeterministic $ n$-tape automaton scan input relate computational power two-way $ n$-tape automaton show one-way $ n$-tape automaton nondeterministic model  computationally much powerful deterministic model  one-way $ n$-tape reduction exist natural complete language automaton complete language cannot sparse furthermore show language complete nondeterministic one-way $ n$-tape automaton  also complete computationally powerful nondeterministic two-way $ n$-tape automaton  two-way $ n$-tape reduction therefore bound $t$ $t   n$ deterministic nondeterministic $t$-tape bounded computation collapse iff nondeterministic one-way $ n$-tape computation carried two-way deterministic log n-tape automaton
1980,succinctness different representation language,purpose paper give simple new proof interesting recent  relative succinctness different representation regular deterministic unambiguous context-free language derive new  relative succinctness representation change representation contain formal proof language generated desired subclass language
1980,eassay research sparse np complete set,purpose paper review origin motivation conjecture sparse np complete set exist  describe development idea technique led recent solution conjecture
1979,relation diagonalization proof system complexity gap,paper study diagonal process time bounded computation one-tape turing machine diagonalizing machine exist formal proof operate given time bound replaces traditional “clock” resource bounded diagonalization formal proof running time establishes close relation property proof system existence sharp time bound one-tape turing machine complexity class diagonalization method also show gap theorem resource bounded computation hold complexity class differ corresponding provable complexity class furthermore show exist recursive time bound class language formally prove existence turing machine accept time differs class language accepted turing machine prove formally run time also investigate corresponding problem tape bound computation discus difference time tapebounded computation
1979,succinctness verifiability determinism representation polynomial-time language,several representation p class deterministic polynomial time acceptable language compared respect succinctness shown requirement polynomial running time verifiability running time verifiability accepting set p cause difference succinctness recursively bounded relating succinctness nondeterminism shown p ≠ np relative succinctness representing language p deterministic nondeterministic clocked polynomial time machine recursively bounded question posed concerning implication p = np respect translatability succinctness pair deterministic nondeterministic representation p
1979,succintness different representation language,purpose paper give simple new proof interesting recent  relative succinctness different representation regular deterministic unambiguous context-free language derive new  relative succinctness representation change representation contain formal proof language generated desired subclass language
1979,relative succinctness representation language separation complexity class,paper study relative succinctness different representation deterministic polynomial time language investigate cannot formally verified representation also show relative succinctness different representation language directly related separation corresponding complexity class example ptime ≠ nptime relative succinctness representing language ptime deterministic nondeterministic clocked polynomial time machine recursively bounded happens relative succinctness representation linearly boundedfurthermore discus problem approximating recognition complete language nptime deterministic polynomial time machine accept finite initial segment language conclude discussing relative succinctness optimal near-optimal program nature family minimal machine different representation
1978,polynomial time isomorphism new complete set,note show recently discovered np complete set arising number theory ptape complete set arising game theory extape complete set arising algebraic word problem polynomial time isomorphic previously known complete set corresponding class
1978,log-tape isomorphism complete set,paper study log n-tape computable reduction set investigate condition log n-tape reduction set extended log n-tape computable isomorphism set application  obtain easy check necessary sufficient condition set complete log n-tape reduction nl csl p np ptape etc log n-tape isomorphic previously known complete set respective class matter fact “known” complete set nl csl p np ptape etc easily seen respectively log n-tape isomorphic  strengthen extend substantially previously known  polynomial time computable reduction isomorphism np ptape complete set furthermore show set complete csl ptape etc must dense therefore example cannot single letter alphabet
1978,one-way log-tape reduction,one-way log-tape  reduction mapping defined log-tape turing machine whose read head input move right -l reduction provide refined tool studying feasible complexity class p-time  log-tape  reduction although -l computation provably weaker feasible class l nl p np known complete set class complete -l reduction however using known technique counting argument recursion theory show certain log-tape reduction cannot -l construct set complete log-tape reduction -l reduction
