2019,algorand secure efficient distributed ledger,distributed ledger tamperproof sequence data publicly accessed augmented everyone without maintained centralized party distributed ledger stand revolutionize way modern society operates secure kind traditional transaction payment asset transfer title exact order transaction occur enable totally new transaction cryptocurrencies smart contract remove intermediary usher new paradigm trust currently implemented however distributed ledger scale poorly cannot achieve enormous potentialin paper propose algorand alternative secure efficient distributed ledger algorand permissionless work highly asynchronous environment unlike prior implementation distributed ledger based “proof work” algorand dispenses “miners” requires negligible amount computation moreover transaction history “forks” negligible probability algorand guarantee finality transaction moment transaction enters ledger
2017,collusion efficiency dominant strategy,green laffont proved collusion-resilient dominant-strategy mechanism whose strategy consist individual valuation guarantee efficiency multi-unit auction chen micali bypassed impossibility slightly enlarging strategy space yet assuming knowledge maximum value player may copy good ability imposing high fine player unrestricted combinatorial auction efficiency collusion-resilient dominant strategy remained open without two assumption fully generalize notion collusion-resilient dominant-strategy mechanism allowing arbitrary strategy space construct one mechanism multi-unit auction without relying two assumption prove mechanism exists unrestricted combinatorial auction without additional assumption  hold mechanism know colludes player coalition perfectly coordinate strategy
2017,simple efficient byzantine agreement,present simple cryptographic binary byzantine-agreement protocol n >= t+ >=  player malicious halt expected  round
2017,algorand scaling byzantine agreement cryptocurrencies,algorand new cryptocurrency confirms transaction latency order minute scaling many user algorand ensures user never divergent view confirmed transaction even user malicious network temporarily partitioned contrast existing cryptocurrencies allow temporary fork therefore require long time order hour confirm transaction high confidencealgorand us new byzantine agreement  protocol reach consensus among user next set transaction scale consensus many user algorand us novel mechanism based verifiable random function allows user privately check whether selected participate ba agree next set transaction include proof selection network message algorands ba protocol user keep private state except private key allows algorand replace participant immediately send message mitigates targeted attack chosen participant identity revealedwe implement algorand evaluate performance  ec virtual machine simulating  user experimental  show algorand confirms transaction minute achieves x bitcoins throughput incurs almost penalty scaling user
2016,reconstructing markov process independent anonymous experiment,investigate problem exactly reconstructing high confidence isomorphism ball radiuscentered starting state markov process independent anonymous experiment anonymous experiment state visited according underlying transition probability global state name known one recognize whether two state reached within experiment samewe prove quite tight bound exact reconstruction term number experiment length
2016,leveraging possibilistic belief unrestricted combinatorial auction,unrestricted combinatorial auction put forward mechanism guarantee meaningful revenue benchmark based possibilistic belief player others valuation essence mechanism guarantee within factor two maximum revenue best informed player would sure obtain he/she sell good his/her opponent via take-it-or-leave-it offer mechanism probabilistic extensive form relies new solution concept analyzing extensive-form game incomplete information assumes mutual belief rationality moreover mechanism enjoys several novel property respect privacy computation collusion view full-text
2016,mechanism costly knowledge,propose investigating design analysis game theoretic mechanism player unstructured initial knowledge refine knowledge costwe consider several set-theoretic model costly knowledge specifically consider auction single good player knowledge valuation lie given interval  however player pay cost depending b  learn possibly arbitrary shorter  sub-interval guaranteed contain iin light set-theoretic uncertainty face natural player act minimize regret first step analyze performance second-price mechanism regret-minimizing strategy show model always return outcome high social welfare
2016,auction revenue general spiteful-utility model,well accepted auction player true utility may depend price pay whether win good also various form externality price paid competitor identity true value actual winnerin work study revenue generation single-good auction general model externality general spiteful-utility model specifically weput forward new revenue benchmark solution conceptsdesign new mechanism information player externality known andanalyze revenue second-price mechanism player information
2015,mechanism design possibilistic belief,study mechanism design non-bayesian setting incomplete information designer information player player arbitrary heterogeneous first-order possibilistic belief opponent payoff typesusing belief auction single good we•define revenue benchmark least high second-highest valuation sometimes much higher•prove meaningfully achievable via traditional notion implementation and•prove achievable via notion implementation based mutual belief rationality
2015,better outcome rationality,mechanism design enables social planner obtain desired outcome leveraging player rationality belief thus fundamental yet unproven intuition higher level rationality player better set obtainable outcomesin paper prove fundamental intuition player possibilistic belief traditional model epistemic game theory specificallywe define sequence monotonically increasing revenue benchmark single-good auction g < g < g gi defined player belief g second-highest valuation  construct single interim individually rational auction mechanism without clue rationality level player guarantee revenue gk player rationality level > k+  prove mechanism guarantee revenue even close gk least two player level-k rational
2014,cryptography miracle secure auction matching problem verification,solution persistent problem preventing collusion vickrey auction
2014,query complexity scoring rule,proper scoring rule crucial tool elicit truthful information expert scoring rule map x expert-provided distribution set possible state world  realized state world real number representing expert reward provided information compute reward scoring rule query distribution x various state number query thus natural measure complexity scoring rulewe prove bounded strictly proper scoring rule deterministic must make number query input distribution quarter number state world state space large make computation scoring rule impractical also show new stochastic scoring rule bounded strictly proper make two query input distribution thus using randomness allows u significant saving computing scoring rule
2014,rational resilient protocol,cryptography distributed computation successful advancing study interaction distinct computing agent moreover field successful conversing sharing model technique notably model agent either good  bad  believe however neglecting fundamental ingredient utility long recognized studied another scientific field game theory particular beautiful subfield mechanism design mechanism design aim obtaining desired outcome engineering game rationally played yield desired outcome game multiple player interact much cryptographic/distributed protocol player good malicious rather every player rational always act maximize utilityi believe properly incorporating utility/rationality model dramatically increase range action viceversa mechanism design stand gain lot properly incorporating cryptographic/distributed notion technique particular rational player may colluding  increase utility value privacy may indeed represent strategic interest unforeseen yet modeled interaction thus privacy collusion disrupt intended course engineered game ultimately prevent desired outcome achieved mechanism design moderately successful protecting collusion largely ignored privacy might gain precious resiliency taking consideration notion techniquesin sum opportunity cryptography distributed computation mechanism design join force study general accurate model interaction design realistic resilient protocol simultaneously take account utility collusion privacy sufficiently complex sufficiently large system organism successfully work merely sustain existence without recognizing harmonizing basic force successful designing effort require good deal modeling development new conceptual framework require open mind open heart leverage past successful scientific experience without trapped confined promise great deal fun challenge excitement must recruit much talent possible effortas concrete simple hopefully provocative example describe  resilient mechanism designed jing chen achieving  alternative revenue benchmark unrestricted combinatorial auction auction multiple distinct good sale player privately attribute arbitrary value possible subset good seller information player valuation
2014,knightian self uncertainty vcg mechanism unrestricted combinatorial auction,study social welfare performance vcg mechanism well-known challenging model self uncertainty initially put forward frank h knight later formalized truman f bewley namely information player true valuation consists set distribution one valuation drawn assume player know true valuation additive inaccuracy  study social welfare performance vcg mechanism relative  >  denoting msw maximum social welfare already shown  even single-good auction mechanism guarantee social welfare greater msw / n dominant strategy ex-post nash equilibrium strategy n number player separate paper  proved multi-unit auction coincides vickrey mechanism vcg mechanism performs well  undominated strategy namely n-player m-unit auction vickrey mechanism guarantee social welfare  - msw - knightian player chooses arbitrary undominated strategy bid auction paper focus social welfare performance vcg mechanism unrestricted combinatorial auction undominated strategy regret-minimizing strategy  first theorem prof n-player m-good combinatorial auction vcg mechanism may produce outcome whose social welfare  - msw -  even n= player chooses undominated strategy also geometrically characterize set undominated strategy setting second theorem show vcg mechanism performs well regret-minimizing strategy guaranteed social welfare -msw - min{mn} player chooses pure regret-minimizing strategy - msw - mixed strategy allowed finally prove lemma bridging two standard model rationality utility maximization regret minimization special case lemma implies game  every implementation regret-minimizing player also applies utility-maximizing player use regret break tie among undominated strategy bridging lemma thus implies vcg mechanism continues perform well also latter player
2013,parametric digital auction,study revenue maximization digital auction infinitely many copy good sale n buyer interested obtaining one copy good buyer private valuation drawn joint distribution vec{f} seller know distribution information mean ui variance buyer marginal distribution fi call auction parametric auction construct deterministic parametric auction wide class distribution guarantee constant fraction optimal revenue achievable seller precisely know distribution f furthermore auction posted price mechanism maximin optimal among mechanism posted price mechanism maximizes revenue worst case adversarial choice distribution
2013,super-efficient rational proof,information asymmetry central problem computer science economics many fundamental problem uninformed principal want obtain knowledge untrusted expert model several real-world situation manager relation employee delegation computational task mechanical turkbecause expert untrusted principal need guarantee provided knowledge correct computer science guarantee usually provided via proof principal verify thus dishonest expert get caught penalized  many economic setting guarantee knowledge correct usually provided via incentive game played expert principal expert maximizes utility honesta rational proof interactive proof prover merlin neither honest malicious rational merlin act order maximize utility rational proof previously studied verifier arthur probabilistic polynomial-time machine {azarmicali}in paper study super efficient rational proof rational proof arthur run logarithmic time new rational proof practical much faster classical analogue also provide tangible incentive expert honest arthur need polynomial-size budget yet penalize merlin large quantity deviate truthwe give following characterization problem admit super-efficient rational proofsuniform tc coincides set language l admit rational proof using time communication constant number round polynomial size budgetpnpcoincides set language rational proof using time poly communication one round polynomial-size budgetfurthermore show arthur restricted polynomial-size budget set language admit rational proof polynomial time verification polynomial communication one round pma
2013,optimal efficient parametric auction,consider seller seek provide service collection interested party subject feasibility constraint party may simultaneously served assuming distribution known value party servicearguably strong assumptionmyersons seminal work provides revenue optimizing auction  show instead general feasibility constraint knowledge median party value distribution quantile distribution approximation thereof suffice designing simple auction simultaneously approximate optimal revenue optimal welfare  apply downward-closed feasibility constraint assumption underlying unknown value distribution monotone hazard rate matroid feasibility constraint weaker assumption regularity underlying distribution  jointly generalize single-item  obtained azar micali  parametric auction daskalakis pierrakos  simultaneously approximately optimal efficient auction
2012,collusive dominant-strategy truthfulness,show collusion wrong belief may cause dramatic efficiency loss vickrey mechanism auctioning single good limited supply thus put forward new mechanism guaranteeing efficiency adversarial collusion model player partition arbitrarily many coalition exchange money perfectly coordinate action mechanism bypass classic impossibility   providing player richer set strategy making dominant every coalition c instruct member report truthfully valuation also belonging c mechanism coalitionally rational implies individually rational independent player
2012,mechanism design approximate valuation,study single-good auction player know valuation within constant multiplicative factor    known mechanism designer classical notion implementation dominant strategy implementation undominated strategy naturally extended setting power vastly differenton negative side prove dominant-strategy mechanism guarantee social welfare significantly better achievable assigning good random playeron positive side provide tight upper lower bound fraction maximum social welfare achievable undominated strategy whether deterministically probabilistically
2012,crowdsourced bayesian auction,investigate problem optimal mechanism design auctioneer want sell set good buyer order maximize revenue bayesian setting buyer valuation good drawn prior distribution often assumed known seller work focus case seller knowledge buyer know better seller know model necessarily common knowledge instead buyer individually know posterior distribution associated since seller relies buyer knowledge help set price call type auction crowdsourced bayesian auctionsfor crowdsourced bayesian model many environment interest show arbitrary valuation distribution  possible design mechanism matching significant extent performance optimal dominant-strategy-truthful mechanism seller know dto obtain  use two technique  proper scoring rule elicit information player  reverse version classical bulow-klemperer inequality first let u build mechanism unique equilibrium good revenue guarantee even player second higher-order belief wrong second allows u upper bound revenue optimal mechanism n player n/n-- fraction revenue optimal mechanism n --  player believe technique new bayesian optimal auction independent interest future work
2012,rational proof,study new type proof system unbounded prover polynomial time verifier interact input string x function f verifier may learn f novelty setting longer good malicious provers rational one essence verifier budget c give prover reward r   determined transcript interaction prover wish maximize expected reward reward maximized verifier correctly learns f rational proof system powerful classical counterpart polynomially many round interaction much powerful allow constant number round indeed prove f  #p f computable one-round rational merlin-arthur game input x merlin single message actually consists sending value f prove ch counting hierarchy coincides class language computable constant-round rational merlin-arthur game  rely basic crucial connection rational proof system proper scoring rule tool developed elicit truthful information expert
2011,perfect implementation,privacy trust affect strategic thinking yet precisely modeled mechanism design setting incomplete information traditional implementation normal-form mechanism—by disregarding player privacy assuming trust mediator—may fail reach mechanism objective thus investigate implementation new typewe put forward notion perfect implementation normal-form mechanism essence concrete extensive-form mechanism exactly preserving strategic property without relying trusted mediator violating player privacywe prove normal-form mechanism perfectly implemented verifiable mediator using envelope envelope-randomizing device differently trusted mediator verifiable one performs prescribed public action everyone verify acting properly never learns information remain private
2011,crowdsourced bayesian auction - abstract,investigate problem optimal mechanism design auctioneer want sell set good buyer order maximize revenue bayesian setting buyers’ valuation good drawn prior distributiondd often assumed known seller work focus case seller knowledge “the buyer know better seller know them” modelddis necessarily common knowledge instead player individually know posterior distribution associated withdd since seller relies buyers’ knowledge help set price call type auction crowdsourced bayesian auctionsfor crowdsourced bayesian model many environment interest show arbitrary type distributionsdd possible design mechanism matching significant extent performance optimal classical mechanism seller knowsdd  “existential” broad class environment  “constructive” auction single goodto obtain  use two technique  proper scoring rule elicit information bidder  quantitative version classical bulow-klemperer inequality first technique let u build mechanism guarantee good revenue even players’ second higher-order belief wrong second allows u upper bound revenue optimal mechanism n player a−nfraction revenue optimal mechanism n −  player believe technique new bayesian optimal auction independent interest future work
2011,mechanism design set-theoretic belief,setting incomplete information put forward  conservative -- indeed purely set-theoretic -- model belief  player may payoff type opponent  new robust solution concept based mutual belief rationality capable leveraging conservative belief exemplify applicability new approach single-good auction showing solution concept normal-form simple deterministic mechanism guarantee -- arbitrarily small additive constant -- revenue benchmark always greater equal second-highest valuation sometimes much greater contrast also prove benchmark cannot even approximated within positive factor classical solution concept
2010,optimal error correction computationally bounded noise,adversarial computationally bounded model error construct appealingly simple efficient cryptographic encoding unique decoding scheme whose error-correction capability much greater classically possible particular  binary alphabet construct positive-rate coding scheme uniquely decodable / - γ error rate constant γ >   large alphabet construct coding scheme uniquely decodable  - r error rate information rate r >   large alphabet actually optimal since computationally bounded adversarial channel simulate behavior q-ary symmetric channel q denotes size alphabet capacity known upper-bounded  - r  hold minimal assumption communication infrastructure namely  allow channel powerful receiver  assume information sender-a public key-is known 
2010,perfect concrete implementation arbitrary mechanism quick summary joint work sergei izmalkov matt lepinski,privacy trust affect everyday thinking particular way approach concrete game accordingly hope rigorous treatment privacy trust become integral part mechanism design field successful finding many ingenious mechanism solution variety problem mechanism theoretical construction enough attention devoted concrete implementation indeed appreciated outcome function simple normal-form mechanism spontaneously evaluate message player selected mind practically useful real strategic setting mechanism whether normal extensive form must concretely implemented concrete implementation issue privacy trust may arise undermine valuable theoretical property
2010,robustly leveraging collusion combinatorial auction,devastating effect auction mechanism collusion prohibited legally prosecuted yet colluders always existed may continue exist thus raise following question mechanism design desideratum achievable type mechanism set player wish collude free without restriction way cooperate coordinate actionsin response question put forward exemplify notion collusion-leveraging mechanism essence mechanism aligning desideratum incentive player including colluders significant mutually beneficial extent course mechanism may exist suitable desideratum unrestricted combinatorial auction classical mechanism essentially guarantee  social welfare  revenue presence two colluders prove possible collusion-leveraging mechanism guarantee sum social welfare revenue always high even player collusive guarantee better performance collusion-leveraging mechanism essence welcome collusive player rather pretending exist raising host new question intersection cooperative non-cooperative game theory
2010,robust perfect revenue perfectly informed player,maximizing revenue presence perfectly informed player well known goal mechanism design yet current mechanism goal vulnerable equilibrium selection collusion privacy complexity problem therefore far guaranteeing maximum revenue obtained paper clarify rectify situation  proving weakly dominant-strategy mechanism  guarantee arbitrarily small fraction maximum possible revenue importantly  constructing new mechanism extensive-form unique sub-game-perfect equilibrium guarantee fraction arbitrarily close  maximum possible revenue provably robust equilibrium selection collusion complexity privacy problem work number player n >  without relying special condition player utility
2009,new approach auction resilient mechanism design,put forward new approach mechanism design exemplify via new mechanism guaranteeing significant revenue unrestricted combinatorial auction mechanism  succeeds new adversarial collusion model  work new equilibrium-less strong solution concept  benchmark performance knowledge player  computationally efficient preserve player privacy unusual extent 
2009,purely rational secret sharing extended abstract,rational secret sharing problem intersection cryptography game theory essence dealer wish engineer communication game rationally played guarantee player learns dealer’s secret yet solution proposed far rely solely players’ rationality also belief also quite inefficientafter providing complete definition problem exhibit efficient purely rational solution verifiable trusted channel
2008,online-untransferable signature,non-transferability digital signature important security concern traditionally achieved via interactive verification protocol protocol however vulnerable “online transfer attacks” — ie attack mounted protocols’ executionsin paper show guarantee online untransferability signature via reasonable public-key infrastructure general assumption without random oracle untransferable signature efficient prior one provably provide weaker type untransferability
2008,verifiably secure device,put forward notion verifiably secure device essence stronger notion secure computation achieve ballot-box model verifiably secure devicesprovide perfect solution problem achieving correlated equilibrium important extensively investigated problem intersection game theory cryptography efficient algorithm enable secure evaluation multiple interdependent function 
2006,input-indistinguishable computation,put forward first definition general secure computation without trusted set-up handle arbitrary number concurrent execution implementable based standard complexity assumption contrast previous definition secure computation simulation-based
