1983,simultaneously exchange secret bit flipping symmetrically-biased coin,present cryptographic protocol allowing two mutually distrusting party b secret bit simultaneously exchange value bit assumed initially party present correct encryption secret bit party develop new tool implement protocol slightly biased symmetric coin key property coin flip receives piece probabilistic information b secret bit symmetric piece information b receives secret bit
1983,strong signature scheme,notion digital signature based trapdoor function introduced diffie hellman rivest shamir adleman gave first number theoretic implementation signature scheme based trapdoor function f trapdoor function message f signature signature verified computing f = approach present following problem even f hard invert may special message space  easy sign without knowing trapdoor information possible forge signature random number violates requirement many protocol given polynomial number signed message may possible sign new one without knowing trapdoor informationwe solve problem exhibiting two signature scheme strategy adversary seen previously signed message moderate success forging even single additional signature transformable fast algorithm factoring inverting rsa function provably hold message space possible probability distribution thus particular given signature forging signature m+ sm hard factoring two signature scheme
1982,signature authentication,design cryptographic protocol using trapdoor one-way function received considerable attention past year  recently attention paid provide rigorous correctness proof based simple mathematical assumption example coin flipping  mental poker  perhaps reasonable speculate time cryptographic protocol eventually designed provably secure simple assumption factoring large number inverting rsa function computationally intractable appropriate sense
1982,generate cryptographically strong sequence pseudo random bit,give set condition allow one generate  unpredictable bitsbased condition present general algorithmic scheme constructing polynomial-time deterministic algorithm stretch short secret random input long sequence unpredictable pseudo-random bitswe give implementation scheme exhibit pseudo-random bit generator efficient strategy predicting next output bit better  chance easily transformable equally efficient algorithm solving discrete logarithm problem particular discrete logarithm problem cannot solved probabilistic polynomial time probabilistic polynomial-time algorithm guess next output bit better flipping coin head guess  tail guess  
1982,establish private code public network extended abstract,diffie hellman model public key cryptosystem received much attention way provide secure network communication paper show original diffie hellman model guarantee security user system shown user powerful adversary traditionally considered passive eavesdropper decrypt user message implementation public key cryptosystem using rsa function rabin function goldwasser&micali scheme weakness depends bit security encryption function rsa  function show computing cyphertext specific bit cleartext polynomially equivalent inverting function  many message space bit easily found communicating system insecure present modification diffie hellman model public-key cryptosystem one concrete implementation modified model implementation difficulty extracting partial information clear text message encoding eavesdropper user chosen cyphertext attack proved equivalent computational difficulty factoring equivalence proof hold strong probabilistic sense message space additional assumption existence perfect signature scheme trusted authentication center made
1982,priority queue variable priority oev log v algorithm finding maximal weighted matching general graph,define two generalized type priority queue allowing form changing priority element queue show implemented efficiently consequently operation take time use generalized priority queue construct algorithm finding maximal weighted matching general graph
1982,probabilistic encryption play mental poker keeping secret partial information,paper proposes encryption scheme posse following property  adversary know encryption algorithm given cyphertext cannot obtain information clear-textany implementation public key cryptosystem proposed diffie hellman  posse propertyour encryption scheme follows idea number theoretic implementation public key cryptosystem due rivest shamir adleman  rabin 
1981,two-way deterministic finite automaton exponentially succinct sweeping automaton,n/a
1980,minimal form lambda-calculus computation,notion minimal form defined extension notion normal form --calculus meaning discussed computational environment feature knuth-gross reduction strategy used prove posse minimal form generic term semidecidable predicate
1980,osqrt|v| |e| algorithm finding maximum matching general graph,paper present  algorithm finding maximum matching general graph algorithm work phase phase maximal set disjoint minimum length augmenting path found existing matching increased along path contribution consists devising special way handling blossom enables implementation phase phase algorithm grows breadth first search tree unmatched vertex detects presence blossom shrink blossom immediately instead delay shrinking way first augmenting path found minimum length furthermore achieves effect shrinking blossom special labeling procedure enables find augmenting path blossom quickly
