2006,independent zero-knowledge set,define construct independent zero-knowledge set  protocol zks protocol prover commits set x prof non-interactively verifier x ∈s x ∉s without revealing information independent zks protocol introduce adversary prevented successfully correlate set one honest prover notion independence particular implies resulting zks protocol non-malleableon way result define notion independence commitment scheme shown notion implies non-malleability argue new notion potential simplify design security proof non-malleable commitment schemesefficient implementation zks protocol based notion mercurial commitment efficient construction independent zks protocol requires design new commitment scheme simultaneously independent  mercurial
2006,local zero knowledge,put forward notion local zero knowledge provide first implementation variety setting standard complexity assumptionswhereas classical notion zero knowledge guarantee secrecy information hard compute new one meaningfully guarantee secrecy information  consequently local zero knowledge remains meaningful even dp = np
2005,rational secure computation ideal mechanism design,secure computation essentially guarantee whatever computation n player help trusted party also fundamentally however notion depends honesty least player put forward implement stronger notion rational secure computation depend player honesty solely player rationality key implementation showing ballot-box - venerable device used throughout world tally secret vote securely - actually used securely compute function work bridge field game theory cryptography broad implication mechanism design
2005,collusion-free protocol,secure protocol attempt minimize injury privacy correctness inflicted malicious participant collude run-time however prevent malicious party colluding coordinating action first place!eliminating collusion malicious party execution protocol important exciting direction research cryptography contribute first general result direction  provide rigorous definition collusion-free protocol  prove standard physical computational assumption ---ie plain envelope trapdoor permutations---collusion-free protocol exist finite protocol task publicly observable action  finiteness game interest  public observability action  use type physically private channel provably essential
2005,optimal error correction computationally bounded noise,computationally bounded adversarial model error construct appealingly simple efficient cryptographic encoding unique decoding scheme whose error-correction capability much greater classically possible particularfor binary alphabet construct positive-rate coding scheme uniquely decodable / – γ error rate constant γ>  large alphabet construct coding scheme uniquely decodable a−r−−√error rate information rate r>    qualitatively stronger related work construction work public-key model  allows channel know everything receiver know addition technique potentially used construct coding scheme information rate approaching shannon limit finally construction qualitatively optimal show unique decoding high error rate impossible several natural relaxation model
2005,fair-zero knowledge,introduce fair zero-knowledge multi-verifier zk system every proof guaranteed “zero-knowledge verifiers” honest verifier accepts fair zero-knowledge proof assured verifier also learn nothing verity statement question even maliciously collude cheating proverwe construct fair zero-knowledge system based standard complexity assumption  initial one-time use physically secure communication channel  communication occurs  broadcast channelthe main technical challenge construction consists provably removing possibility using steganography zk proof overcome technical difficulty introduce tool —such unique zero knowledge— may independent interest
2004,sequential aggregate signature trapdoor permutation,aggregate signature scheme  method combining n signature n different signer n different message one signature unit length propose sequential aggregate signature set signer ordered aggregate signature computed signer turn add signature show realize way size aggregate signature independent n make sequential aggregate signature natural primitive certificate chain whose length reduced aggregating signature chain give construction random oracle model based family certified trapdoor permutation show instantiate scheme based rsa
2004,completely fair sfe coalition-safe cheap talk,secure function evaluation  enables group player evaluate function private input securely trusted third party done completely fair sfe protocol conceptually function value learned atomicallywe provide completely fair sfe protocol secure number malicious player using novel combination computational physical channel assumptionswe also show completely fair sfe striking application togame theory particular enables cheap-talk protocol achieve correlated-equilibrium payoff game first protocol provably give additional power coalition player exponentially efficient prior counterpart
2004,algorithmic tamper-proof atp security theoretical foundation security hardware tampering,traditionally secure cryptographic algorithm provide security adversary black-box access secret information honest party however model always adequate particular security algorithm may completely break  attack tamper secret keyin paper propose theoretical framework investigate algorithmic aspect related tamper-proof security particular define model security adversary allowed apply arbitrary feasible function f secret key sk obtain result cryptographic algorithm using new secret key fwe prove general setting impossible achieve strong notion security show minimal addition model needed order obtain provable securitywe prove addition necessary also sufficient common cryptographic primitive encryption signature schemeswe discus application portable device protected pin show integrate pin security generic security designfinally investigate restriction model tampering power adversary limited restriction model realistic attack  demonstrated practice setting show security solution work even without addition mentioned
2004,physically observable cryptography extended abstract,complexity-theoretic cryptography considers abstract notion computation hence cannot protect attack exploit information leakage  inherent physical execution cryptographic algorithm “physical observation attacks” bypass impressive barrier mathematical security erected far successfully break mathematically impregnable system great practicality inherent availability physical attack threaten relevance complexity-theoretic securityto respond present crisis put forward physically observable cryptography powerful comprehensive precise model defining delivering cryptographic security adversary access information leaked physical execution cryptographic algorithm general model allows variety adversary paper however focus strongest possible adversary capture cryptographically possible worst possible physically observable setting particular weconsider adversary full  access leaked informationshow basic theorem intuition traditional cryptography longer hold physically observable setting andconstruct pseudorandom generator provably secure physical-observation attacksour model make easy meaningfully restrict power general physically observing adversary restriction may enable scheme efficient rely weaker assumption retaining security meaningful physical observation attack
2003,plaintext awareness via key registration,paper reconsider notion plaintext awareness present new model plaintext-aware encryption natural useful achieve plaintext-aware encryption without random oracle using third party however need trust third party even third party dishonest still guarantee security adaptive chosen ciphertext attack show construction achieves definition general assumption motivate achievement showing important natural application giving additional real-world meaningfulness dolev-yao model
2003,fractal merkle tree representation traversal,introduce technique traversal merkle tree propose efficient algorithm generates sequence leaf along associated authentication path one choice parameter total n leaf technique requires worst-case computational effort  logn/loglog n hash function evaluation per output total storage capacity le  log n/loglogn hash value simultaneous improvement space time complexity previously published algorithm
2003,zero-knowledge set,show polynomial-time prover commit arbitrary finite set string later string x reveal proof whether x /spl isin/ x /spl notin/ without revealing knowledge beyond verity membership assertion method non interactive given public random string prover commits set simply posting short easily computable message time want prove whether given element set simply post another short easily computable proof whose correctness verified one public random string scheme efficient reasonable prior way achieve desideratum existed new primitive immediately extends providing zero-knowledge database
2003,simple fast optimistic protocol fair electronic exchange,assume two party something want fair exchange electronic protocol guaranteeing either party get want none protocol relying traditional trusted party easily guarantee exchange inefficient  expensive paper quickly review fair exchange optimistic relying trusted party  participate honest execution yet  guarantee fairness execution present older surprisingly simple optimistic protocol fair certified e-mail contract signing never appeared scientific literature
2002,improving exact security digital signature scheme,put forward new method constructing fiat-shamir-like signature scheme yield better “exact security” original fiat-shamir method 
2002,micropayments revisited,present new micropayment scheme efficient user friendly previous onesthese scheme reduce bank processing cost several order magnitude preserving simple interface user merchant scheme utilize probabilistic deposit protocol scheme may entirely hidden user
2002,transitive signature scheme,introduce provide first example transitive digital signature scheme informally way digitally sign vertex edge dynamically growing transitively closed graph g guarantee following propertiesgiven signature edge   anyone easily derive digital signature edge computationaly hard adversary forge digital signature new vertex edge g even request legitimate signer digitally sign number g’s vertex edge choice adaptive fashion 
2001,mutually independent commitment,study two-party commitment problem two player secret value wish commit traditional commitment scheme cannot used guarantee independence committed value present three increasingly strong definition independence setting give practical protocol work related work non-malleable cryptography however two-party commitment problem solved much efficiently using non-malleability technique
2001,accountable-subgroup multisignatures extended abstract,formal model security proof especially important multisignatures contrast threshold signature precise definition ever provided scheme proposal subsequently brokenin paper formalize implement variant multi-signature scheme accountable-subgroup multisignatures  essence asm scheme enable subgroup given group g potential signer sign efficiently message signature provably reveals identity signer verifierspecifically providethe first formal model security multisignature scheme explicitly includes key generation protocol based schnorrs signature scheme  provable efficientonly three round communication required per signaturethe signing time per signer single-signer schnorr scheme regardless number signersthe verification time slightly greater single-signer schnorr schemethe signature length single signer schnorr scheme regardless number signersour proof security relies random oracle hardness discrete log problem
2001,soundness public-key model,public-key model interactive proof proved quite effective improving protocol efficiency  argue however soundness notion subtle complex classical model better understood avoid designing erroneous protocol specifically public-key model weidentify four meaningful notion soundnessprove minimal complexity assumption four notion distinctidentify exact soundness notion satisfied prior interactive protocol andidentify round complexity new notion
2001,min-round resettable zero-knowledge public-key model,stoc  canetti goldreich goldwasser micali put forward strongest notion zero-knowledge date resettable zero-knowledge  implemented constant round new model verifier simply public key registered interaction proverto achieve ultimate round efficiency advocate slightly stronger model informally show long honest verifier use given public key fixed-polynomial number time exist -round  rzk protocol np
2001,identification protocol secure reset attack,provide identification protocol secure even adversary reset internal state and/or randomization source user identifying executed asynchronous environment like internet give adversary concurrent access instance user protocol suitable use device  adversary control may able reliably maintain internal state invocation
2001,amortized e-cash,present e-cash scheme provides trade-off anonymity efficiency amortizing cost zero-knowledge signature computation cash generation phaseour work solves open problem okamoto divisible e-cash namely achieve  similar okamoto  based traditional complexity assumption   within much crisper definitional framework highlight anonymity property  simple fashion
2000,reducibility completeness private computation,define notion reducibility completeness  private computation let g n-argument function say function f reducible function g n honest-but-curious player compute function fn -privately given black box g  say g complete  every function f reducible gin paper characterize complete boolean function show boolean function g complete g cannot computed n-privately  namely n-argument boolean function notion completeness n-privacy complementary characterization provides huge collection complete function nonprivate boolean function! compared example given  previous work hand nonboolean function show two notion complementary
2000,computationally sound proof,paper put forward new notion proof based computational complexity explores implication computation largecomputationally sound proof provide novel meaningful framework answer old new question complexity theory particular given random oracle new complexity assumption enable u prove verifying easier deciding theorem provide quite effective way prove membership computationally hard language  show every computation posse short certificate vouching correctnessfinally special type computationally sound proof exists show blums notion program checking meaningfully broadened prove $ n  p$-complete language checkable
2000,parallel reducibility information-theoretically secure computation,secure function evaluation  protocol hard design reducibility recognized highly desirable property sfe protocol informally speaking reducibility  automatic ability break design complex sfe protocol several simpler individually secure component despite much effort basic type reducibility sequential reducibility  considered proven hold specific class sfe protocol unfortunately sequential reducibility allow one save number round  achieving general notion easy paper information-theoretic sfe protocol weformalize notion parallel reducibility sub-protocols run timeclarify two distinct form parallel reducibilityconcurrent reducibility applies order sub-protocol call important  andsynchronous reducibility applies sub-protocols must executed simultaneously show large class sfe protocol  provably enjoy  parallel reducibility
2000,public-key encryption multi-user setting security proof improvement,paper address security public-key cryptosystems “multi-user” setting namely presence attack involving encryption related message different public key exemplified håstad’s classical attack rsa prove security single-user setting implies security multi-user setting long former interpreted strong sense “indistinguishability” thereby pin-pointing many scheme guaranteed secure håstad-type attack highlight importance practice considering improving concrete security general reduction present improvement two diffie-hellman based scheme namely el gamal cramer-shoup
2000,resettable zero-knowledge extended abstract,introduce notion resettable zero-knowledge  new security measure cryptographic protocol strengthens classical notion zero-knowledge essence rzk protocol one remains zero knowledge even adversary interact prover many time time resetting prover initial state forcing use random tape known example zero-knowledge proof argument trivially breakable setting moreover definition zero-knowledge proof knowledge breakable setting general complexity assumption hold example discrete logarithm problem hard construct  resettable zero-knowledge proof-systems np non-constant number round * five-round resettable witness-indistinguishable proofsystems np e four-round resettabie zero-knowledge argument np public key model verifier fixed public key associated addition shedding new light make zero knowledge possible  rzk great relevance application firstly rzk protocol closed parallel concurrent execution thus guaranteed secure implemented fully asynchronous network even adversary schedule arrival every message sent foil security secondly rzk protocol enlarge range physical way provers zk protocol securely implemented including device cannot reliably toss coin line keep state 
1999,improving exact security fiat-shamir signature scheme,provide two contribution exact security analysis digital signature  put forward new method constructing fiat-shamir-like signature scheme yield better “exact security” original fiat-shamir method  extend exact security analysis exact cost-security analysis showing digital signature scheme “loose security” may preferable reasonable measure cost
1999,all-or-nothing nature two-party secure computation,function f computationally securely computable two computationally-bounded party alice secret input x bob secret input talk back forth   bob learns essentially f  alice learns essentially nothingwe prove non-trivial function computed every function consequently complexity assumption sufficient and/or required computationally securely computing f every non-trivial function f
1999,lower bound oblivious transfer reduction,prove first general non-trivial lower bound number time -out-of-n oblivious transfer string length l invoked obtain information-theoretically secure reduction -out-of-n oblivious transfer string length l bound tight many significant caseswe also prove first non-trivial lower bound number random bit needed implement reduction whenever receiver sends message sender bound also tight many significant case
1999,computationally private information retrieval polylogarithmic communication,present single-database computationally private information retrieval scheme polylogarithmic communication complexity construction based new reasonable intractability assumption call φ-hiding assumption  essentially difficulty deciding whether small prime divide φ composite integer unknown factorization
1999,verifiable random function,efficiently combine unpredictability verifiability extending goldreich-goldwasser-micali  construction pseudorandom function f/sub s/ secret seed knowledge enables one evaluate f/sub s/ point x also provide np-proof value f/sub s/ indeed correct without compromising unpredictability f/sub s/ point proof provided
1998,computationally-sound checker,show c proof important implication validating one-sided heuristic np namely generalizing prior notion blums put forward notion c checker show special-type c proof imply c checker np-complete language
1997,optimal probabilistic protocol synchronous byzantine agreement,broadcasting guarantee recipient message everyone else received message guarantee longer exists setting communication person-to-person people involved untrustworthy though may claim send message everyone untrustworthy sender may send different message different people setting byzantine agreement offer best alternative broadcasting thus far however reaching byzantine agreement required either many round communication  help external trusted partyin paper standard communication model synchronous network pair processor connected private communication line exhibit protocol probabilistic polynomial time without relying external trusted party reach byzantine agreement expected constant number round worst natural fault model fact protocol successfully tolerates / processor network may deviate prescribed instruction arbitrary way cooperate perform arbitrarily long computationsour protocol effectively demonstrates power randomization zero-knowledge computation error indeed prof privacy  even desired goal  crucial tool achieving correctnessour protocol also introduces three new primitives---graded broadcast graded verifiable secret sharing oblivious common coin---that independent interest may effectively used practical protocol
1996,on-line/off-line digital signature,new type signature scheme proposed consists two phase first phase performed off-line message signed even known second phase performed on-line message signed known supposed fast method constructing on-line/off-line signature scheme presented method us one-time signature scheme fast on-line signing ordinary signature scheme used off-line stagein practical implementation scheme use variant rabins signature scheme  de on-line phase use moderate amount de computation single modular multiplication stress costly modular exponentiation operation performed off-line implementation ideally suited electronic wallet smart card
1996,secure protocol oblivious transfer extended abstract,great deal interest lately cryptographic protocol vaguely cryptographic protocol mean whereby two people interact manner exchange certain amount information keeping information secret  one interesting task one would like protocol oblivious transfer introduced rabin  involves two party b would like send message sort b constraint b  chance receiving message half time b receives information message additional constraint idea whether b received message oblivious transfer viewed special type coin tossing although useful appears useful mean towards end fact used number protocol number different researcher -  rabin proposed protocol oblivious transfer intended protocol correct assuming hard factor certain large composite number however described potential flaw protocol possible b cheat obtain extra information even assumption difficulty factoring true although cannot prove b cheat way one yet able prove b cannot section  present new protocol oblivious transfer similar rabins fix potential flaw possible prove protocol work subject assumption difficulty factoring
1996,practical provably-secure commitment scheme collision-free hashing,present practical string-commitment scheme provably secure based solely collision-free hashing scheme enables computationally bounded party commit string unbounded one optimal  term interaction communication computationour result also prof constant round statistical zero-knowledge argument constant-round computational zero-knowledge proof np exist based existence collision-free hash function
1995,simple method generating sharing pseudo-random function application clipper-like escrow system,present simple method generating shared pseudo-random function poly-random collection function discus application construction key escrow
1995,verifiable secret sharing secure computation,verifiable secret sharing fundamental primitive secure cryp- tographic design present stronger notion verifiable secret sharing exhibit protocol implementing show new notion preferable old one whenever verifiable secret sharing used tool within larger protocol rather goal indeed definition protocol satisfying provably guarantee reducibility application new notion field secure multiparty computation also provided
1994,c proof extended abstract,paper put forward computationally-based notion proof explores implication computation large particular given random oracle suitable cryptographic assumption show every computation posse short certificate vouching correctness cryptographic assumption program /spl nscr//spl pscr/-complete problem checkable polynomial time addition work provides beginning theory computational complexity based individual input rather languages< >
1994,reducibility completeness multi-party private computation,define notion reducibility completeness multi-party private computation let g n-argument function say function f reducible g n honest-but-curious player compute function f n-privately given black-box g  say g complete  every function f reducible g paper characterize complete boolean function show boolean function g complete g cannot computed n-privately  namely boolean function notion completeness n-privacy complementary characterization give huge collection complete function  compared example given  previous work hand non-boolean function show two notion complementary  viewed generalization -argument function two-party case known oblivious transfer protocol  complete< >
1993,secret-key agreement without public-key cryptography,paper describe novel approach secret-key agreement scheme based public-key cryptography number theory extremely efficient implemented software make use simple unexpensive hardware technology particularly well-suited use cryptographic scenario like clipper chip recent encryption proposal put forward clinton administration
