2011,manifold tangent classifier,combine three important idea present previous work building classifier semi-supervised hypothesis  unsupervised manifold hypothesis  manifold hypothesis classification  exploit novel algorithm capturing manifold structure  show build topological atlas chart chart characterized principal singular vector jacobian representation mapping representation learning algorithm stacked yield deep architecture combine domain knowledge-free version tangentprop algorithm encourage classifier insensitive local direction change along manifold record-breaking classification  obtained
2011,tracking partition function,markov random field  proven powerful density estimator feature extractor classification however use often limited inability estimate partition function z paper exploit gradient descent training procedure restricted boltzmann machine  { track} log partition function learning method relies two distinct source information  estimating change  zincurred gradient update  estimating difference zover small set tempered distribution using bridge sampling two source information combined using inference procedure similar kalman filtering learning mrfs tempered stochastic maximum likelihood estimate zusing temperature required learning comparing exact value estimate using annealed importance sampling  show several datasets method able accurately track log partition function contrast ai method provides estimate time-step computational cost similar required training alone
2011,algorithm hyper-parameter optimization,several recent advance state art image classification benchmark come better configuration existing technique rather novel approach feature learning traditionally hyper-parameter optimization job human efficient regime trial possible presently computer cluster gpu processor make possible run trial show algorithmic approach find better  present hyper-parameter optimization  task training neural network deep belief network  optimize hyper-parameters using random search two new greedy sequential method based expected improvement criterion random search shown sufficiently efficient learning neural network several datasets show unreliable training dbns sequential algorithm applied difficult dbn learning problem  find significantly better  best previously reported work contributes novel technique making response surface model p  many element hyper-parameter assignment  known irrelevant given particular value element
2011,higher order contractive auto-encoder,propose novel regularizer training auto-encoder unsupervised feature extraction explicitly encourage latent representation contract input space regularizing norm jacobian  hessian  encoder’s output respect input training point penalty jacobian’s norm ensures robustness tiny corruption sample input space constraining norm hessian extends robustness moving away sample manifold learning perspective balancing regularization auto-encoder’s reconstruction objective yield representation varies moving along data manifold input space insensitive direction orthogonal manifold second order regularization using hessian penalizes curvature thus favor smooth manifold show proposed technique remaining computationally efficient yield representation significantly better suited initializing deep architecture previously proposed approach beating state-of-the-art performance number datasets
2011,discussion neural autoregressive distribution estimator,restricted boltzmann machine  inspired much research recent year particular building block deep architecture  review restricted boltzmann machine  undirected graphical model latent variable exact inference rather simple sampling procedure  several successful learning algorithm based approximation log-likelihood gradient however come actually computing distribution density function intractable except either number input latent variable small  
2011,deep learner benefit out-of-distribution example,recent theoretical empirical work statistical machine learning demonstrated potential learning algorithm deep architecture ie function class obtained composing multiple level representation hypothesis evaluated intermediate level representation shared across task example different related distribution yield even benefit comparative experiment performed large-scale handwritten character recognition setting  class  using multi-task setting perturbed example order obtain out-ofdistribution example  agree hypothesis show deep learner beat previously published  reached human-level performance 
2011,spike slab restricted boltzmann machine,introduce spike slab restricted boltzmann machine characterized real-valued vector slab binary variable spike associated unit hidden layer model posse practical property amenable block gibbs sampling well capable generating similar latent representation data recently introduced mean covariance restricted boltzmann machine illustrate spike slab restricted boltzmann machine achieves competitive performance cifar- object recognition task
2011,deep sparse rectifier neural network,logistic sigmoid neuron biologically plausible hyperbolic tangent neuron latter work better training multi-layer neural network paper show rectifying neuron even better model biological neuron yield equal better performance hyperbolic tangent network spite hard non-linearity non-differentiability 
2010,decision tree generalize new variation,family decision tree learning algorithm among widespread studied motivated desire develop learning algorithm generalize learning highly varying function presumably needed achieve artificial intelligence study theoretical limitation decision tree demonstrate formally seriously hurt curse dimensionality sense bit different nonparametric statistical method importantly cannot generalize variation seen training set decision tree creates partition input space need least one example region associated leaf make sensible prediction region better understanding fundamental reason limitation suggests one use forest even deeper architecture instead tree provide form distributed representation generalize variation encountered training data
2010,alternative time representation dopamine model,dopaminergic neuron activity modeled learning appetitive behavior commonly using temporal-difference  algorithm however proper representation elapsed time exact task usually required model work model use timing element delay-line representation time biologically realistic interval range second interval-timing literature provides several alternative one timing could emerge general network dynamic instead coming dedicated circuit present general rate-based learning model based long short-term memory  network learns time representation needed using nave network learning environment conjunction td reproduce dopamine activity appetitive trace conditioning constant cs-us interval including probe trial unexpected delay proposed model learns representation environment dynamic adaptive biologically plausible framework without recourse delay line special-purpose circuit instead model predicts task-dependent representation time learned experience encoded ramp-like change single-neuron activity distributed across small neural network reflects temporal integration mechanism resulting inherent dynamic recurrent loop within network model also reproduces known finding trace conditioning difficult delay conditioning learned representation task highly dependent type trial experienced training finally suggests phasic dopaminergic signal could facilitate learning cortex
2010,unsupervised pre-training help deep learning,much recent research devoted learning algorithm deep architecture deep belief network stack auto-encoder variant impressive  obtained several area mostly vision language data set best  obtained supervised learning task involve unsupervised learning component usually unsupervised pre-training phase even though new algorithm enabled training deep model many question remain nature difficult learning problem main question investigated following unsupervised pre-training work answering question important learning deep architecture improved propose several explanatory hypothesis test extensive simulation empirically show influence pre-training respect architecture depth model capacity number training example experiment confirm clarify advantage unsupervised pre-training  suggest unsupervised pre-training guide learning towards basin attraction minimum support better generalization training data set evidence  support regularization explanation effect pre-training
2010,stacked denoising autoencoders learning useful representation deep network local denoising criterion,explore original strategy building deep network based stacking layer denoising autoencoders trained locally denoise corrupted version input resulting algorithm straightforward variation stacking ordinary autoencoders however shown benchmark classification problem yield significantly lower classification error thus bridging performance gap deep belief network  several case surpassing higher level representation learnt purely unsupervised fashion also help boost performance subsequent svm classifier qualitative experiment show contrary ordinary autoencoders denoising autoencoders able learn gabor-like edge detector natural image patch larger stroke detector digit image work clearly establishes value using denoising criterion tractable unsupervised objective guide learning useful higher level representation
2010,deep belief network compact universal approximators,deep belief network  generative model many layer hidden causal variable recently introduced hinton osindero teh  along greedy layer-wise unsupervised learning algorithm building le roux bengio  sutskever hinton  show deep narrow generative network require parameter shallow one achieve universal approximation exploiting proof technique prove deep narrow feedforward neural network sigmoidal unit represent boolean expression
2010,tractable multivariate binary density estimation restricted boltzmann forest,investigate problem estimating density function multivariate binary data particular focus model computing estimated probability data point tractable setting previous work mostly concentrated mixture modeling approach argue problem tractable density estimation restricted boltzmann machine  provides competitive framework multivariate binary density modeling mind also generalize rbm framework present restricted boltzmann forest  replaces binary variable hidden layer rbms group tree-structured binary variable extension allows u obtain model modeling capacity remain tractable experiment several data set demonstrate competitiveness approach study property
2010,word representation simple general method semi-supervised learning,take existing supervised nlp system simple general way improve accuracy use unsupervised word representation extra word feature evaluate brown cluster collobert weston  embeddings hlbl  embeddings word ner chunking use near state-of-the-art supervised baseline find three word representation improves accuracy baseline find improvement combining different word representation
2010,learning tag vary within song,paper examines relationship human generated tag describing different part song tag collected using amazon mechanical turk service find agreement different people tag decrease distance part song heard increase model tag relationship describe conditional restricted boltzmann machine using model fill tag probably present given context tag train automatic tag classifier  outperform trained original data
2010,tempered markov chain monte carlo training restricted boltzmann machine,alternating gibbs sampling common scheme used sampling restricted boltzmann machine  crucial component deep architecture deep belief network however find often poor job rendering diversity mode captured trained model suspect hinders advantage could principle brought training algorithm relying gibbs sampling uncovering spurious mode persistent contrastive divergence algorithm alleviate problem explore use tempered markov chain monte-carlo sampling rbms find visualization sample measure likelihood toy dataset help sampling learning
2010,understanding difficulty training deep feedforward neural network,whereas  appears deep multi-layer neural network successfully trained since several algorithm shown successfully train experimental  showing superiority deeper v le deep architecture experimental  obtained new initialization training mechanism objective understand better standard gradient descent random initialization poorly deep neural network better understand recent relative success help design better algorithm future first observe influence non-linear activation function find logistic sigmoid activation unsuited deep network random initialization mean value drive especially top hidden layer saturation surprisingly find saturated unit move saturation albeit slowly explaining plateau sometimes seen training neural network find new non-linearity saturates le often beneficial finally study activation gradient vary across layer training idea training may difficult singular value jacobian associated layer far  based consideration propose new initialization scheme brings substantially faster convergence
2009,learning deep architecture ai,theoretical  strongly suggest order learn kind complicated function represent high-level abstraction  one need deep architecture deep architecture composed multiple level non-linear operation neural net many hidden layer complicated propositional formula re-using many sub-formulae searching parameter space deep architecture difficult optimization task learning algorithm deep belief network recently proposed tackle problem notable success beating state-of-the-art certain area paper discus motivation principle regarding learning algorithm deep architecture particular exploiting building block unsupervised learning single-layer model restricted boltzmann machine used construct deeper model deep belief network
2009,exploring strategy training deep neural network,deep multi-layer neural network many level non-linearities allowing compactly represent highly non-linear highly-varying function however recently clear train deep network since gradient-based optimization starting random initialization often appears get stuck poor solution hinton et al recently proposed greedy layer-wise unsupervised learning procedure relying training algorithm restricted boltzmann machine  initialize parameter deep belief network  generative model many layer hidden causal variable followed proposal another greedy layer-wise procedure relying usage autoassociator network context optimization problem study algorithm empirically better understand success experiment confirm hypothesis greedy layer-wise unsupervised training strategy help optimization initializing weight region near good local minimum also implicitly act sort regularization brings better generalization encourages internal distributed representation high-level abstraction input also present series experiment aimed evaluating link performance deep neural network practical aspect topology example demonstrating case addition depth help finally empirically explore simple variant training algorithm use different rbm input unit distribution simple way combining gradient estimator improve performance well on-line version algorithm
2009,incorporating functional knowledge neural network,incorporating prior knowledge particular task architecture learning algorithm greatly improve generalization performance study case know function learned non-decreasing two argument convex one purpose propose class function similar multi-layer neural network  property  universal approximator lipschitz function property apply new class function task modelling price call option experiment show improvement regressing price call option using new type function class incorporate priori constraint
2009,justifying generalizing contrastive divergence,study expansion log likelihood undirected graphical model restricted boltzmann machine  term expansion associated sample gibbs chain alternating two random variable  particularly interested estimator gradient log likelihood obtained expansion show residual term converges zero justifying use truncationrunning short gibbs chain main idea behind contrastive divergence  estimator log-likelihood gradient truncating even obtain stochastic reconstruction error related mean-field approximation reconstruction error often used train autoassociators stacked autoassociators derivation specific particular parametric form used rbms requires convergence gibbs chain present theoretical empirical evidence linking number gibbs step k magnitude rbm parameter bias cd estimator experiment also suggest sign cd estimator correct time even bias large cd-k good descent direction even small k
2009,hybrid pareto mixture conditional asymmetric fat-tailed distribution,many case observe variable x contain predictive information scalar variable interest  pair observed training set take advantage information estimate conditional density p paper propose conditional mixture model hybrid pareto component estimate p hybrid pareto gaussian whose upper tail replaced generalized pareto tail third parameter addition location spread parameter gaussian control heaviness upper tail using hybrid pareto mixture model  nonparametric estimator adapt multimodality asymmetry heavy tail conditional density estimator built modeling parameter mixture estimator function x use neural network implement function conditional density estimator important application many domain finance insurance show experimentally novel approach better model conditional density term likelihood compared competing algorithm conditional mixture model type component classical kernel-based nonparametric model
2009,workshop summary workshop learning feature hierarchy,abstract available
2009,curriculum learning,human animal learn much better example randomly presented organized meaningful order illustrates gradually concept gradually complex one formalize training strategy context machine learning call curriculum learning context recent research studying difficulty training presence non-convex training criterion  explore curriculum learning various set-ups experiment show significant improvement generalization achieved hypothesize curriculum learning effect speed convergence training process minimum case non-convex criterion quality local minimum obtained curriculum learning seen particular form continuation method 
2009,quadratic feature deep architecture chunking,experiment several chunking model deeper architecture achieve better generalization quadratic filter simplification theoretical model v complex cell reliably increase accuracy fact logistic regression quadratic filter outperforms standard single hidden layer neural network adding quadratic filter logistic regression almost effective feature engineering despite predicting output label independently model competitive one use previous decision
2009,slow decorrelated feature pretraining complex cell-like network,introduce new type neural network activation function based recent physiological rate model complex cell visual area v single-hidden-layer neural network kind model achieves  error mnist also introduce existing criterion learning slow decorrelated feature pretraining strategy image model pretraining strategy  orientation-selective feature similar receptive field complex cell pretraining single-hidden-layer model achieves better generalization error even though pretraining sample distribution different fine-tuning distribution implement pretraining strategy derive fast algorithm online learning decorrelated feature iteration algorithm run linear time respect number feature
2009,infinite factor model hierarchy via noisy-or mechanism,indian buffet process bayesian nonparametric approach model object arising infinite number latent factor extend latent factor model framework two unbounded layer latent factor generative perspective layer defines conditional {factorial} prior distribution binary latent variable layer via noisy-or mechanism explore property model two empirical study one digit recognition task one music tag data experiment
2009,difficulty training deep architecture effect unsupervised pre-training,whereas theoretical work suggests deep architecture might efficient representing highly-varying function training deep architecture unsuccessful recent advent algorithm based unsupervised pretraining even though new algorithm enabled training deep model many question remain nature difficult learning problem answering question important learning deep architecture improved attempt shed light question extensive simulation experiment confirm clarify advantage unsupervised pre-training demonstrate robustness training procedure respect random initialization positive effect pre-training term optimization role kind regularizer show influence architecture depth model capacity number training example
2008,representational power restricted boltzmann machine deep belief network,deep belief network  generative neural network model many layer hidden explanatory factor recently introduced hinton osindero teh  along greedy layer-wise unsupervised learning algorithm building block dbn probabilistic model called restricted boltzmann machine  used represent one layer model restricted boltzmann machine interesting inference easy successfully used building block training deeper model first prove adding hidden unit yield strictly improved modeling power second theorem show rbms universal approximators discrete distribution study question whether dbns layer strictly powerful term representational power suggests new le greedy criterion training rbms within dbns
2008,neural net language model,n/a
2008,adaptive importance sampling accelerate training neural probabilistic language model,previous work statistical language modeling shown possible train feedforward neural network approximate probability sequence word resulting significant error reduction compared standard baseline model based n-grams however training neural network model maximum-likelihood criterion requires computation proportional number word vocabulary paper introduce adaptive importance sampling way accelerate training model idea use adaptive n-gram model track conditional distribution produced neural network show significant speedup obtained standard problem
2008,zero-data learning new task,introduce problem zero-data learning model must generalize class task training data available description class task provided zero-data learning useful problem set class distinguish task solve large entirely covered training data main contribution work lie presentation general formalization zero-data learning experimental analysis property empirical evidence showing generalization possible significant context experimental work paper address two classification problem character recognition multi-task ranking problem context drug discovery finally conclude discussing new framework could lead novel perspective extend machine learning towards ai agent given specification learning problem attempting solve 
2008,classification using discriminative restricted boltzmann machine,recently many application restricted boltzmann machine  developed large variety learning problem however rbms usually used feature extractor another learning algorithm provide good initialization deep feed-forward neural network classifier considered standalone solution classification problem paper argue rbms provide self-contained framework deriving competitive non-linear classifier present evaluation different learning algorithm rbms aim introducing discriminative component rbm training improve performance classifier approach simple rbms used directly build classifier rather stepping stone finally demonstrate discriminative rbms also successfully employed semi-supervised setting
2008,extracting composing robust feature denoising autoencoders,previous work shown difficulty learning deep generative discriminative model overcome initial unsupervised learning step map input useful intermediate representation introduce motivate new training principle unsupervised learning representation based idea making learned representation robust partial corruption input pattern approach used train autoencoders denoising autoencoders stacked initialize deep architecture algorithm motivated manifold learning information theoretic perspective generative model perspective comparative experiment clearly show surprising advantage corrupting input autoencoders pattern classification benchmark suite
2007,noisy k best-paths approximate dynamic programming application portfolio optimization,describe general method transform non-markovian sequential decision problem supervised learning problem using k-best-paths algorithm consider application financial portfolio management train controller directly optimize sharpe ratio  utility function illustrate approach demonstrating experimental  using kernel-based controller architecture would normally considered traditional reinforcement learning approximate dynamic programming show using non-additive criterion  yield noisy k-best-paths extraction problem give substantially improved performance
