2014,identifying attacking saddle point problem high-dimensional non-convex optimization,central challenge many field science engineering involves minimizing non-convex error function continuous high dimensional space gradient descent quasi-newton method almost ubiquitously used perform minimization often thought main source difficulty local method find global minimum proliferation local minimum much higher error global minimum argue based  statistical physic random matrix theory neural network theory empirical evidence deeper profound difficulty originates proliferation saddle point local minimum especially high dimensional problem practical interest saddle point surrounded high error plateau dramatically slow learning give illusory impression existence local minimum motivated argument propose new approach second-order optimization saddle-free newton method rapidly escape high dimensional saddle point unlike gradient descent quasi-newton method apply algorithm deep recurrent neural network training provide numerical evidence superior optimization performance
2014,transferable feature deep neural network,many deep neural network trained natural image exhibit curious phenomenon common first layer learn feature similar gabor filter color blob first-layer feature appear specific particular dataset task general applicable many datasets task feature must eventually transition general specific last layer network transition studied extensively paper experimentally quantify generality versus specificity neuron layer deep convolutional neural network report surprising  transferability negatively affected two distinct issue  specialization higher layer neuron original task expense performance target task expected  optimization difficulty related splitting network co-adapted neuron expected example network trained imagenet demonstrate either two issue may dominate depending whether feature transferred bottom middle top network also document transferability feature decrease distance base task target task increase transferring feature even distant task better using random feature final surprising result initializing network transferred feature almost number layer produce boost generalization lingers even fine-tuning target dataset
2014,equivalence deep nade generative stochastic network,neural autoregressive distribution estimator  recently shown successful alternative modeling high dimensional multimodal distribution one issue associated nades rely particular order factorization p issue recently addressed variant nade called orderless nades deeper version deep orderless nade orderless nades trained based criterion stochastically maximizes p possible order factorization unfortunately ancestral sampling deep nade expensive corresponding running neural net separately predicting visible variable given others work make connection criterion training criterion generative stochastic network  show training nades way also train gsn defines markov chain associated nade model based connection show alternative way sample trained orderless nade allows trade-off computing time quality sample  -fold speedup  obtained without noticeably reducing quality sample achieved using novel sampling procedure gsns called annealed gsn sampling similar tempering method combine fast mixing  accurate sample 
2014,learned-norm pooling deep feedforward recurrent neural network,paper propose investigate novel nonlinear unit called l p unit deep neural network proposed l p unit receives signal several projection subset unit layer computes normalized l p norm notice two interesting interpretation l p unit first proposed unit understood generalization number conventional pooling operator average root-mean-square max pooling widely used instance convolutional neural network  hmax model neocognitrons furthermore l p unit certain degree similar recently proposed maxout unit  achieved state-of-the-art object recognition  number benchmark datasets secondly provide geometrical interpretation activation function based argue l p unit efficient representing complex nonlinear separating boundary l p unit defines superelliptic boundary exact shape defined order p claim make possible model arbitrarily shaped curved boundary efficiently combining l p unit different order insight justifies need learning different order unit model empirically evaluate proposed l p unit number datasets show multilayer perceptrons  consisting l p unit achieve state-of-the-art  number benchmark datasets furthermore evaluate proposed l p unit recently proposed deep recurrent neural network 
2014,overcoming curse sentence length neural machine translation using automatic segmentation,author  shown recently introduced neural network translation system suffer significant drop translation quality translating long sentence unlike existing phrase-based translation system paper propose way address issue automatically segmenting input sentence phrase easily translated neural network translation model segment independently translated neural machine translation model translated clause concatenated form final translation empirical  show significant improvement translation quality long sentence
2014,property neural machine translation encoder-decoder approach,neural machine translation relatively new approach statistical machine translation based purely neural network neural machine translation model often consist encoder decoder encoder extract fixed-length representation variable-length input sentence decoder generates correct translation representation paper focus analyzing property neural machine translation using two model rnn encoder--decoder newly proposed gated recursive convolutional neural network show neural machine translation performs relatively well short sentence without unknown word performance degrades rapidly length sentence number unknown word increase furthermore find proposed gated recursive convolutional network learns grammatical structure sentence automatically
2014,bounding test log-likelihood generative model,several interesting generative learning algorithm involve complex probability distribution many random variable involving intractable normalization constant latent variable normalization may even analytic expression unnormalized probability function tractable approximation make difficult estimate quality model trained monitor quality  training previously proposed method based constructing non-parametric density estimator model probability function sample generated model revisit idea propose efficient estimator prove provides lower bound true test log-likelihood unbiased estimator number generated sample go infinity although one incorporates effect poor mixing propose biased variant estimator used reliably finite number sample purpose model comparison
2014,empirical investigation catastrophic forgeting gradient-based neural network,catastrophic forgetting problem faced many machine learning model algorithm trained one task trained second task many machine learning model forget perform first task widely believed serious problem neural network investigate extent catastrophic forgetting problem occurs modern neural network comparing established recent gradient-based training algorithm activation function also examine effect relationship first task second task catastrophic forgetting find always best train using dropout algorithm--the dropout algorithm consistently best adapting new task remembering old task best tradeoff curve two extreme find different task relationship task result different ranking activation function performance suggests choice activation function always cross-validated
2014,multimodal transition generative stochastic network,generative stochastic network  recently introduced alternative traditional probabilistic modeling instead parametrizing data distribution directly one parametrizes transition operator markov chain whose stationary distribution estimator data generating distribution result training therefore machine generates sample markov chain however previously introduced gsn consistency theorem suggest order capture wide class distribution transition operator general multimodal something done paper introduce first time multimodal transition distribution gsns particular using model nade family  output distribution transition operator nade model related rbm  likelihood  computed easily parameter nade obtained learned function previous state learned markov chain experiment clearly illustrate advantage multimodal transition distribution unimodal gsns
2014,construct deep recurrent neural network,paper explore different way extend recurrent neural network  {deep} rnn start arguing concept depth rnn clear feedforward neural network carefully analyzing understanding architecture rnn however find three point rnn may made deeper  input-to-hidden function  hidden-to-hidden transition  hidden-to-output function based observation propose two novel architecture deep rnn orthogonal earlier attempt stacking multiple recurrent layer build deep rnn  provide alternative interpretation deep rnns using novel framework based neural operator proposed deep rnns empirically evaluated task polyphonic music prediction language modeling experimental result support claim proposed deep rnns benefit depth outperform conventional shallow rnns
2014,number inference region deep feed forward network piece-wise linear activation,paper explores complexity deep feedforward network linear pre-synaptic coupling rectified linear activation contribution growing body work contrasting representational power deep shallow network architecture particular offer framework comparing deep shallow model belong family piecewise linear function based computational geometry look deep rectifier multi-layer perceptron  linear output unit compare single layer version model asymptotic regime number input stay constant shallow model hasknhidden unit andninputs number linear region isoknnn aklayer model withnhidden unit layer isω⌊n/n⌋k−nn number⌊n/n⌋k−grows faster thanknwhenntends infinity whenktends infinity andn≥n additionally even whenkis small restrictnto ben show deep model considerably linear region shallow one consider first step towards understanding complexity model specifically towards providing suitable mathematical tool future analysis
2014,empirical analysis dropout piecewise linear network,recently introduced dropout training criterion neural network subject much attention due simplicity remarkable effectiveness regularizer well interpretation training procedure exponentially large ensemble network share parameter work empirically investigate several question related efficacy dropout specifically concern network employing popular rectified linear activation function investigate quality test time weight-scaling inference procedure evaluating geometric average exactly small model well compare performance geometric mean arithmetic mean commonly employed ensemble technique explore effect tied weight ensemble interpretation training ensemble masked network without tied weight finally investigate alternative criterion based biased estimator maximum likelihood ensemble gradient
2014,revisiting natural gradient deep network,evaluate natural gradient algorithm originally proposed amari  learning deep model contribution paper follows show connection natural gradient three recently proposed method training deep model hessian-free  krylov subspace descent  tonga  describe one use unlabeled data improve generalization error obtained natural gradient empirically evaluate robustness algorithm ordering training set compared stochastic gradient descent finally extend natural gradient incorporate second order information alongside manifold information provide benchmark new algorithm using truncated newton approach inverting metric matrix instead using diagonal approximation
2013,learning deep physiological model affect,feature extraction feature selection crucial phase process affective modeling however incorporate substantial limitation hinder development reliable accurate model affect purpose modeling affect manifested physiology paper build recent advance machine learning deep learning  approach efficiency dl algorithm train artificial neural network model tested compared standard feature extraction selection approach followed literature  game data corpus - containing player physiological signal  subjective self-reports affect - reveal dl outperforms manual ad-hoc feature extraction yield significantly accurate affective model moreover appears dl meet even outperforms affective model boosted automatic feature selection several scenario examined dl method generic applicable affective modeling task key finding paper suggest ad-hoc feature extraction selection - lesser degree - could bypassed
2013,representation learning review new perspective,success machine learning algorithm generally depends data representation hypothesize different representation entangle hide le different explanatory factor variation behind data although specific domain knowledge used help design representation learning generic prior also used quest ai motivating design powerful representation-learning algorithm implementing prior paper review recent work area unsupervised feature learning deep learning covering advance probabilistic model autoencoders manifold learning deep network motivates longer term unanswered question appropriate objective learning good representation computing representation  geometrical connection representation learning density estimation manifold learning
2013,scaling spike-and-slab model unsupervised feature learning,describe use two spike-and-slab model modeling real-valued data emphasis application object recognition first model call spike-and-slab sparse coding  preexisting model introduce faster approximate inference algorithm introduce deep variant sc call partially directed deep boltzmann machine  extend sc inference algorithm use model describe learning procedure demonstrate inference procedure sc enables scaling model unprecedented large problem size demonstrate using sc feature extractor  good object recognition performance particularly number labeled example low show pd-dbm generates better sample shallow counterpart unlike dbms dbns pd-dbm may trained successfully without greedy layerwise training
2013,texture modeling convolutional spike-and-slab rbms deep extension,apply spike-and-slab restricted boltzmann machine  texture modeling ssrbm tiled-convolution weight sharing  achieves surpasses state-of-the-art texture synthesis inpainting parametric model also develop novel rbm model spike-and-slab visible layer binary variable hidden layer model designed stacked top ssrbm show resulting deep belief network  powerful generative model improves single-layer model capable modeling single high-resolution challenging texture also multiple texture fixed-size filter bottom layer
2013,stacked calibration off-policy policy evaluation video game matchmaking,consider industrial strength application recommendation system video-game matchmaking off-policy policy evaluation important standard approach hardly applied objective policy sequentially form team player waiting matched way produce well-balanced match unfortunately available training data come policy known perfectly stochastic making impossible use method based importance weight furthermore observe estimated reward function policy obtained training off-policy dataset policy evaluation using estimated reward function biased present simple calibration procedure similar stacked regression remove bias experiment performed data collected beta test ghost recon online first person shooter ubisoft used experiment
2013,high-dimensional sequence transduction,investigate problem transforming input sequence high-dimensional output sequence order transcribe polyphonic audio music symbolic notation introduce probabilistic model based recurrent neural network able learn realistic output distribution given input devise efficient algorithm search global mode distribution resulting method produce musically plausible transcription even high level noise drastically outperforms previous state-of- the-art approach five datasets synthesized sound real recording approximately halving test error rate
2013,advance optimizing recurrent network,decade-long period relatively little research activity area recurrent neural network several new development reviewed allowed substantial progress understanding technical solution towards efficient training recurrent network advance motivated related optimization issue surrounding deep learning although recurrent network extremely powerful principle represent term modeling sequence training plagued two aspect issue regarding learning long-term dependency experiment reported evaluate use clipping gradient spanning longer time range leaky integration advanced momentum technique using powerful output probability model encouraging sparser gradient help symmetry breaking credit assignment experiment performed text music data show combined effect technique generally improving training test error
2013,combining modality specific deep neural network emotion recognition video,paper present technique used university montréals team submission  emotion recognition wild challenge challenge classify emotion expressed primary human subject short video clip extracted feature length movie involves analysis video clip acted scene lasting approximately one-two second including audio track may contain human voice well  music approach combine multiple deep neural network different data modality including  deep convolutional neural network analysis facial expression within video frame  deep belief net capture audio information  deep autoencoder model spatio-temporal information produced human action depicted within entire scene  shallow network architecture focused extracted feature mouth primary human subject scene discus technique performance characteristic different strategy aggregate prediction best single model convolutional neural network trained predict emotion static frame using two large data set toronto face database set face image harvested google image search followed per frame aggregation strategy used challenge training data yielded test set accuracy  using best strategy aggregating top performing model single predictor able produce accuracy  challenge test set compare favorably challenge baseline test set accuracy 
2013,better mixing via deep representation,hypothesized supported experimental evidence deeper representation well trained tend better job disentangling underlying factor variation study following related conjecture better representation sense better disentangling exploited produce markov chain mix faster mode consequently mixing mode would efficient higher level representation better understand propose secondary conjecture higher-level sample fill uniformly space occupy high-density manifold tend unfold represented higher level paper discus hypothesis test experimentally visualization measurement mixing mode interpolating sample
2013,difficulty training recurrent neural network,two widely known issue properly training recurrent neural network vanishing exploding gradient problem detailed bengio et al  paper attempt improve understanding underlying issue exploring problem analytical geometric dynamical system perspective analysis used justify simple yet effective solution propose gradient norm clipping strategy deal exploding gradient soft constraint vanishing gradient problem validate empirically hypothesis proposed solution experimental section
2013,maxout network,consider problem designing model leverage recently introduced approximate model averaging technique called dropout define simple new model called maxout  designed facilitate optimization dropout improve accuracy dropout fast approximate model averaging technique empirically verify model successfully accomplishes task use maxout dropout demonstrate state art classification performance four benchmark datasets mnist cifar- cifar- svhn
2013,unsupervised learning semantics object detection scene categorization,classifying scene  important complicated task nowadays image come variability ambiguity wide range illumination scale condition standard approach build intermediate representation global image learn classifier recently proposed depict image aggregation contained object  representation classifier trained composed many heterogeneous feature vector derived various object detector paper propose study different approach efficiently learn contextual semantics object detection use feature provided object-bank   show several benchmark scene categorization careful combination taking account structure data allows greatly improve original  from++to++ drastically reducing dimensionality representation  %  also show uncertainty relative object detector hamper use external semantic knowledge improve detector combination unlike unsupervised learning approach
2013,unsupervised transfer learning uncertainty - object detection scene categorization,classifying scene  important complicated task nowadays image come variability ambiguity wide range illumination scale condition standard approach build intermediate representation global image learn classifier recently proposed depict image aggregation contained object representation classifier trained composed many heterogeneous approach efficiently combine data extracted detector use feature provided object-bank drastically reducing dimensionality representation 
2013,investigation recurrent-neural-network architecture learning method spoken language understanding,one key problem spoken language understanding  task slot filling light recent success applying deep neural network technology domain detection intent identification carried in-depth investigation use recurrent neural network difficult task slot filling involving sequence discrimination work implemented compared several important recurrent-neural-network architecture including elman-type jordan-type recurrent network variant make  easy reproduce compare implemented network common theano neural network toolkit evaluated atis benchmark also compared  conditional random field  baseline  show task type recurrent network outperform crf baseline substantially bi-directional jordan-type network take account past future dependency among slot work best outperforming crf-based baseline  relative error reduction
2013,audio chord recognition recurrent neural network,paper present audio chord recognition system based recurrent neural network audio feature obtained deep neural network optimized combination chromagram target chord information aggregated different time scale contrarily existing approach system incorporates acoustic musicological model single training objective devise efficient algorithm search global mode output distribution taking long-term dependency account resulting method competitive state-of-the-art approach mirex dataset major/minor prediction task
2013,multi-prediction deep boltzmann machine,introduce multi-prediction deep boltzmann machine  mp-dbm seen single probabilistic model trained maximize variational approximation generalized pseudolikelihood family recurrent net share parameter approximately solve different inference problem prior method training dbms either perform well classification task require initial learning pas train dbm greedily one layer time mp-dbm require greedy layerwise pretraining outperforms standard dbm classification classification missing input mean field prediction task
2013,generalized denoising auto-encoders generative model,recent work shown denoising contractive autoencoders implicitly capture structure data generating density case corruption noise gaussian reconstruction error squared error data continuous-valued led various proposal sampling implicitly learned density function using langevin metropolis-hastings mcmc however remained unclear connect training procedure regularized auto-encoders implicit estimation underlying data generating distribution data discrete using form corruption process reconstruction error another issue mathematical justification valid limit small corruption noise propose different attack problem deal issue arbitrary  corruption arbitrary reconstruction loss  handling discrete continuous-valued variable removing bias due non-infinitesimal corruption noise 
2013,stochastic ratio matching rbms sparse high-dimensional input,sparse high-dimensional data vector common many application domain large number rarely non-zero feature devised unfortunately creates computational bottleneck unsupervised feature learning algorithm based auto-encoders rbms involve reconstruction step whole input vector predicted current feature value algorithm recently developed successfully handle case auto-encoders based importance sampling scheme stochastically selecting input element actually reconstruct training particular example generalize idea rbms propose stochastic ratio-matching algorithm inherits computational advantage unbiasedness importance sampling scheme show stochastic ratio matching good estimator allowing approach beat state-of-the-art two bag-of-word text classification benchmark  keeping computational cost linear number non-zeros
