2019,equivalence equilibrium propagation recurrent backpropagation,recurrent backpropagation equilibrium propagation supervised learning algorithm fixed-point recurrent neural network differ second phase first phase algorithm converge fixed point corresponds configuration prediction made second phase equilibrium propagation relaxes another nearby fixed point corresponding smaller prediction error whereas recurrent backpropagation us side network compute error derivative iteratively work establish close connection two algorithm show every moment second phase temporal derivative neural activity equilibrium propagation equal error derivative computed iteratively recurrent backpropagation side network work show required side network computation error derivative support hypothesis biological neural network temporal derivative neural activity may code error signal
2019,gated orthogonal recurrent unit learning forget,present novel recurrent neural network based model combine remembering ability unitary evolution rnns ability gated rnns effectively forget redundant irrelevant information memory achieve extending restricted orthogonal evolution rnns gating mechanism similar gated recurrent unit rnns reset gate update gate model able outperform long short-term memory gated recurrent unit vanilla unitary orthogonal rnns several long-term-dependency benchmark task empirically show orthogonal unitary rnns lack ability forget ability play important role rnns provide competitive  along analysis model many natural sequential task including question answering speech spectrum prediction character-level language modeling synthetic task involve long-term dependency algorithmic denoising copying task
2019,depth nonlinearity creates bad local minimum resnets,paper prove depth nonlinearity creates bad local minimum type arbitrarily deep resnets arbitrary nonlinear activation function sense value local minimum worse global minimum value corresponding classical machine-learning model guaranteed improve via residual representation result paper provides affirmative answer open question stated paper conference neural information processing system  paper advance optimization theory deep learning resnets network architecture
2019,towards non-saturating recurrent unit modelling long-term dependency,modelling long-term dependency challenge recurrent neural network primarily due fact gradient vanish training sequence length increase gradient attenuated transition operator attenuated dropped activation function canonical architecture like lstm alleviate issue skipping information memory mechanism propose new recurrent architecture  relies memory mechanism forgoes saturating activation function saturating gate order alleviate vanishing gradient series synthetic real world task demonstrate proposed model model performs among top  model across task without long-term dependency compared range architecture
2019,combined reinforcement learning via abstract representation,quest efficient robust reinforcement learning method model-free model-based approach offer advantage paper propose new way explicitly bridging approach via shared low-dimensional learned encoding environment meant capture summarizing abstraction show modularity brought approach lead good generalization computationally efficient planning happening smaller latent state space addition approach recovers sufficient low-dimensional representation environment open new strategy interpretable ai exploration transfer learning
2019,neural dialog system use conversation history effectively empirical study,neural generative model become increasingly popular building conversational agent offer flexibility easily adapted new domain require minimal domain engineering common criticism system seldom understand use available dialog history effectively paper take empirical approach understanding model use available dialog history studying sensitivity model artificially introduced unnatural change perturbation context test time experiment  different type perturbation  multi-turn dialog datasets find commonly used neural dialog architecture like recurrent transformer-based seqseq model rarely sensitive perturbation missing reordering utterance shuffling word etc also open-sourcing code believe serve useful diagnostic tool evaluating dialog system future
2019,interpolated adversarial training achieving robust neural network without sacrificing much accuracy,adversarial robustness become central goal deep learning theory practice however successful method improve adversarial robustness  greatly hurt generalization performance unperturbed data could major impact achieving adversarial robustness affect real world system  propose interpolated adversarial training employ recently proposed interpolation based training method framework adversarial training cifar- adversarial training increase standard test error    whereas interpolated adversarial training retain adversarial robustness achieving standard test error  technique relative increase standard error robust model reduced  
2019,interactive language learning question answering,human observe interact world acquire knowledge however existing machine reading comprehension  task miss interactive information-seeking component comprehension task present model static document contain necessary information usually concentrated single short substring thus model achieve strong performance simple word- phrase-based pattern matching address problem formulating novel text-based question answering task question answering interactive text  qait agent must interact partially observable text-based environment gather information required answer question qait pose question existence location attribute object found environment data built using text-based game generator defines underlying dynamic interaction environment propose evaluate set baseline model qait task includes deep reinforcement learning agent experiment show task present major challenge machine reading system human solve relative ease
2019,transferable feature convolutional neural network acoustic model across language,characterization representation learned intermediate layer deep network provide valuable insight nature task guide development well-tailored learning strategy study convolutional neural network -based acoustic model context automatic speech recognition adapting method proposed  measure transferability layer english dutch german ass language-specificity observed three distinct region transferability  first two layer entirely transferable language  layer - also highly transferable found evidence language specificity  subsequent fully connected layer language specific could successfully finetuned target language probe effect weight freezing performed follow-up experiment using freeze-training   consistent observation cnns converge `bottom training demonstrate benefit freeze training especially transfer learning
2019,highly adaptive acoustic model accurate multi-dialect speech recognition,despite success deep learning speech recognition multi-dialect speech recognition remains difficult problem although dialect-specific acoustic model known perform well general easy maintain dialect-specific data scarce number dialect language large therefore single unified acoustic model  generalizes well many dialect demand paper propose novel acoustic modeling technique accurate multi-dialect speech recognition single proposed dynamically adapted based dialect information internal representation  highly adaptive handling multiple dialect simultaneously also propose simple effective training method deal unseen dialect experimental  large scale speech datasets show proposed outperforms previous one reducing word error rate   relative compared single all-dialects  relative compared dialect-specific am
2019,representation mixing tt synthesis,recent character phoneme-based parametric tt system using deep learning shown strong performance natural speech generation however choice character phoneme input create serious limitation practical deployment direct control pronunciation crucial certain case demonstrate simple method combining multiple type linguistic information single encoder named representation mixing enabling flexible choice character phoneme mixed representation inference experiment user study public audiobook corpus show efficacy approach
2019,pytorch-kaldi speech recognition toolkit,availability open-source software playing remarkable role popularization speech recognition deep learning kaldi instance nowadays established framework used develop state-of-the-art speech recognizers pytorch used build neural network python language recently spawn tremendous interest within machine learning community thanks simplicity flexibility pytorch-kaldi project aim bridge gap popular toolkits trying inherit efficiency kaldi flexibility pytorch pytorch-kaldi simple interface software embeds several useful feature developing modern speech recognizers instance code specifically designed naturally plug-in user-defined acoustic model alternative user exploit several pre-implemented neural network customized using intuitive configuration file pytorch-kaldi support multiple feature label stream well combination neural network enabling use complex neural architecture toolkit publicly-released along rich documentation designed properly work locally hpc cluster experiment conducted several datasets task show pytorch-kaldi effectively used develop modern state-of-the-art speech recognizers
2019,babyai platform study sample efficiency grounded language learning,allowing human interactively train artificial agent understand language instruction desirable practical scientific reason  though given  lack sample efficiency current learning method reaching goal may require substantial research effort introduce babyai research platform goal supporting investigation towards including human loop grounded language learning babyai platform comprises extensible suite  level increasing difficulty level gradually lead agent towards acquiring combinatorially rich synthetic language proper subset english platform also provides hand-crafted bot agent simulates human teacher  report estimated amount supervision required training neural reinforcement behavioral-cloning agent babyai level put forward strong evidence current deep learning method yet sufficiently sample-efficient context learning language compositional property
2019,adversarial domain adaptation stable brain-machine interface,brain-machine interface  recently emerged clinically viable optionto restore voluntary movement paralysis device based theability extract information movement intent neural signal recordedusing multi-electrode array chronically implanted motor cortex thebrain however inherent loss turnover recorded neuron requires repeatedrecalibrations interface potentially alter day-to-dayuser experience resulting need continued user adaptation interferes withthe natural subconscious use bmi introduce new computationalapproach decodes movement intent low-dimensional latent representationof neural data implement various domain adaptation methodsto stabilize interface significantly long time includes canonicalcorrelation analysis used align latent variable across day methodrequires prior point-to-point correspondence time series across domainsalternatively match empirical probability distribution latent variablesacross day minimization kullback-leibler divergencethese two method provide significant comparable improvement performanceof interface however implementation adversarial domainadaptation network trained match empirical probability distribution theresiduals reconstructed neural signal outperforms two method basedon latent variable requiring remarkably data point solve domainadaptation problem
2019,recall trace backtracking model efficient reinforcement learning,many environment tiny subset state yield high reward  case interaction environment provide relevant learning signal hence may want preferentially train high-reward state probable trajectory leading end advocate use {backtracking model} predicts preceding state terminate given high-reward state  train model starting high value state  predicts sample -tuples may led high value state trace  pair refer recall trace sampled backtracking model starting high value state informative terminate good state hence use trace improve policy provide variational interpretation idea practical algorithm backtracking model sample approximate posterior distribution trajectory lead large reward method improves sample efficiency on- off-policy rl algorithm across several environment task  
2019,infobot transfer exploration via information bottleneck,central challenge reinforcement learning discovering effective policy task reward sparsely distributed postulate absence useful reward signal effective exploration strategy seek { decision states} state lie critical junction state space agent transition new potentially unexplored region propose learn decision state prior experience training goal-conditioned model information bottleneck identify decision state examining model access goal state bottleneck find simple mechanism effectively identifies decision state even partially observed setting effect model learns sensory cue correlate potential subgoals new environment model identify novel subgoals exploration guiding agent sequence potential decision  state new region state space
2019,learning deep representation mutual information estimation maximization,work investigates unsupervised learning representation maximizing mutual information input output deep neural network encoder importantly show structure matter incorporating knowledge locality input objective significantly improve representation suitability downstream task control characteristic representation matching prior distribution adversarially method call deep infomax  outperforms number popular unsupervised learning method compare favorably fully-supervised learning several classification task standard architecture dim open new avenue unsupervised learning representation important step towards flexible formulation representation learning objective specific end-goals
2019,relation sharpest direction dnn loss sgd step length,training deep neural network stochastic gradient descent  large learning rate small batch-size typically end flat region weight space indicated small eigenvalue hessian training loss found correlate good final generalization performance  paper extend previous work investigating curvature loss surface along whole training trajectory rather endpoint find initially sgd visit increasingly sharp region reaching maximum sharpness determined learning rate batch-size sgd peak value sgd start fail minimize loss along direction loss surface corresponding largest curvature  investigate effect dynamic training process study variant sgd using reduced learning rate along sharpest direction show improve training speed finding sharper better generalizing solution compared vanilla sgd overall  show sgd dynamic subspace sharpest direction influence region sgd steer  overall training speed generalization ability final model
2019,h-detach modifying lstm gradient towards better optimization,recurrent neural network known notorious exploding vanishing gradient problem  problem becomes evident task information needed correctly solve exist long time scale evgp prevents important gradient component back-propagated adequately large number step introduce simple stochastic algorithm  specific lstm optimization targeted towards addressing problem specifically show lstm weight large gradient component linear path  lstm computational graph get suppressed based hypothesis component carry information long term dependency  suppression prevent lstms capturing algorithm{our code available https//githubcom/bhargav/h-detach} prevents gradient flowing path getting suppressed thus allowing lstm capture dependency better show significant improvement vanilla lstm gradient based training term convergence speed robustness seed learning rate generalization using modification lstm gradient various benchmark datasets
2019,modeling long term future model-based reinforcement learning,model-based reinforcement learning agent interleaf model learning planning  two component  inextricably intertwined model able provide sensible long-term prediction executed planer would exploit model flaw yield catastrophic failure paper focus building model reason long-term future demonstrates use efficient planning exploration end build latent-variable autoregressive model leveraging recent idea variational inference argue forcing latent variable carry future information auxiliary task substantially improves long-term prediction moreover planning latent space planner solution ensured within region model valid exploration strategy devised searching unlikely trajectory model method achieves higher reward faster compared baseline variety task environment imitation learning model-based reinforcement learning setting 
2019,quaternion recurrent neural network,recurrent neural network  powerful architecture model sequential data due capability learn short long-term dependency basic element sequence nonetheless popular task speech image recognition involve multi-dimensional input feature characterized strong internal dependency dimension input vector propose novel quaternion recurrent neural network  alongside quaternion long-short term memory neural network  take account external relation internal structural dependency quaternion algebra similarly capsule quaternion allow qrnn code internal dependency composing processing multidimensional feature single entity recurrent operation reveals correlation element composing sequence show qrnn qlstm achieve better performance rnn lstm realistic application automatic speech recognition finally show qrnn qlstm reduce maximum factor x number free parameter needed compared real-valued rnns lstms reach better  leading compact representation relevant information
2019,probabilistic planning sequential monte carlo method,work propose novel formulation planning view probabilistic inference problem future optimal trajectory enables u use sampling method thus tackle planning continuous domain using fixed computational budget   design new algorithm  sequential monte carlo planning leveraging classical method sequential monte carlo bayesian smoothing context control inference furthermore show sequential monte carlo planning capture multimodal policy quickly learn continuous control task
2019,empirical study example forgetting deep neural network learning,inspired phenomenon catastrophic forgetting investigate learning dynamic neural network train single classification task goal understand whether related phenomenon occurs data undergo clear distributional shift define ``forgetting event occurred individual training example transition classified correctly incorrectly course learning across several benchmark data set find  certain example forgotten high frequency  data set forgettable example generalize across neural architecture  based forgetting dynamic significant fraction example omitted training data set still maintaining state-of-the-art generalization performance
2019,deep graph infomax,present deep graph infomax  general approach learning node representation within graph-structured data unsupervised manner dgi relies maximizing mutual information patch representation corresponding high-level summary graphs---both derived using established graph convolutional network architecture learnt patch representation summarize subgraphs centered around node interest thus reused downstream node-wise learning task contrast prior approach unsupervised learning gcns dgi rely random walk objective readily applicable transductive inductive learning setup demonstrate competitive performance variety node classification benchmark time even exceeds performance supervised learning
2019,perceptual generative autoencoders,framework training autoencoder-based generative model non-adversarial loss unrestricted neural network architecture
2019,state-reification network improving generalization modeling distribution hidden representation,machine learning promise method generalize well finite labeled data however brittleness existing neural net approach revealed notable failure existence adversarial example misclassified despite nearly identical training example inability recurrent sequence-processing net stay track without teacher forcing introduce method refer _state reification_ involves modeling distribution hidden state training data projecting hidden state observed testing toward distribution intuition network remain familiar manifold hidden space subsequent layer net well trained respond appropriately show state-reification method help neural net generalize better especially labeled data sparse also help overcome challenge achieving robust generalization adversarial training
2019,gmnn graph markov neural network,paper study semi-supervised object classification relational data fundamental problem relational data modeling problem extensively studied literature statistical relational learning  graph neural network  statistical relational learning method effectively model dependency object label conditional random field collective classification whereas graph neural network learn effective object representation classification end-to-end training paper propose graph markov neural network  combine advantage world gmnn model joint distribution object label conditional random field effectively trained variational em algorithm e-step one graph neural network learns effective object representation approximating posterior distribution object label m-step another graph neural network used model local label dependency experiment object classification link classification unsupervised node representation learning show gmnn achieves state-of-the-art 
2019,spectral bias neural network,neural network known class highly expressive function able fit even random input-output mapping  accuracy work present property neural network complement aspect expressivity using tool fourier analysis highlight learning bias deep network towards low frequency function – ie function vary globally without local fluctuation – manifest frequency-dependent learning speed intuitively property line observation over-parameterized network prioritize learning simple pattern generalize across data sample also investigate role shape data manifold presenting empirical theoretical evidence somewhat counter-intuitively learning higher frequency get easier increasing manifold complexity
2019,manifold mixup better representation interpolating hidden state,deep neural network excel learning training data often provide incorrect confident prediction evaluated slightly different test example includes distribution shift outlier adversarial example address issue propose {} simple regularizer encourages neural network predict le confidently interpolation hidden representation {} leverage semantic interpolation additional training signal obtaining neural network smoother decision boundary multiple level representation result neural network trained {} learn flatter class-representations fewer direction variance prove theory flattening happens ideal condition validate empirically practical situation connect previous work information theory generalization spite incurring significant computation implemented line code {} improves strong baseline supervised learning robustness single-step adversarial attack test log-likelihood
2019,data-efficient framework training sim-to-real transfer navigation policy,learning effective visuomotor policy robot purely data challenging also appealing since learning-based system require manual tuning calibration case robot operating real environment training process costly time-consuming even dangerous since failure common start training reason desirable able leverage simulation off-policy data extent possible train robot work introduce robust framework plan simulation transfer well real environment model incorporates gradient-descent based planning module given initial image goal image encodes image lower dimensional latent state plan trajectory reach goal model consisting encoder planner module first trained meta-learning strategy simulation subsequently perform adversarial domain transfer encoder using bank unlabelled random image simulation real environment enable encoder map image real simulated environment similarly distributed latent representation fine tuning entire model  real world expert demonstration show successful planning performance different navigation task
2019,interpolation consistency training semi-supervised learning,introduce interpolation consistency training  simple computation efficient algorithm training deep neural network semi-supervised learning paradigm ict encourages prediction interpolation unlabeled point consistent interpolation prediction point classification problem ict move decision boundary low-density region data distribution experiment show ict achieves state-of-the-art performance applied standard neural network architecture cifar- svhn benchmark dataset
