2017,plug & play generative network conditional iterative generation image latent space,generating high-resolution photo-realistic image long-standing goal machine learning recently nguyen et al  showed one interesting way synthesize novel image performing gradient ascent latent space generator network maximize activation one multiple neuron separate classifier network paper extend method introducing additional prior latent code improving sample quality sample diversity leading state-of-the-art generative model produce high quality image higher resolution  previous generative model  imagenet category addition provide unified probabilistic interpretation related activation maximization method call general class model plug play generative network ppgns composed  generator network g capable drawing wide range image type  replaceable condition network c tell generator draw demonstrate generation image conditioned class  also conditioned caption  method also improves state art multifaceted feature visualization  generates set synthetic input activate neuron order better understand deep neural network operate finally show model performs reasonably well task image inpainting image model used paper approach modality-agnostic applied many type data
2017,random weight texture generation one layer cnns,recent work literature shown experimentally one use lower layer trained convolutional neural network  model natural texture interestingly also experimentally shown one layer random filter also model texture although le variability paper ask question one layer cnns random filter effective generating texture theoretically show one layer convolutional architecture  paired energy function used previous literature fact preserve modulate frequency coefficient manner random weight pretrained weight generate type image based  analysis question whether similar property hold case one us one convolution layer non-linearity show case relu non-linearity situation one input give minimum possible energy whereas case nonlinearity always infinite solution give minimum possible energy thus show certain situation adding relu non-linearity generates le variable image
2017,network deep neural network distant speech recognition,despite remarkable progress recently made distant speech recognition state-of-the-art technology still suffers lack robustness especially adverse acoustic condition characterized non-stationary noise reverberation met prominent limitation current system lie lack matching communication various technology involved distant speech recognition process speech enhancement speech recognition module instance often trained independently moreover speech enhancement normally help speech recognizer output latter commonly used turn improve speech enhancement address concern propose novel architecture based network deep neural network component jointly trained better cooperate thanks full communication scheme experiment conducted using different datasets task acoustic condition revealed proposed framework overtake competitive solution including recent joint training approach
2017,count-ception counting fully convolutional redundant counting,counting object digital image process replaced machine tedious task time consuming prone error due fatigue human annotator goal system take input image return count object inside justification prediction form object localization repose problem originally posed lempitsky zisserman instead predict count map contains redundant count based receptive field smaller regression network regression network predicts count object exist inside frame processing image fully convolutional way pixel going accounted number time number window include size window  recover true count take average redundant prediction contribution redundant counting instead predicting density map order average error also propose novel deep neural network architecture adapted inception family network called count-ception network together approach   relative improvement  state art method xie noble zisserman 
2017,understanding intermediate layer using linear classifier probe,neural network model reputation black boxeswe propose new method better understand role dynamicsof intermediate layersour method us linear classifier referred probeswhere probe use hidden unit given intermediate layeras discriminating featuresmoreover probe cannot affect training phase modeland generally added trainingwe demonstrate used develop better intuitionabout model diagnose potential problem
2017,actor-critic algorithm sequence prediction,present approach training neural network generate sequence using actor-critic method reinforcement learning  current log-likelihood training method limited discrepancy training testing mode model must generate token conditioned previous guess rather ground-truth token address problem introducing textit{critic} network trained predict value output token given policy textit{actor} network  training procedure much closer test phase allows u directly optimize task-specific score bleu crucially since leverage technique supervised learning setting rather traditional rl setting condition critic network ground-truth output show method lead improved performance synthetic task german-english machine translation analysis pave way method applied natural language generation task machine translation caption generation dialogue modelling 
2017,mode regularized generative adversarial network,although generative adversarial network achieve state-of-the-art  avariety generative task regarded highly unstable prone missmodes argue bad behavior gans due particularfunctional shape trained discriminator high dimensional space whichcan easily make training stuck push probability mass wrong directiontowards higher concentration data generating distributionwe introduce several way regularizing objective dramaticallystabilize training gan model also show regularizers helpthe fair distribution probability mass across mode data generatingdistribution early phase training thus providing unified solutionto missing mode problem
2017,hierarchical multiscale recurrent neural network,learning hierarchical temporal representation among long- standing challenge recurrent neural network multiscale recurrent neural network considered promising approach resolve issue yet lack empirical evidence showing type model actually capture temporal dependency discovering latent hierarchical structure sequence paper propose novel multiscale approach called hierarchical multiscale recurrent neural network capture latent hierarchical structure sequence encoding temporal dependency different timescales using novel update mechanism show evidence proposed model discover underlying hierarchical structure sequence without using explicit boundary information evaluate proposed model character-level language modelling handwriting sequence generation
2017,mollifying network,optimization deep neural network challenging traditional convex optimization problem due highly non-convex nature loss function eg involve pathological landscape saddle-surfaces difficult escape algorithm based simple gradient descent paper attack problem optimization highly non-convex neural network objective starting smoothed -- mollified -- objective function becomes complex training proceeds  proposition inspired recent study continuation method similarly curriculum method begin learning easier  objective function let evolve training eventually becomes original difficult optimize objective function complexity mollified network controlled single hyperparameter annealed training show improvement various difficult optimization task establish relationship recent work continuation method neural network mollifiers
2017,zoneout regularizing rnns randomly preserving hidden activation,propose zoneout novel method regularizing rnnsat timestep zoneout stochastically force hidden unit maintain previous valueslike dropout zoneout us random noise train pseudo-ensemble improving generalizationbut preserving instead dropping hidden unit gradient information state information readily propagated time feedforward stochastic depth networkswe perform empirical investigation various rnn regularizers find zoneout give significant performance improvement across task achieve competitive  relatively simple model character- word-level language modelling penn treebank text datasets combining recurrent batch normalization yield state-of-the-art  permuted sequential mnist
2017,structured self-attentive sentence embedding,paper proposes new model extracting interpretable sentence embedding introducing self-attention instead using vector use -d matrix represent embedding row matrix attending different part sentence also propose self-attention mechanism special regularization term model side effect embedding come easy way visualizing specific part sentence encoded embedding evaluate model  different task author profiling sentiment classification textual entailment  show model yield significant performance gain compared sentence embedding method  task
2017,samplernn unconditional end-to-end neural audio generation model,paper propose novel model unconditional audio generation task generates one audio sample time show model profit combining memory-less module namely autoregressive multilayer perceptron stateful recurrent neural network hierarchical structure de facto powerful capture underlying source variation temporal domain long time three datasets different nature human evaluation generated sample indicate model preferred competing model also show component model contributes exhibited performance
2017,generalizable feature unsupervised learning,human learn predictive model world use model reason future event consequence action contrast machine predictor exhibit impressive ability generalize unseen scenario reason intelligently setting  one important aspect ability physical intuition work explore potential unsupervised learning find feature promote better generalization setting outside supervised training distribution  task predicting stability tower square block demonstrate unsupervised model trained predict future frame video sequence stable unstable block configuration yield feature support extrapolating stability prediction block configuration outside training set distribution
2017,diet network thin parameter fat genomics,learning task involving genomic data often pose serious challenge number input feature order magnitude larger number training example making difficult avoid overfitting even using known regularization technique focus task input description genetic variation specific patient single nucleotide polymorphism  yielding million ternary input improving ability deep learning handle datasets could important impact medical research specifically precision medicine high-dimensional data regarding particular patient used make prediction interest even though amount data task increasing mismatch number example number input remains concern naive implementation classifier neural network involve huge number free parameter first layer  input feature associated many parameter hidden unit propose novel neural network parametrization considerably reduces number free parameter based idea first learn provide distributed representation input feature  learn  map feature distributed representation  vector parameter specific feature classifier neural network  approach view problem producing parameter associated feature multi-task learning problem show experimentally population stratification task interest medical study proposed approach significantly reduce number parameter error rate classifier
2017,char2wav end-to-end speech synthesis,present charwav end-to-end model speech synthesis charwav two component reader neural vocoder reader encoder-decoder model attention encoder bidirectional recurrent neural network accepts text phoneme input decoder recurrent neural network  attention produce vocoder acoustic feature neural vocoder refers conditional extension samplernn generates raw waveform sample intermediate representation unlike traditional model speech synthesis charwav learns produce audio directly text
2017,improving generative adversarial network denoising feature matching,propose augmented training procedure generative adversarial network designed address shortcoming original directing generator towards probable configuration abstract discriminator feature estimate track distribution feature computed data denoising auto-encoder use propose high-level target generator combine new loss original evaluate hybrid criterion task unsupervised image synthesis datasets comprising diverse set visual category noting qualitative quantitative improvement ``objectness resulting sample
2017,closer look memorization deep network,examine role memorization deep learning drawing connection capacity generalization adversarial robustness deep network capable memorizing noise data  suggest tend prioritize learning simple pattern first experiment expose qualitative difference gradient-based optimization deep neural network  noise vs~real data also demonstrate appropriately tuned explicit regularization  degrade dnn training performance noise datasets without compromising generalization real data analysis suggests notion effective capacity dataset independent unlikely explain generalization performance deep network trained gradient based method training data play important role determining degree memorization
2017,sharp minimum generalize deep net,despite overwhelming capacity overfit deep learning architecture tend generalize relatively well unseen data allowing deployed practice however explaining case still open area research one standing hypothesis gaining popularity eg hochreiter & schmidhuber  keskar et al  flatness minimum loss function found stochastic gradient based method  good generalization paper argues notion flatness problematic deep model directly applied explain generalization specifically focusing deep network rectifier unit exploit particular geometry parameter space induced inherent symmetry architecture exhibit build equivalent model corresponding arbitrarily sharper minimum depending definition flatness given minimum furthermore allow reparametrize function geometry parameter change drastically without affecting generalization property
2017,robust adaptive stochastic gradient method deep learning,stochastic gradient algorithm main focus large-scale optimization problem led important success recent advancement deep learning algorithm convergence sgd depends careful choice learning rate amount noise stochastic estimate gradient paper propose adaptive learning rate algorithm utilizes stochastic curvature information loss function automatically tuning learning rate information element-wise curvature loss function estimated local statistic stochastic first order gradient propose new variance reduction technique speed convergence experiment deep neural network obtained better performance compared popular stochastic gradient algorithm
2017,improving speech recognition revising gated recurrent unit,speech recognition largely taking advantage deep learning showing substantial benefit obtained modern recurrent neural network  popular rnns long short-term memory  typically reach state-of-the-art performance many task thanks ability learn long-term dependency robustness vanishing gradient nevertheless lstms rather complex design three multiplicative gate might impair efficient implementation attempt simplify lstms recently led gated recurrent unit  based two multiplicative gatesthis paper build effort revising grus proposing simplified architecture potentially suitable speech recognition contribution work two-fold first suggest remove reset gate gru design resulting efficient single-gate architecture second propose replace tanh relu activation state update equation  show implementation revised architecture reduces per-epoch training time  consistently improves recognition performance across different task input feature noisy condition compared standard gru
2017,dynamic layer normalization adaptive neural acoustic modeling speech recognition,layer normalization recently introduced technique normalizing activity neuron deep neural network improve training speed stability paper introduce new layer normalization technique called dynamic layer normalization  adaptive neural acoustic modeling speech recognition dynamically generating scaling shifting parameter layer normalization dln adapts neural acoustic model acoustic variability arising various factor speaker channel noise environment unlike adaptive acoustic model proposed approach require additional adaptation data speaker information i-vectors moreover model size fixed dynamically generates adaptation parameter apply proposed dln deep bidirectional lstm acoustic model evaluate two benchmark datasets large vocabulary asr experiment wsj ted-lium release  experimental  show dln improves neural acoustic model term transcription accuracy dynamically adapting various speaker environment
2017,towards hardware-friendly deep learning,n/a
2017,variational walkback learning transition operator stochastic recurrent net,propose novel method { directly} learn stochastic transition operator whose repeated application provides generated sample traditional undirected graphical model approach problem indirectly learning markov chain model whose stationary distribution obeys detailed balance respect parameterized energy function energy function modified model data distribution match guarantee number step required markov chain converge moreover detailed balance condition highly restrictive energy based model corresponding neural network must symmetric weight unlike biological neural circuit contrast develop method directly learning arbitrarily parameterized transition operator capable expressing non-equilibrium stationary distribution violate detailed balance thereby enabling u learn biologically plausible asymmetric neural network general non-energy based dynamical system proposed training objective derive via principled variational method encourages transition operator walk back  multi-step trajectory start data-points quickly possible back original data point present series experimental  illustrating soundness proposed approach variational walkback  mnist cifar- svhn celeba datasets demonstrating superior sample compared earlier attempt learn transition operator also show although rapid training trajectory limited finite variable number step transition operator continues generate good sample well past length trajectory thereby demonstrating match non-equilibrium stationary distribution data distribution source codehttp//githubcom/anirudh/walkback_nips
2017,gibbsnet iterative adversarial inference deep graphical model,directed latent variable model formulate joint distribution p = p phave advantage fast exact sampling however model weakness needing specify p often simple fixed prior limit expressiveness model undirected latent variable model discard requirement pbe specified prior yet sampling generally requires iterative procedure blocked gibbs-sampling may require many step draw sample joint distribution p propose novel approach learning joint distribution data latent code us adversarially learned iterative procedure gradually refine joint distribution p better match data distribution step gibbsnet best world theory practice achieving speed simplicity directed latent variable model guaranteed  produce sample pwith sampling iteration achieving expressiveness flexibility undirected latent variable model gibbsnet away need explicit pand ability attribute prediction class-conditional generation joint image-attribute modeling single model trained specific task show empirically gibbsnet able learn complex pand show lead improved inpainting iterative refinement pfor dozen step stable generation without collapse thousand step despite trained step
2017,plan attend generate planning sequence-to-sequence model,investigate integration planning mechanism sequence-to-sequence model using attention develop model plan ahead future computes alignment input output sequence constructing matrix proposed future alignment commitment vector governs whether follow recompute plan mechanism inspired recently proposed strategic attentive reader writer  model reinforcement learning proposed model end-to-end trainable using primarily differentiable operation show outperforms strong baseline character-level translation task wmt algorithmic task finding eulerian circuit graph question generation text analysis demonstrates model computes qualitatively intuitive alignment converges faster baseline achieves superior performance fewer parameter
2017,z-forcing training stochastic recurrent network,many effort devoted training generative latent variable model autoregressive decoder recurrent neural network  stochastic recurrent model successful capturing variability observed natural sequential data speech unify successful idea recently proposed architecture stochastic recurrent model step sequence associated latent variable used condition recurrent dynamic future step training performed amortised variational inference approximate posterior augmented rnn run backward sequence addition maximizing variational lower bound ease training latent variable adding auxiliary cost force reconstruct state backward recurrent network provides latent variable task-independent objective enhances performance overall model found strategy perform better alternative approach kl annealing although conceptually simple model achieves state-of-the-art  standard speech benchmark timit blizzard competitive performance sequential mnist finally apply model language modeling imdb dataset auxiliary cost help learning interpretable latent variable
2017,plan attend generate character-level neural machine translation planning,investigate integration planning mechanism encoder-decoder architecture attention develop model plan ahead computes alignment source target sequence single time-step next k time-steps well constructing matrix proposed future alignment commitment vector governs whether follow recompute plan mechanism inspired strategic attentive reader writer  model recent neural architecture planning hierarchical reinforcement learning also learn higher level temporal abstraction proposed model end-to-end trainable differentiable operation show model outperforms strong baseline character-level translation task wmt’ fewer parameter computes alignment qualitatively intuitive
2016,knowledge matter importance prior information optimization,explored effect introducing prior knowledge intermediate level deep supervised neural network two task task designed black-box state-of-the-art machine learning algorithm tested failed generalize well motivate work hypothesis training barrier involved nature task human learn useful intermediate concept individual using form supervision guidance using curriculum  provide positive evidence favor hypothesis experiment trained two- tiered mlp architecture dataset input image contains three sprite binary target class  three shape belong category otherwise class  term generalization black-box machine learning algorithm could perform better chance task standard deep supervised neural network also failed generalize however using particular structure guiding learner providing intermediate target form intermediate concept  allowed u solve task efficiently obtained much better chance imperfect  exploring different architecture optimization variant observation might indication optimization difficulty neural network trained without hint task hypothesize learning difficulty due composition two highly non-linear task finding also consistent hypothesis cultural learning inspired observation training neural network sometimes getting stuck even though good solution exist term training generalization error
2016,emonets multimodal deep learning approach emotion recognition video,task emotion recognition wild  challenge assign one seven emotion short video clip extracted hollywood style movie video depict acted-out emotion realistic condition large degree variation attribute pose illumination making worthwhile explore approach consider combination feature multiple modality label assignment paper present approach learning several specialist model using deep learning technique focusing one modality among convolutional neural network focusing capturing visual information detected face deep belief net focusing representation audio stream k-means based “bag-of-mouths” model extract visual feature around mouth region relational autoencoder address spatio-temporal aspect video explore multiple method combination cue modality one common classifier achieves considerably greater accuracy prediction strongest single-modality classifier method winning submission  emotiw challenge achieved test set accuracy  %  dataset
2016,big data theoretical aspect scanning issue,special issue highlight number algorithmic approach fundamental data analysis formulating solving problem relate big data
