2019,From Real-time Logic to Timed Automata.,"We show how to construct temporal testers for the logic MITL, a prominent linear-time logic for real-time systems. A temporal tester is a transducer that inputs a signal holding the Boolean value of atomic propositions and outputs the truth value of a formula along time. Here we consider testers over continuous-time Boolean signals that use clock variables to enforce duration constraints, as in timed automata. We first rewrite the MITL formula into a ‚Äúsimple‚Äù formula using a limited set of temporal modalities. We then build testers for these specific modalities and show how to compose testers for simple formulae into complex ones. Temporal testers can be turned into acceptors, yielding a compositional translation from MITL to timed automata. This construction is much simpler than previously known and remains asymptotically optimal. It supports both past and future operators and can easily be extended."
2012,"Low dimensional hybrid systems - decidable, undecidable, don't know.","Even though many attempts have been made to define the boundary between decidable and undecidable hybrid systems, the affair is far from being resolved. More and more low dimensional systems are being shown to be undecidable with respect to reachability, and many open problems in between are being discovered. In this paper, we present various two-dimensional hybrid systems for which the reachability problem is undecidable. We show their undecidability by simulating Minsky machines. Their proximity to the decidability frontier is understood by inspecting the most parsimonious constraints necessary to make reachability over these automata decidable. We also show that for other two-dimensional systems, the reachability question remains unanswered, by proving that it is as hard as the reachability problem for piecewise affine maps on the real line, which is a well known open problem.
"
2012,Verification of multi-linked heaps.,"We define the class of single-parent heap systems, which rely on a singly-linked heap in order to model destructive updates on tree structures. This encoding has the advantage of relying on a relatively simple theory of linked lists in order to support abstraction computation. To facilitate the application of this encoding, we provide a program transformation that, given a program operating on a multi-linked heap without sharing, transforms it into one over a single-parent heap. It is then possible to apply shape analysis by predicate and ranking abstraction. The technique has been successfully applied on examples with lists (reversal and bubble sort) and trees with of fixed arity (balancing of, and insertion into, a binary sort tree).
"
2012,Synthesis of Reactive(1) designs.,"We address the problem of automatically synthesizing digital designs from linear-time specifications. We consider various classes of specifications that can be synthesized with effort quadratic in the number of states of the reactive system, where we measure effort in symbolic steps. The synthesis algorithm is based on a novel type of game called General Reactivity of rank 1 (gr(1)), with a winning condition of the form  is a Boolean combination of atomic propositions. We show symbolic algorithms to solve this game, to build a winning strategy and several ways to optimize the winning strategy and to extract a system from it. We also show how to use gr(1) games to solve the synthesis of ltl specifications in many interesting cases. As empirical evidence to the generality and efficiency of our approach we include a significant case study. We describe the formal specifications and the synthesis process applied to a bus arbiter, which is a realistic industrial hardware specification of modest size.
"
2012,Once and for all.,"It has long been known that past-time operators add no expressive power to linear temporal logics. In this paper, we consider the extension of branching temporal logics with past-time operators. Two possible views regarding the nature of past in a branching-time model induce two different such extensions. In the first view, past is branching and each moment in time may have several possible futures and several possible pasts. In the second view, past is linear and each moment in time may have several possible futures and a unique past. Both views assume that past is finite. We discuss the practice of these extensions as specification languages, characterize their expressive power, and examine the complexity of their model-checking and satisfiability problems.
"
2012,Effective Synthesis of Asynchronous Systems from GR(1) Specifications.,"Abstract
We consider automatic synthesis from linear temporal logic specifications for asynchronous systems. We aim the produced reactive systems to be used as software in a multi-threaded environment. We extend previous reduction of asynchronous synthesis to synchronous synthesis to the setting of multiple input and multiple output variables. Much like synthesis for synchronous designs, this solution is not practical as it requires determinization of automata on infinite words and solution of complicated games. We follow advances in synthesis of synchronous designs, which restrict the handled specifications but achieve scalability and efficiency. We propose a heuristic that, in some cases, maintains scalability for asynchronous synthesis. Our heuristic can prove that specifications are realizable and extract designs. This is done by a reduction to synchronous synthesis that is inspired by the theoretical reduction."
2010,Towards Component Based Design of Hybrid Systems: Safety and Stability.,"Abstract
We propose a library based incremental design methodology for constructing hybrid controllers from a component library of models of hybrid controllers, such that global safety and stability properties are preserved. To this end, we propose hybrid interface specifications of components characterizing plant regions for which safety and stability properties are guaranteed, as well as exception mechanisms allowing safe and stability-preserving transfer of control whenever the plant evolves towards the boundary of controllable dynamics. We then propose a composition operator for constructing hybrid automata from a library of such pre-characterized components supported by compositional and automatable proofs of hybrid interface specifications."
2010,Proving the Refuted: Symbolic Model Checkers as Proof Generators.,"Abstract
The paper presents an automatic method to derive a deductive proof of response properties from symbolic model checking. The method is based on a new proof rule for response properties that deals directly with compassion (strong fairness). The method can be applied to infinite-state systems. In particular, model checking of response of (predicate- and ranking-) abstracted heap programs is automatically transformed into a deductive proof for the concrete heap system. All examples presented in the paper were run in tlv."
2010,Temporal Verification of Reactive Systems: Response.,"Abstract
Nearly twenty years ago, Amir and I (ZM) decided to write a series of three volumes summarizing the state of the art (at that time) on the verification of Reactive Systems using Temporal Logic techniques."
2010,Jtlv: A Framework for Developing Verification Algorithms.,"Abstract
Jtlv is a computer-aided verification scripting environment offering state-of-the-art Integrated Developer Environment for algorithmic verification applications. Jtlv may be viewed as a new, and much enhanced Tlv [18], with Java rather than Tlv-basic as the scripting language. JTLV attaches its internal parsers as an Eclipse editor, and facilitates a rich, common, and abstract verification developer environment that is implemented as an Eclipse plugin."
2010,Revisiting Synthesis of GR(1) Specifications.,"Abstract
The last few years have seen a rising interest in the problem of synthesizing systems from temporal logic specifications. One major contributor to this is the recent work of Piterman et al., which showed how polynomial time synthesis could be achieved for a class of LTL specifications that is large enough and expressive enough to cover an extensive number of complex, real-world, applications (despite a known doubly-exponential time lower bound for general LTL formulae). That approach has already been used extensively for the synthesis of various applications and as basis for further theoretical work on synthesis.
Here, we expose a fundamental flaw in the initial processing of specifications in that paper and demonstrate how it may produce incorrect results, declaring that specifications could not be synthesized when, in fact, they could. We then identify a class of specifications for which this initial processing is sound and complete. Thus, giving an insight to the reason that this problem arises in the first place. We also show that it can be easily checked whether specifications belong to the sound and complete class by using the same synthesis techniques. Finally, we show in the cases that specifications do not fall into this category how to modify them so that their processing is, indeed, both sound and complete."
2009,Controller Synthesis from LSC Requirements.,"Abstract
Live Sequence Charts (LSCs) is a visual requirements language for specifying reactive system behavior. When modeling and designing open reactive systems, it is often essential to have a guarantee that the requirements can be satisfied under all possible circumstances. We apply results in the area of controller synthesis to a subset of the LSC language to decide the realizability of LSC requirements. If realizable, we show how to generate system responses that are guaranteed to satisfy the requirements. We discuss one particular implementation of this result which is formulated as an extension of smart play-out, a method for direct execution of scenario-based requirements."
2009,Synthesis of programs from temporal property specifications.,"Abstract:
The paper investigates a development process for reactive programs, in which the program is automatically generated (synthesized) from a high-level temporal specification. The method is based on previous results that proposed a similar synthesis method for the automatic construction of hardware designs from their temporal specifications. Thus, the work reported here can be viewed as a generalization of existing methods for the synthesis of synchronous reactive systems into the synthesis of asynchronous systems. In the synchronous case it was possible to identify a restricted subclass of formulas and present an algorithm that solves the synthesis problem for these restricted specifications in polynomial time. Here the results are less definitive in the sense that we can offer some heuristics that may provide polynomial-time solutions only in some of the cases."
2008,A Sound and Complete Deductive System for CTL* Verification.,"The paper presents a compositional approach to the verification of CTL* properties over reactive systems. Both symbolic model-checking (SMC) and deductive verification are considered. Both methods are based on two decomposition principles. A general state formula is decomposed into basic state formulas which are CTL* formulas with no embedded path quantifiers. To deal with arbitrary basic state formulas, we introduce another reduction principle which replaces each basic path formula, i.e., path formulas whose principal operator is temporal and which contain no embedded temporal operators or path quantifiers, by a newly introduced boolean variable which is added to the system. Thus, both the algorithmic and the deductive methods are based on two statification transformations which successively replace temporal formulas by assertions which contain no path quantifiers or temporal operators. Performing these decompositions repeatedly, we remain with basic assertional formulas, i.e., formulas of the form Efp and Afp for some assertion p. In the model-checking method we present a single symbolic algorithm to verify both universal and existential basic assertional properties. In the deductive method we present a small set of proof rules and show that this set is sound and relatively complete for verifying universal and existential basic assertional properties over reactive systems. Together with two proof rules for the decompositions, we obtain a sound and relatively complete proof system for arbitrary CTL* properties. Interestingly, the deductive approach for CTL* presented here, offers a viable new approach to the deductive verification of arbitrary LTL formulas.
The paper corrects a previous preliminary version of a deductive system for CTL*, in which some of the rules were unsound. The correction is based on the introduction of a new type of temporal testers which are guaranteed to be non blocking. That is, when composed with a deadlock-free system, which is a key operation in the verification process, the resulting composed system is guaranteed to remain deadlock free.
"
2008,Using Abstraction to Verify Arbitrary Temporal Properties.,"Abstract:
Summary form only given. It is a known fact that finitary state abstraction methods (i.e. methods in which the abstract domain is finite), such as predicate abstraction, are inadequate for verifying general liveness properties or even termination of sequential programs. In this talk we will present an abstraction approach called ranking abstraction which is sound and complete for verifying all temporally specified properties, including all liveness properties. We will start by presenting a general simple framework for state abstraction emphasizing that, in order to get soundness, it is necessary to apply an over-approximating abstraction to the system and an under-approximating abstraction to the (temporal) property. We show that finitary version of this abstraction are complete for verifying all safety properties. We also show examples of simple programs whose termination provably cannot be established by finitary abstraction. We then consider abstraction approaches to the verification of deadlock freedom, presenting some sufficient conditions guaranteeing that deadlock freedom is inherited from the concrete to the abstract. Finally, we introduce the method of ranking abstraction and illustrate its application to the verification of termination and more general liveness properties. In this presentation we emphasize the similarity between predicate abstraction and its extension into ranking abstraction. In particular, the fact that the user does not have to provide a full ranking function but only to specify the ingredients from which such a function can be constructed. We also sketch how abstraction refinement can be applied to ranking abstraction, thus opening the way to a CEGAR-like methodology. Time permitting, we will present a brief comparison between ranking abstraction and the methods of transition abstraction developed by Podelski, Rybalchenko, and Cook which underly the Terminator system. The talk is based on results obtained through joint research with I....
(View more)"
2008,"Checking Temporal Properties of Discrete, Timed and Continuous Behaviors.","Abstract
We survey some of the problems associated with checking whether a given behavior (a sequence, a Boolean signal or a continuous signal) satisfies a property specified in an appropriate temporal logic and describe two such monitoring algorithms for the real-time logic MITL."
2008,Mechanical Verification of Transactional Memories with Non-transactional Memory Accesses.,"Abstract
Transactional memory is a programming abstraction intended to simplify the synchronization of conflicting memory accesses (by concurrent threads) without the difficulties associated with locks. In a previous work we presented a formal framework for proving that a transactional memory implementation satisfies its specifications and provided with model checking verification of some using small instantiations. This paper extends the previous work to capture non-transactional accesses to memory, which occurs, for example, when using legacy code. We provide a mechanical proof of the soundness of the verification method, as well as a mechanical verification of a version of the popular tcc implementation that includes non-transactional memory accesses. The verification is performed by the deductive temporal checker tlpvs."
2008,Discriminative Model Checking.,"Abstract
Model checking typically compares a system description with a formal specification, and returns either a counterexample or an affirmation of compatibility between the two descriptions. Counterexamples provide evidence to the existence of an error, but it can still be very difficult to understand what is the cause for that error. We propose a model checking methodology which uses two levels of specification. Under this methodology, we group executions as good and bad with respect to satisfying a base LTL specification. We use an analysis specification, in CTL‚Äâ‚àó‚Äâ style, quantifying over the good and bad executions. This specification allows checking not only whether the base specification holds or fails to hold in a system, but also how it does so. We propose a model checking algorithm in the style of the standard CTL‚Äâ‚àó‚Äâ decision procedure. This framework can be used for comparing between good and bad executions in a system and outside it, providing assistance in locating the design or programming errors."
2008,CoVaC: Compiler Validation by Program Analysis of the Cross-Product.,"Abstract
The paper presents a deductive framework for proving program equivalence and its application to automatic verification of transformations performed by optimizing compilers. To leverage existing program analysis techniques, we reduce the equivalence checking problem to analysis of one system ‚Äì a cross-product of the two input programs. We show how the approach can be effectively used for checking equivalence of consonant (i.e., structurally similar) programs. Finally, we report on the prototype tool that applies the developed methodology to verify that a compiler optimization run preserves the program semantics. Unlike existing frameworks, CoVaC accommodates absence of compiler annotations and handles most of the classical intraprocedural optimizations such as constant folding, reassociation, common subexpression elimination, code motion, dead code elimination, branch optimizations, and others."
2008,Program analysis for compiler validation.,"Translation Validation is an approach of ensuring compilation correctness in which each compiler run is followed by a validation pass that proves that the target code produced by the compiler is a correct translation (implementation) of the source code. It has been previously shown that the problem of translation validation can be reduced to checking if a single system - the corss-product of the source and target, satisfies a specific property. In this paper, we show how to adapt the existing program analysis techniques in the setting of translation validation. In addition, we present a novel invariant generation algorithm which strengthens our analysis when the input programs contain dynamically allocated data structures. Finally, we report on the prototype tool that applies the developed methodology to verification of the LLVM compiler. The tool handles many of the classical intraprocedural compiler optimizations such as constant folding, reassociation, common subexpression elimination, code motion, dead code elimination, and others."
2008,On the Merits of Temporal Testers.,"Abstract
The paper discusses the merits of temporal testers, which can serve as a compositional basis for automata construction corresponding to temporal formulas in the context of ltl, psl, and mitl logics. Temporal testers can be viewed as (non-deterministic) transducers that, at any point, output a boolean value which is 1 iff the corresponding temporal formula holds starting at the current position.
The main advantage of testers, compared to acceptors (such asB√ºchi automata) is their compositionality. Namely, a tester for a compound formula can be constructed out of the testers for its sub-formulas. Besides providing the construction of testers for formulas specified in ltl, psl, and mitl, the paper also presents a general overview of the tester methodology, and highlights some of the unique features and applications of transducers including compositional deductive verification of ltl properties."
2008,All You Need Is Compassion.,"Abstract
The paper presents a new deductive rule for verifying response properties under the assumption of compassion (strong fairness) requirements. It improves on previous rules in that the premises of the new rule are all first order. We prove that the rule is sound, and present a constructive completeness proof for the case of finite-state systems. For the general case, we present a sketch of a relative completeness proof. We report about the implementation of the rule in PVS and illustrate its application on some simple but non-trivial examples."
2007,"Specify, Compile, Run: Hardware from PSL.","We propose to use a formal specification language as a high-level hardware description language. Formal languages allow for compact, unambiguous representations and yield designs that are correct by construction. The idea of automatic synthesis from specifications is old, but used to be completely impractical. Recently, great strides towards efficient synthesis from specifications have been made. In this paper we extend these recent methods to generate compact circuits and we show their practicality by synthesizing a generalized buffer and an arbiter for ARM's AMBA AHB bus from specifications given in PSL. These are the first industrial examples that have been synthesized automatically from their specifications.
"
2007,Modular Ranking Abstraction.,"Predicate abstraction has become one of the most successful methodologies for proving safety properties of programs. Recently, several abstraction methodologies have been proposed for proving liveness properties. This paper studies ""ranking abstraction"" where a program is augmented by a non-constraining progress monitor based on a set of ranking functions, and further abstracted by predicate-abstraction, to allow for automatic verification of progress properties. Unlike many liveness methodologies, the augmentation does not require a complete ranking function that is expected to decrease with each helpful step. Rather, adequate user-provided inputs are component rankings from which a complete ranking function may be automatically formed. The premise of the paper is an analogy between the methods of ranking abstraction and predicate abstraction, one ingredient of which is refinement: When predicate abstraction fails, one can refine it. When ranking abstraction fails, one must determine whether the predicate abstraction, or the ranking abstraction, needs be refined. The paper presents strategies for determining which case is at hand, and methods for performing the apporpriate refinements. The other part of the analogy is that of automatically deriving deductive proof constructs: Predicate abstraction is often used to derive program invariants for proving safety properties as a boolean combination of the given predicates. Deductive proof of progress properties requires well-founded ranking functions in addition to invariants. We show how the constructs necessary for a deductive proof of an arbitrary LTL formula can be automatically extracted from a successful application of the ranking abstraction method.


"
2007,On Synthesizing Controllers from Bounded-Response Properties.,"Abstract
In this paper we propose a complete chain for synthesizing controllers from high-level specifications. From real-time properties expressed in the logic mtl we generate, under bounded-variability assumptions, deterministic timed automata to which we apply safety synthesis algorithms to derive a controller that satisfies the properties by construction. Some preliminary experimental results are reported."
2007,Interactive presentation: Automatic hardware synthesis from specifications: a case study.,"We propose to use a formal specification language as a high-level hardware description language. Formal languages allow for compact, unambiguous representations and yield designs that are correct by construction. The idea of automatic synthesis from specifications is old, but used to be completely impractical. Recently, great strides towards efficient synthesis from specifications have been made. In this paper we extend these recent methods to generate compact circuits and we show their practicality by synthesizing an arbiter for ARM's AMBA AHB bus and a generalized-buffer from specifications given in PSL. These are the first industrial examples that have been synthesized automatically from their specifications."
2007,Verifying Correctness of Transactional Memories.,"Abstract:
We show how to verify the correctness of transactional memory implementations with a model checker. We show how to specify transactional memory in terms of the admissible interchange of transaction operations, and give proof rules for showing that an implementation satisfies this specification. This notion of an admissible interchange is a key to our ability to use a model checker, and lets us capture the various notions of transaction conflict as characterized by Scott. We demonstrate our work using the TLC model checker to verify several well-known implementations described abstractly in the TLA+ specification language."
