2005,"Real Time Temporal Logic: Past, Present, Future.","Abstract
This paper attempts to improve our understanding of timed languages and their relation to timed automata. We start by giving a constructive proof of the folk theorem stating that timed languages specified by the past fragment of mitl, can be accepted by deterministic timed automata. On the other hand we provide a proof that certain languages expressed in the future fragment of mitl are not deterministic, and analyze the reason for this asymmetry."
2005,Ranking Abstraction as Companion to Predicate Abstraction.,"Abstract
Predicate abstraction has become one of the most successful methodologies for proving safety properties of programs. Recently, several abstraction methodologies have been proposed for proving liveness properties. This paper studies ‚Äúranking abstraction‚Äù where a program is augmented by a nonconstraining progress monitor, and further abstracted by predicate-abstraction, to allow for automatic verification of progress properties. Unlike most liveness methodologies, the augmentation does not require a complete ranking function that is expected to decrease with each step. Rather, the inputs are component rankings from which a complete ranking function may be formed.
The premise of the paper is an analogy between the methods of ranking abstraction and predicate abstraction, one ingredient of which is refinement: When predicate abstraction fails, one can refine it. When ranking abstraction fails, one must determine whether the predicate abstraction, or the ranking abstraction, need be refined. The paper presents strategies for determining which case is at hand.
The other part of the analogy is that of automatically deriving deductive proof constructs: Predicate abstraction is often used to derive program invariants for proving safety properties as a boolean combination of the given predicates. Deductive proof of progress properties requires well-founded ranking functions instead of invariants. We show how to obtain concrete global ranking functions from abstract programs.
We demonstrate the various methods on examples with nested loops, including a bubble sort algorithm on linked lists."
2005,Refining the Undecidability Frontier of Hybrid Automata.,"Abstract
Reachability becomes undecidable in hybrid automata (HA) that can simulate a Turing (TM) or Minsky (MM) machine. Asarin and Schneider have shown that, between the decidable 2-dim Piecewise Constant Derivative (PCD) class and the undecidable 3-dim PCD class, there lies the ‚Äúopen‚Äù class 2-dim Hierarchical PCD (HPCD). This class was shown to be equivalent to the class of 1-dim Piecewise Affine Maps (PAM). In this paper, we first explore 2-dim HPCD‚Äôs proximity to decidability, by showing that they are equivalent to 2-dim PCDs with translational resets, and to HPCDs without resets. A hierarchy of intermediates also equivalent to the HPCD class is presented, revealing semblance to timed and initialized rectangular automata. We then explore the proximity to the undecidability frontier. We show that 2-dim HPCDs with zeno executions or integer-checks can simulate the 2-counter MM. We conclude by retreating HPCDs as PAMs, to derive a simple over-approximating algorithm for reachability. This also defines a decidable subclass 1-dim Onto PAM (oPAM). The novel non-trivial transformation of 2-dim HPCDs into ‚Äúalmost decidable‚Äù systems, is likely to pave the way for approximate reachability algorithms, and the characterization of decidable subclasses. It is hoped that these ideas eventually coalesce into a complete understanding of the reachability problem for the class 2-dim HPCD (1-dim PAM)."
2005,Separating Fairness and Well-Foundedness for the Analysis of Fair Discrete Systems.,"Abstract
Fair discrete systems (FDSs) are a computational model of concurrent programs where fairness assumptions are specified in terms of sets of states. The analysis of fair discrete systems involves a non-trivial interplay between fairness and well-foundedness (ranking functions). This interplay has been an obstacle for automation. The contribution of this paper is a new analysis of temporal properties of FDSs. The analysis uses a domain of binary relations over states labeled by sets of indices of fairness requirements. The use of labeled relations separates the reasoning on well-foundedness and fairness."
2005,Temporal Logic for Scenario-Based Specifications.,"Abstract
We provide semantics for the powerful scenario-based language of live sequence charts (LSCs). We show how the semantics of live sequence charts can be captured using temporal logic. This is done by studying various subsets of the LSC language and providing an explicit translation into temporal logic. We show how a kernel subset of the LSC language (which omits variables, for example) can be embedded within the temporal logic CTL*. For this kernel subset the embedding is a strict inclusion. We show that existential charts can be expressed using the branching temporal logic CTL while universal charts are in the intersection of linear temporal logic and branching temporal logic LTL ‚à© CTL. Since our translations are efficient, the work described here may be used in the development of tools for analyzing and executing scenario-based requirements and for verifying systems against such requirements."
2005,Abstraction for Liveness.,"Abstract
Unlike model checking which is restricted to finite-state systems, there are two methods which can be applied for the verification of arbitrary infinite-state systems. These are the methods of deductive verification and finitary abstraction (FA). Finitary abstraction is the process which provides an abstraction mapping, mapping a potentially infinite-state system into a finite-state one. After obtaining the finite-state abstraction, we may apply model checking in order to verify the property.
In the talk, we will explore some of the relations between the methods of finitary abstraction and deductive verification. One important connection is the recent proof that finitary abstraction is as powerful as deductive verification, thus establishing the completeness (and universality) of the finitary abstraction method. In order to obtain this result, it was necessary to extend the procedure by allowing augmentation of the verified system with auxiliary variables prior to the application of abstraction. With this extension, it is possible to transform the phenomenon of well-founded descent which is essential for proofs of liveness properties into fairness properties of the finite abstracted system.
Since the proof of completeness of the FA method builds upon the proof of completeness of deductive verification, one may get the false impression that, while being as powerful as deductive verification, FA is not much easier to apply. The focus of the talk is aimed at dispelling this false impression, in particular for the case of liveness properties.
We consider first the case of predicate abstraction, which is a special case of FA. We can view predicate abstraction as an effort to find an inductive assertion, where the user does not know the full form of the assertion but can identify a set of atomic formulas under the conjecture that there exists a useful inductive assertion which is some boolean combination of these atomic formulas. In this case, we let the model checker find for us the correct (and best) boolean combination that yields an inductive assertion. In analogy with this view, we will consider the ‚Äúaugmented finitary abstraction‚Äù approach as a situation that the user finds it difficult to formulate a full ranking function, as required by deductive verification, but can identify some components of such a ranking function. In that case, we let the model checker arrange and combine these components into a full liveness proof. In both cases, the method relies on the superior ability of model checkers to exhaustively analyze all the combinations of a finite (but possibly large) set of components.
This is work is based on collaboration with Ittai Balaban, Yonit Kesten, and Lenore Zuck."
2005,Shape Analysis by Predicate Abstraction.,"Abstract
The paper presents an approach for shape analysis based on predicate abstraction. Using a predicate base that involves reachability relations between program variables pointing into the heap, we are able to analyze functional properties of programs with destructive heap updates, such as list reversal and various in-place list sorts. The approach allows verification of both safety and liveness properties. The abstraction we use does not require any abstract representation of the heap nodes (e.g. abstract shapes), only reachability relations between the program variables.
The computation of the abstract transition relation is precise and automatic yet does not require the use of a theorem prover. Instead, we use a small model theorem to identify a truncated (small) finite-state version of the program whose abstraction is identical to the abstraction of the unbounded-heap version of the same program. The abstraction of the finite-state version is then computed by BDD techniques.
For proving liveness properties, we augment the original system by a well-founded ranking function, which is abstracted together with the system. Well-foundedness is then abstracted into strong fairness (compassion). We show that, for a restricted class of programs that still includes many interesting cases, the small model theorem can be applied to this joint abstraction.
Independently of the application to shape-analysis examples, we demonstrate the utility of the ranking abstraction method and its advantages over the direct use of ranking functions in a deductive verification of the same property."
2004,Model checking and abstraction to the aid of parameterized systems (a survey).,"Parameterized systems are systems that involve numerous instantiations of the same finite-state module, and depend on a parameter which defines their size. Examples of parameterized systems include sensor systems, telecommunication protocols, bus protocols, cache coherence protocols, and many other protocols that underly current state-of-the-art systems. Formal verification of parameterized systems is known to be undecidable (Inform. Process. Lett. 22 (6)) and thus cannot be automated. Recent research has shown that it is often the case that a combination of methodologies allows to reduce the problem of verification of a parameterized system into the problem of verification of a finite-state system, that can be automatically verified.
This paper describes several recent methodologies, based on model checking and abstraction. We start with the method of invisible auxiliary assertions that combines a small-model theorem with heuristics to automatically generate auxiliary constructs used in proofs of correctness of parameterized systems. We also describe the method of counter abstraction that offers simple liveness proofs for many parameterized systems, and discuss novel methodologies of using counter abstraction to automatically verify that probabilistic parameterized system satisfy their temporal specifications with probability 1.
"
2004,Validating the Translation of an Industrial Optimizing Compiler.,"Abstract
The paper presents an approach to the translation validation of an optimizing compiler which translates synchronous C programs into machine code programs. Being synchronous means that both source and target programs are loop free. This enables representation of each of these programs by a single state transformer, and verification of the translation correctness is based on comparison of the source and target state transformers. The approach has been implemented on a tool called MCVT which is also described."
2004,Range Allocation for Separation Logic.,"Abstract
Separation Logic consists of a Boolean combination of predicates of the form v i ‚â• v j + c where c is a constant and v i ,v j are variables of some ordered infinite type like real or integer. Any equality or inequality can be expressed in this logic. We propose a decision procedure for Separation Logic based on allocating small domains (ranges) to the formula‚Äôs variables that are sufficient for preserving satisfiability. Given a Separation Logic formula œÜ, our procedure constructs the inequalities graph of œÜ, based on œÜ‚Äôs predicates. This graph represents an abstraction of the formula, as there are many formulas with the same set of predicates. Our procedure then analyzes this graph and allocates a range to each variable that is adequate for all of these formulas. This approach of finding small finite ranges and enumerating them symbolically is both theoretically and empirically more efficient than methods based on case-splitting or reduction to Propositional Logic. Experimental results show that the state-space (that is, the number of assignments that need to be enumerated) allocated by our procedure is frequently exponentially smaller than previous methods."
2004,On Recognizable Timed Languages.,"Abstract
In this work we generalize the fundamental notion of recognizability from untimed to timed languages. The essence of our definition is the existence of a right-morphism from the monoid of timed words into a bounded subset of itself. We show that the recognizable languages are exactly those accepted by deterministic timed automata and argue that this is, perhaps, the right class of timed languages, and that the closure of untimed regular languages under projection is a positive accident that cannot be expected to hold beyond the finite-state case."
2004,Smart Play-Out Extended: Time and Forbidden Elements.,"Abstract:
Smart play-out is a powerful technique for executing live sequence charts (LSCs). It uses verification techniques to help run a program, rather than to prove properties thereof. We extend smart play-out to cover a larger set of the LSC language features and to deal more efficiently with larger models. The extensions cover two key features of the rich version of LSCs, namely, time and forbidden elements. The former is crucial for systems with time constraints and/or time-driven behavior, and the latter allows specifying invariants and contracts on behavior. Forbidden elements can also help reduce the state space considered, thus enabling smart play-out to handle larger models."
2004,Liveness with Incomprehensible Ranking.,"Abstract
The methods of Invisible Invariants and Invisible Ranking were developed originally in order to verify temporal properties of parameterized systems in a fully automatic manner. These methods are based on an instantiate-project-and-generalize heuristic for the automatic generation of auxiliary constructs and a small model property implying that it is sufficient to check validity of a deductive rule premises using these constructs on small instantiations of the system. The previous version of the method of Invisible Ranking was restricted to cases where the helpful assertions and ranking functions for a process depended only on the local state of this process and not on any neighboring process, which seriously restricted the applicability of the method, and often required the introduction of auxiliary variables.
In this paper we extend the method of Invisible Ranking to cases where the helpful assertions and ranking functions of a process may also refer to other processes. We first develop an enhanced version of the small model property, making it applicable to assertions that refer both to processes and their immediate neighbors. This enables us to apply the Invisible Ranking method to parameterized systems with ring topologies. For cases where the auxiliary assertions refer to all processes, we develop a novel proof rule which simplifies the selection of the next helpful transition, and enables the validation of the premises possible under the (old) small model theorem."
2004,Deductive Verification of UML Models in TLPVS.,"Abstract
In recent years, UML has been applied to the development of reactive safety-critical systems, in which the quality of the developed software is a key factor. In this paper we present an approach for the deductive verification of such systems using the PVS interactive theorem prover. Using a PVS specification of a UML kernel language semantics, we generate a formal representation of the UML model. This representation is then verified using tlpvs, our PVS-based implementation of linear temporal logic and some of its proof rules. We apply our method by verifying two examples, demonstrating the feasibility of our approach on models with unbounded event queues, object creation, and variables of unbounded domain. We define a notion of fairness for UML systems, allowing us to verify both safety and liveness properties."
2004,Liveness with Invisible Ranking.,"Abstract
The method of Invisible Invariants was developed originally in order to verify safety properties of parameterized systems fully automatically. Roughly speaking, the method is based on a small model property that implies it is sufficient to prove some properties on small instantiations of the system, and on a heuristic that generates candidate invariants. Liveness properties usually require well founded ranking, and do not fall within the scope of the small model theorem. In this paper we develop novel proof rules for liveness properties, all of whose proof obligations are of the correct form to be handled by the small model theorem. We then develop abstraction and generalization techniques that allow for fully automatic verification of liveness properties of parameterized systems. We demonstrate the application of the method on several examples."
2003,VOC: A Methodology for the Translation Validation of OptimizingCompilers.,"There is a growing awareness, both in industry and academia, of the crucial role of formally verifying the translation from high-level source-code into low-level object code that is typically performed by an optimizing compiler. Formally verifying an optimizing compiler, as one would verify any other large program, is not feasible due to its size, ongoing evolution and modification, and, possibly, proprietary considerations. Translation validation is a novel approach that offers an alternative to the verification of translators in general and compilers in particular: Rather than verifying the compiler itself, one constructs a validation tool which, after every run of the compiler, formally confirms that the target code produced in the run is a correct translation of the source program. The paper presents voc, a methodology for the translation validation of optimizing compilers. We distinguish between structure preserving optimizations, for which we establish a simulation relation between the source and target code based on computational induction, and structure modifying optimizations, for which we develop specialized permutation rules. The paper also describes voc-64 - a prototype translation validator tool that automatically produces verification conditions for the global optimizations of the SGI Pro-64 compiler."
2003,TLPVS: A PVS-Based LTL Verification System.,"Abstract
In this paper we present our pvs implementation of a linear temporal logic verification system. The system includes a set of theories defining a temporal logic, a number of proof rules for proving soundness and response properties, and strategies which aid in conducting the proofs. In addition to implementing a framework for existing rules, we have also derived new methods which are particularly useful in a deductive ltl system. A distributed rank rule for the verification of response properties in parameterized systems is presented, and a methodology is detailed for reducing compassion requirements to justice requirements (strong fairness to weak fairness). Special attention has been paid to the verification of unbounded systems ‚Äî systems in which the number of processes is unbounded ‚Äî and our verification rules are appropriate to such systems."
2003,Bridging the Gap between Fair Simulation and Trace Inclusion.,"Abstract
The paper considers the problem of checking abstraction between two finite-state fair discrete systems. In automata-theoretic terms this is trace inclusion between two Streett automata. We propose to reduce this problem to an algorithm for checking fair simulation between two generalized B√ºchi automata. For solving this question we present a new triply nested Œº-calculus formula which can be implemented by symbolic methods.
We then show that every trace inclusion of this type can be solved by fair simulation, provided we augment the concrete system (the contained automaton) by appropriate auxiliary variables. This establishes that fair simulation offers a complete method for checking trace inclusion. We illustrate the feasibility of the approach by algorithmically checking abstraction between finite state systems whose abstraction could only be verified by deductive methods up to now."
2003,The ROBDD Size of Simple CNF Formulas.,"Abstract
Reduced Ordered Binary Decision diagrams (ROBDDs) are nowadays one of the most common dynamic data structures for Boolean functions. Among the many areas of application are verification, model checking, and computer aided design. In the last few years, SAT checkers, based on the CNF representation of Boolean functions are getting more and more attention as an alternative to the ROBDD based methods. We show the difference between the CNF representation and the ROBDD representation in one of the most degenerate cases ‚Äì random monotone 2CNF formulas. We examine this model and give almost matching lower and upper bounds for the ROBDD size in different cases, and show that as soon as the formulas are non-trivial the ROBDD size becomes exponential, thus showing perhaps one of the most fundamental advantages of SAT solvers over ROBDDs."
2003,Formal Modeling of C. elegans Development: A Scenario-Based Approach.,"Abstract
We present preliminary results of a new approach to the formal modeling of biological phenomena. The approach stems from the conceptual compatibility of the methods and logic of data collection and analysis in the field of developmental genetics with the languages, methods and tools of scenario-based reactive system design. In particular, we use the recently developed methodology consisting of the language of live sequence charts with the play-in/play-out process, to model the well-characterized process of cell fate acquisition during C. elegans vulval development."
2003,Parameterized Verification by Probabilistic Abstraction.,"Abstract
The paper studies automatic verification of liveness properties with probability 1 over parameterized programs that include probabilistic transitions, and proposes two novel approaches to the problem. The first approach is based on a Planner that occasionally determines the outcome of a finite sequence of ‚Äúrandom‚Äùchoices, while the other random choices are performed non-deterministically.Using a Planner, a probabilistic protocol can be treated just like a non-probabilistic one and verified as such. The second approach is based on Œ≥-fairness, a notion of fairness that is sound and complete for verifying simple temporal properties (whose only temporal operators are ‚ãÑand ‚ñ°) over finite-state systems.The paper presents a symbolic model checker based on Œ≥-fairness.We then show how the network invariant approach can be adapted to accommodate probabilistic protocols. The utility of the Planner approach is demonstrated on a probabilistic mutual exclusion protocol. The utility of the approach of Œ≥-fairness with network invariants is demonstrated on Lehman and Rabin's Courteous Philosophers algorithm."
2003,Smart play-out.,"We describe ""smart play-out"", a new method for executing and analyzing scenario based behavior, which is part of the Play-In/Play-Out methodology and the Play-Engine tool. Behavior is ""played in"" directly from the system's GUI, and as this is being done the Play-Engine continuously constructs Live Sequence Charts (LSCs), a powerful extension of sequence diagrams. Later, behavior can be ""played out"" freely from the GUI, and the tool executes the LSCs directly, thus driving the system's behavior. An inherent difficulty in constructing a ``play-out"" mechanism is how to resolve the nondeterminism allowed by the LSC specification in order to obtain an executable model. Smart play-out, is a recent strengthening of the play-out mechanism, which addresses this problem by using powerful verification methods, mainly model-checking, to execute and analyze the LSCs, helping the execution to avoid deadlocks and violations. Thus, smart play-out utilizes verification techniques to run programs, rather than to verify a program with respect to given requirements, as in traditional verification approaches. The ideas appear to be relevant in various stages of system development, including requirements specification and analysis, implementation and testing."
