1991,On the Faithfulness of Formal Models.,"Abstract
The paper presents a critical examination of the way certain central aspects of concurrent programs are formally modeled. The main formal model examined is the operational model of fair transition system which represents concurrency by interleaving of actions considered atomic. Several questions concerning the faithfulness of this representation naturally arise. The paper considers some of these questions and, while presenting and analyzing some of the alternatives, attempts to justify the design decisions actually taken in the construction of the model."
1991,Communication with Directed Logic Variables.,n/a
1991,Temporal Proof Methodologies for Real-time Systems.,n/a
1991,Timed Transition Systems.,"Abstract
We incorporate time into an interleaving model of concurrency. In timed transition systems, the qualitative fairness requirements of traditional transition system are replaced (and superseded) by quantitative lower-bound and upperbound timing constraints on transitions. The purpose of this paper is to explore the scope of applicability for the abstract model of timed transition systems. We demonstrate that the model can represent a wide variety of phenomena that routinely occur in conjunction with the timed execution of concurrent processes. Our treatment covers both processes that are executed in parallel on separate processors and communicate either through shared variables or by message passing, and processes that time-share a limited number of processors under a given scheduling policy. Often it is this scheduling policy that determines if a system meets its real-time requirements. Thus we explicitly address such questions as time-outs, interrupts, static and dynamic priorities."
1991,From Timed to Hybrid Systems.,"Abstract
We propose a framework for the formal specification and verification of timed and hybrid systems. For timed systems we propose a specification language that refers to time only through age functions which measure the length of the most recent time interval in which a given formula has been continuously true.
We then consider hybrid systems, which are systems consisting of a non-trivial mixture of discrete and continuous components, such as a digital controller that controls a continuous environment. The proposed framework extends the temporal logic approach which has proven useful for the formal analysis of discrete systems such as reactive programs. The new framework consists of a semantic model for hybrid time, the notion of phase transition systems, which extends the formalism of discrete transition systems, an extended version of Statecharts for the specification of hybrid behaviors, and an extended version of temporal logic that enables reasoning about continuous change."
1991,What is in a Step: On the Semantics of Statecharts.,"Abstract
This paper presents a proposal for the definition of a step in the execution of a statechart. The proposed semantics maintains the synchrony hypothesis, by which the system is infinitely faster than its environment, and can always finish computing its response before the next stimulus arrives. However, it corrects some inconsistencies present in previous definitions, by requiring global consistency of the step."
1990,STATEMATE: A Working Environment for the Development of Complex Reactive Systems.,"Abstract:
STATEMATE is a set of tools, with a heavy graphical orientation, intended for the specification, analysis, design, and documentation of large and complex reactive systems. It enables a user to prepare, analyze, and debug diagrammatic, yet precise, descriptions of the system under development from three interrelated points of view, capturing structure, functionality, and behavior. These views are represented by three graphical languages, the most intricate of which is the language of statecharts, used to depict reactive behavior over time. In addition to the use of statecharts, the main novelty of STATEMATE is in the fact that it understands the entire descriptions perfectly, to the point of being able to analyze them for crucial dynamic properties, to carry out rigorous executions and simulations of the described system, and to create running code automatically. These features are invaluable when it comes to the quality and reliability of the final outcome.<>"
1990,Tight Bounds on the Complexity of Cascaded Decomposition of Automata.,"Abstract:
Exponential upper and lower bounds on the size of the cascaded (Krohn-Rhodes) decomposition of automata are given. These results are used to obtain elementary algorithms for various translations between automata and temporal logic, where the previously known translations were nonelementary. The relevance of the result is discussed.< >"
1990,Distributed Reactive Systems Are Hard to Synthesize.,"Abstract:
The problem of synthesizing a finite-state distributed reactive system is considered. Given a distributed architecture A, which comprises several processors P/sub 1/, . . ., P/sub k/ and their interconnection scheme, and a propositional temporal specification phi , a solution to the synthesis problem consists of finite-state programs Pi /sub 1/, . . ., Pi /sub k/ (one for each processor), whose joint (synchronous) behavior maintains phi against all possible inputs from the environment. Such a solution is referred to as the realization of the specification phi over the architecture A. Specifically, it is shown that the problem of realizing a given propositional specification over a given architecture is undecidable, and it is nonelementarily decidable for the very restricted class of hierarchical architectures. An extensive characterization of architecture classes for which the realizability problem is elementarily decidable and of classes for which it is undecidable is given.< >"
1990,Proving Partial Order Liveness Properties.,"Abstract
A temporal verification method which is based upon partial order semantics of traces [31] is presented. The semantic model used here can express the distributed nature of a program. E.g., properties such as serializability of database transactions, layering of a program, snapshots or the parallel execution of program segments."
1990,An interleaving model for real-time.,"Abstract:
Real-time is incorporated into the interleaving model, which is used for the practical specification and verification of many properties of concurrent systems, by defining the abstract notion of a real-time transition system as a conservative extension of traditional transition systems. Qualitative fairness requirements are replaced (and superseded) by quantitative lower-bound and upper-bound real-time requirements for transitions. Proof rules are presented and used to establish lower and upper real-time bounds for response properties of real-time transition systems. This proof system can be used to verify bounded-invariance and bounded-response properties, such as timely termination of shared-variables multiprocessing systems whose semantics is defined in terms of real-time transition systems.< >"
1990,A temporal proof methodology for reactive systems.,"Abstract:
A minimal proof theory that is adequate for proving the main important temporal properties of reactive programs is presented. The properties considered consist of the classes of invariance and response properties. For each of these classes a small set of rules that is complete for verifying properties belonging to the class is given. The application of these rules is illustrated by several examples. Concise presentations of complex proofs using the devices of transition tables and proof diagrams are discussed.< >"
1990,Explicit Clock Temporal Logic.,"Abstract:
The authors present a single exponent decision procedure for the validity of XCTL formulas, and a double exponent decision procedure for the validity of XCTL formulas over finite state programs (model checking). The expressive power of XCTL is compared with that of some other logics proposed for the expression of real time properties. It is shown that it is incomparable with the expressive power of the recently proposed logic TPTL (timed propositional temporal logic).< >"
1990,A Hierarchy of Temporal Properties.,"We propose a classification of temporal properties into a hierarchy which refines the known safety-liveness classification of properties. The new classification recognizes the classes of safety, guarantee, persistence, fairness, and hyper-fairness. The classification suggested here is based on the different ways a property of finite computations can be extended into a property of infinite computations. For properties that are expressible by temporal logic and predicate automata, we provide a syntactic characterization of the formulae and automata that specify properties in the different classes. We consider the verification of properties over a given program, and provide a unique proof principle for each class."
1989,Learning omega-Regular Languages from Queries and Counter-Examples (A Preliminary Report).,"Abstract
In this paper we discuss problems concerning the learnability of œâ-regular languages from examples via the synthesis of their corresponding finite-state acceptors. The main technical contribution of this paper is a polynomial algortihm that learns a sub-class of the œâ-regular languages from queries and counter-examples. A similar setting has been suggested in [Ang87] for learning (finitary) regular languages. The algorithm given there produces the minimal automaton accepting the desired language using polynomially many (in the number of states) queries and computation steps. Our algorithm tackles some special problems that arise when adapting this framework to the infinitary case."
1989,Completing the Temporal Picture.,"Abstract
The paper presents a relatively complete proof system for proving the validity of temporal properties of reactive programs. The presented proof system improves on previous temporal systems, such as [MP83a] and [MP83b], in that it reduces the validity of program properties into pure assertional reasoning, not involving additional temporal reasoning. The proof system is based on the classification of temporal properties according to the Borel hierarchy, providing an appropriate proof rule for each of the main classes, such as safety, response, and progress properties."
1989,On the Synthesis of an Asynchronous Reactive Module.,"Abstract
We consider the synthesis of a reactive asynchronous module which communicates with its environment via the shared input variable x and the shared output variable y, assuming that the module is specified by the linear temporal formula œï(x,y). We derive from œï(x,y) another linear formula œá(r,w,x,y), with the additional scheduling variables r,w, and show that there exists a program satisfying œï iff the branching time formula (‚àÄr,w,x)(‚àÉy)Aœá(r,w,x,y) is valid over all tree models. For the restricted case that all variables range over finite domains, the validity problem is decidable, and we present an algorithm, of doubly exponential time and space complexity, for constructing a program that implements the specification whenever it is implementable. In addition, we provide some matching lower bounds."
1989,Specification and verification of VLSI systems.,"Abstract:
A hardware verification approach based on linear time temporal logic is described. The authors show that by introducing appropriate abbreviations into linear temporal logic, which facilitate the expression of precise timing constraints, they obtain a very convenient language for the description of the behavior of hardware systems, and for the development of a formal verification system used in proving that designs meet their specifications. The authors automatically verified several sequential circuits. As an example they describe the specification and verification of an edge-triggered D-type flip-flop and the discovery of an error in a published specification. It is demonstrated that the approach is practical and offers a viable alternative to simulation. Comparison is made with other formal methods.< >"
1989,On the Synthesis of a Reactive Module.,"We consider the synthesis of a reactive module with input x and output y, which is specified by the linear temporal formula @@@@(x, y). We show that there exists a program satisfying @@@@ iff the branching time formula (‚àÄx) (‚àÉy) A@@@@(x, y) is valid over all tree models. For the restricted case that all variables range over finite domains, the validity problem is decidable, and we present an algorithm for constructing the program whenever it exists. The algorithm is based on a new procedure for checking the emptiness of Rabin automata on infinite trees in time exponential in the number of pairs, but only polynomial in the number of states. This leads to a synthesis algorithm whose complexity is double exponential in the length of the given specification."
1988,The grammar of dimensions in machine drawings.,"Dimensioning is an important constituent in machine drawings. Recognition of dimensions in machaine drawings is a prerequisite for the development of a machine drawing understanding system (MDUS), which is a special class of image understanding systems (IUSs). The approach proposed in this work is a syntactic analysis of the dimensions, which are represented by undirected, labeled graphs called ìwebsî. Utilizing the conventions of web grammar, a set of web rewriting rules is established, which specify how all the possible dimension-sets can be generated and detected. The recognition process starts by detecting arrows using statistical methods. The location and orientation of the arrows together with rewriting rules of the dimensioning grammar are used to detect the rest of the components and the tree structure of the corresponding dimension set.
"
1988,A Framework for the Synthesis of Reactive Modules.,"Abstract
We consider the synthesis of a reactive module with input x and output y, which is specified by the linear temporal formula œï(x, y). We show that there exists a program satisfying œï iff the branching time formula (‚àÄx)(‚àÉy)Aœï(x, y) is valid over all tree models."
1988,Applications of Temporal Logic to the Specification of Real-time Systems.,n/a
1988,STATEMATE; A Working Environment for the Development of Complex Reactive Systems.,"This paper provides a brief overview of the STATEMATE system, constructed over the past three years by i-Logix Inc., and Ad Cad Ltd. STATEMATE is a graphical working environment, intended for the specification, analysis, design and documentation of large and complex reactive systems, such as real-time embedded systems, control and communication systems, and interactive software. It enables a user to prepare, analyze and debug diagrammatic, yet precise, descriptions of the system under development from three inter-related points of view, capturing, structure, functionality and behavior. These views are represented by three graphical languages, the most intricate of which is the language of statecharts used to depict reactive behavior over time. In addition to the use of state-charts, the main novelty of STATEMATE is in the fact that it `understands` the entire descriptions perfectly, to the point of being able to analyze them for crucial dynamic properties, to carry out rigorous animated executions and simulations of the described system, and to create running code automatically. These features are invaluable when it comes to the quality and reliability of the final outcome."
1988,The anchored version of the temporal framework.,"Abstract
In this survey paper we present some of the recent developments in the temporal formal system for the specification, verification and development of reactive programs. While the general methodology remains very much the one presented in some earlier works on the subject, such as [MP83c,MP83a,Pnu86], there have been several technical improvements and gained insights in understanding the computational model, the logic itself, the proof system and its presentation, and connections with alternative formalisms, such as finite automata. In this paper we explicate some of these improvements and extensions.
The main difference between this and preceding versions is that here we consider a notion of validity for temporal formulae, which is anchored at the initial state of the computation. The paper discusses some of the consequences of this decision."
1987,Very High Level Concurrent Programming.,"Abstract:
Concurrent systems are typically large and complex, requiring long, development time and much labor. They are, therefore, prime candidates for simplification and automation of the design and programming process. Their major application areas include real time systems, operating systems and cooperative computation. New applications are emerging with the trends towards wide usage of personal computers connected in a network and towards use of parallel processing in supercomputer architectures."
1987,On the Formal Semantics of Statecharts (Extended Abstract).,n/a
1987,A Hierarchy of Temporal Properties (Abstract).,n/a
1987,Specification and Verification of Concurrent Programs By Forall-Automata.,"‚àÄ-automata are non-deterministic finite-state automata over infinite sequences. They differ from conventional automata in that a sequence is accepted if all runs of the automaton over the sequence are accepting. These automata are suggested as a formalism for the specification and verification of temporal properties of concurrent programs. It is shown that they are as expressive as extended-temporal-logic (ETL), and in some cases provide a more compact representation of properties than temporal logic. A structured diagram notation is suggested for the graphical representation of these automata. A single sound and complete proof rule is presented for proving that all computations of a program have the property specified by a ‚àÄ-automaton."
1987,Specification and Implementation of Concurrently Accessed Data Structures: An Abstract Data Type Approach.,"Abstract
In this paper, we extended abstract data types methods to the question of the specification and the implementation of data structures accessed concurrently by several processes. Our approach provides the underlying theory for modularity and development by a stepwise refinement strategy of such systems.
We have identified the properties that must be checked in order to prove that an implementation is correct. They consist of two groups: the first one is similar to the properties usually required when proving the implementation of a classical, non-concurrent algebraic specification; they are dealt with in the usual fashion. The second group states that no new, undesirable interleavings occur in the implementation; we have designed a proof method for this.
One direction of future research, is to investigate the introduction of more sophisticated primitives for the construction of non-atomic processes (conditionals, guarded choice,...). Several new questions then arise; in particular, our notion of strong implementation should be refined, and our proof methods extended accordingly."
1987,Specification and Verification of Concurrent Programs by forall-Automata.,"Abstract
‚àÄ-automata are non-deterministic finite-state automata over infinite sequences. They differ from conventional automata in that a sequence is accepted if all runs of the automaton over the sequence are accepting. These automata are suggested as a formalism for the specification and verification of temporal properties of concurrent programs. It is shown that they are as expressive as extended temporal logic (ETL), and, in some cases, provide a more compact representation of properties than temporal logic. A structured diagram notation is suggested for the graphical representation of these automata. A single sound and complete proof rule is presented for proving that all computations of a program have the property specified by a ‚àÄ-automaton."
1986,Verification of Multiprocess Probabilistic Protocols.,"Abstract
In this paper we demonstrate the utility of temporal logic to the formal verification of probabilistic distributed programs. The approach taken is to represent the quantitative notion of probabilistic computations by the qualitative abstraction ofextreme fairness. The method is illustrated first on the dining philosophers problem [3] and then on a new probabilistic symmetric solution to then-processes mutual exclusion problem. Two related solutions are presented corresponding to different assumptions about the granularity of a compound test."
1986,Specification and Development of Reactive Systems (Invited Paper).,n/a
1986,A Choppy Logic.,n/a
1986,Probabilistic Verification by Tableaux.,n/a
1986,A Really Abstract Concurrent Model and its Temporal Logic.,"In this paper we advance the radical notion that a computational model based on the <i>reals</i> provides a more abstract description of concurrent and reactive systems, than the conventional <i>integers</i> based behavioral model of execution <i>sequences.</i> The real model is studied in the setting of temporal logic, and we illustrate its advantages by providing a <i>fully abstract</i> temporal semantics for a simple concurrent language, and an example of verification of a concurrent program within the real temporal logic defined here. It is shown that, by imposing the crucial condition of <i>finite variability,</i> we achieve a balanced formalism that is insensitive to <i>finite</i> stuttering, but can recognize <i>infinite</i> stuttering, a distinction which is essential for obtaining a fully abstract semantics of non-terminating processes. Among other advantages, going into real-based semantics obviates the need for the controversial representation of concurrency by interleaving, and most of the associated fairness constraints."
1985,Linear and Branching Structures in the Semantics and Logics of Reactive Systems.,"Abstract
In this presentation we reviewed the dichotomy between branching and linear views of reactive systems as they are reflected in three different approaches to the formalization of reactive systems. Hopefully we succeeded in convincing the reader that these views are distinct and represent different attitudes to the desired level of abstractness in the semantics of reactive systems. The branching view is always more detailed than the linear view, and the important question that should be left open for the user of the approach, is whether this additional detail is necessary for his application.
In this presentation we only considered the branching vs. linear dichotomy in the treatment of nondeterminism. A very similar dichotomy exists in the treatment of concurrency itself, namely between the partial order (hence acyclic graph) representation of causality and concurrency and its linearization by all the total orders consistent with this partial order. We suggest a similar study for the identification of the elements captured in the partial order which are lost in the linearization."
1985,Proving Termination of Prolog Programs.,"Abstract
The paper presented two kinds of proof rules to prove B-termination, the kind of termination obtained by the combination of backtracking and recursion as displayed by Prolog. The first kind of rule takes into account the context of the whole program and is based on a tree oriented operational semantics. The second kind is more compositional, dealing with separate procedures in a context independent way. It is based on a stream oriented semantics.
We would like to stress that such proof rules may be successfully used for defining other search strategies than the actual one used by prolog. An interesting question is to define in this way a probabilistic backtracking search strategy."
1985,The Glory of the Past.,"Abstract
An extension of propositional temporal logic that includes operators referring to a bounded past is considered. An exponential time decision procedure and a complete axiomatic system are presented. A suggested normal form leads to a syntactic classification of safety and liveness formulae. The adequacy of temporal logic to modular verification is examined. Finally we present the notion of Œ±-fairness which is proved to fully capture the behavior of probabilistic finite state programs."
1985,Checking That Finite State Concurrent Programs Satisfy Their Linear Specification.,"We present an algorithm for checking satisfiability of a linear time temporal logic formula over a finite state concurrent program. The running time of the algorithm is exponential in the size of the formula but linear in the size of the checked program. The algorithm yields also a formal proof in case the formula is valid over the program. The algorithm has four versions that check satisfiability by unrestricted, impartial, just and fair computations of the given program."
1984,Adequate Proof Principles for Invariance and Liveness Properties of Concurrent Programs.,"This paper presents proof principles for establishing invariance and liveness properties of concurrent programs. Invariance properties are established by systematically checking that they are preserved by every atomic instruction in the program. The methods for establishing liveness properties are based on well-founded assertions and are applicable to both ëjustí and ëfairí computations. These methods do not assume a decrease of the rank at each computation step. It is sufficient that there exists one process which decreases the rank when activated. Fairness then ensures that the program will eventually attain its goal. In the finite state case such proofs can be represented by diagrams. Several examples are given.
"
