2001,Range Allocation for Equivalence Logic.,"Abstract
The range allocation problem was recently introduced as part of an efficient decision procedure for deciding satisfiability of equivalence logic formulas with or without uninterpreted functions. These type of formulas are mainly used when proving equivalence or refinement between systems (hardware designs, compiler‚Äôs translation, etc). The problem is to find in polynomial time a small finite domain for each of the variables in an equality formula œÜ, such that œÜ is valid if and only if it is valid over this small domain. The heuristic that was presented for finding small domains was static, i.e. it finds a small set of integer constants for each variable. In this paper we show new, more flexible range allocation methods. We also show the limitations of these and other related approaches by proving a lower bound on the size of the state space generated by such procedures. To prove this lower bound we reduce the question to a graph theoretic counting question, which we believe to be of independent interest."
2001,Sticks and stones: a coding scheme for parameterized verification.,"We consider the problem of Uniform Algorithmic Verification of Parameterized Systems, which requires establishing in a single verification effort the correctness of a parameterized family of systems for any value of the parameter. As has been observed by several researchers, using regular expressions or equivalent formalisms (e.g. WS1S) as assertional language, we can perform symbolic model checking of systems of unbounded number of states.
We start by showing that the verification problem can be viewed as taking place in a space of 3 dimensions: Time, Control, and Data. We will illustrate how regular expressions can be naturally applied to deal with any of these dimensions in case it becomes unbounded. Unfortunately, extending the tool of regular expressions to 2 dimension leads to undecidability.
We therefore consider alternate ways of dealing with systems which have both unbounded control and unbounded data. By appropriate abstractions and encoding it is frequently possible to encode these two dimensions within a single dimension, using a coding scheme to which we refer as ‚Äústicks and stones‚Äù. The method will be illustrated on parameterized versions of the Bakery and Peterson's algorithms for mutual exclusion. Among other things, we will show that, in some cases, we can use languages more expressive than regular expressions and still get manageable verification algorithms. This is, for example, the case of Peterson's algorithm for N processes, which cannot be analyzed in terms of purely regular expressions."
2001,Automatic Deductive Verification with Invisible Invariants.,"Abstract
The paper presents a method for the automatic verification of a certain class of parameterized systems. These are bounded-data systems consisting of N processes (N being the parameter), where each process is finite-state. First, we show that if we use the standard deductive INV rule for proving invariance properties, then all the generated verification conditions can be automatically resolved by finite-state (BDD-based) methods with no need for interactive theorem proving.
Next, we show how to use model-checking techniques over finite (and small) instances of the parameterized system in order to derive candidates for invariant assertions. Combining this automatic computation of invariants with the previously mentioned resolution of the VCs (verification conditions) yields a (necessarily) incomplete but fully automatic sound method for verifying bounded-data parameterized systems. The generated invariants can be transferred to the VC-validation phase without ever been examined by the user, which explains why we refer to them as ‚Äúinvisible‚Äù.
We illustrate the method on a non-trivial example of a cache protocol, provided by Steve German."
2000,Verification of Clocked and Hybrid Systems.,"This paper presents a new computational model for real-time systems, called the clocked transition system (CTS) model. The CTS model is a development of our previous timed transition model, where some of the changes are inspired by the model of timed automata. The new model leads to a simpler style of temporal specification and verification, requiring no extension of the temporal language. We present verification rules for proving safety a nd liveness properties of clocked transition systems. All rules are associated with verification diagrams. The verification of response properties requires adjustments of the proof rules developed for untimed systems, reflecting the fact that progress in the real time systems is ensured by the progress of time and not by fairness. The style of the verification rules is very close to the verification style of untimed systems which allows the (re)use of verification methods and tools, developed for u ntimed reactive systems, for proving all interesting properties of real-time systems.
We conclude with the presentation of a branching-time based approach for verifying that an arbitrary given CTS is non-zeno. Finally, we present an extension of the model and the invariance proof rule for hybrid systems.

"
2000,Verification by Augmented Finitary Abstraction.,"The paper deals with the proof method of verification by finitary abstraction (VFA), which presents a feasible approach to the verification of the temporal properties of (potentially infinite-state) reactive systems. The method consists of a two-step process by which, in a first step, the system and its temporal specification are jointly abstracted into a finite-state system and a finite-state specification. The second step uses model checking to establish the validity of the abstracted property over the abstracted system. The VFA method can be considered a viable alternative to verification by temporal deduction which, up to now, has been the main method generally applicable for verification of infinite-state systems. The paper presents a general recipe for the joint abstraction, which is shown to be sound, where soundness means that validity over the abstract system implies validity over the concrete (original) system. To make the method applicable for the verification of liveness properties, pure abstraction is sometimes no longer adequate. We show that by augmenting the system by an appropriate (and standardly constructible) progress monitor, we obtain an augmented system, whose computations are essentially the same as the original system, and which may now be abstracted while preserving the desired liveness properties. We refer to the extended method as verification by augmented abstraction (VAA). We then proceed to show that the VAA method is sound and complete for proving all properties expressible by temporal logic (including both safety and liveness). Completeness establishes that whenever the property is valid, there exists a finitary abstraction which abstracts the system, augmented by an appropriate progress monitor, into a finite-state system which validated the abstracted property.
"
2000,Propositional Temporal Logics: Decidability and Completeness.,"A sound and complete axiomatic system and a tableau-based decision procedure are presented for propositional temporal logic over linear and discrete time models. The axiomatic system and decision procedure are presented for the full logic, including the past operators, but contain a clear identification of the parts whose omission yields axiomatization and a decision procedure for the future fragment. The paper summarizes work of over 20 years and is intended to provide a definitive reference to the version of propositional temporal logic used for the specification and verification of reactive systems.
"
2000,Control and Data Abstraction: The Cornerstones of Practical Formal Verification.,"In spite of the impressive progress in the development of the two main methods for formal verification of reactive systems ñ Symbolic Model Checking and Deductive Verification, they are still limited in their ability to handle large systems. It is generally recognized that the only way these methods can ever scale up is by the extensive use of abstraction and modularization, which break the task of verifying a large system into several smaller tasks of verifying simpler systems.
In this paper, we review the two main tools of compositionality and abstraction in the framework of linear temporal logic. We illustrate the application of these two methods for the reduction of an infinite-state system into a finite-state system that can then be verified using model checking.
The technical contributions contained in this paper are a full formulation of abstraction when applied to a system with both weak and strong fairness requirements and to a general temporal formula, and a presentation of a compositional framework for shared variables and its application for forming network invariants.
"
2000,Rigorous development of embedded systems.,"Opinions differ as to what are the main challenges posed by the meteoritically expanding area of embedded systems. Some consider communication and the correct blending of local-area and wide-area networks to be the main obstacle which, when overcome, will open the way to an accelerated development of the field. Others consider customized hardware to be the key that will open the last blocking lock. According to the opinion expressed in this talk, the most important problem, whose solution will greatly improve our ability to construct reliable embedded systems in a timely manner, is the development methodology and process. In this talk, we will outline a rigorous development approach which provides a seamless passage from requirements to running code (including customized hardware construction), where special care is taken to validate the correctness of each step in the process. The concept of the seamless development process for embedded systems grew out of the European Esprit project Sacres which constructed a prototype development environment for Safety Critical Systems. The components of the Sacres environment included executable system specification, using either the statebased specification language of Statecharts, or the dataflowbased specification language Sildex, or a combination thereof. It then translated this (combined) specification into a common format, and provided tools for the formal verification of the resulting design. The verification tools provided ìunit verificationî which could verify a single module or component within the design, using model-checking techniques. After this has been applied to some of the modules, one could invoke the tool of ìsystem verificationî which combines the results of unit verification to infer properties of bigger subsystems. Once the common design has been satisfactorily validated, the next development step invoked a code generator which translated the high-level specification into a running code program in a language of choice, such as C, Ada, or Java. As part of the code-generation process one could activate various allocation and optimization processes, the most relevant of which (for embedded systems) is that of code distribution. By this we mean that the user can earmark each of the activities/modules to be allocated to a node in a distributed architecture. On providing information about the communication regime in the distributed net, the code generator could also generate the necessary protocols for support of the application. An important element of the Sacres tool suit was that the translation performed by the code generator is continuously validated by a special code-validation tool. After presenting the capabilities of the Sacres kernel, we will proceed to outline the extensions that will stretch the scope of applicability of such a methodology to cover the full range from requirements to full implementation. The extensions are at both ends of the spectrum. At the low end, we will describe extensions which will enable these tools to add software/hardware partition in support of system co-design, and the appropriate techniques for hardware compilation, that will make customized hardware design part of the seamless process. At the upper end, we will discuss several approaches that will help the designers of an embedded system to formulate their requirements in either a visual style extending the popular message-sequence-charts notation, or by simulated test-driving of a mock-up of the system under construction. We will outline methods for automatic transformation from formal requirements into executable specifications. This will complete the top link of the seamless vertically integrated development process for embedded systems"
2000,"Keynote Address: Abstraction, Composition, Symmetry, and a Little Deduction: The Remedies to State Explosion.","Abstract
In this talk, we will consider possible remedies to the State Explosion problem, enabling the verification of large designs. All of these require some user interaction and cannot be done in a fully automatic manner. We will explore the tradeoffs and connections between the different approaches, such as deduction and abstraction, searching for the most natural and convenient mode of user interaction, and speculate about useful additional measures of automation which can make the task of user supervision even simpler."
2000,Liveness and Acceleration in Parameterized Verification.,"Abstract
The paper considers the problem of uniform verification of parameterizedsystems by symbolic model checking, using formulas in fs1s (a syntactic variant of the 2nd order logic ws1s) for the symbolic representation of sets of states. The technical difficulty addressed in this work is that, in many cases, standard model-checking computations fail to converge.
Using the tool tlv [P], we formulated a general approach to the acceleration of the transition relations, allowing an unbounded number of different processes to change their local state (or interact with their neighbor) in a single step. We demonstrate that this acceleration process solves the difficulty and enables an efficient symbolic model-checking of many parameterized systems such as mutual-exclusion and token-passing protocols for any value of N, the parameter specifying the size of the system.
Most previous approaches to the uniform verification of parameterized systems, only considered safety properties of such systems. In this paper, we present an approach to the verification of iveness properties and demonstrate its application to prove accessibility properties of the considered protocols."
2000,Formal Verification of the Ricart-Agrawala Algorithm.,"Abstract
This paper presents the first formal verification of the Ricart- Agrawala algorithm [RA81] for distributed mutual exclusion of an arbitrary number of nodes. It uses the Temporal Methodology of [MP95a]. We establish both the safety property of mutual exclusion and the liveness property of accessibility. To establish these properties for an arbitrary number of nodes, parameterized proof rules are used as presented in [MP95a] (for safety) and [MP94] (for liveness). A new and efficient notation is introduced to facilitate the presentation of liveness proofs by verification diagrams.
The proofs were carried out using the Stanford Temporal Prover (STeP) [BBC+95], a software package that supports formal verification of temporal specifications of concurrent and reactive systems."
2000,A Comparison of Two Verification Methods for Speculative Instruction Execution.,"Abstract
In this paper we describe and compare two methodologies for verifying the correctness of a speculative out-of-order execution system with interrupts. Both methods are deductive (we use PVS) and are based on refinement. The first proof is by direct refinement to a sequential system; the second proof combines refinement with induction over the number of retirement buffer slots."
1999,Proving Refinement Using Transduction.,"Summary.
When designing distributed systems, one is faced with the problem of verifying a refinement between two specifications, given at different levels of abstraction. Suggested verification techniques in the literature include refinement mappings and various forms of simulation. We present a verification method, in which refinement between two systems is proven by constructing a transducer that inputs a computation of a concrete system and outputs a matching computation of the abstract system. The transducer uses a FIFO queue that holds segments of the concrete computation that have not been matched yet. This allows a finite delay between the occurrence of a concrete event and the determination of the corresponding abstract event. This delay often makes the use of prophecy variables or backward simulation unnecessary. An important generalization of the method is to prove refinement modulo some transformation on the observed sequences of events. The method is adapted by replacing the FIFO queue by a component that allows the appropriate transformation on sequences of events. A particular case is partial-order refinement, i.e., refinement that preserves only a subset of the orderings between events of a system. Examples are sequential consistency and serializability. The case of sequential consistency is illustrated on a proof of sequential consistency of a cache protocol."
1999,Decidable Integration Graphs.,"Integration graphsare a computational model developed in the attempt to identify simple hybrid systems with decidable analysis problems. We start with the class ofconstant slope hybrid systems(CSHS), in which the right-hand side of all differential equations is an integer constant. We refer to continuous variables whose right-hand side constants are always 1 astimers. All other continuous variables are calledintegrators. The first result shown in the paper is that simple questions such as reachability of a given state are undecidable for even this simple class of systems. To restrict the model even further, we impose the requirement that no test that refers to integrators may appear within a loop in the graph. This restricted class of CSHS is calledintegration graphs. The main results of the paper are that the reachability problem of integration graphs is decidable for two special cases: the case of a single timer and the case of a single test involving integrators. The expressive power of the integration-graphs formalism is demonstrated by showing that some typical problems studied within the context of the calculus of durations and timed statecharts can be formulated as reachability problems for restricted integration graphs, and a high fraction of these fall into the subclasses of a single timer or a single test involving integrators.
"
1999,Translation Validation: From SIGNAL to C.,"Abstract
Translation validation is an alternative to the verification of translators (compilers, code generators). Rather than proving in advance that the compiler always produces a target code which correctly implements the source code (compiler verification), each individual translation (i.e. a run of the compiler) is followed by a validation phase which verifies that the target code produced on this run correctly implements the submitted source program. In order to be a practical alternative to compiler verification, a key feature of this validation is its full automation.
Since the validation process attempts to ‚Äúxunravel‚Äù the transformation effected by the translators, its task becomes increasingly more difficult (and necessary) with the increase of sophistication and variety of the optimizations methods employed by the translator. In this paper we address the practicability of translation validation for highly optimizing, industrial code generators from Signal, a widely used synchronous language, to C. We introduce new abstraction techniques as part of the automation of our approach."
1999,Deciding Equality Formulas by Small Domains Instantiations.,"Abstract
We introduce an efficient decision procedure for the theory of equality based on finite instantiations. When using the finite instantiations method, it is a common practice to take a range of [1..n] (where n is the number of input non-Boolean variables) as the range for all non-Boolean variables, resulting in a state-space of n n . Although various attempts to minimize this range were made, typically they either required various restrictions on the investigated formulas or were not very effective. In many cases, the n n state-space cannot be handled by BDD-based tools within a reasonable amount of time. In this paper we show that significantly smaller domains can be algorithmically found, by analyzing the structure of the formula. We also show an upper bound for the state-space based on this analysis. This method enabled us to verify formulas containing hundreds of integer and floating point variables."
1999,Verifying Liveness by Augmented Abstraction.,"Abstract
The paper deals with the proof method of verification by augmented finitary abstraction (VAA), which presents an effective approach to the verification of the temporal properties of (potentially infinitestate) reactive systems. The method consists of a two-step process by which, in a first step, the system and its temporal specification are combined an then abstracted into a finite-state B√ºchi automaton. The second step uses model checking to establish emptiness of the abstracted automaton.
The (VAA) method can be considered as a viable alternative to verification by temporal deduction which, up to now, has been the main method shown to be complete for the verification of infinite-state systems.
The paper presents a general recipe for the abstraction of B√ºchi automata which is shown to be sound, where soundness means that emptiness of the abstract automaton implies emptiness of the concrete (infinitestate) automaton. To make the method applicable for the verification of liveness properties, pure abstraction is sometimes no longer adequate.We show that by augmenting the system by an appropriate (and standardly constructible) progress monitor, we obtain an augmented system, whose computations are essentially the same as the original system, and which may now be abstracted while preserving the desired liveness properties. We then proceed to show that the (VAA) method is sound and complete for proving all properties expressible by temporal logic (including both safety and liveness). Completeness establishes that whenever an infinite-state B√ºchi automaton has no computations, there exists a finitary abstraction which abstracts the automaton, augmented by an appropriate progress monitor, into a finite-state B√ºchi automaton with no computations"
1999,A Perfect Verification: Combining Model Checking with Deductive Analysis to Verify Real-Life Software.,"Abstract
The paper presents an approach to the formal verification of a complete software system intended to support the flagship product of Perfecto Technologies which enforces application security over an open communication net.
Based on initial experimentation, it was decided that the verification method will be based on a combination of model-checking using spin with deductive verification which handles the more data-intensive elements of the design. The analysis was that only such a combination can cover by formal verification all the important aspects of the complete system.
In order to enable model checking of large portions of the design, we have developed an assume-guarantee approach which supports compositional verification. We describe how this general approach was implemented in the spin framework.
Then, we explain the need to split the verification activity into the modelchecking part which deals with the control issues such as concurrency or deadlocking and a deductive part which handles the data-intensive elements of the design."
1999,Orthogonal Polyhedra: Representation and Computation.,"Abstract
In this paper we investigate orthogonal polyhedra, i.e. polyhedra which are finite unions of full-dimensional hyper-rectangles. We define representation schemes for these polyhedra based on their vertices, and show that these compact representation schemes are canonical for all (convex and non-convex) polyhedra in any dimension. We then develop efficient algorithms for membership, face-detection and Boolean operations for these representations."
1999,A Framework for Scheduler Synthesis.,"Abstract:
We present a framework integrating specification and scheduler generation for real time systems. In a first step, the system, which can include arbitrarily designed tasks (cyclic or sporadic, with or without precedence constraints, any number of resources and CPUs) is specified as a timed Petri net. In a second step, our tool generates the most general non preemptive online scheduler for the specification, using a controller synthesis technique."
1999,Verifying Tomasulo's Algoithm by Refinement.,"Abstract:
In this paper Tomasulo's algorithm for out-of-order execution is shown to be a refinement of the sequential instruction execution algorithm. Correctness of Tomasulo's algorithm is established by proving that the register files of Tomasulo's algorithm and the sequential algorithm agree once all instructions have been completed."
