2003,Model Checking for Dependable Software-Intensive Systems.,"Model checking is indispensable in the development of modern digital circuitry and is emerging as a valuable instrument for software verification. Model checking has uncovered errors in a variety of software-intensive systems, including spacecraft redundancy management, aircraft collision avoidance, and weapons control systems. The approach offers the potential to help ensure behavioral properties and eliminate catastrophic errors in software systems that require high levels of dependability. "
2003,Specifying and Verifying Systems with Multiple Clocks.,"Abstract:
Multiple clock domains are a challenge for hardware specification and verification. We present a method for specifying the relations between multiple clocks, and for modeling the possible behaviors. We can then verify a hardware design assuming that the clocks meet these constraints. We implement our ideas in the context of SAT based bounded model checking (BMC), using ANSI-C programs to specify the functional behavior of the design."
2003,SAT-Based Algorithms for Logic Minimization.,"Abstract:
We introduce a new method for two-level logic minimization. Unlike previous approaches, the new method uses a SAT solver as an underlying engine. While the overall minimization strategy of the new method is based on the operators as defined in ESPRESSO-II, our SAT-based implementation is significantly different. The new minimizer SAT-ESPRESSO was found to perform 5-20 times faster than ESPRESSO-II and 3-5 times faster than BOOM on a set of large examples."
2003,Modular Verification of Software Components in C.,"Abstract:
We present a new methodology for automatic verification of C programs against finite state machine specifications. Our approach is compositional, naturally enabling us to decompose the verification of large software systems into subproblems of manageable complexity. The decomposition reflects the modularity in the software design. We use weak simulation as the notion of conformance between the program and its specification. Following the abstract-verify-refine paradigm, our tool MAGIC first extracts a finite model from C source code using predicate abstraction and theorem proving. Subsequently, simulation is checked via a reduction to Boolean satisfiability. MAGIC is able to interface with several publicly available theorem provers and SAT solvers. We report experimental results with procedures from the Linux kernel and the OpenSSL toolkit."
2003,High Level Verification of Control Intensive Systems Using Predicate Abstraction.,"Abstract:
Predicate abstraction has been widely used for model checking hardware/software systems. However, for control intensive systems, existing predicate abstraction techniques can potentially result in a blowup of the size of the abstract model. We deal with this problem by retaining important control variables in the abstract model. By this method we avoid having to introduce an unreasonable number of predicates to simulate the behavior of the control variables. We also show how to improve predicate abstraction by extracting useful information from a high level representation of hardware/software systems. This technique works by first extracting relevant branch conditions. These branch conditions are used to invalidate spurious abstract counterexamples through a new counterexample-based lazy refinement algorithm. Experimental results are included to demonstrate the effectiveness of our methods."
2003,SAT Based Predicate Abstraction for Hardware Verification.,"Abstract
Predicate abstraction is an important technique for extracting compact finite state models from large or infinite state systems. Predicate abstraction uses decision procedures to compute a model which is amenable to model checking, and has been used successfully for software verification. Little work however has been done on applying predicate abstraction to large scale finite state systems, most notably, hardware, where the decision procedures are SAT solvers. We consider predicate abstraction for hardware in the framework of Counterexample-Guided Abstraction Refinement where in the course of verification, the abstract model has to be repeatedly refined. The goal of the refinement is to eliminate spurious behavior in the abstract model which is not present in the original model, and gives rise to false negatives (spurious counterexamples).
In this paper, we present two efficient SAT-based algorithms to refine abstract hardware models which deal with spurious transitions and spurious counterexamples respectively. Both algorithms make use of the conflict graphs generated by SAT solvers. The first algorithm extracts constraints from the conflict graphs which are used to make the abstract model more accurate. Once an abstract transition is determined to be spurious, our algorithm does not need to make any additional calls to SAT solver. Our second algorithm generates a compact predicate which eliminates a spurious counterexample. This algorithm uses the conflict graphs to identify the important concrete variables that render the counterexample spurious, creates an additional predicate over these concrete variables, and adds it to the abstract model. Experiments over hardware designs with several thousands of registers demonstrate the effectiveness of our methods."
2003,Verification of Hybrid Systems Based on Counterexample-Guided Abstraction Refinement.,"Abstract
Hybrid dynamic systems include both continuous and discrete state variables. Properties of hybrid systems, which have an infinite state space, can often be verified using ordinary model checking together with a finite-state abstraction. Model checking can be inconclusive, however, in which case the abstraction must be refined. This paper presents a new procedure to perform this refinement operation for abstractions of infinite-state systems, in particular of hybrid systems. Following an approach originally developed for finite-state systems [1],[2], the refinement procedure constructs a new abstraction that eliminates a counterexample generated by the model checker. For hybrid systems, analysis of the counterexample requires the computation of sets of reachable states in the continuous state space.We showhowsuch reachability computations with varying degrees of complexity can be used to refine hybrid system abstractions efficiently. A detailed example illustrates our counterexample-guided refinement procedure. Experimental results for a prototype implementation of the procedure indicate its advantages over existing methods."
2003,Counterexample-Guided Abstraction Refinement.,"Abstract:
The main practical problem in model checking is the combinatorial explosion of system states commonly known as the state explosion problem. Abstraction methods attempt to reduce the size of the state space by employing knowledge about the system and the specification in order to model only relevant features in the Kripke structure. Counterexample-guided abstraction refinement is an automatic abstraction method where, starting with a relatively small skeletal representation of the system to be verified, increasingly precise abstract representations of the system are computed. The key step is to extract information from false negatives (""spurious counterexamples"") due to over-approximation."
2002,Verification of Out-Of-Order Processor Designs Using Model Checking and a Light-Weight Completion Function.,"Abstract
We present a new technique for verification of complex hardware devices that allows both generality and a high degree of automation. The technique is based on our new way of constructing a “light-weight” completion function together with new encoding of uninterpreted functions called reference file representation.
Our technique combines our completion function method and reference file representation with compositional model checking and theorem proving. This extends the state of the art in two directions. First, we obtain a more general verification methodology. Second, it is easier to use, since it has a higher degree of automation.
As a benchmark, we take Tomasulo's algorithm for scheduling out-of-order instruction execution used in many modern superscalar processors like the Pentium-II and the PowerPC 604. The algorithm is parameterized by the processor configuration, and our approach allows us to prove its correctness in general, independent of any actual design."
2002,Program slicing for VHDL.,"Abstract.
Hardware description languages (HDLs) are used today to describe circuits at all levels. In large HDL programs, there is a need for source code reduction techniques to address a myriad of problems in design, simulation, testing, and formal verification. Program slicing is a static program analysis technique that allows an analyst to automatically extract portions of programs relevant to the aspects being analyzed. Slicing is fundamentally based on data and control dependences between program points. However, program slicing algorithms have traditionally been designed for sequential languages, and the presence of concurrent constructs such as those found in HDLs complicates slicing considerably. In this paper, we develop the concepts needed for slicing VHDL. The techniques extend readily to other HDLs such as Verilog. Our techniques are based on a slicing-oriented VHDL execution semantics that augments traditional dependences with inter-procedural dependences between VHDL processes. Based on these concepts, we have developed an automatic VHDL slicing tool composed of a traditional slicer and a front-end that captures VHDL simulation semantics. This paper discusses our techniques for VHDL slicing, the slicer tool, and slicing applications in design, simulation, testing, and formal verification of VHDL programs. A particularly important application of HDL slicing is source code reduction leading to reduced state spaces for model checking, and we also present empirical results for this."
2002,SAT Based Abstraction-Refinement Using ILP and Machine Learning Techniques.,"Abstract
We describe new techniques for model checking in the counterexample guided abstraction/refinement framework. The abstraction phase ‘hides’ the logic of various variables, hence considering them as inputs. This type of abstraction may lead to ‘spurious’ counterexamples, i.e. traces that can not be simulated on the original (concrete) machine. We check whether a counterexample is real or spurious with a SAT checker. We then use a combination of Integer Linear Programming (ILP) and machine learning techniques for refining the abstraction based on the counterexample. The process is repeated until either a real counterexample is found or the property is verified. We have implemented these techniques on top of the model checker NuSMV and the SAT solver Chaff. Experimental results prove the viability of these new techniques."
2002,NuSMV 2: An OpenSource Tool for Symbolic Model Checking.,"Abstract
This paper describes version 2 of the NuSMV tool. NuSMV is a symbolic model checker originated from the reengineering, reimplementation and extension of SMV, the original BDD-based model checker developed at CMU [15]. The NuSMV project aims at the development of a state-of-the-art symbolic model checker, designed to be applicable in technology transfer projects: it is a well structured, open, flexible and documented platform for model checking, and is robust and close to industrial systems standards [6]."
2002,Automated Abstraction Refinement for Model Checking Large State Spaces Using SAT Based Conflict Analysis.,"Abstract
We introduce a SAT based automatic abstraction refinement framework for model checking systems with several thousand state variables in the cone of influence of the specification. The abstract model is constructed by designating a large number of state variables as invisible. In contrast to previous work where invisible variables were treated as free inputs we describe a computationally more advantageous approach in which the abstract transition relation is approximated by pre-quantifying invisible variables during image computation. The abstract counterexamples obtained from model-checking the abstract model are symbolically simulated on the concrete system using a state-of-the-art SAT checker. If no concrete counterexample is found, a subset of the invisible variables is reintroduced into the system and the process is repeated. The main contribution of this paper are two new algorithms for identifying the relevant variables to be reintroduced. These algorithms monitor the SAT checking phase in order to analyze the impact of individual variables. Our method is complete for safety properties (AG p) in the sense that-performance permitting - a property is either verified or disproved by a concrete counterexample. Experimental results are given to demonstrate the power of our method on real-world designs."
2002,Tree-Like Counterexamples in Model Checking.,"Abstract:
Counter examples for specification violations provide engineers with important debugging information. Although counterexamples are considered one of the main advantages of model checking, state-of the art model checkers are restricted to relatively simple counterexamples, and surprisingly little research effort has been put into counterexamples. In this paper, we introduce a new general framework for counterexamples. The paper has three main contributions: (i) We determine the general form of ACTL counterexamples. To this end, we investigate the notion of counterexample and show that a large class of temporal logics beyond ACTL admits counterexamples with a simple tree-like transition relation. We show that the existence of tree-like counterexamples is related to a universal fragment of extended branching time logic based on w-regular temporal operators. (ii) We present new symbolic algorithms to generate tree-like counterexamples for ACTL specifications. (iii) Based on tree-like counterexamples we extend the abstraction refinement methodology developed recently by Clarke et al. (CAV'2000) to full ACTL. This demonstrates the conceptual simplicity and elegance of tree-like counterexamples."
2002,SAT-Based Counterexample Guided Abstraction Refinement.,"Abstract
We describe new techniques for model checking in the counterexample guided abstraction / refisnement framework. The abstraction phase ‘hides’ the logic of various variables, hence considering them as inputs. This type of abstraction may lead to ‘spurious’ counterexamples, i.e. traces that cannot be simulated on the original (concrete) machine. We check whether a counterexample is real or spurious with a SAT Checker. We then use a combination of Integer Linear Programming (ILP) and machine learning techniques for refining the abstraction based on the counterexample. The process is repeated until either a real counterexample is found or the property is verified.We have implemented these techniques on top of the model checker NuSMV and the SAT solver Chaff. Experimental results prove the viability of these new techniques."
2001,Bounded Model Checking Using Satisfiability Solving.,"Abstract
The phrase model checking refers to algorithms for exploring the state space of a transition system to determine if it obeys a specification of its intended behavior. These algorithms can perform exhaustive verification in a highly automatic manner, and, thus, have attracted much interest in industry. Model checking programs are now being commercially marketed. However, model checking has been held back by the state explosion problem, which is the problem that the number of states in a system grows exponentially in the number of system components. Much research has been devoted to ameliorating this problem.
In this tutorial, we first give a brief overview of the history of model checking to date, and then focus on recent techniques that combine model checking with satisfiability solving. These techniques, known as bounded model checking, do a very fast exploration of the state space, and for some types of problems seem to offer large performance improvements over previous approaches. We review experiments with bounded model checking on both public domain and industrial designs, and propose a methodology for applying the technique in industry for invariance checking. We then summarize the pros and cons of this new technology and discuss future research efforts to extend its capabilities."
2001,The Verus language: representing time efficiently with BDDs.,"Abstract
There have been significant advances on formal methods to verify complex systems recently. Nevertheless, these methods have not yet been accepted as a realistic alternative to the verification of industrial systems. One reason for this is that formal methods are still difficult to apply efficiently. Another reason is that current verification algorithms are still not efficient enough to handle many complex systems. This work addresses the problem by presenting a language designed especially to simplify writing time-critical programs. It is an imperative language with a syntax similar to C. Special constructs are provided to allow the straightforward expression of timing properties. The familiar syntax makes it easier for non-experts to use the tool. The special constructs make it possible to model the timing characteristics of the system naturally and accurately. A symbolic representation using BDDs, model checking and quantitative algorithms are used to check system timing properties. The efficiency of the representation allows complex realistic systems to be verified."
2001,Using Combinatorial Optimization Methods for Quantification Scheduling.,"Abstract
Model checking is the process of verifying whether a model of a concurrent system satisfies a specified temporal property. Symbolic algorithms based on Binary Decision Diagrams (BDDs) have significantly increased the size of the models that can be verified. The main problem in symbolic model checking is the image computation problem, i.e., efficiently computing the successors or predecessors of a set of states. This paper is an in-depth study of the image computation problem. We analyze and evaluate several new heuristics, metrics, and algorithms for this problem. The algorithms use combinatorial optimization techniques such as hill climbing, simulated annealing, and ordering by recursive partitioning to obtain better results than was previously the case. Theoretical analysis and systematic experimentation are used to evaluate the algorithms."
2001,Progress on the State Explosion Problem in Model Checking.,"Abstract
Model checking is an automatic verification technique for finite state concurrent systems. In this approach to verification, temporal logic specifications are checked by an exhaustive search of the state space of the concurrent system. Since the size of the state space grows exponentially with the number of processes, model checking techniques based on explicit state enumeration can only handle relatively small examples. This phenomenon is commonly called the “State Explosion Problem”. Over the past ten years considerable progress has been made on this problem by (1) representing the state space symbolically using BDDs and by (2) using abstraction to reduce the size of the state space that must be searched. As a result model checking has been used successfully to find extremely subtle errors in hardware controllers and communication protocols. In spite of these successes, however, additional research is needed to handle large designs of industrial complexity. This aim of this paper is to give a succinct survey of symbolic model checking and to introduce the reader to recent advances in abstraction."
2001,Using cutwidth to improve symbolic simulation and Boolean satisfiability.,"Abstract:
In this paper, we propose cutwidth based heuristics to improve the efficiency of symbolic simulation and SAT algorithms. These algorithms are the underlying engines of many formal verification techniques. We present a new approach for computing variable orderings that reduce CNF/circuit cutwidth. We show that the circuit cutwidth and the peak number of live BDDs during symbolic simulation are equal. Thus using an ordering that reduces the cutwidth in scheduling the gates during symbolic simulation can significantly improve both the runtime and memory requirements. It has been shown that the time complexity of SAT problems can be bounded exponentially by the formula cutwidth and many practical circuits has cutwidth logarithmic of the size of the formulas. We have developed cutwidth based heuristics which in practice can speed up existing SAT algorithms, especially for SAT instances with small cutwidth. We demonstrate the power of our approach on a number of standard benchmarks."
2001,Non-linear Quantification Scheduling in Image Computation.,"Abstract:
Computing the set of states reachable in one step from a given set of states, i.e. image computation, is a crucial step in several symbolic verification algorithms, including model checking and reachability analysis. So far, the best methods for quantification scheduling in image computation, with a conjunctively partitioned transition relation, have been restricted to a linear schedule. This results in a loss of flexibility during image computation. We view image computation as a problem of constructing an optimal parse tree for the image set. The optimality of a parse tree is defined by the largest BDD that is encountered during the computation of the tree. We present dynamic and static versions of a new algorithm, VarScore, which exploits the flexibility offered by the parse tree approach to the image computation. We show by extensive experimentation that our techniques outperform the best known techniques so far."
2001,Efficient Filtering in Publish-Subscribe Systems Using Binary Decision.,"Abstract:
Implicit invocation or publish-subscribe has become an important architectural style for large-scale system design and evolution. The publish-subscribe style facilitates developing large-scale systems by composing separately developed components because the style permits loose coupling between various components. One of the major bottlenecks in using publish-subscribe systems for very large scale systems is the efficiency of filtering incoming messages, i.e., matching of published events with event subscriptions. This is a very challenging problem because in a realistic publish subscribe system the number of subscriptions can be large. We present an approach for matching published events with subscriptions which scales to a large number of subscriptions. Our approach uses binary decision diagrams, a compact data structure for representing Boolean functions which has been successfully used in verification techniques such as model checking. Experimental results clearly demonstrate the efficiency of our approach."
2000,Selective Quantitative Analysis and Interval Model Checking: Verifying Different Facets of a System.,"Abstract
In this work we propose a verification methodology consisting of selective quantitative timing analysis and interval model checking. Our methods can aid not only in determining if a system works correctly, but also in understanding how well the system works. The selective quantitative algorithms compute minimum and maximum delays over a selected subset of system executions. A linear-time temporal logic (LTL) formula is used to select either infinite paths or finite intervals over which the computation is performed. We show how tableau for LTL formulas can be used for selecting either paths or intervals and also for model checking formulas interpreted over paths or intervals.
To demonstrate the usefulness of our methods we have verified a complex and realistic distributed real-time system. Our tool has been able to analyze the system and to compute the response time of the various components. Moreover, we have been able to identify inefficiencies that caused the response time to increase significantly (about 50%). After changing the design we not only verified that the response time was lower, but were also able to determine the causes for the poor performance of the original model using interval model checking."
2000,Verification of a safety-critical railway interlocking system with real-time constraints.,"Abstract
Ensuring the correctness of computer systems used in life-critical applications is very difficult. The most commonly used verification methods, simulation and testing, are not exhaustive and can miss errors. This work describes an alternative verification technique based on symbolic model checking that can automatically and exhaustively search the state space of the system and verify if properties are satisfied or not. The method also provides useful quantitative timing information about the behavior of the system. We have applied this technique using the Verus tool to a complex safety-critical system designed to control medium and large-size railway stations. We have identified some anomalous behaviors in the model with serious potential consequences in the actual implementation. The fact that errors can be identified before a safety-critical system is deployed in the field not only eliminates sources of very serious problems, but also makes it significantly less expensive to debug the system."
