2010,Bayesian statistical model checking with application to Simulink/Stateflow verification.,"We address the problem of model checking stochastic systems, i.e.~checking whether a stochastic system satisfies a certain temporal property with a probability greater (or smaller) than a fixed threshold. In particular, we present a novel Statistical Model Checking (SMC) approach based on Bayesian statistics. We show that our approach is feasible for hybrid systems with stochastic transitions, a generalization of Simulink/Stateflow models. Standard approaches to stochastic (discrete) systems require numerical solutions for large optimization problems and quickly become infeasible with larger state spaces. Generalizations of these techniques to hybrid systems with stochastic effects are even more challenging. The SMC approach was pioneered by Younes and Simmons in the discrete and non-Bayesian case. It solves the verification problem by combining randomized sampling of system traces (which is very efficient for Simulink/Stateflow) with hypothesis testing or estimation. We believe SMC is essential for scaling up to large Stateflow/Simulink models. While the answer to the verification problem is not guaranteed to be correct, we prove that Bayesian SMC can make the probability of giving a wrong answer arbitrarily small. The advantage is that answers can usually be obtained much faster than with standard, exhaustive model checking techniques. We apply our Bayesian SMC approach to a representative example of stochastic discrete-time hybrid system models in Stateflow/Simulink: a fuel control system featuring hybrid behavior and fault tolerance. We show that our technique enables faster verification than state-of-the-art statistical techniques, while retaining the same error bounds. We emphasize that Bayesian SMC is by no means restricted to Stateflow/Simulink models: we have in fact successfully applied it to very large stochastic models from Systems Biology."
2010,Comparing Learning Algorithms in Automated Assume-Guarantee Reasoning.,"Abstract
We compare two learning algorithms for generating contextual assumptions in automated assume-guarantee reasoning. The CDNF algorithm implicitly represents contextual assumptions by a conjunction of DNF formulae, while the OBDD learning algorithm uses ordered binary decision diagrams as its representation. Using these learning algorithms, the performance of assume-guarantee reasoning is compared with monolithic interpolation-based Model Checking in parametrized hardware test cases."
2010,"A Non-prenex, Non-clausal QBF Solver with Game-State Learning.","Abstract
We describe a DPLL-based solver for the problem of quantified boolean formulas (QBF) in non-prenex, non-CNF form. We make two contributions. First, we reformulate clause/cube learning, extending it to non-prenex instances. We call the resulting technique game-state learning. Second, we introduce a propagation technique using ghost literals that exploits the structure of a non-CNF instance in a manner that is symmetric between the universal and existential variables. Experimental results on the QBFLIB benchmarks indicate our approach outperforms other state-of-the-art solvers on certain benchmark families, including the tipfixpoint and tipdiam families of model checking problems."
2010,Statistical Verification of Probabilistic Properties with Unbounded Until.,"Abstract
We consider statistical (sampling-based) solution methods for verifying probabilistic properties with unbounded until. Statistical solution methods for probabilistic verification use sample execution trajectories for a system to verify properties with some level of confidence. The main challenge with properties that are expressed using unbounded until is to ensure termination in the face of potentially infinite sample execution trajectories. We describe two alternative solution methods, each one with its own merits. The first method relies on reachability analysis, and is suitable primarily for large Markov chains where reachability analysis can be performed efficiently using symbolic data structures, but for which numerical probability computations are expensive. The second method employs a termination probability and weighted sampling. This method does not rely on any specific structure of the model, but error control is more challenging. We show how the choice of termination probability—when applied to Markov chains—is tied to the subdominant eigenvalue of the transition probability matrix, which relates it to iterative numerical solution techniques for the same problem."
2009,Functional Equivalence Verification Tools in High-Level Synthesis Flows.,"Abstract:
High-level synthesis facilitates the use of formal verification methodologies that check the equivalence of the generated RTL model against the original source specification. The article provides an overview of sequential equivalence checking techniques, its challenges, and successes in real-world designs."
2009,Efficient Craig interpolation for linear Diophantine (dis)equations and linear modular equations.,"The use of Craig interpolants has enabled the development of powerful hardware and software model checking techniques. Efficient algorithms are known for computing interpolants in rational and real linear arithmetic. We focus on subsets of integer linear arithmetic. Our main results are polynomial time algorithms for obtaining interpolants for conjunctions of linear Diophantine equations, linear modular equations (linear congruences), and linear Diophantine disequations. We also present an interpolation result for conjunctions of mixed integer linear equations. We show the utility of the proposed interpolation algorithms for discovering modular/divisibility predicates in a counterexample guided abstraction refinement (CEGAR) framework. This has enabled verification of simple programs that cannot be checked using existing CEGAR based model checkers.
"
2009,Computing differential invariants of hybrid systems as fixedpoints.,"We introduce a fixedpoint algorithm for verifying safety properties of hybrid systems with differential equations whose right-hand sides are polynomials in the state variables. In order to verify nontrivial systems without solving their differential equations and without numerical errors, we use a continuous generalization of induction, for which our algorithm computes the required differential invariants. As a means for combining local differential invariants into global system invariants in a sound way, our fixedpoint algorithm works with a compositional verification logic for hybrid systems. With this compositional approach we exploit locality in system designs. To improve the verification power, we further introduce a saturation procedure that refines the system dynamics successively with differential invariants until safety becomes provable. By complementing our symbolic verification algorithm with a robust version of numerical falsification, we obtain a fast and sound verification procedure. We verify roundabout maneuvers in air traffic management and collision avoidance in train control and car control.
"
2009,A Bayesian Approach to Model Checking Biological Systems.,"Recently, there has been considerable interest in the use of Model Checking for Systems Biology. Unfortunately, the state space of stochastic biological models is often too large for classical Model Checking techniques. For these models, a statistical approach to Model Checking has been shown to be an effective alternative. Extending our earlier work, we present the first algorithm for performing statistical Model Checking using Bayesian Sequential Hypothesis Testing. We show that our Bayesian approach outperforms current statistical Model Checking techniques, which rely on tests from Classical (aka Frequentist) statistics, by requiring fewer system simulations. Another advantage of our approach is the ability to incorporate prior Biological knowledge about the model being verified. We demonstrate our algorithm on a variety of models from the Systems Biology literature and show that it enables faster verification than state-of-the-art techniques, even when no prior knowledge is available.
"
2009,"Efficient SAT solving for non-clausal formulas using DPLL, graphs, and watched cuts.","Boolean satisfiability (SAT) solvers are used heavily in hardware and software verification tools for checking satisfiability of Boolean formulas. Most state-of-the-art SAT solvers are based on the Davis-Putnam-Logemann-Loveland (DPLL) algorithm and require the input formula to be in conjunctive normal form (CNF). We present a new SAT solver that operates on the negation normal form (NNF) of the given Boolean formulas/circuits. The NNF of a formula is usually more succinct than the CNF of the formula in terms of the number of variables. Our algorithm applies the DPLL algorithm to the graph-based representations of NNF formulas. We adapt the idea of the two-watched-literal scheme from CNF SAT solvers in order to efficiently carry out Boolean Constraint Propagation (BCP), a key task in the DPLL algorithm. We evaluate the new solver on a large collection of Boolean circuit benchmarks obtained from formal verification problems. The new solver outperforms the top solvers of the SAT 2007 competition and SAT-Race 2008 in terms of run time on a large majority of the benchmarks."
2009,Formal Verification of Curved Flight Collision Avoidance Maneuvers: A Case Study.,"Abstract
Aircraft collision avoidance maneuvers are important and complex applications. Curved flight exhibits nontrivial continuous behavior. In combination with the control choices during air traffic maneuvers, this yields hybrid systems with challenging interactions of discrete and continuous dynamics. As a case study illustrating the use of a new proof assistant for a logic for nonlinear hybrid systems, we analyze collision freedom of roundabout maneuvers in air traffic control, where appropriate curved flight, good timing, and compatible maneuvering are crucial for guaranteeing safe spatial separation of aircraft throughout their flight. We show that formal verification of hybrid systems can scale to curved flight maneuvers required in aircraft control applications. We introduce a fully flyable variant of the roundabout collision avoidance maneuver and verify safety properties by compositional verification."
2009,My 27-year Quest to Overcome the State Explosion Problem.,"Abstract:
Model checking is an automatic verification technique for state-transition systems that are finite-state or that have finite-state abstractions. In the early 1980's in a series of joint papers with my graduate students E.A. Emerson and A.P. Sistla, we proposed that model checking could be used for verifying concurrent systems and gave algorithms for this purpose. At roughly the same time, Joseph Sifakis and his student J.P. Queille at the University of Grenoble independently developed a similar technique. Model checking has been used successfully to reason about computer hardware and communication protocols and is beginning to be used for verifying computer software. Specifications are written in temporal logic, which is particularly valuable for expressing concurrency properties. An intelligent, exhaustive search is used to determine if the specification is true or not. If the specification is not true, the model checker will produce a counterexample execution trace that shows why the specification does not hold. This feature is extremely useful for finding obscure errors in complex systems. The main disadvantage of model checking is the state-explosion problem, which can occur if the system under verification has many processes or complex data structures. Although the state-explosion problem is inevitable in worst case, over the past 27 years considerable progress has been made on the problem for certain classes of state-transition systems that occur often in practice. In this talk, I will describe what model checking is, how it works, and the main techniques that have been developed for combating the state explosion problem."
2009,Model Checking - My 27-year Quest to Overcome the State Explosion Problem.,"Model Checking is an automatic verification technique for state-transition systems that are finite-state or that have finite-state abstractions. In the early 1980's in a series of joint papers with my graduate students E.A. Emerson and A.P. Sistla, we proposed that Model Checking could be used for verifying concurrent systems and gave algorithms for this purpose. At roughly the same time, Joseph Sifakis and his student J.P. Queille at the University of Grenoble independently developed a similar technique. Model Checking has been used successfully to reason about computer hardware and communication protocols and is beginning to be used for verifying computer software. Specifications are written in temporal logic, which is particularly valuable for expressing concurrency properties. An intelligent, exhaustive search is used to determine if the specification is true or not. If the specification is not true, the Model Checker will produce a counterexample execution trace that shows why the specification does not hold. This feature is extremely useful for finding obscure errors in complex systems. The main disadvantage of Model Checking is the state-explosion problem, which can occur if the system under verification has many processes or complex data structures. Although the state-explosion problem is inevitable in worst case, over the past 27 years considerable progress has been made on the problem for certain classes of state-transition systems that occur often in practice. In this talk, I will describe what Model Checking is, how it works, and the main techniques that have been developed for combating the state explosion problem"
2009,Learning Minimal Separating DFA's for Compositional Verification.,"Abstract
Algorithms for learning a minimal separating DFA of two disjoint regular languages have been proposed and adapted for different applications. One of the most important applications is learning minimal contextual assumptions in automated compositional verification. We propose in this paper an efficient learning algorithm, called
, that learns and generates a minimal separating DFA. Our algorithm has a quadratic query complexity in the product of sizes of the minimal DFA’s for the two input languages. In contrast, the most recent algorithm of Gupta et al. has an exponential query complexity in the sizes of the two DFA’s. Moreover, experimental results show that our learning algorithm significantly outperforms all existing algorithms on randomly-generated example problems. We describe how our algorithm can be adapted for automated compositional verification. The adapted version is evaluated on the LTSA benchmarks and compared with other automated compositional verification approaches. The result shows that our algorithm surpasses others in 30 of 49 benchmark problems."
2008,Verification of evolving software via component substitutability analysis.,"This paper presents an automated and compositional procedure to solve the substitutability problem in the context of evolving software systems. Our solution contributes two techniques for checking correctness of software upgrades: (1) a technique based on simultaneous use of over-and under-approximations obtained via existential and universal abstractions; (2) a dynamic assume-guarantee reasoning algorithmpreviously generated component assumptions are reused and altered on-the-fly to prove or disprove the global safety properties on the updated system. When upgrades are found to be non-substitutable, our solution generates constructive feedback to developers showing how to improve the components. The substitutability approach has been implemented and validated in the COMFORT reasoning framework, and we report encouraging results on an industrial benchmark.
"
2008,Word-Level Predicate-Abstraction and Refinement Techniques for Verifying RTL Verilog.,"Abstract:
As a first step, most model checkers used in the hardware industry convert a high-level register-transfer-level (RTL) design into a netlist. However, algorithms that operate at the netlist level are unable to exploit the structure of the higher abstraction levels and, thus, are less scalable. The RTL of a hardware description language such as Verilog is similar to a software program with special features for hardware design such as bit-vector arithmetic and concurrency. This paper uses predicate abstraction, a software verification technique, for verifying RTL Verilog. There are two challenges when applying predicate abstraction to circuits: 1) the computation of the abstract model in presence of a large number of predicates and 2) the discovery of suitable word-level predicates for abstraction refinement. We address the first problem using a technique called predicate clustering. We address the second problem by computing the weakest preconditions of Verilog statements in order to obtain new word-level predicates during abstraction refinement. We compare the performance of our technique with localization reduction, a netlist-level abstraction technique, and report improvements on a set of benchmarks."
2008,Computing Differential Invariants of Hybrid Systems as Fixedpoints.,"Abstract
We introduce a fixedpoint algorithm for verifying safety properties of hybrid systems with differential equations whose right-hand sides are polynomials in the state variables. In order to verify nontrivial systems without solving their differential equations and without numerical errors, we use a continuous generalization of induction, for which our algorithm computes the required differential invariants. As a means for combining local differential invariants into global system invariants in a sound way, our fixedpoint algorithm works with a compositional verification logic for hybrid systems. To improve the verification power, we further introduce a saturation procedure that refines the system dynamics successively with differential invariants until safety becomes provable. By complementing our symbolic verification algorithm with a robust version of numerical falsification, we obtain a fast and sound verification procedure. We verify roundabout maneuvers in air traffic management and collision avoidance in train control."
2008,Efficient Craig Interpolation for Linear Diophantine (Dis)Equations and Linear Modular Equations.,"Abstract
The use of Craig interpolants has enabled the development of powerful hardware and software model checking techniques. Efficient algorithms are known for computing interpolants in rational and real linear arithmetic. We focus on subsets of integer linear arithmetic. Our main results are polynomial time algorithms for obtaining interpolants for conjunctions of linear diophantine equations, linear modular equations (linear congruences), and linear diophantine disequations. We show the utility of the proposed interpolation algorithms for discovering modular/divisibility predicates in a counterexample guided abstraction refinement (CEGAR) framework. This has enabled verification of simple programs that cannot be checked using existing CEGAR based model checkers."
2008,Statistical Model Checking in BioLab: Applications to the Automated Analysis of T-Cell Receptor Signaling Pathway.,"Abstract
We present an algorithm, called BioLab, for verifying temporal properties of rule-based models of cellular signalling networks.
BioLab models are encoded in the BioNetGen language, and properties are expressed as formulae in probabilistic bounded linear temporal logic. Temporal logic is a formalism for representing and reasoning about propositions qualified in terms of time. Properties are then verified using sequential hypothesis testing on executions generated using stochastic simulation. BioLab is optimal, in the sense that it generates the minimum number of executions necessary to verify the given property. BioLab also provides guarantees on the probability of it generating Type-I (i.e., false-positive) and Type-II (i.e., false-negative) errors. Moreover, these error bounds are pre-specified by the user. We demonstrate BioLab by verifying stochastic effects and bistability in the dynamics of the T-cell receptor signaling network."
2008,Statistical Model Checking of Mixed-Analog Circuits with an Application to a Third Order Delta-Sigma Modulator.,"Abstract
In this paper, we consider verifying properties of mixed-signal circuits, i.e., circuits for which there is an interaction between analog (continuous) and digital (discrete) quantities. We follow the statistical Model Checking approach of [You05, You06] that consists of evaluating the property on a representative subset of behaviors, generated by simulation, and answering the question of whether the circuit satisfies the property with a probability greater than or equal to some value. The answer is correct up to a certain probability of error, which is pre-specified. The method automatically determines the minimal number of simulations needed to achieve the desired accuracy, thus providing a convenient way to control the trade-off between precision and computational cost. We propose a logic adapted to the specification of properties of mixed-signal circuits, in the temporal domain as well as in the frequency domain. Our logic is unique in that it allows us to compare the Fourier transform of two signals. We demonstrate the applicability of the method on a model of a third order Δ − Σ modulator for which previous formal verification attempts were too conservative and required excessive computation time."
2008,Verification of Supervisory Control Software Using State Proximity and Merging.,"Abstract
This paper describes an approach for bounded-time verification of safety properties of supervisory control software interacting with a continuous-time plant. A combination of software Model Checking and numerical simulation is used to compute a conservative approximation of the reachable states. The technique verifies system properties in the presence of nondeterministic behavior in the software due to, for instance, interleaving of tasks. A notion of program equivalence is used to characterize the behaviors of the controller, and the bisimulation functions of Girard and Pappas are employed to characterize the behaviors of the plant. The approach can conservatively merge traces that reach states that are in proximity to each other. The technique has been implemented for the case of affine plant dynamics, which allows efficient operations on ellipsoidal sets based on convex optimization involving linear matrix inequalities (LMIs). We present an illustrative example for a model of the position controller of an unmanned aerial vehicle (UAV)."
2008,Model Checking - My 27-Year Quest to Overcome the State Explosion Problem.,"Abstract
Model Checking is an automatic verification technique for state-transition systems that are finite-state or that have finite-state abstractions. In the early 1980’s in a series of joint papers with my graduate students E.A. Emerson and A.P. Sistla, we proposed that Model Checking could be used for verifying concurrent systems and gave algorithms for this purpose. At roughly the same time, Joseph Sifakis and his student J.P. Queille at the University of Grenoble independently developed a similar technique. Model Checking has been used successfully to reason about computer hardware and communication protocols and is beginning to be used for verifying computer software. Specifications are written in temporal logic, which is particularly valuable for expressing concurrency properties. An intelligent, exhaustive search is used to determine if the specification is true or not. If the specification is not true, the Model Checker will produce a counterexample execution trace that shows why the specification does not hold. This feature is extremely useful for finding obscure errors in complex systems. The main disadvantage of Model Checking is the state-explosion problem, which can occur if the system under verification has many processes or complex data structures. Although the state-explosion problem is inevitable in worst case, over the past 27 years considerable progress has been made on the problem for certain classes of state-transition systems that occur often in practice. In this talk, I will describe what Model Checking is, how it works, and the main techniques that have been developed for combating the state explosion problem."
2008,The Birth of Model Checking.,"Abstract
“When the time is ripe for certain things, these things appear in different places in the manner of violets coming to light in early spring.” (Wolfgang Bolyai to his son Johann in urging him to claim the invention of non- Euclidean geometry without delay [Vit88])."
2008,Design and Synthesis of Synchronization Skeletons Using Branching Time Temporal Logic.,"Abstract
We Propose a method of constructing concurrent programs in which the synchronization skeleton of the program is automatically synthesized from a high-level (branching time) Temporal Logic specification. The synchronization skeleton is an abstraction of the actual program where detail irrelevant to synchronization is suppressed. For example, in the synchronization skeleton for a solution to the critical section problem each process’s critical section may be viewed as a single node since the internal structure of the critical section is unimportant. Most solutions to synchronization problems in the literature are in fact given as synchronization skeletons. Because synchronization skeletons are in general finite state, the propositional version of Temporal Logic can be used to specify their properties."
