2017,From non-preemptive to preemptive scheduling using synchronization synthesis.,"Abstract
We present a computer-aided programming approach to concurrency. The approach allows programmers to program assuming a friendly, non-preemptive scheduler, and our synthesis procedure inserts synchronization to ensure that the final program works even with a preemptive scheduler. The correctness specification is implicit, inferred from the non-preemptive behavior. Let us consider sequences of calls that the program makes to an external interface. The specification requires that any such sequence produced under a preemptive scheduler should be included in the set of sequences produced under a non-preemptive scheduler. We guarantee that our synthesis does not introduce deadlocks and that the synchronization inserted is optimal w.r.t. a given objective function. The solution is based on a finitary abstraction, an algorithm for bounded language inclusion modulo an independence relation, and generation of a set of global constraints over synchronization placements. Each model of the global constraints set corresponds to a correctness-ensuring synchronization placement. The placement that is optimal w.r.t. the given objective function is chosen as the synchronization solution. We apply the approach to device-driver programming, where the driver threads call the software interface of the device and the API provided by the operating system. Our experiments demonstrate that our synthesis method is precise and efficient. The implicit specification helped us find one concurrency bug previously missed when model-checking using an explicit, user-provided specification. We implemented objective functions for coarse-grained and fine-grained locking and observed that different synchronization placements are produced for our experiments, favoring a minimal number of synchronization operations or maximum concurrency, respectively."
2016,Solving QBF with counterexample guided refinement.,"Abstract
This article puts forward the application of Counterexample Guided Abstraction Refinement (CEGAR) in solving the well-known PSPACE-complete problem of quantified Boolean formulas (QBF). The article studies the application of CEGAR in two scenarios. In the first scenario, CEGAR is used to expand quantifiers of the formula and subsequently a satisfiability (SAT) solver is applied. First it is shown how to do that for two levels of quantification and then it is generalized for arbitrary number of levels by recursion. It is also shown that these ideas can be generalized to non-prenex and non-CNF QBF solvers. In the second scenario, CEGAR is employed as an additional learning technique in an existing DPLL-based QBF solver. Experimental evaluation of the implemented prototypes shows that the CEGAR-driven solver outperforms existing solvers on a number of benchmark families and that the DPLL solver benefits from the additional type of learning."
2016,"CyberCardia project: Modeling, verification and validation of implantable cardiac devices.","Abstract:
In this paper, we survey recent progress in CyberCardia project, a CPS Frontier project funded by the National Science Foundation. The CyberCardia project will lead to significant advances in the state of the art for system verification and cardiac therapies based on the use of formal methods and closed-loop control and verification. The animating vision for the work is to enable the development of a true in silico design methodology for medical devices that can be used to speed the development of new devices and to provide greater assurance that their behavior matches designer intentions, and to pass regulatory muster more quickly so that they can be used on patients needing their care. The acceleration in medical-device innovation achievable as a result of the CyberCardia research will also have long-term and sustained societal benefits, as better diagnostic and therapeutic technologies enter into the practice of medicine more quickly."
2016,Bifurcation Analysis of Cardiac Alternans Using \delta -Decidability.,"Abstract
We present a bifurcation analysis of electrical alternans in the two-current Mitchell-Schaeffer (MS) cardiac-cell model using the theory of
δ
δ
-decidability over the reals. Electrical alternans is a phenomenon characterized by a variation in the successive Action Potential Durations (APDs) generated by a single cardiac cell or tissue. Alternans are known to initiate re-entrant waves and are an important physiological indicator of an impending life-threatening arrhythmia such as ventricular fibrillation. The bifurcation analysis we perform determines, for each control parameter
τ
τ
of the MS model, the bifurcation point in the range of
τ
τ
such that a small perturbation to this value results in a transition from alternans to non-alternans behavior. To the best of our knowledge, our analysis represents the first formal verification of non-trivial dynamics in a numerical cardiac-cell model.
Our approach to this problem rests on encoding alternans-like behavior in the MS model as a 11-mode, multinomial hybrid automaton (HA). For each model parameter, we then apply a sophisticated, guided-search-based reachability analysis to this HA to estimate parameter ranges for both alternans and non-alternans behavior. The bifurcation point separates these two ranges, but with an uncertainty region due to the underlying
δ
δ
-decision procedure. This uncertainty region, however, can be reduced by decreasing
δ
δ
at the expense of increasing the model exploration time. Experimental results are provided that highlight the effectiveness of this method."
2016,Formal Modeling and Analysis of Pancreatic Cancer Microenvironment.,"Abstract
The focus of pancreatic cancer research has been shifted from pancreatic cancer cells towards their microenvironment, involving pancreatic stellate cells that interact with cancer cells and influence tumor progression. To quantitatively understand the pancreatic cancer microenvironment, we construct a computational model for intracellular signaling networks of cancer cells and stellate cells as well as their intercellular communication. We extend the rule-based BioNetGen language to depict intra- and inter-cellular dynamics using discrete and continuous variables respectively. Our framework also enables a statistical model checking procedure for analyzing the system behavior in response to various perturbations. The results demonstrate the predictive power of our model by identifying important system properties that are consistent with existing experimental observations. We also obtain interesting insights into the development of novel therapeutic strategies for pancreatic cancer."
2016,High-level modeling and verification of cellular signaling.,"Abstract:
We use computational modeling and formal analysis techniques to study temporal behavior of a discrete logical model of the naïve T cell differentiation. The model is analyzed formally and automatically by performing temporal logic queries via statistical model checking. While the model can be verified and then further explored using Monte Carlo simulations, model checking allows for much more efficient analysis by testing a large set of system properties, with much smaller runtime than the one required by simulations. The results obtained using model checking provide details about relative timing of events in the system, which would otherwise be very cumbersome and time consuming to obtain through simulations only. We efficiently test a large number of properties, and confirm or reject hypotheses that were drawn from previous analysis of experimental and simulation data."
2016,Probabilistic reachability analysis of the tap withdrawal circuit in caenorhabditis elegans.,"Abstract:
We present a probabilistic reachability analysis of a (nonlinear ODE) model of a neural circuit in Caeorhabditis elegans (C. elegans), the common roundworm. In particular, we consider Tap Withdrawal (TW), a reflexive behavior exhibited by a C. elegans worm in response to vibrating the surface on which it is moving. The neural circuit underlying this response is the subject of this investigation. Specially, we perform bounded-time reachability analysis on the TW circuit model of Wicks et al. (1996) to estimate the probability of various TW responses. The Wicks et al. model has a number of parameters, and we demonstrate that the various TW responses and their probability of occurrence in a population of worms can be viewed as a problem of parameter uncertainty. Our approach to this problem rests on encoding each TW response as a hybrid automaton with parametric uncertainty. We then perform probabilistic reachability analysis on these automata using a technique that combines a δ-decision procedure with statistical tests. The results we obtain are a significant extension of those of Wicks et al. (1996), who equip their model with fixed parameter values that reproduce a single TW response. In contrast, our technique allow us to more thoroughly explore the models parameter space using statistical sampling theory, identifying in the process the distribution of TW responses. Wicks et al. conducted a number of ablation experiments on a population of worms in which one or more of the neurons in the TW circuit are surgically ablated (removed). We show that our technique can be used to correctly estimate TW response-probabilities for four of these ablation groups. We also use our technique to predict TW response behavior for two ablation groups not previously considered by Wicks et al."
2016,Formal modeling of biological systems.,"Abstract:
As biomedical research advances into more complicated systems, there is an increasing need to model and analyze these systems to better understand them. For decades, biologists have been using diagrammatic models to describe and understand the mechanisms and dynamics behind their experimental observations. Although these models are simple to be built and understood, they can only offer a rather static picture of the corresponding biological systems, and scalability is limited. Thus, there is an increasing need to develop formalism into more dynamic forms that can capture time-dependent processes, together with increases in the models scale and complexity. In this invited review paper, we argue that the formal modeling formalisms can be applied fruitfully to biological systems, and can be complementary to the traditional mathematical descriptive modeling approaches used in systems biology. We also discuss one example: a stochastic hybrid model of the effect of estrogen at different levels in species' population in a freshwater ecosystem."
2016,SMT-Based Analysis of Virtually Synchronous Distributed Hybrid Systems.,"This paper presents general techniques for verifying virtually synchronous distributed control systems with interconnected physical environments. Such cyber-physical systems (CPSs) are notoriously hard to verify, due to their combination of nontrivial continuous dynamics, network delays, imprecise local clocks, asynchronous communication, etc. To simplify their analysis, we first extend the PALS methodology---that allows to abstract from the timing of events, asynchronous communication, network delays, and imprecise clocks, as long as the infrastructure guarantees bounds on the network delays and clock skews---from real-time to hybrid systems. We prove a bisimulation equivalence between Hybrid PALS synchronous and asynchronous models. We then show how various verification problems for synchronous Hybrid PALS models can be reduced to SMT solving over nonlinear theories of the real numbers. We illustrate the Hybrid PALS modeling and verification methodology on a number of CPSs, including a control system for turning an airplane."
2015,From Non-preemptive to Preemptive Scheduling Using Synchronization Synthesis.,"Abstract
We present a computer-aided programming approach to concurrency. The approach allows programmers to program assuming a friendly, non-preemptive scheduler, and our synthesis procedure inserts synchronization to ensure that the final program works even with a preemptive scheduler. The correctness specification is implicit, inferred from the non-preemptive behavior. Let us consider sequences of calls that the program makes to an external interface. The specification requires that any such sequence produced under a preemptive scheduler should be included in the set of such sequences produced under a non-preemptive scheduler. The solution is based on a finitary abstraction, an algorithm for bounded language inclusion modulo an independence relation, and rules for inserting synchronization. We apply the approach to device-driver programming, where the driver threads call the software interface of the device and the API provided by the operating system. Our experiments demonstrate that our synthesis method is precise and efficient, and, since it does not require explicit specifications, is more practical than the conventional approach based on user-provided assertions."
2015,SReach: A Probabilistic Bounded Delta-Reachability Analyzer for Stochastic Hybrid Systems.,"Abstract
In this paper, we present a new tool SReach, which solves probabilistic bounded reachability problems for two classes of models of stochastic hybrid systems. The first one is (nonlinear) hybrid automata with parametric uncertainty. The second one is probabilistic hybrid automata with additional randomness for both transition probabilities and variable resets. Standard approaches to reachability problems for linear hybrid systems require numerical solutions for large optimization problems, and become infeasible for systems involving both nonlinear dynamics over the reals and stochasticity. SReach encodes stochastic information by using a set of introduced random variables, and combines
δ
δ
-complete decision procedures and statistical tests to solve
δ
δ
-reachability problems in a sound manner. Compared to standard simulation-based methods, it supports non-deterministic branching, increases the coverage of simulation, and avoids the zero-crossing problem. We demonstrate SReach’s applicability by discussing three representative biological models and additional benchmarks for nonlinear hybrid systems with multiple probabilistic system parameters."
2015,Formal Analysis Provides Parameters for Guiding Hyperoxidation in Bacteria using Phototoxic Proteins.,"In this work, we developed a methodology to analyze a bacteria model that mimics the stages through which bacteria change when phage therapy is applied. Due to the widespread misuse and overuse of antibiotics, drug resistant bacteria now pose significant risks to health, agriculture and the environment. Therefore, we were interested in an alternative to conventional antibiotics, a phage therapy. Our model was designed according to an experimental procedure to engineer a temperate phage, Lambda (λ), and then kill bacteria via light-activated production of superoxide. We applied formal analysis to our model and the results show that such an approach can speed up evaluation of the system, which would be impractical or possibly not even feasible to study in a wet lab."
2015,Towards personalized prostate cancer therapy using delta-reachability analysis.,"Recent clinical studies suggest that the efficacy of hormone therapy for prostate cancer depends on the characteristics of individual patients. In this paper, we develop a computational framework for identifying patient-specific androgen ablation therapy schedules for postponing the potential cancer relapse. We model the population dynamics of heterogeneous prostate cancer cells in response to androgen suppression as a nonlinear hybrid automaton. We estimate personalized kinetic parameters to characterize patients and employ δ-reachability analysis to predict patient-specific therapeutic strategies. The results show that our methods are promising and may lead to a prognostic tool for prostate cancer therapy."
2015,dReach: δ-Reachability Analysis for Hybrid Systems.,"Abstract
dReach is a bounded reachability analysis tool for nonlinear hybrid systems. It encodes reachability problems of hybrid systems to first-order formulas over real numbers, which are solved by delta-decision procedures in the SMT solver dReach. In this way, dReach is able to handle a wide range of highly nonlinear hybrid systems. It has scaled well on various realistic models from biomedical and robotics applications."
2014,Pathway-gene identification for pancreatic cancer survival via doubly regularized Cox regression.,"Background
Recent global genomic analyses identified 69 gene sets and 12 core signaling pathways genetically altered in pancreatic cancer, which is a highly malignant disease. A comprehensive understanding of the genetic signatures and signaling pathways that are directly correlated to pancreatic cancer survival will help cancer researchers to develop effective multi-gene targeted, personalized therapies for the pancreatic cancer patients at different stages. A previous work that applied a LASSO penalized regression method, which only considered individual genetic effects, identified 12 genes associated with pancreatic cancer survival.

Results
In this work, we integrate pathway information into pancreatic cancer survival analysis. We introduce and apply a doubly regularized Cox regression model to identify both genes and signaling pathways related to pancreatic cancer survival.

Conclusions
Four signaling pathways, including Ion transport, immune phagocytosis, TGF? (spermatogenesis), regulation of DNA-dependent transcription pathways, and 15 genes within the four pathways are identified and verified to be directly correlated to pancreatic cancer survival. Our findings can help cancer researchers design new strategies for the early detection and diagnosis of pancreatic cancer."
2014,Parameter Synthesis for Cardiac Cell Hybrid Models Using δ-Decisions.,"Abstract
A central problem in systems biology is to identify parameter values such that a biological model satisfies some behavioral constraints (e.g., time series). In this paper we focus on parameter synthesis for hybrid (continuous/discrete) models, as many biological systems can possess multiple operational modes with specific continuous dynamics in each mode. These biological systems are naturally modeled as hybrid automata, most often with nonlinear continuous dynamics. However, hybrid automata are notoriously hard to analyze — even simple reachability for hybrid systems with linear differential dynamics is an undecidable problem. In this paper we present a parameter synthesis framework based on δ-complete decision procedures that sidesteps undecidability. We demonstrate our method on two highly nonlinear hybrid models of the cardiac cell action potential. The results show that our parameter synthesis framework is convenient and efficient, and it enabled us to select a suitable model to study and identify crucial parameter ranges related to cardiac disorders."
2014,25 Years of Model Checking.,"Abstract
Model Checking is an automatic verification technique for large state transition systems. It was originally developed for reasoning about finite-state concurrent systems. The technique has been used successfully to debug complex computer hardware, communication protocols, and software. It is beginning to be used for analyzing cyber-physical, biological, and financial systems as well. The major challenge for the technique is a phenomenon called the State Explosion Problem. This issue is impossible to avoid in the worst case; but, by using sophisticated data structures and clever search algorithms, it is now possible to verify state transition systems with an astronomical number of states. In this paper, we will briefly review the development of Model Checking over the past 32 years, with an emphasis on model checking stochastic hybrid systems."
2014,"Compositional, Approximate, and Quantitative Reasoning for Medical Cyber-Physical Systems with Application to Patient-Specific Cardiac Dynamics and Devices.","Abstract
The design of bug-free and safe medical device software is challenging, especially in complex implantable devices that control and actuate organs who’s response is not fully understood. Safety recalls of pacemakers and implantable cardioverter defibrillators between 1990 and 2000 affected over 600,000 devices. Of these, 200,000 or 41%, were due to firmware issues that continue to increase in frequency. According to the FDA, software failures resulted in 24% of all medical device recalls in 2011. There is currently no formal methodology or open experimental platform to test and verify the correct operation of medical-device software within the closed-loop context of the patient.
The goal of this effort is to develop the foundations of modeling, synthesis and development of verified medical device software and systems from verified closed-loop models of the device and organ(s). Our research spans both implantable medical devices such as cardiac pacemakers and physiological control systems such as drug infusion pumps which have multiple networked medical systems. These devices are physically connected to the body and exert direct control over the physiology and safety of the patient. The focus of this effort is on (a) Extending current binary safety properties to quantitative verification; (b) Development of patient-specific models and therapies; (c) Multi-scale modeling of complex physiological phenomena and compositional reasoning across a range of model abstractions and refinements; and (d) Bridging the formal reasoning and automated generation of safe and effective software for future medical devices."
2014,Model Checking Hybrid Systems - (Invited Talk).,"Abstract
We present the framework of delta-complete analysis for bounded reachability problems of hybrid systems. We perform bounded reachability checking through solving delta-decision problems over the reals. The techniques take into account of robustness properties of the systems under numerical perturbations. Our implementation of the techniques scales well on several highly nonlinear hybrid system models that arise in biomedical applications."
2014,Proof Generation from Delta-Decisions.,"Abstract:
We show how to generate and validate logical proofs of unsatisfiability from delta-complete decision procedures that rely on error-prone numerical algorithms. Solving this problem is important for ensuring correctness of the decision procedures. At the same time, it is a new approach for automated theorem proving over real numbers. We design a first-order calculus, and transform the computational steps of constraint solving into logic proofs, which are then validated using proof-checking algorithms. As an application, we demonstrate how proofs generated from our solver can establish many nonlinear lemmas in the theormal proof of the Kepler Conjecture."
2013,Bayesian statistical model checking with application to Stateflow/Simulink verification.,"Abstract
We address the problem of model checking stochastic systems, i.e., checking whether a stochastic system satisfies a certain temporal property with a probability greater (or smaller) than a fixed threshold. In particular, we present a Statistical Model Checking (SMC) approach based on Bayesian statistics. We show that our approach is feasible for a certain class of hybrid systems with stochastic transitions, a generalization of Simulink/Stateflow models. Standard approaches to stochastic discrete systems require numerical solutions for large optimization problems and quickly become infeasible with larger state spaces. Generalizations of these techniques to hybrid systems with stochastic effects are even more challenging. The SMC approach was pioneered by Younes and Simmons in the discrete and non-Bayesian case. It solves the verification problem by combining randomized sampling of system traces (which is very efficient for Simulink/Stateflow) with hypothesis testing (i.e., testing against a probability threshold) or estimation (i.e., computing with high probability a value close to the true probability). We believe SMC is essential for scaling up to large Stateflow/Simulink models. While the answer to the verification problem is not guaranteed to be correct, we prove that Bayesian SMC can make the probability of giving a wrong answer arbitrarily small. The advantage is that answers can usually be obtained much faster than with standard, exhaustive model checking techniques. We apply our Bayesian SMC approach to a representative example of stochastic discrete-time hybrid system models in Stateflow/Simulink: a fuel control system featuring hybrid behavior and fault tolerance. We show that our technique enables faster verification than state-of-the-art statistical techniques. We emphasize that Bayesian SMC is by no means restricted to Stateflow/Simulink models. It is in principle applicable to a variety of stochastic models from other domains, e.g., systems biology."
2013,Studies of biological networks with statistical model checking: application to immune system cells.,"We use computational modeling and formal analysis techniques to study temporal behavior of a discrete logical model of the naïve T cell differentiation. The model is analyzed formally and automatically by performing temporal logic queries via statistical model checking. The results obtained using model checking provide details about relative timing of events in the system, which would otherwise be very cumbersome and time consuming to obtain through simulations only."
