1995,Verus: A Tool for Quantitative Analysis of Finite-State Real-Time Systems.,"Symbolic model checking is a technique for verifying finite-state concurrent systems. Models with up to 1030 states can often be verified in minutes. In this paper, we present a new tool to analyze real-time systems, based on this technique. We have designed a language, called Verus, for the description of real-time systems. Such a description is compiled into a state-transition graph and represented symbolically using binary decision diagrams. We have developed new algorithms for exploring the state space and computing quantitative information about the system. In addition to determining the exact bounds on the length of the time interval between two specified events, we compute the number of occurrences of an event in such an interval. This technique allows us to determine performance measures such as schedulability, response time, and system load. Our algorithms produce more detailed information than traditional methods. This information leads to a better understanding of the behavior of the system, in addition to verifying if its timing requirements are satisfied. We integrate these ideas into the Verus tool, currently under development. To demonstrate how our technique works, we have verified a robotics control system. The results obtained demonstrate that our method can be successfully applied in the analysis of real-time system designs."
1995,Automatic verification of industrial designs.,"Abstract:
This study presents new risk analysis tools and demonstrates the feasibility and applicability of these tools in the design verification of railway interlocking control systems and deadlock prevention in automated manufacturing systems. Our verification methodology consists of the following stages. First, we analyze the rules executed by the controller and extract a state machine model of the controller. Second, we compose safety, reliability, and operability system specifications using a propositional temporal logic. Finally, we use the model checker to check the state machine model of the system against its requirements. The verification approach allows an exhaustive search of all possible behaviors and scenarios. We verified two real railway interlocking control applications with 125 and 452 constraints respectively. Checking two opposing signal protection specifications involving 3 signals ranged between 74 and 1223 seconds depending on the size and the complexity of the interlocking. Traditional verification methods typically require several person weeks."
1995,Timing analysis of industrial real-time systems.,"Abstract:
We describe a formal method for modelling real-time systems and a procedure to compute the model's timing characteristics automatically. We present algorithms that compute exact bounds on the delay between two specified events. We also describe an algorithm to count the minimum and maximum number of times an event occurs between a given starting condition and an ending condition. These algorithms are based on symbolic model checking techniques which have been successfully used to find bugs in several industrial designs. Such techniques can be used to search exhaustively state spaces with up to 10/sup 30/ states. To illustrate the usefulness of our method, we describe the timing analysis for a patient monitoring system with more than 10/sup 13/ states. We also present the timing analysis and verification for an aircraft controller. The sizes of the examples we verify demonstrate that our tool can be applied to realistic industrial designs."
1994,Symbolic model checking for sequential circuit verification.,"Abstract:
The temporal logic model checking algorithm of Clarke, Emerson, and Sistla (1986) is modified to represent state graphs using binary decision diagrams (BDD's) and partitioned transition relations. Because this representation captures some of the regularity in the state space of circuits with data path logic, we are able to verify circuits with an extremely large number of states. We demonstrate this new technique on a synchronous pipelined design with approximately 5/spl times/10/sup 120/ states. Our model checking algorithm handles full CTL with fairness constraints. Consequently, we are able to express a number of important liveness and fairness properties, which would otherwise not be expressible in CTL. We give empirical results on the performance of the algorithm applied to both synchronous and asynchronous circuits with data path logic.< >"
1994,Model Checking and Abstraction.,"We describe a method for using abstraction to reduce the complexity of temporal-logic model checking. Using techniques similar to those involved in abstract interpretation, we construct an abstract model of a program without ever examining the corresponding unabstracted model. We show how this abstract model can be used to verify properties of the original program. We have implemented a system based on these techniques, and we demonstrate their practicality using a number of examples, including a program representing a pipelined ALU circuit with over 101300 states."
1994,Automatic Verification of Finite-state Concurrent Systems.,"Abstract
Logical errors in finite-state concurrent systems such as sequential circuit designs and communication protocols are an important problem for computer scientists. They can delay getting a new product on the market or cause the failure of some critical device that is already in use. My research group has developed a verification method called temporal logic model checking for this class of systems. In this approach specifications are expressed in a propositional temporal logic, while circuits and protocols are modeled as state-transition systems. An efficient search procedure is used to determine automatically if a specification is satisfied by some transition system. The technique has been used in the past to find subtle errors in a number of non-trivial examples.
During the last few years, the size of the state-transition systems that can be verified by model checking techniques has increased dramatically. By representing transition relations implicitly using Binary Decision Diagrams (BDDs), we have been able to check some examples that would have required 1020 states with the original algorithm. Various refinements of the BDD-based techniques have pushed the state count up to 10100. By combining model checking with various abstraction techniques, we have been able to handle even larger systems. In one example, we were able to verify a pipelined ALU with more than 101300 states (including 64 registers of 64 bits each).
Recently, we have used model checking techniques to verify the cache coherence protocol in the IEEE Futurebus+ Standard. We found several errors that had been previously undetected. Apparently, this is the first time that formal methods have been used to find nontrivial errors in an IEEE standard. The result of the project is a concise, comprehensible, and unambiguous model of the cache coherence protocol that should be useful both to the Futurebus+ Working Group members who are responsible for the protocol and to actual designers of Futurebus+ boards. We believe this experience demonstrates that model checking techniques are already sufficiently powerful to be useful in verifying real industrial designs."
1994,Combining Symbolic Computation and Theorem Proving: Some Problems of Ramanujan.,"One way of building more powerful theorem provers is to use techniques from symbolic computation. The challenge problems in this paper are taken from Chapter 2 of Ramanujan''s Notebooks. They were selected because they are non-trivial and require the use of symbolic computation techniques. We have developed a theorem prover based on the symbolic computation system Mathematica, that can prove all the challenge problems completely automatically. The axioms and inference rules for constructing the proofs are also briefly discussed."
1994,An Improved Algorithm for the Evaluation of Fixpoint Expressions.,"Abstract
Many automated finite-state verification procedures can be viewed as fixpoint computations over a finite lattice (typically the powerset of the set of system states). Hence, fixpoint calculi such as the propositional Μ-calculus have proven useful, both as ways to describe verification algorithms and as specification formalisms in their own right. We consider the problem of evaluating expressions in a fixpoint calculus over a given model. A naive algorithm for this task may require time n q , where n is the maximum length of a chain in the lattice and q is the depth of fixpoint nesting. In 1986, Emerson and Lei presented a method requiring about n d steps, where d is the number of alternations between least and greatest fixpoints. More recent algorithms have reduced the exponent by one or two, but the complexity has remained at about nd. In this paper, we present a new algorithm that makes extensive use of monotonicity considerations to solve the problem in about nd/2 steps. Thus, the time required by our method is only about the square root of the time required by the earlier algorithms."
1994,Another Look at LTL Model Checking.,"Abstract
We show how LTL model checking can be reduced to CTL model checking with fairness constraints. Using this reduction, we also describe how to construct a symbolic LTL model checker that appears to be quite efficient in practice. In particular, we show how the SMV model checking system developed by McMillan [16] can be extended to permit LTL specifications. The results that we have obtained are quite surprising. For the examples we considered, the LTL model checker required at most twice as much time and space as the CTL model checker. Although additional examples still need to be tried, it appears that efficient LTL model checking is possible when the specifications are not excessively complicated."
1994,Fast Spectrum Computation for Logic Functions using Binary Decision Diagrams.,"Abstract:
We show very efficient methods to compute Walsh spectrum for logic functions with large numbers of inputs (30 or more) using Binary Decision Diagrams. The BUD structure is extended to have any integer values as leaf (constant) nodes. The result is an efficient representation for integer vectors and integer matrices. The proposed procedure works directly on an extended BDD for the logic function, and computes the full Walsh spectrum in the form of an extended BDD. The algorithm presented is a more efficient version of the matrix-multiplication method. Our method embeds the Walsh transform matrix implicitly into program code with recursive calls, which results in a significant speed improvement. Our algorithm has the same complexity as the fastest known Walsh algorithm, and utilizes a much more efficient data structure than traditional truth tables. Furthermore, in cases where the complete set of spectra coefficient is either infeasible or impractical, we also present a method to compute subsets of Walsh coefficients. We present experimental results showing that logic functions having more than 60 inputs which cannot be processed by other published methods can be computed within 30 seconds on Sparc 2.< >"
1994,Automatic Verification of Finite-State Concurrent Systems.,"Abstract:
Logical errors in finite-state concurrent systems such as sequential circuit designs and communication protocols are an important problem for computer scientists. A research group has developed a verification method called temporal logic model checking for this class of systems. In this approach specifications are expressed in a propositional temporal logic, while circuits and protocols are modeled as state-transition systems. An efficient search procedure is used to determine automatically if a specification is satisfied by some transition system. The technique has been used to find subtle errors in a number of non-trivial examples. During the last few years, the size of the state-transition systems that can be verified by model checking techniques has increased dramatically. By representing transition relations implicitly using binary decision diagrams (BDDs), we have been able to check some examples that would have required 10/sup 20/ states with the original algorithm. Various refinements of the BDD-based techniques have pushed the state count up to 10/sup 100/. By combining model checking with various abstraction techniques, we have been able to handle even larger systems. We focus on four of the most important directions for research: use of abstraction and symmetry to achieve an even greater reduction in the size of the state-space that must be explored by this method; development of model checking techniques that can handle parameterized designs without requiring each individual instance of the design to be verified; use of partial order semantics to avoid the state explosion problem that can occur in loosely coupled systems when concurrency is modeled by interleaving; determination of appropriate models and verification techniques for circuits and protocols with real-time constraints.< >"
1994,Computing Quantitative Characteristics of Finite-State Real-Time Systems.,"Abstract:
Presents a general method for computing quantitative information about finite-state real-time systems. We have developed algorithms that compute exact bounds on the delay between two specified events and on the number of occurrences of an event in a given interval. This technique allows us to determine performance measures such as schedulability, response time, and system load. Our algorithms produce more detailed information than traditional methods. This information leads to a better understanding of system behavior, in addition to determining its correctness. The algorithms presented in this paper are efficiently implemented using binary decision diagrams and have been incorporated into the SMV symbolic model verifier. Using this method, we have verified a model of an aircraft control system with 10/sup 15/ states. The results obtained demonstrate that our method can be successfully applied in the verification of real-time system designs.< >"
1993,New and used temporal models: An issue of time.,"The Special Issue on Applications of Temporal Models raises many issues of time: What are the important properties of time? How can time be best represented? How can one reason about time-dependent properties? What are the important directions of temporal research? This introductory piece very briefly surveys the current wide variety of temporal models, temporal reasoning methods, and applications to time-varying phenomena. Promising areas of investigation such as the verification of concurrent systems, knowledge-base representation methods, and dealing with theFrame Problem pass in fleeting review. Brief introductions to each of the works in the volume close the section.
"
1993,A Unified Approch for Showing Language Inclusion and Equivalence Between Various Types of omega-Automata.,"Abstract
We consider the language inclusion and equivalence problems for six different types of ω-automata; Büchi, Muller, Rabin, Streett, the L-automata of Kurshan, and the ∀-automata of Manna and Pnueli. We give a six by six matrix in which each row and column is associated with one of these types of automata. The entry in the ith row and jth column is the complexity of showing inclusion between the ith type of automaton and the jth. Thus, for example, we give the complexity of showing language inclusion and equivalence between a Büchi automaton and a Muller or Streett automaton. Our results are obtained by a uniform method that associates a formula of the computation tree logic CTL∗ with each type of automaton. Our algorithms use a model checking procedure for the logic with the formulas obtained from the automata. The results of our paper are important for verification of finite state concurrent systems with fairness constraints. A natural way of reasoning about such systems is to model the finite state program by one ω-automaton and its specification by another."
1993,Efficient Verification of Parallel Real-Time Systems.,"Abstract
This paper presents an efficient model checking algorithm for one-safe time Petri nets and a timed temporal logic. The approach is based on the idea of (1) using only differences of timing variables to be able to construct a finite representation of the set of all reachable states and (2) further reducing the size of this representation by exploiting the concurrency in the net, i.e. only one of several equivalent interleavings being generated for the evaluation of the given formula. This reduction of the state space is possible, because the considered linear-time temporal logic is stuttering invariant. In this paper the concrete model checking algorithm is developed and some experimental results which demonstrate the efficiency of the method are given."
1993,Exploiting Symmetry In Temporal Logic Model Checking.,"Abstract
In practice, finite state concurrent systems often exhibit considerable symmetry. We investigate techniques for reducing the complexity of temporal logic model checking in the presence of symmetry. In particular, we show that symmetry can frequently be used to reduce the size of the state space that must be explored during model checking. In the past, symmetry has been exploited in computing the set of reachable states of a system when the transition relation is represented explicitly [13, 10, 17]. However, this research did not consider arbitrary temporal properties or the complications that arise when BDDs are used in such procedures. We have formalized what it means for a finite state system to be symmetric and described techniques for reducing such systems when the transition relation is given explicitly in terms of states or symbolically as a BDD. Moreover, we have identified an important class of temporal logic formulas that are preserved ander this reduction. Our paper also investigates the complexity of various critical steps, like the computation of the orbit relation, which arise when symmetry is used in this type of verification. Finally, we have tested our ideas on a simple cache-coherency protocol based on the IEEE Futurebus+ standard."
1993,Verification of the Futurebus+ Cache Coherence Protocol.,"We used a hardware description language to construct a formal model of the cache coherence protocol described in the IEEE Futurebus+ standard. By applying temporal logic model checking techniques, we found errors in the standard. The result of our project is a concise, comprehensible and unambiguous model of the protocol that should be useful both to the Futurebus+ Working Group members, who are responsible for the protocol, and to actual designers of Futurebus+ boards. "
1993,Automatic Verification of Sequential Circuit Designs.,"Temporal logic model checking is a method for automatically deciding if a sequential circuit satisfies its specifications. In this approach, the circuit is modelled as a state transition system, and specifications are given by temporal logic formulas. Efficient search algorithms are used to determine if the specifications are satisfied or not. The procedure has been used successfully in the past to find subtle errors in a number of non trivial circuit designs. Recently, the size of the circuits that can be handled by this technique has increased dramatically. It is now possible to verify transition systems that are many orders of magnitude larger than was previously the case. In this paper, we describe some of the techniques that have made this increase possible. These techniques are based on the use of binary decision diagrams to represent transition systems and sets of states."
1993,Spectral Transforms for Large Boolean Functions with Applications to Technology Mapping.,"The Walsh transform has numerous applications in computer-aided design, but the usefulness of these techniques in practice has been limited by the size of the boolean functions that can be transformed. Currently available techniques limit the functions to less than 20 variables. In this paper, we show how to compute concise representations of the Walsh transform for functions with several hundred variables. We have applied our techniques to boolean technology mapping and, in certain cases, we obtained a speed up of as much as 50% for the matching phase."
1993,Verification Tools for Finite-State Concurrent Systems.,"Abstract
Temporal logic model checking is an automatic technique for verifying finite-state concurrent systems. Specifications are expressed in a propositional temporal logic, and the concurrent system is modeled as a state-transition graph. An efficient search procedure is used to determine whether or not the state-transition graph satisfies the specification. When the technique was first developed ten years ago, it was only possible to handle concurrent systems with a few thousand states. In the last few years, however, the size of the concurrent systems that can be handled has increased dramatically. By representing transition relations and sets of states implicitly using binary decision diagrams, it is now possible to check concurrent systems with more than 10120 states. In this paper we describe in detail how the new implementation works and give realistic examples to illustrate its power. We also discuss a number of directions for future research. The necessary background information on binary decision diagrams, temporal logic, and model checking has been included in order to make the exposition as self-contained as possible."
1992,Symbolic Model Checking: 10^20 States and Beyond.,"Abstract
Many different methods have been devised for automatically verifying finite state systems by examining state-graph models of system behavior. These methods all depend on decision procedures that explicitly represent the state space using a list or a table that grows in proportion to the number of states. We describe a general method that represents the state space symbolically instead of explicitly. The generality of our method comes from using a dialect of the Mu-Calculus as the primary specification language. We describe a model checking algorithm for Mu-Calculus formulas that uses Bryant's Binary Decision Diagrans (Bryant, R. E., 1986, IEEE Trans. Comput.C-35) to represent relations and formulas. We then show how our new Mu-Calculus model checking algorithm can be used to derive efficient decision procedures for CTL model checking, satisfiability of linear-time temporal logic formulas, strong and weak observational equivalence of finite transition systems, and language containment for finite ω-automata. The fixed point computations for each decision procedure are sometimes complex, but can be concisely expressed in the Mu-Calculus. We illustrate the practicality of our approach to symbolic model checking by discussing how it can be used to verify a simple synchronous pipeline circuit."
1992,PARTHENON: A Parallel Theorem Prover for Non-Horn Clauses.,"We describe a parallel resolution theorem prover, called Parthenon, that handles full first order logic. Although there has been much work on parallel implementations of logic programming languages, Parthenon is the first general purpose theorem prover to be developed for a multiprocessor. The system is based on a modification of Warren's SRI model for or-parallelism and implements a variant of Loveland's model elimination procedure. It has been evaluated on various shared memory multiprocessors including a 16-processor Encore Multimax and IBM's 64-processor RP3. We have found that many theorem proving problems exhibit a great deal of potential parallelism. Parthenon has been able to exploit much of this parallelism, producing both good absolute run times and near-linear speedup curves in many cases.
"
1992,A Synthesis of Two Approaches for Verifying Finite State Concurrent Systems.,"The paper provides a synthesis between two main approaches to automatic verification of finite-state systems: temporal logic model checking and language containment of automata on infinite tapes. A new branching-time temporal logic is suggested, in which automata on infinite tapes are used to define new temporal operators. Each such operator defines a set of acceptable computation paths. Path quantifiers are used to specify whether all paths or some path from a state should be in some acceptable set. The logic is very powerful and includes both linear-time and branching-time temporal logics. We give an efficient model checking procedure that checks whether a finite-state system satisfies its specification, given by a formula of the new logic. Our procedure is linear in the size of the system and a low level polynomial in the size of the specification.
"
