1992,Competitive Analysis of Financial Games.,"Abstract:
In the unidirectional conversion problem an on-line player is given the task of converting dollars to yen over some period of time. Each day, a new exchange rate is announced and the player must decide how many dollars to convert. His goal is to minimize the competitive ratio. defined as sup/sub E/ (P/sub OPT/(E)/P/sub X/E) where E ranges over exchange rate sequences. P/sub OPT/(E) is the number of yen obtained by an optimal off-line algorithm, and Px(E) is the number of yen obtained by the on-line algorithm X. The authors also consider a continuous version of the problem. in which the exchange rate varies over a continuous time interval. The on-line line players a priori information about the fluctuation of exchange rates distinguishes different variants of the problem. For three variants they show that a simple threat-based strategy is optimal for the on-line player and determine its competitive ratio. They also derive and analyze an optimal policy for the on-line player when he knows the probability distribution of the maximum value that the exchange rate will reach. Finally, they consider a bidirectional conversion problem, which the player may trade dollars for yen or yen for dollars.< >"
1992,On-Line Algorithms Versus Off-Line Algorithms: How Much is it Worth to Know the Future?,"An online algorithm is one that receives a sequence of requests and performs an immediate action in response to each request. Online algorithms arise in any situation where decisions must be made and resources allocated without knowledge of the future. The effectiveness of an online algorithm may be measured by its competitive ratio, defined as the worst-case ratio between its cost and that of a hypothetical offline algorithm which knows the entire sequence of requests in advance and chooses its actions optimally. In a variety of settings, we discuss techniques for proving upper and lower bounds on the competitive ratios achievable by online algorithms. In particular, we discuss the advantages of randomized online algorithms over deterministic ones."
1992,When is the Assignment Bound Tight for the Asymmetric Traveling Salesman Problem?,"We consider the probabilistic relationship between the value of a random asymmetric traveling salesman problem $ATSP(M)$ and the value of its assignment relaxation $AP(M)$. We assume here that the costs are given by an $n\times n$ matrix $M$ whose entries are independently and identically distributed. We focus on the relationship between $Pr(ATSP(M)=AP(M))$ and the probability $p_n$ that any particular entry is zero. If $np_n\rightarrow \infty$ with $n$ then we prove that $ATSP(M)=AP(M)$ with probability 1-o(1). This is shown to be best possible in the sense that if $np(n)\rightarrow c$, $c>0$ and constant, then $Pr(ATSP(M)=AP(M))<1-\phi(c)$ for some positive function $\phi$. Finally, if $np_n\rightarrow 0$ then $Pr(ATSP(M)=AP(M))\rightarrow 0$"
1992,Efficient PRAM Simulation on a Distributed Memory Machine.,"We present a randomized simulation of a nlog log (n) log (n)-processor shared memory machine (DMM) with optimal expected delay O(log log (n)) per step of simulation. The time bound for the delay is guaranteed with overwhelming probability. The algorithm is based on hashing and uses a novel simulation scheme. The best previous simulations use a simpler scheme based on hashing and have much larger expected delay: &THgr;(log(n)/log log (n)) for the simulation of an n-processor PRAM on an n processor DMM, and &THgr;(log(n)) in the case where the simulation preserves the processor-time product."
1991,"FFD Bin Packing for Item Sizes with Uniform Distributions on [0, 1/2].","Abstract
We study the expected behavior of the FFD bin-packing algorithm applied to items whose sizes are distributed in accordance with a Poisson process with rateN on the interval[0, 1/2] of item sizes. By viewing the algorithm as a succession of queueing processes we show that the expected wasted space for FFD bin-packing is bounded above by 11.3 bins, independent ofN."
1991,An introduction to randomized algorithms.,"Abstract
Research conducted over the past fifteen years has amply demonstrated the advantages of algorithms that make random choices in the course of their execution. This paper presents a wide variety of examples intended to illustrate the range of applications of randomized algorithms, and the general principles and approaches that are of greatest use in their construction. The examples are drawn from many areas, including number theory, algebra, graph theory, pattern matching, selection, sorting, searching, computational geometry, combinatorial enumeration, and parallel and distributed computation."
1991,Transitive Compaction in Parallel via Branchings.,"Abstract
We study the following problem: given a strongly connected digraph, find a minimal strongly connected spanning subgraph of it. Our main result is a parallel algorithm for this problem, which runs in polylog parallel time and uses O(n3) processors on a PRAM. Our algorithm is simple and the major tool it uses is computing a minimum-weight branching with zero-one weights. We also present sequential algorithms for the problem that run in time O(m + n ¬∑ log n)."
1991,Competitive Paging Algorithms.,"Abstract
The paging problem is that of deciding which pages to keep in a memory of k pages in order to minimize the number of page faults. We develop the marking algorithm, a randomized on-line algorithm for the paging problem. We prove that its expected cost on any sequence of requests is within a factor of 2Hk of optimum. (Where Hk is the kth harmonic number, which is roughly ln k.) The best such factor that can be achieved is Hk. This is in contrast to deterministic algorithms, which cannot be guaranteed to be within a factor smaller than k of optimum. An alternative to comparing an on-line algorithm with the optimum off-line algorithm is the idea of comparing it to several other on-line algorithms. We have obtained results along these lines for the paging problem. Given a set of on-line algorithms and a set of appropriate constants, we describe a way of constructing another on-line algorithm whose performance is within the appropriate constant factor of each algorithm in the set."
1991,A Graph-Theoretic Game and its Application to the k-Server Problem (Extended Abstract).,"This paper investigates a zero-sum game played on a weighted connected graph $G$ between two players, the tree player and the edge player. At each play, the tree player chooses a spanning tree $T$ and the edge player chooses an edge $e$. The payoff to the edge player is $cost(T,e)$, defined as follows: If $e$ lies in the tree $T$ then $cost(T,e)=0$; if $e$ does not lie in the tree then $cost(T,e) = cycle(T,e)/w(e)$, where $w(e)$ is the weight of edge $e$ and $cycle(T,e)$ is the weight of the unique cycle formed when edge $e$ is added to the tree $T$. The main result is that the value of the game on any $n$-vertex graph is bounded above by $\exp(O(\sqrt{\log n \log\log n}))$. It is conjectured that the value of the game is $O(\log n)$.
The game arises in connection with the $k$-server problem on a road network; i.e., a metric space that can be represented as a multigraph $G$ in which each edge $e$ represents a road of length $w(e)$. It is shown that, if the value of the game on $G$ is $Val(G,w)$, then there is a randomized strategy that achieves a competitive ratio of $k(1 + Val(G,w))$ against any oblivious adversary. Thus, on any $n$-vertex road network, there is a randomized algorithm for the $k$-server problem that is $k\cdot\exp(O(\sqrt{\log n \log\log n}))$ competitive against oblivious adversaries.
At the heart of the analysis of the game is an algorithm that provides an approximate solution for the simple network design problem. Specifically, for any $n$-vertex weighted, connected multigraph, the algorithm constructs a spanning tree $T$ such that the average, over all edges $e$, of $cost(T,e)$ is less than or equal to $\exp(O(\sqrt{\log n \log\log n}))$. This result has potential application to the design of communication networks. It also improves substantially known estimates concerning the existence of a sparse basis for the cycle space of a graph."
1991,Probabilistic Recurrence Relations.,"This paper is concerned with recurrence relations that arise frequently in the analysis of divide and conquer algorithms. In order to solve a problem instance of size x, such as an algorithm invests an amount of work a(x) to break the problem into subproblems of sizes , and then proceeds to solve the subproblems. Our particular interest is in the case where the sizes are random variables; this may occur either because of randomization within the algorithm or because the instances to be solved are assumed to be drawn from a probability distribution. When the are random variables the running time of the algorithm on instances of size x is also a random variable T(x). We give several easy-to-apply methods for obtaining fairly tight bounds on the upper tails of the probability distribution of T(x), and present a number of typical applications of these bounds to the analysis of algorithms. The proofs of the bounds are based on an interesting analysis of optimal strategies in certain gambling games."
1990,Subtree isomorphism is in random NC.,"Abstract
Given two trees, a guest tree G and a host tree H, the subtree isomorphism problem is to determine whether there is a subgraph of H that is isomorphic to G. We present a randomized parallel algorithm for finding such an isomorphism, if it exists. The algorithm runs in time O(log3n) on a CREW PRAM, where n is the number of nodes in H. The number of processors required by the algorithm is polynomial in n. Randomization is used (solely) to solve each of a series of bipartite matching problems during the course of the algorithm. We demonstrate the close connection between the two problems by presenting a log-space reduction from bipartite perfect matching to subtree isomorphism. Finally, we present some techniques to reduce the number of processors used by the algorithm."
1990,The Transitive Closure of a Random Digraph.,"In a random n?vertex digraph, each arc is present with probability p, independently of the presence or absence of other arcs. We investigate the structure of the strong components of a random digraph and present an algorithm for the construction of the transitive closure of a random digraph. We show that, when n is large and np is equal to a constant c greater than 1, it is very likely that all but one of the strong components are very small, and that the unique large strong component contains about ?2n vertices, where ? is the unique root in [0, 1] of the equation 1 ? x ? e?ex = 0. Nearly all the vertices outside the large strong component line in strong components of size 1. Provided that the expected degree of a vertex is bounded away from 1, our transitive closure algorithm runs in expected time O(n). for all choices of n and p, the expected execution time of the algorithm is O(w(n) (n log n)4/3), where w(n) is an arbitrary nondecreasing unbounded function. To circumvent the fact that the size of the transitive closure may be ?(n2) the algorithm presents the transitive closure in the compact form (A ◊ B)U C, where A and B are sets of vertices, and C is a set of arcs.
"
1990,An Optimal Algorithm for On-line Bipartite Matching.,"There has been a great deal of interest recently in the relative power of on-line and off-line algorithms. An on-line algorithm receives a sequence of requests and must respond to each request as soon as it is receiveD. An off-line algorithm may wait until all requests have been received before determining its responses. One approach to evaluating an on-line algorithm is to compare its performance with that of the best possible off-line algorithm for the same problem. Thus, given a measure of ""profit"", the performance of an on-line algorithm can be measured by the worst-case ratio of its profit to that of the optimal off-line algorithm. This general approach has been applied in a number of contexts, including data structures [SITa], bin packing [CoGaJo], graph coloring [GyLe] and the k-server problem [MaMcSI]. Here we apply it to bipartite matching and show that a simple randomized on-line algorithm achieves the best possible performance."
1990,On the Power of Randomization in Online Algorithms (Extended Abstract).,"Against an adaptive adversary, we show that the power of randomization in on-line algorithms is severely limited! We prove the existence of an efficient ìsimulationî of randomized on-line algorithms by deterministic ones, which is best possible in general. The proof of the upper bound is existential. We deal with the issue of computing the efficient deterministic algorithm, and show that this is possible in very general cases.†"
1989,Monte-Carlo Approximation Algorithms for Enumeration Problems.,"Abstract
We develop polynomial time Monte-Carlo algorithms which produce good approximate solutions to enumeration problems for which it is known that the computation of the exact solution is very hard. We start by developing a Monte-Carlo approximation algorithm for the DNF counting problem, which is the problem of counting the number of satisfying truth assignments to a formula in disjunctive normal form. The input to the algorithm is the formula and two parameters Œµ and Œ¥. The algorithm produces an estimate which is between 1 ‚àí œµ and 1 + œµ times the number of satisfying truth assignments with probability at least 1 ‚àí Œ¥. The running time of the algorithm is linear in the length of the formula times
times
. On the other hand, the problem of computing the exact answer for the DNF counting problem is known to be #P-complete, which implies that there is no polynomial time algorithm for the exact solution if P ‚â† NP. This paper improves and gives new applications of some of the work previously reported. Variants of an œµ, Œ¥ approximation algorithm for the DNF counting problem have been highly tailored to be especially efficient for the network reliability problems to which they are applied. In this paper the emphasis is on the development and analysis of a much more efficient œµ, Œ¥ approximation algorithm for the DNF counting problem. The running time of the algorithm presented here substantially improves the running time of versions of this algorithm given previously. We give a new application of the algorithm to a problem which is relevant to physical chemistry and statistical physics. The resulting œµ, Œ¥ approximation algorithm is substantially faster than the fastest known deterministic solution for the problem."
1989,Failure Correction Techniques for Large Disk Arrays.,"The ever increasing need for I/O bandwidth will be met with ever larger arrays of disks. These arrays require redundancy to protect against data loss. This paper examines alternative choices for encodings, or codes, that reliably store information in disk arrays. Codes are selected to maximize mean time to data loss or minimize disks containing redundant data, but are all constrained to minimize performance penalties associated with updating information or recovering from catastrophic disk failures. We also codes that give highly reliable data storage with low redundant data overhead for arrays of 1000 information disks."
1989,On Parallel Evaluation of Game Trees.,"We present parallel algorithms for evaluating game trees. These algorithms parallelize the ""left-to-right"" sequential algorithm for evaluating AND/OR trees and the alpha-beta pruningn procedure for evaluating MIN/MAX trees. We show that, on every instance of a uniform tree, these parallel algorithms achieve a linear speed-up over their corresponding sequential algorithms, if number of processors used is close to the height of the input tree. These are the first non-trivial deterministic speed-up bounds known for the ""left-to-right"" algorithm and the alpha-beta pruning procedure."
1988,The Complexity of Parallel Search.,"This paper studies parallel search algorithms within the framework of independence systems. It is motivated by earlier work on parallel algorithms for concrete problems such as the determination of a maximal independent set of vertices or a maximum matching in a graph and by the general question of determining the parallel complexity of a search problem when an oracle is available to solve the associated decision problem. Our results provide a parallel analog of the self-reducibility process that is so useful in sequential computation. An abstract independence system is specified by a ground set†E†and a family of subsets of†E†called the independent sets; it is required that every subset of an independent set be independent. We investigate parallel algorithms for determining a maximal independent set through oracle queries of the form ìIs the set†A†independent?,î as well as parallel algorithms for determining a maximum independent set through queries to a more powerful oracle called a rank oracle. We also study these problems for three special types of independence systems: matroids, graphic matroids, and partition matroids. We derive lower and upper bounds on the deterministic and randomized complexity of these problems. These bounds are sharp enough to give a clear picture of the processor-time trade-offs that are possible, to establish that randomized parallel algorithms are much more powerful than deterministic ones, and to show that even randomized algorithms cannot make effective use of extremely large numbers of processors."
1988,Deferred Data Structuring.,"We consider the problem of answering a series of on-line queries on a static data set. The conventional approach to such problems involves a preprocessing phase which constructs a data structure with good search behavior. The data structure representing the data set then remains fixed throughout the processing of the queries. Our approach involves dynamic or query-driven structuring of the data set; our algorithm processes the data set only when doing so is required for answering a query. A data structure constructed progressively in this fashion is called a deferred data structure.

We develop the notion of deferred data structures by solving the problem of answering membership queries on an ordered set. We obtain a randomized algorithm which achieves asymptotically optimal performance with high probability. We then present optimal deferred data structures for the following problems in the plane: testing convex-hull membership, half-plane intersection queries and fixed-constraint multi-objective linear programming. We also apply the deferred data structuring technique to multi-dimensional dominance query problems.
"
1988,Subtree Isomorphism is in Random NC.,"Abstract
Given two trees, a guest tree G and a host tree H, the subtree isomorphism problem is to determine whether there is a subgraph of H that is isomorphic to G. We present a randomized parallel algorithm for finding such an isomorphism, if it exists. The algorithm runs in time O(log3 n) on a CREW PRAM, where n is the number of nodes in H. Randomization is used (solely) to solve each of a series of bipartite matching problems during the course of the algorithm. We demonstrate the close connection between the two problems by presenting a log space reduction from bipartite perfect matching to subtree isomorphism. Finally, we present some techniques to reduce the number of processors used by the algorithm."
1988,A Randomized Parallel Branch-and-Bound Procedure.,"We present a universal randomized method called Local Best-First Search for parallelizing sequential branch-and-bound algorithms. The method executes on a message-passing multiprocessor system, and requires no global data structures or complex communication protocols. We show that, uniformly on all instances, the execution time of the method is unlikely to exceed a certain inherent lower bound by more than a constant factor."
1987,Global Wire Routing in Two-Dimensional Arrays.,"Abstract
We examine the problem of routing wires of a VLSI chip, where the pins to be connected are arranged in a regular rectangular array. We obtain tight bounds for the worst-case ‚Äúchannel-width‚Äù needed to route ann√ón array, and develop provably good heuristics for the general case. Single-turn routings are proved to be near-optimal in the worst-case.
A central result of our paper is a ‚Äúrounding algorithm‚Äù for obtaining integral approximations to solutions of linear equations. Given a matrix A and a real vector x, then we can find an integral x such that for alli, ¬¶x i -x i ¬¶ <1 and (Ax) i -(Ax) i <Œî. Our error bound Œî is defined in terms of sign-segregated column sums of A:
Œî=
max
j
(max{
‚àë
i:
a
ij
>0
a
ij
,
‚àë
i:
a
ij
<0
‚àí
a
ij
}).
Œî=maxj‚Å°(max{‚àëi:aij>0aij,‚àëi:aij<0‚àíaij})."
1987,Efficient Randomized Pattern-Matching Algorithms.,"Abstract:
We present randomized algorithms to solve the following string-matching problem and some of its generalizations: Given a string X of length n (the pattern) and a string Y (the text), find the first occurrence of X as a consecutive block within Y. The algorithms represent strings of length n by much shorter strings called fingerprints, and achieve their efficiency by manipulating fingerprints instead of longer strings. The algorithms require a constant number of storage locations, and essentially run in real time. They are conceptually simple and easy to implement. The method readily generalizes to higher-dimensional pattern-matching problems."
1987,"A simplex variant solving an m times d linear program in O(min(m2, d2) expected number of pivot steps.","Abstract
We present a variant of the Simplex method which requires on the average at most 2 (min(m, d) + 1)2 pivots to solve the linear program min cT, Ax ‚â• b, x ‚â• 0 with A Œµ Rm√ód. The underlying probabilistic distribution is assumed to be invariant under inverting the sense of any subset of the inequalities. In particular, this implies that under Smale's spherically symmetric model this variant requires an average of no more than 2(d + 1)2 pivots, independent of m, where d ‚â§ m."
1986,"Combinatorics, Complexity, and Randomness.",The 1985 Turing Award winner presents his perspective on the development of the field that has come to be called theoretical computer science.
1986,Constructing a perfect matching is in random NC.,"Abstract
We show that the problem of constructing a perfect matching in a graph is in the complexity class Random NC; i.e., the problem is solvable in polylog time by a randomized parallel algorithm using a polynomial-bounded number of processors. We also show that several related problems lie in Random NC. These include:
(i)
Constructing a perfect matching of maximum weight in a graph whose edge weights are given in unary notation;
 (ii)
Constructing a maximum-cardinality matching;
 (iii)
Constructing a matching covering a set of vertices of maximum weight in a graph whose vertex weights are given in binary;
 (iv)
Constructing a maximums-t flow in a directed graph whose edge weights are given in unary.
 "
1986,A Family of Simplex Variants Solving an m √ó d Linear Program in Expected Number of Pivot Steps Depending on d Only.,"We present a family of variants of the Simplex method, which are based on a Constraint-By-Constraint procedure: the solution to a linear program is obtained by solving a sequence of subproblems with an increasing number of constraints. We discuss several probabilistic models for generating linear programs. In all of them the underlying distribution is assumed to be invariant under changing the signs of rows or columns in the problem data. A weak regularity condition is also assumed. Under these models, for linear programs with d variables and m + d inequality constraints, the expected number of pivots required by these algorithms is bounded by a function of min(m, d) only. In particular this means that, for a fixed number of variables, the expected number of pivots is bounded by a constant when the number of constraints tends to infinity. Since Smale's original model [Smale, S. 1983. On the average speed of the simplex method of linear programming. Math. Programming27.] satisfies our probabilistic assumptions, the same results apply to his model, although not to the particular algorithm he analyzes. We also present some results for models generating only feasible linear programs, and for Bland's pivoting rule. We conclude with a discussion of our probabilistic models, and show why they are inadequate for obtaining meaningful results unless d and m are of the same order of magnitude.
"
1986,On a Search Problem Related to Branch-and-Bound Procedures.,n/a
1986,"FFD Bin Packing for Item Sizes with Distributions on [0,1/2].","Abstract:
We study the expected behavior of the FFD binpacking algorithm applied to items whose sizes are distributed in accordance with a Poisson process with rate N on the interval [0,1/2] of item sizes. By viewing the algorithm as a succession of queueing processes we show that the expected wasted space for FFD bin-packing is bounded above by 9.4 bins, independent of N. We extend this upper bound to a FFD bin-packing of items in accordance with a non-homogeneous Poisson process with a nonincreasing intensity function Œª(t) on [0,1/2]."
