2019,Massively Parallel Computation of Matching and MIS in Sparse Graphs.,"The Massively Parallel Computation (MPC) model serves as a common abstraction of many modern large-scale parallel computation frameworks and has recently gained a lot of importance, especially in the context of classic graph problems. In this work, we mainly consider maximal matching and maximal independent set problems in the MPC model.
These problems are known to admit efficient MPC algorithms if the space available per machine is near-linear in the number n of nodes. This is not only often significantly more than what we can afford, but also allows for easy if not trivial solutions for sparse graphs---which are common in real-world large-scale graphs. We are, therefore, interested in the low-memory MPC model, where the space per machine is restricted to be strongly sublinear, that is, nŒ¥ for any constant 0 < Œ¥ < 1.
We parametrize our algorithms by the arboricity Œª of the input graph. Our key ingredient is a degree reduction technique that reduces these problems in graphs with arboricity Œª to the corresponding problems in graphs with maximum degree poly(Œª, log n) in O(log2 log n) rounds, giving rise to O(‚àö log Œª ‚ãÖ log log Œª + log 2 log n)-round algorithms.
Our result is particularly interesting for graphs with poly log n arboricity as for such graphs, we get O(log 2 log n)-round algorithms. This covers most natural families of sparse graphs and almost exponentially improves over previous algorithms that all required log Œ©(1) n rounds in this regime of MPC.
Finally, our maximal matching algorithm can be employed to obtain a (1+Œµ)-approximate maximum cardinality matching, a (2+Œµ)-approximate maximum weighted matching, as well as a 2-approximate minimum vertex cover in essentially the same number of rounds."
2017,Random Knockout Tournaments.,"We consider a random knockout tournament among players 1,Ö, n, in which each match involves two players. The match format is specified by the number of matches played in each round, where the constitution of the matches in a round is random. Supposing that there are numbers v1,Ö, vn such that a match between i and j will be won by i with probability vi/(vi + vj), we obtain a lower bound on the tournament win probability for the best player, as well as upper and lower bounds for all of the players. We also obtain additional bounds by considering the best and worst formats for player 1 in the special case v1 > v2 = v3 = Ö = vn.
"
2014,Finding a most biased coin with fewest flips.,"We study the problem of learning a most biased coin among a set of coins by tossing the coins adaptively. The goal is to minimize the number of tosses until we identify a coin whose posterior probability of being most biased is at least 1-Œ¥for a given Œ¥. Under a particular probabilistic model, we give an optimal algorithm, i.e., an algorithm that minimizes the expected number of future tosses. The problem is closely related to finding the best arm in the multi-armed bandit problem using adaptive strategies. Our algorithm employs an optimal adaptive strategy‚Äîa strategy that performs the best possible action at each step after observing the outcomes of all previous coin tosses. Consequently, our algorithm is also optimal for any given starting history of outcomes. To our knowledge, this is the first algorithm that employs an optimal adaptive strategy under a Bayesian setting for this problem. Our proof of optimality employs mathematical tools from the area of Markov games."
2013,The Implicit Hitting Set Approach to Solve Combinatorial Optimization Problems with an Application to Multigenome Alignment.,"We develop a novel framework, the implicit hitting set approach, for solving a class of combinatorial optimization problems. The explicit hitting set problem is as follows: given a set U and a family S of subsets of U, find a minimum-cardinality set that intersects (hits) every set in S. In the implicit hitting set problem (IHSP), the family of subsets S is not explicitly listed (its size is, generally, exponential in terms of the size of U); instead, it is given via a polynomial-time oracle that verifies if a given set H is a hitting set or returns a set in S that is not hit by H. Many NP-hard problems can be straightforwardly formulated as implicit hitting set problems. We show that the implicit hitting set approach is valuable in developing exact and heuristic algorithms for solving this class of combinatorial optimization problems. Specifically, we provide a generic algorithmic strategy, which combines efficient heuristics and exact methods, to solve any IHSP. Given an instance of an IHSP, the proposed algorithmic strategy gives a sequence of feasible solutions and lower bounds on the optimal solution value and ultimately yields an optimal solution. We specialize this algorithmic strategy to solve the multigenome alignment problem and present computational results that illustrate the effectiveness of the implicit hitting set approach.
"
2013,Reconstructing Boolean Models of Signaling.,"Since the first emergence of proteinñprotein interaction networks more than a decade ago, they have been viewed as static scaffolds of the signalingñregulatory events taking place in cells, and their analysis has been mainly confined to topological aspects. Recently, functional models of these networks have been suggested, ranging from Boolean to constraint-based methods. However, learning such models from large-scale data remains a formidable task, and most modeling approaches rely on extensive human curation. Here we provide a generic approach to learning Boolean models automatically from data. We apply our approach to growth and inflammatory signaling systems in humans and show how the learning phase can improve the fit of the model to experimental data, remove spurious interactions, and lead to better understanding of the system at hand.
"
2012,Comparing Pedigree Graphs.,"Pedigree graphs, or family trees, are typically constructed by an expensive process of examining genealogical records to determine which pairs of individuals are parent and child. New methods to automate this process take as input genetic data from a set of extant individuals and reconstruct ancestral individuals. There is a great need to evaluate the quality of these methods by comparing the estimated pedigree to the true pedigree. In this article, we consider two main pedigree comparison problems. The first is the pedigree isomorphism problem, for which we present a linear-time algorithm for leaf-labeled pedigrees. The second is the pedigree edit distance problem, for which we present (1) several algorithms that are fast and exact in various special cases, and (2) a general, randomized heuristic algorithm. In the negative direction, we first prove that the pedigree isomorphism problem is as hard as the general graph isomorphism problem, and that the sub-pedigree isomorphism problem is NP-hard. We then show that the pedigree edit distance problem is APX-hard in general and NP-hard on leaf-labeled pedigrees. We use simulated pedigrees to compare our edit-distance algorithms to each other as well as to a branch-and-bound algorithm that always finds an optimal solution.
"
2012,Algorithms to Detect Multiprotein Modularity Conserved during Evolution.,"Abstract:
Detecting essential multiprotein modules that change infrequently during evolution is a challenging algorithmic task that is important for understanding the structure, function, and evolution of the biological cell. In this paper, we define a measure of modularity for interactomes and present a linear-time algorithm, Produles, for detecting multiprotein modularity conserved during evolution that improves on the running time of previous algorithms for related problems and offers desirable theoretical guarantees. We present a biologically motivated graph theoretic set of evaluation measures complementary to previous evaluation measures, demonstrate that Produles exhibits good performance by all measures, and describe certain recurrent anomalies in the performance of previous algorithms that are not detected by previous measures. Consideration of the newly defined measures and algorithm performance on these measures leads to useful insights on the nature of interactomics data and the goals of previous and current algorithms. Through randomization experiments, we demonstrate that conserved modularity is a defining characteristic of interactomes. Computational experiments on current experimentally derived interactomes for Homo sapiens and Drosophila melanogaster, combining results across algorithms, show that nearly 10 percent of current interactome proteins participate in multiprotein modules with good evidence in the protein interaction data of being conserved between human and Drosophila."
2012,An Algorithmic View of the Universe.,"In the years since Alan Turing, and following his lead, computer scientists advanced their understanding of computational phenomena by developing a very specialized, original and penetrating way of rigorous thinking. Now it turns out that this ""algorithmic"" way of thinking can be applied productively to the study of important phenomena outside computation proper (examples: the cell, the brain, the market, the universe, indeed mathematical truth itself). This development is an exquisite unintended consequence of the fact that there is latent computation underlying each of these phenomena, or the ways in which science studies them."
2012,Algorithmic methodologies for ultra-efficient inexact architectures for sustaining technology scaling.,"Owing to a growing desire to reduce energy consumption and widely anticipated hurdles to the continued technology scaling promised by Moore's law, techniques and technologies such as inexact circuits and probabilistic CMOS (PCMOS) have gained prominence. These radical approaches trade accuracy at the hardware level for significant gains in energy consumption, area, and speed. While holding great promise, their ability to influence the broader milieu of computing is limited due to two shortcomings. First, they were mostly based on ad-hoc hand designs and did not consider algorithmically well-characterized automated design methodologies. Also, existing design approaches were limited to particular layers of abstraction such as physical, architectural and algorithmic or more broadly software. However, it is well-known that significant gains can be achieved by optimizing across the layers. To respond to this need, in this paper, we present an algorithmically well-founded cross-layer co-design framework (CCF) for automatically designing inexact hardware in the form of datapath elements. Specifically adders and multipliers, and show that significant associated gains can be achieved in terms of energy, area, and delay or speed. Our algorithms can achieve these gains with adding any additional hardware overhead. The proposed CCF framework embodies a symbiotic relationship between architecture and logic-layer design through the technique of probabilistic pruning combined with the novel confined voltage scaling technique introduced in this paper, applied at the physical layer. A second drawback of the state of the art with inexact design is the lack of physical evidence established through measuring fabricated ICs that the gains and other benefits that can be achieved are valid. Again, in this paper, we have addressed this shortcoming by using CCF to fabricate a prototype chip implementing inexact data-path elements; a range of 64-bit integer adders whose outputs can be erroneous. Through physical measurements of our prototype chip wherein the inexact adders admit expected relative error magnitudes of 10% or less, we have found that cumulative gains over comparable and fully accurate chips, quantified through the area-delay-energy product, can be a multiplicative factor of 15 or more. As evidence of the utility of these results, we demonstrate that despite admitting error while achieving gains, images processed using the FFT algorithm implemented using our inexact adders are visually discernible."
2012,Reconstructing Boolean Models of Signaling.,"Abstract
Since the first emergence of protein-protein interaction networks, more than a decade ago, they have been viewed as static scaffolds of the signaling-regulatory events taking place in the cell and their analysis has been mainly confined to topological aspects. Recently, functional models of these networks have been suggested, ranging from Boolean to constraint-based ones. However, learning such models from large-scale data remains a formidable task and most modeling approaches rely on extensive human curation. Here we provide a generic approach to learning Boolean models automatically from data. We apply our approach to growth and inflammatory signaling systems in human and show how the learning phase can improve the fit of the model to experimental data, remove spurious interactions and lead to better understanding of the system at hand."
2012,Theory of Computation as an Enabling Tool for the Sciences.,"Abstract
Researchers in the theory of computation are increasingly adopting a computational worldview that is radiating out to a wide circle of scientific and technological fields, recognizing that central phenomena of these fields are often computational in nature. Over the past decade we have applied this viewpoint to physics, molecular biology and economics. Connections are also developing to evolutionary biology, machine learning, social choice, social network analysis, nanotechnology, cognitive science and astronomy. To maximize the effectiveness of this outreach to the sciences, the theory of computation must join forces with the fields of massive data analysis and combinatorial optimization."
2011,Pedigree Reconstruction Using Identity by Descent.,"Can we find the family trees, or pedigrees, that relate the haplotypes of a group of individuals? Collecting the genealogical information for how individuals are related is a very time-consuming and expensive process. Methods for automating the construction of pedigrees could stream-line this process. While constructing single-generation families is relatively easy given whole genome data, reconstructing multi-generational, possibly inbred, pedigrees is much more challenging. This article addresses the important question of reconstructing monogamous, regular pedigrees, where pedigrees are regular when individuals mate only with other individuals at the same generation. This article introduces two multi-generational pedigree reconstruction methods: one for inbreeding relationships and one for outbreeding relationships. In contrast to previous methods that focused on the independent estimation of relationship distances between every pair of typed individuals, here we present methods that aim at the reconstruction of the entire pedigree. We show that both our methods out-perform the state-of-the-art and that the outbreeding method is capable of reconstructing pedigrees at least six generations back in time with high accuracy. The two programs are available at http://cop.icsi.berkeley.edu/cop/.
"
2011,Heuristic algorithms in computational molecular biology.,"Abstract
In this paper we develop a framework for designing and validating heuristic algorithms for NP-hard problems arising in computational biology and other application areas. We introduce two areas of current research in which we are applying the framework: implicit hitting set problems and analysis of protein‚Äìprotein interaction networks, with emphasis on a specific problem in each area: multi-genome alignment and colorful connected graph detection."
2011,Understanding Science Through the Computational Lens.,"Abstract
This article explores the changing nature of the interaction between computer science and the natural and social sciences. After briefly tracing the history of scientific computation, the article presents the concept of computational lens, a metaphor for a new relationship that is emerging between the world of computation and the world of the sciences. Our main thesis is that, in many scientific fields, the processes being studied can be viewed as computational in nature, in the sense that the processes perform dynamic transformations on information represented as digital data. Viewing natural or engineered systems through the lens of their computational requirements or capabilities provides new insights and ways of thinking. A number of examples are discussed in support of this thesis. The examples are from various fields, including quantum computing, statistical physics, the World Wide Web and the Internet, mathematics, and computational molecular biology."
2011,Sorting and Selection in Posets.,"Classical problems of sorting and searching assume an underlying linear ordering of the objects being compared. In this paper, we study these problems in the context of partially ordered sets, in which some pairs of objects are incomparable. This generalization is interesting from a combinatorial perspective, and it has immediate applications in ranking scenarios where there is no underlying linear ordering, e.g., conference submissions. It also has applications in reconstructing certain types of networks, including biological networks. Our results represent significant progress over previous results from two decades ago by Faigle and Tur·n. In particular, we present the first algorithm that sorts a width-w poset of size n with query complexity $O(n(w+\log n))$ and prove that this query complexity is asymptotically optimal. We also describe a variant of Mergesort with query complexity $O(wn\log\frac{n}{w})$ and total complexity $O(w^{2}n\log\frac{n}{w})$; an algorithm with the same query complexity was given by Faigle and Tur·n, but no efficient implementation of that algorithm is known. Both our sorting algorithms can be applied with negligible overhead to the more general problem of reconstructing transitive relations. We also consider two related problems: finding the minimal elements, and its generalization to finding the bottom k ìlevels,î called the k-selection problem. We give efficient deterministic and randomized algorithms for finding the minimal elements with query complexity and total complexity $O(wn)$. We provide matching lower bounds for the query complexity up to a factor of 2 and generalize the results to the k-selection problem. Finally, we present efficient algorithms for computing a linear extension of a poset and computing the heights of all elements.
"
2011,Algorithms to Detect Multiprotein Modularity Conserved during Evolution.,"Abstract
Detecting essential multiprotein modules that change infrequently during evolution is a challenging algorithmic task that is important for understanding the structure, function, and evolution of the biological cell. In this paper, we present a linear-time algorithm, Produles, that improves on the running time of previous algorithms. We present a biologically motivated graph theoretic set of algorithm goals complementary to previous evaluation measures, demonstrate that Produles attains these goals more comprehensively than previous algorithms, and exhibit certain recurrent anomalies in the performance of previous algorithms that are not detected by previous measures."
2011,Pedigree Reconstruction Using Identity by Descent.,"Abstract
Can we find the family trees, or pedigrees, that relate the haplotypes of a group of individuals? Collecting the genealogical information for how individuals are related is a very time-consuming and expensive process. Methods for automating the construction of pedigrees could stream-line this process. While constructing single-generation families is relatively easy given whole genome data, reconstructing multi-generational, possibly inbred, pedigrees is much more challenging.
This paper addresses the important question of reconstructing monogamous, regular pedigrees, where pedigrees are regular when individuals mate only with other individuals at the same generation. This paper introduces two multi-generational pedigree reconstruction methods: one for inbreeding relationships and one for outbreeding relationships. In contrast to previous methods that focused on the independent estimation of relationship distances between every pair of typed individuals, here we present methods that aim at the reconstruction of the entire pedigree. We show that both our methods out-perform the state-of-the-art and that the outbreeding method is capable of reconstructing pedigrees at least six generations back in time with high accuracy.
The two programs are available at http://cop.icsi.berkeley.edu/ cop/"
2011,Algorithms for Implicit Hitting Set Problems.,"A hitting set for a collection of sets is a set that has a nonempty intersection with each set in the collection; the hitting set problem is to find a hitting set of minimum cardinality. Motivated by instances of the hitting set problem where the number of sets to be hit is large, we introduce the notion of implicit hitting set problems. In an implicit hitting set problem the collection of sets to be hit is typically too large to list explicitly; instead, an oracle is provided which, given a set H, either determines that H is a hitting set or returns a set that H does not hit. We show a number of examples of classic implicit hitting set problems, and give a generic algorithm for solving such problems optimally. The main contribution of this paper is to show that this framework is valuable in developing approximation algorithms. We illustrate this methodology by presenting a simple on-line algorithm for the minimum feedback vertex set problem on random graphs. In particular our algorithm gives a feedback vertex set of size nñ(1/p) log np(1 ? o(1)) with probability at least 3/4 for the random graph Gn,p (the smallest feedback vertex set is of size n ? (2/p) log np(1 + o(1))). We also consider a planted model for the feedback vertex set in directed random graphs. Here we show that a hitting set for a polynomial-sized subset of cycles is a hitting set for the planted random graph and this allows us to exactly recover the planted feedback vertex set.
"
2010,Topology-Free Querying of Protein Interaction Networks.,"In the network querying problem, one is given a protein complex or pathway of species A and a proteinñprotein interaction network of species B; the goal is to identify subnetworks of B that are similar to the query in terms of sequence, topology, or both. Existing approaches mostly depend on knowledge of the interaction topology of the query in the network of species A; however, in practice, this topology is often not known. To address this problem, we develop a topology-free querying algorithm, which we call Torque. Given a query, represented as a set of proteins, Torque seeks a matching set of proteins that are sequence-similar to the query proteins and span a connected region of the network, while allowing both insertions and deletions. The algorithm uses alternatively dynamic programming and integer linear programming for the search task. We test Torque with queries from yeast, fly, and human, where we compare it to the QNet topology-based approach, and with queries from less studied species, where only topology-free algorithms apply. Torque detects many more matches than QNet, while giving results that are highly functionally coherent.
"
2010,Haplotype Inference in Complex Pedigrees.,"Despite the desirable information contained in complex pedigree data sets, analysis methods struggle to efficiently process these data. The attractiveness of pedigree data is their power for detecting rare variants, particularly in comparison with studies of unrelated individuals. In addition, rather than assuming individuals in a study are unrelated, knowledge of their relationships can avoid spurious results due to confounding population structure effects. However, a major challenge for applying pedigree methods is difficulty in handling complex pedigrees having multiple founding lineages, inbreeding, and half-sibling relationships.
A key ingredient in association studies is imputation and inference of haplotypes from genotype data. Existing haplotype inference methods either do not efficiently scale to complex pedigrees or are of limited accuracy. In this article, we present algorithms for efficient haplotype inference and imputation in complex pedigrees. Our method, PhyloPed, leverages the perfect phylogeny model, resulting in an efficient method with high accuracy. PhyloPed effectively combines the founder haplotype information from different lineages and is immune to inaccuracies in prior information about the founders. In addition, we demonstrate that inference of missing data, using PhyloPed, can substantially improve disease association. 
"
