2006,Reconstructing Chain Functions in Genetic Networks.,"The following problems arise in the analysis of biological networks: We have a boolean function of n variables, each of which has some default value. An experiment fixes the values of any subset of the variables, the remaining variables assume their default values, and the function value is the result of the experiment. How many experiments are needed to determine (reconstruct) the function? How many experiments that involve fixing at most q values are needed? What are the answers to these questions when an unknown subset of the variables are actually involved in the function? In the biological context, the variables are genes and the values are gene expression intensities. An experiment measures the gene levels under conditions that perturb the values of a subset of the genes. The goal is to reconstruct the particular logic (regulation function) by which a subset of the genes together regulate one target gene, using few experiments that involve minor perturbations. We study these questions under the assumption that all functions belong to a biologically motivated set of so?called chain functions. We give optimal reconstruction schemes for several scenarios and show their application in reconstructing the regulation of galactose utilization in yeast.

"
2006,Fair Bandwidth Allocation Without Per-Flow State.,"Abstract
A fundamental goal of Internet congestion control is to allocate limited bandwidth fairly to competing flows. Such flow control involves an interplay between the behavior of routers and the behavior of end hosts. Routers must decide which packets to drop when their output links become congested. End hosts must decide how to moderate their packet transmissions in response to feedback in the form of acknowledgements of packet delivery (acks). Typically this is done according to the TCP protocol, in which a host maintains a window (the number of packets that have been sent but not yet acknowledged) that is increased when an ack is received and decreased when a drop is detected.
Often the selection of packets to be dropped at a router depends on the order of their arrivals at the router but not on the flows to which the packets belong. An exception occurs when packets are stratified according to their quality of service guarantee; in this case packets at higher strata are given priority, but within a stratum the packets from different flows receive the same treatment. A number of methods have been proposed to ensure fairness by selectively dropping packets from flows that are receiving more than their fair share of bandwidth. The most effective known algorithms for detecting and selectively dropping high-rate flows at a router are based on random hashing or random sampling of packets and give only probabilistic guarantees. The known deterministic algorithms either require excessive storage, require packets to carry accurate estimates of the rates of their flows, assume some special properties of the stream of arriving packets, or fail to guarantee fairness. In a simplified theoretical setting we show that the detection and selective dropping of high-rate flows can be accomplished deterministically without any of these defects. This result belies the conventional wisdom that per-flow state is required to guarantee fairness.
Given an arriving stream of packets, each labeled with the name of its flow, our algorithm drops packets selectively upon arrival so as to guarantee that, in every consecutive subsequence of the stream of surviving packets, no flow has significantly more than its fair share of the packets. The main results of the paper are tight bounds on the worst-case storage requirement of this algorithm. The bounds demonstrate that the storage and computation required to guarantee fairness are easily within the capabilites of conventional routers.
It is important to acknowedge the limitations of this work. We have formulated the achievement of fairness at a router in terms of local information on the stream of arriving packets at that router. The implications of such a locally optimal policy on the global stability of the Internet would require analyzing the Internet as a complex dynamical system involving interactions among routers and end hosts, of which some will be TCP-compliant and some will not. In work not reported here we have made an initial simulation study of this complex process, but such a study is outside the scope of the present paper."
2006,Optimal Flow Distribution Among Multiple Channels with Unknown Capacities .,"Abstract
Consider a simple network flow problem in which a flow of value D must be split among n channels directed from a source to a sink. The initially unknown channel capacities can be probed by attempting to send a flow of at most D units through the network. If the flow is not feasible, we are told on which channels the capacity was exceeded (binary feedback) and possibly also how many units of flow were successfully sent on these channels (throughput feedback). For throughput feedback we present optimal protocols for minimizing the number of rounds needed to find a feasible flow and for minimizing the total amount of wasted flow. For binary feedback we present an asymptotically optimal protocol."
2006,On the price of heterogeneity in parallel systems.,"Suppose we have a parallel or distributed system whose nodes have limited capacities, such as processing speed, bandwidth, memory, or disk space. How does the performance of the system depend on the amount of heterogeneity of its capacity distribution? We propose a general framework to quantify the worst-case effect of increasing heterogeneity in models of parallel systems. Given a cost function g(C,W) representing the system's performance as a function of its nodes' capacities C and workload W (such as the completion time of an optimum schedule of jobs W on machines C), we say that g has price of heterogeneity Œ± when for any workload, cost cannot increase by more than a factor Œ± if node capacities become arbitrarily more heterogeneous. We give constant bounds on the price of heterogeneity of several well-known job scheduling and graph degree/diameter problems, indicating that increasing heterogeneity can never be much of a disadvantage. On the other hand, with the introduction of timing constraints such as release times or precedence constraints on the jobs, the dependence on node capacities becomes more complex, so that increasing heterogeneity may be quite detrimental."
2005,Optimal flow distribution among multiple channels with unknown capacities.,"Consider a simple network flow problem in which a flow of value D must be split among n channels directed from a source to a sink. The initially unknown channel capacities can be probed by attempting to send a flow of at most D units through the network. If the flow is not feasible, we are told on which channels the capacity was exceeded (binary feedback) and possibly also how many units of flow were successfully sent on these channels (throughput feedback). For throughput feedback we present optimal protocols for minimizing the number of rounds needed to find a feasible flow and for minimizing the total amount of wasted flow. For binary feedback we present an asymptotically optimal protocol.
"
2005,Identification of Protein Complexes by Comparative Analysis of Yeast and Bacterial Protein Interaction Data.,"Mounting evidence shows that many protein complexes are conserved in evolution. Here we use conservation to find complexes that are common to the yeast S. cerevisiae and the bacteria H. pylori. Our analysis combines protein interaction data that are available for each of the two species and orthology information based on protein sequence comparison. We develop a detailed probabilistic model for protein complexes in a single species and a model for the conservation of complexes between two species. Using these models, one can recast the question of finding conserved complexes as a problem of searching for heavy subgraphs in an edge- and node-weighted graph, whose nodes are orthologous protein pairs. We tested this approach on the data currently available for yeast and bacteria and detected 11 significantly conserved complexes. Several of these complexes match very well with prior experimental knowledge on complexes in yeast only and serve for validation of our methodology. The complexes suggest new functions for a variety of uncharacterized proteins. By identifying a conserved complex whose yeast proteins function predominantly in the nuclear pore complex, we propose that the corresponding bacterial proteins function as a coherent cellular membrane transport system. We also compare our results to two alternative methods for detecting complexes and demonstrate that our methodology obtains a much higher specificity.
"
2005,The minimum-entropy set cover problem.,"Abstract
We consider the minimum entropy principle for learning data generated by a random source and observed with random noise.
In our setting we have a sequence of observations of objects drawn uniformly at random from a population. Each object in the population belongs to one class. We perform an observation for each object which determines that it belongs to one of a given set of classes. Given these observations, we are interested in assigning the most likely class to each of the objects.
This scenario is a very natural one that appears in many real life situations. We show that under reasonable assumptions finding the most likely assignment is equivalent to the following variant of the set cover problem. Given a universe U and a collection
of subsets of U, we wish to find an assignment
such that
and the entropy of the distribution defined by the values
is minimized.
We show that this problem is NP-hard and that the greedy algorithm for set cover s with an additive constant error with respect to the optimal cover. This sheds a new light on the behavior of the greedy set cover algorithm. We further enhance the greedy algorithm and show that the problem admits a polynomial time approximation scheme (PTAS).
Finally, we demonstrate how this model and the greedy algorithm can be useful in real life scenarios, and in particular, in problems arising naturally in computational biology."
2005,Verification decoding of raptor codes.,"Abstract:
In this paper we extend the double verification algorithm of Luby and Mitzenmacher to the class of Raptor codes, analyze it, and design Raptor codes that perform very well with respect to this algorithm"
2005,Efficient Algorithms for Detecting Signaling Pathways in Protein Interaction Networks.,"Abstract
The interpretation of large-scale protein network data depends on our ability to identify significant sub-structures in the data, a computationally intensive task. Here we adapt and extend efficient techniques for finding paths in graphs to the problem of identifying pathways in protein interaction networks. We present linear-time algorithms for finding paths in networks under several biologically-motivated constraints. We apply our methodology to search for protein pathways in the yeast protein-protein interaction network. We demonstrate that our algorithm is capable of reconstructing known signaling pathways and identifying functionally enriched paths in an unsupervised manner. The algorithm is very efficient, computing optimal paths of length 8 within minutes and paths of length 10 in less than two hours."
2004,Logos: a Modular Bayesian Model for de Novo Motif Detection.,"The complexity of the global organization and internal structure of motifs in higher eukaryotic organisms raises significant challenges for motif detection techniques. To achieve successful de novo motif detection, it is necessary to model the complex dependencies within and among motifs and to incorporate biological prior knowledge. In this paper, we present LOGOS, an integrated LOcal and GlObal motif Sequence model for biopolymer sequences, which provides a principled framework for developing, modularizing, extending and computing expressive motif models for complex biopolymer sequence analysis. LOGOS consists of two interacting submodels: HMDM, a local alignment model capturing biological prior knowledge and positional dependency within the motif local structure; and HMM, a global motif distribution model modeling frequencies and dependencies of motif occurrences. Model parameters can be fit using training motifs within an empirical Bayesian framework. A variational EM algorithm is developed for de novo motif detection. LOGOS improves over existing models that ignore biological priors and dependencies in motif structures and motif occurrences, and demonstrates superior performance on both semi-realistic test data and cis-regulatory sequences from yeast and Drosophila genomes with regard to sensitivity, specificity, flexibility and extensibility.
"
2004,Towards Optimally Multiplexed Applications of Universal Arrays.,"We study a design and optimization problem that occurs, for example, when single nucleotide polymorphisms (SNPs) are to be genotyped using a universal DNA tag array. The problem of optimizing the universal array to avoid disruptive cross-hybridization between universal components of the system was addressed in previous work. Cross-hybridization can, however, also occur assay specifically, due to unwanted complementarity involving assay-specific components. Here we examine the problem of identifying the most economic experimental configuration of the assay-specific components that avoids cross-hybridization. Our formalization translates this problem into the problem of covering the vertices of one side of a bipartite graph by a minimum number of balanced subgraphs of maximum degree 1. We show that the general problem is NP-complete. However, in the real biological setting, the vertices that need to be covered have degrees bounded by d. We exploit this restriction and develop an O(d)-approximation algorithm for the problem. We also give an O(d)-approximation for a variant of the problem in which the covering subgraphs are required to be vertex disjoint. In addition, we propose a stochastic model for the input data and use it to prove a lower bound on the cover size. We complement our theoretical analysis by implementing two heuristic approaches and testing their performance on synthetic data as well as on simulated SNP data.
"
2004,MotifPrototyper: A Bayesian profile model for motif families.,"In this article, we address the problem of modeling generic features of structurally but not textually related DNA motifs, that is, motifs whose consensus sequences are entirely different but nevertheless share ìmetasequence featuresî reflecting similarities in the DNA-binding domains of their associated protein recognizers. We present MotifPrototyper, a profile Bayesian model that can capture structural properties typical of particular families of motifs. Each family corresponds to transcription regulatory proteins with similar types of structural signatures in their DNA-binding domains. We show how to train MotifPrototypers from biologically identified motifs categorized according to the TRANSFAC categorization of transcription factors and present empirical results of motif classification, motif parameter estimation, and de novo motif detection by using the learned profile models.
"
2004,The Minimum-Entropy Set Cover Problem.,"Abstract
We consider the minimum entropy principle for learning data generated by a random source and observed with random noise.
In our setting we have a sequence of observations of objects drawn uniformly at random from a population. Each object in the population belongs to one class. We perform an observation for each object which determines that it belongs to one of a given set of classes. Given these observations, we are interested in assigning the most likely class to each of the objects.
This scenario is a very natural one that appears in many real life situations. We show that under reasonable assumptions finding the most likely assignment is equivalent to the following variant of the set cover problem. Given a universe U and a collection
S=(
S
1
,‚Ä¶,
S
m
)
S
of subsets of U, we wish to find an assignment
f:U‚ÜíS
f
such that u ‚àà f(u) and the entropy of the distribution defined by the values |f ‚àí‚Äâ‚àí‚Äâ1(S i )| is minimized.
We show that this problem is NP-hard and that the greedy algorithm for set cover finds a cover with an additive constant error with respect to the optimal cover. This sheds a new light on the behavior of the greedy set cover algorithm. We further enhance the greedy algorithm and show that the problem admits a polynomial time approximation scheme (PTAS).
Finally, we demonstrate how this model and the greedy algorithm can be useful in real life scenarios, and in particular, in problems arising naturally in computational biology."
2004,Load Balancing in Dynamic Structured P2P Systems.,"Abstract:
Most P2P systems that provide a DHT abstraction distribute objects randomly among ""peer nodes"" in a way that results in some nodes having /spl theta/(log N) times as many objects as the average node. Further imbalance may result due to non-uniform distribution of objects in the identifier space and a high degree of heterogeneity in object loads and node capacities. Additionally, a node's load may vary greatly over time since the system can be expected to experience continuous insertions and deletions of objects, skewed object arrival patterns, and continuous arrival and departure of nodes. We propose an algorithm for load balancing in such heterogeneous, dynamic P2P systems. Our simulation results show that in the face of rapid arrivals and departures of objects of widely varying load, our algorithm achieves load balancing for system utilizations as high as 90% while moving only about 8% of the load that arrives into the system. Similarly, in a dynamic system where nodes arrive and depart, our algorithm moves less than 60% of the load the underlying DHT moves due to node arrivals and departures. Finally, we show that our distributed algorithm performs only negligibly worse than a similar centralized algorithm, and that node heterogeneity helps, not hurts, the scalability of our algorithm."
2004,Finite length analysis of LT codes.,"Abstract:
This paper provides an efficient method for analyzing the error probability of the belief propagation (BP) decoder applied to LT Codes. Each output symbol is generated independently by sampling from a distribution and adding the input symbols corresponding to the support of the sampled vector."
2004,Global Synchronization in Sensornets.,"Abstract
Time synchronization is necessary in many distributed systems, but achieving synchronization in sensornets, which combine stringent precision requirements with severe resource constraints, is particularly challenging. This challenge has been met by the recent Reference-Broadcast Synchronization (RBS) proposal, which provides on-demand pairwise synchronization with low overhead and high precision. In this paper we introduce a model of the basic RBS synchronization paradigm. Within the context of this model we characterize the optimally precise clock synchronization algorithm and establish its global consistency. In the course of this analysis we point out unexpected connections between optimal clock synchronization, random walks, and resistive networks, and present a polynomial-time approximation scheme for the problem of calculating the effective resistance in a network based on min-cost flow. We also sketch a polynomial-time algorithm for finding a schedule of data acquisition giving the optimal trade-off between energy consumption and precision of clock synchronization. We also discuss synchronization in the presence of clock skews. In ongoing work we are adapting our synchronization algorithm for execution in a network of seismic sensors that requires global clock consistency."
2004,Reconstructing Chain Functions in Genetic Networks.,"Deciphering the mechanisms that control gene expression in the cell is a fundamental question in molecular biology. This task is complicated by the large number of possible regulation relations in the cell, and the relatively small amount of available experimental data. Recently, a new class of regulation functions called chain functions was suggested. Many signal transduction pathways can be accurately modeled by chain functions, and the restriction to chain functions greatly reduces the vast search space of regulation relations. In this paper we study the computational problem of reconstructing a chain function using a minimum number of experiments, in each of which only few genes are perturbed. We give optimal reconstruction schemes for several scenarios and show their application in reconstructing the regulation of galactose utilization in yeast."
2004,Perfect phylogeny and haplotype assignment.,"This paper is concerned with the reconstruction of perfect phylogenies from binary character data with missing values, and related problems of inferring complete haplotypes from haplotypes or genotypes with missing data. In cases where the problems considered are NP-hard we assume a rich data hypothesis under which they become tractable. Natural probabilistic models are introduced for the generation of character vectors, haplotypes or genotypes with missing data, and it is shown that these models support the rich data hypothesis. The principal results include:
A near-linear time algorithm for inferring a perfect phylogeny from binary character data (or haplotype data) with missing values, under the rich data hypothesis;
A quadratic-time algorithm for inferring a perfect phylogeny from genotype data with missing values with high probability, under certain distributional assumptions;
Demonstration that the problems of maximum-likelihood inference of complete haplotypes from partial haplotypes or partial genotypes can be cast as minimum-entropy disjoint set cover problems;
In the case where the haplotypes come from a perfect phylogeny, a representation of the set cover problem as minimum-entropy covering of subtrees of a tree by nodes;
An exact algorithm for minimum-entropy subtree covering, and demonstration that it runs in polynomial time when the subtrees have small diameter;
Demonstration that a simple greedy approximation algorithm solves the minimum-entropy subtree covering problem with relative error tending to zero when the number of partial haplotypes per complete haplotype is large;
An asymptotically consistent method of estimating the frequencies of the complete haplotypes in a perfect phylogeny, under an iid model for the distribution of missing data;
Computational results on real data demonstrating the effectiveness of a the greedy algorithm for inferring haplotypes from genotypes with missing data, even in the absence of a perfect phylogeny.
."
2004,Algorithms for inferring cis-regulatory structures and protein interaction networks.,"A major focus of functional genomics today is the discovery of the interactions between genes and proteins that regulate the transcription of genes and the responses of cells to external signals. The speaker will describe his recent efforts with several coworkers to solve pieces of this puzzle. The work divides into several parts:
A new approach to the recognition of transcription-factor binding sites, based on the principle that transcription factors divide naturally into families such as the leucine zippers and the zinc fingers, and that the binding site motifs for transcription factors within the same family have common features. These features may be obscure at the sequence level, but can be characterized at a higher level of description. By discovering and modeling such meta-sequence features one can improve the sensitivity and specificity with which binding sites can be determined for transcription factors within a family. [5], [6]
An algorithm and an associated web-based tool for finding recurrent cis-regulatory modules in the promoter regions of human genes. Each such module consists of a set of transcription factors that often bind to the same promoter regions and collectively enhance or inhibit the transcription of the corresponding genes. [4]
An algorithm for minimizing the number of gene perturbation experiments required to reconstruct signal transduction pathways whose regulatory structures can be described within the mathematical framework of chain functions. [1]
Algorithms for discovering protein complexes and regulatory pathways that are conserved in evolution, using protein sequence data and protein-protein interaction data for two or more organisms. [2], [3]."
