2002,The restriction scaffold problem.,"Most shotgun sequencing projects undergo a long and costly phase of finishing, in which a partial assembly forms several contigs whose order, orientation and relative distance is unknown. We propose here a new technique that supplements the shotgun assembly data by cheap and simple complete restriction digests of the target. By computationally combining information from the contig sequences and the fragment sizes measured for several different enzymes, we seek to form a ""scaffold"" on which the contigs will be placed in their correct orientation, order and distance. We give a heuristic search algorithm for solving the problem and report on promising preliminary simulation results. The key to the success of the search scheme is the very rapid solution of its two time-critical subproblems that are solved precisely in linear time.Our simulations indicate that with noise levels of some 3% relative error in measuring fragment sizes, using five enzymes, most datasets of 20 contigs can be correctly ordered, and the remaining ones have most of their pairs of neighboring contigs correct. Hence, the technique has a potential to provide real help to finishing. Even when the target clone remains unfinished, the ability to order and orient the contigs correctly makes the partial assembly both more accessible and more useful for biologists."
2002,Selfish behavior and stability of the internet: a game-theoretic analysis of TCP.,"For years, the conventional wisdom [7, 22] has been that the continued stability of the Internet depends on the widespread deployment of ""socially responsible"" congestion control. In this paper, we seek to answer the following fundamental question: If network end-points behaved in a selfish manner, would the stability of the Internet be endangered?.We evaluate the impact of greedy end-point behavior through a game-theoretic analysis of TCP. In this ""TCP Game"" each flowattempts to maximize the throughput it achieves by modifying its congestion control behavior. We use a combination of analysis and simulation to determine the Nash Equilibrium of this game. Our question then reduces to whether the network operates efficiently at these Nash equilibria.Our findings are twofold. First, in more traditional environments -- where end-points use TCP Reno-style loss recovery and routers use drop-tail queues -- the Nash Equilibria are reasonably efficient. However, when endpoints use more recent variations of TCP (e.g., SACK) and routers employ either RED or drop-tail queues, the Nash equilibria are very inefficient. This suggests that the Internet of the past could remain stable in the face of greedy end-user behavior, but the Internet of today is vulnerable to such behavior. Second, we find that restoring the efficiency of the Nash equilibria in these settings does not require heavy-weight packet scheduling techniques (e.g., Fair Queuing) but instead can be done with a very simple stateless mechanism based on CHOKe [21]."
2001,Optimal Search and One-Way Trading Online Algorithms.,"This paper is concerned with the time series search and one-way trading problems. In the (time series) search problem a player is searching for the maximum (or minimum) price in a sequence that unfolds sequentially, one price at a time. Once during this game the player can decide to accept the current price p in which case the game ends and the player's payoff is p . In the one-way trading problem a trader is given the task of trading dollars to yen. Each day, a new exchange rate is announced and the trader must decide how many dollars to convert to yen according to the current rate. The game ends when the trader trades his entire dollar wealth to yen and his payoff is the number of yen acquired.
The search and one-way trading are intimately related. Any (deterministic or randomized) one-way trading algorithm can be viewed as a randomized search algorithm. Using the competitive ratio as a performance measure we determine the optimal competitive performance for several variants of these problems. In particular, we show that a simple threat-based strategy is optimal and we determine its competitive ratio which yields, for realistic values of the problem parameters, surprisingly low competitive ratios.
We also consider and analyze a one-way trading game played against an adversary called Nature where the online player knows the probability distribution of the maximum exchange rate and that distribution has been chosen by Nature. Finally, we consider some applications for a special case of portfolio selection called two-way trading in which the trader may trade back and forth between cash and one asset.
"
2001,Algorithms for graph partitioning on the planted partition model.,"The NP?hard graph bisection problem is to partition the nodes of an undirected graph into two equal?sized groups so as to minimize the number of edges that cross the partition. The more general graph l?partition problem is to partition the nodes of an undirected graph into l equal?sized groups so as to minimize the total number of edges that cross between groups. We present a simple, linear?time algorithm for the graph l?partition problem and we analyze it on a random ìplanted l?partitionî model. In this model, the n nodes of a graph are partitioned into l groups, each of size n/l; two nodes in the same group are connected by an edge with some probability p, and two nodes in different groups are connected by an edge with some probability r<p. We show that if p?r?n?1/2+? for some constant ?, then the algorithm finds the optimal partition with probability 1? exp(?n?(?)).?© 2001 John Wiley & Sons, Inc.?Random Struct. Alg., 18: 116ñ140, 2001
"
2001,Theoretical Improvements in Algorithmic Efficiency for Network Flow Problems.,"Abstract
This paper presents new algorithms for the maximum flow problem, the Hitchcock transportation problem and the general minimum-cost flow problem. Upper bounds on the number of steps in these algorithms are derived, and are shown to improve on the upper bounds of earlier algorithms."
2001,Feature selection for high-dimensional genomic microarray data.,"We report on the successful application of feature selection methods to a classification problem in molecular biology involving only 72 data points in a 7130 dimensional space. Our approach is a hybrid of filter and wrapper approaches to feature selection. We make use of a sequence of simple filters, culminating in Koller and Sahamiís (1996) Markov Blanket filter, to decide on particular feature subsets for each subset cardinality. We compare between the resulting subset cardinalities using cross validation. The paper also investigates regularization methods as an alternative to feature selection, showing that feature selection methods are preferable in this problem."
2001,CLIFF: clustering of high-dimensional microarray data via iterative feature filtering using normalized cuts.,"We present CLIFF, an algorithm for clustering biological samples using gene expression microarray data. This clustering problem is difficult for several reasons, in particular the sparsity of the data, the high dimensionality of the feature (gene) space, and the fact that many features are irrelevant or redundant. Our algorithm iterates between two computational processes, feature filtering and clustering. Given a reference partition that approximates the correct clustering of the samples, our feature filtering procedure ranks the features according to their intrinsic discriminability, relevance to the reference partition, and irredundancy to other relevant features, and uses this ranking to select the features to be used in the following round of clustering. Our clustering algorithm, which is based on the concept of a normalized cut, clusters the samples into a new reference partition on the basis of the selected features. On a well-studied problem involving 72 leukemia samples and 7130 genes, we demonstrate that CLIFF outperforms standard clustering approaches that do not consider the feature selection issue, and produces a result that is very close to the original expert labeling of the sample set."
2001,Application-Level Multicast Using Content-Addressable Networks.,"Abstract
Most currently proposed solutions to application-level multicast organise the group members into an application-level mesh over which a Distance-Vector routingp rotocol, or a similar algorithm, is used to construct source-rooted distribution trees. The use of a global routing protocol limits the scalability of these systems. Other proposed solutions that scale to larger numbers of receivers do so by restricting the multicast service model to be single-sourced. In this paper, we propose an application-level multicast scheme capable of scaling to large group sizes without restrictingthe service model to a single source. Our scheme builds on recent work on Content-Addressable Networks (CANs). Extendingthe CAN framework to support multicast comes at trivial additional cost and, because of the structured nature of CAN topologies, obviates the need for a multicast routingalg orithm. Given the deployment of a distributed infrastructure such as a CAN, we believe our CAN-based multicast scheme offers the dual advantages of simplicity and scalability."
2001,A scalable content-addressable network.,"Hash tables - which map ""keys"" onto ""values"" - are an essential building block in modern software systems. We believe a similar functionality would be equally valuable to large distributed systems. In this paper, we introduce the concept of a Content-Addressable Network (CAN) as a distributed infrastructure that provides hash table-like functionality on Internet-like scales. The CAN is scalable, fault-tolerant and completely self-organizing, and we demonstrate its scalability, robustness and low-latency properties through simulation."
2000,Algorithms for Optical Mapping.,"Optical mapping is a novel technique for determining the restriction sites on a DNA molecule by directly observing a number of partially digested copies of the molecule under a light microscope. The problem is complicated by uncertainty as to the orientation of the molecules and by erroneous detection of cuts. In this paper we study the problem of constructing a restriction map based on optical mapping data. We give several variants of a polynomial reconstruction algorithm, as well as an algorithm that is exponential in the number of cut sites, and hence is appropriate only for small number of cut sites. We give a simple probabilistic model for data generation and for the errors and prove probabilistic upper and lower bounds on the number of molecules needed by each algorithm in order to obtain a correct map, expressed as a function of the number of cut sites and the error parameters. To the best of our knowledge, this is the first probabilistic analysis of algorithms for the problem. We also provide experimental results confirming that our algorithms are highly effective on simulated data.
"
2000,Universal DNA Tag Systems: A Combinatorial Design Scheme.,"Custom-designed DNA arrays offer the possibility of simultaneously monitoring thousands of hybridization reactions. These arrays show great potential for many medical and scientific applications, such as polymorphism analysis and genotyping. Relatively high costs are associated with the need to specifically design and synthesize problem-specific arrays. Recently, an alternative approach was suggested that utilizes fixed, universal arrays. This approach presents an interesting design problem - the arrays should contain as many probes as possible, while minimizing experimental errors caused by cross-hybridization. We use a simple thermodynamic model to cast this design problem in a formal mathematical framework. Employing new combinatorial ideas, we derive an efficient construction for the design problem and prove that our construction is near-optimal.
"
2000,An Algorithm Combining Discrete and Continuous Methods for Optical Mapping.,"Optical mapping is a novel technique for generating the restriction map of a DNA molecule by observing many single, partially digested copies of it, using fluorescence microscopy. The real-life problem is complicated by numerous factors: false positive and false negative cut observations, inaccurate location measurements, unknown orientations, and faulty molecules. We present an algorithm for solving the real-life problem. The algorithm combines continuous optimization and combinatorial algorithms applied to a nonuniform discretization of the data. We present encouraging results on real experimental data and on simulated data.
"
2000,An Optimal Algorithm for Monte Carlo Estimation.,"A typical approach to estimate an unknown quantity $\mu$ is to design an experiment that produces a random variable Z, distributed in [0,1] with E[Z]=\mu$, run this experiment independently a number of times, and use the average of the outcomes as the estimate. In this paper, we consider the case when no a priori information about Z is known except that is distributed in [0,1]. We describe an approximation algorithm ${\cal A}{\cal A}$ which, given $\epsilon$ and $\delta$, when running independent experiments with respect to any Z, produces an estimate that is within a factor $1+\epsilon$ of $\mu$ with probability at least $1-\delta$. We prove that the expected number of experiments run by ${\cal A}{\cal A}$ (which depends on Z) is optimal to within a constant factor {for every} Z.
"
2000,Parallel Sorting with Limited Bandwidth.,"We study the problem of sorting on a parallel computer with limited communication bandwidth. By using the PRAM(m) model, where p processors communicate through a globally shared memory which can service m requests per unit time, we focus on the trade-off between the amount of local computation and the amount of interprocessor communication required for parallel sorting algorithms. Our main result is a lower bound of $\Omega(\frac{n \log m}{m \log n})$ on the time required to sort n numbers on the exclusive-read and queued-read variants of the PRAM(m). We also show that Leighton's Columnsort can be used to give an asymptotically matching upper bound in the case where m grows as a fractional power of n. The bounds are of a surprising form in that they have little dependence on the parameter p. This implies that attempting to distribute the workload across more processors while holding the problem size and the size of the shared memory fixed will not improve the optimal running time of sorting in this model. We also show that both the lower and the upper bounds can be adapted to bridging models that address the issue of limited communication bandwidth: the LogP model and the bulk-synchronous parallel (BSP) model. The lower bounds provide further convincing evidence that efficient parallel algorithms for sorting rely strongly on high communication bandwidth."
2000,Optimization Problems in Congestion Control.,"Abstract:
One of the crucial elements in the Internet's success is its ability to adequately control congestion. The paper defines and solves several optimization problems related to Internet congestion control, as a step toward understanding the virtues of the TCP congestion control algorithm currently used and comparing it with alternative algorithms. We focus on regulating the rate of a single unicast flow when the bandwidth available to it is unknown and may change over time. We determine near-optimal policies when the available bandwidth is unchanging, and near-optimal competitive policies when the available bandwidth is changing in a restricted manner under the control of an adversary."
2000,Randomized Rumor Spreading.,"Abstract:
Investigates the class of epidemic algorithms that are commonly used for the lazy transmission of updates to distributed copies of a database. These algorithms use a simple randomized communication mechanism to ensure robustness. Suppose n players communicate in parallel rounds in each of which every player calls a randomly selected communication partner. In every round, players can generate rumors (updates) that are to be distributed among all players. Whenever communication is established between two players, each one must decide which of the rumors to transmit. The major problem is that players might not know which rumors their partners have already received. For example, a standard algorithm forwarding each rumor form the calling to the called players for /spl Theta/(ln n) rounds needs to transmit the rumor /spl Theta/(n ln n) times in order to ensure that every player finally receives the rumor with high probability. We investigate whether such a large communication overhead is inherent to epidemic algorithms. On the positive side, we show that the communication overhead can be reduced significantly. We give an algorithm using only O(n ln ln n) transmissions and O(ln n) rounds. In addition, we prove the robustness of this algorithm. On the negative side, we show that any address-oblivious algorithm needs to send /spl Omega/(n ln ln n) messages for each rumor, regardless of the number of rounds. Furthermore, we give a general lower bound showing that time and communication optimality cannot be achieved simultaneously using random phone calls, i.e. every algorithm that distributes a rumor in O(ln n) rounds needs /spl omega/(n) transmissions."
2000,The Genomics Revolution and Its Challenges for Algorithmic Research.,"Abstract
A fundamental goal of biology is to understand how living cells work. Recent developments in biotechnology and information processing have revolutionized this research field. Computational biology is a major component of this revolution and a fertile source of interesting problems related to algorithm design, combinatorics, statistics, combinatorial optimization, pattern recognition, data mining and computational learning theory. The speaker will provide an overview of this field, describing such areas as genomic mapping and sequencing, sequence analysis and analysis of gene expression data. He will then describe how his research in this field has called upon his background in theoretical computer science but required a shift in his approach to the design and development of algorithms."
2000,Universal DNA tag systems: a combinatorial design scheme.,"Custom-designed DNA arrays offer the possibility of simultaneously monitoring thousands of hybridization reactions These arrays show great potential for many medical and scientific applications such as polymorphism analysis and genotyping. Relatively high costs are associated with the need to specifically design and synthesize problem specific arrays. Recently, an alternative approach was suggested that utilizes fixed, universal arrays. This approach presents an interesting design problem‚Äîthe arrays should contain as many probes as possible, while minimizing experimental errors caused by cross-hybridization. We use a simple thermodynamic model to cast this design problem in a formal mathematical framework. Employing new combinatorial ideas, we derive an efficient construction for the design problem, and prove that our construction is near-optimal."
1999,An Algorithmic Approach to Multiple Complete Digest Mapping.,"Multiple Complete Digest (MCD) mapping is a method of determining the locations of restriction sites along a target DNA molecule. The resulting restriction map has many potential applications in DNA sequencing and genetics. In this work, we present a heuristic algorithm for fragment identification, a key step in the process of constructing an MCD map. Given measurements of the restriction fragment sizes from one or more complete digestions of each clone in a clone library covering the molecule to be mapped, the algorithm identifies groups of restriction fragments on different clones that correspond to the same region of the target DNA. Once these groups are correctly determined the desired map can be constructed by solving a system of simple linear inequalities. We demonstrate the effectiveness of our algorithm on real data provided by the Genome Center at the University of Washington.
"
1999,Error-resilient DNA computation.,"The DNA model of computation, with test tubes of DNA molecules encoding bit sequences, is based on three primitives: Extract?A?Bit, which splits a test tube into two test tubes according to the value of a particular bit x, Merge?Two?Tubes, and Detect?Emptiness. If perfect, these operations can test the satisfiability of any boolean formula in linear time. However, in reality the Extract operation is faulty and misclassifies some of the strands. We consider the following reduction problem: given an algorithm based on perfect Extract, Merge, and Detect operations, convert it to an algorithm that is correct with high probability even though the Extract operation is faulty. The fundamental problem in such a reduction is the simulation of a single highly reliable Extract operation. We determine the number of faulty Extract operations to simulate a highly reliable Extract operation, with matching upper and lower bounds (up to a constant factor). We then propose a reduction to convert any algorithm based on error?free operations to an error?resilient algorithm. In the case of simple n?variable boolean functions, Conjunction, Disjunction, and Parity, we prove that our error?resilient algorithms are optimal.?©1999 John Wiley & Sons, Inc.?Random Struct. Alg., 15, 450ñ466, 1999
"
1999,An Algorithm Combining Discrete and Continuous Methods for Optical Mapping.,"Optical mapping is a novel technique for generating the restriction map of a DNA molecule by observing many single, partially digested, copies of it, using florescence microscopy. The real-life problem is complicated by numerous factors: false positive and false negative cut observations, inaccurate location measurements, unknown orientations and faulty molecules. We present an algorithm for solving the real-life problem. The algorithm combines continuous optimization and combinatorial algorithms, applied to a non-uniform discretization of the data. We present encouraging results on real experimental data."
1999,Algorithms for Graph Partitioning on the Planted Partition Model.,"Abstract
The NP-hard graph bisection problem is to partition the nodes of an undirected graph into two equal-sized groups so as to minimize the number of edges that cross the partition. The more general graph l-partition problem is to partition the nodes of an undirected graph into l equal-sized groups so as to minimize the total number of edges that cross between groups.
We present a simple, linear-time algorithm for the graph l-partition problem and analyze it on a random ‚Äúplanted l-partition‚Äù model. In this model, the n nodes of a graph are partitioned into l groups, each of size n/l; two nodes in the same group are connected by an edge with some probability p, and two nodes in different groups are connected by an edge with some probability r < p. We show that if p ‚Äì r > n ‚Äâ‚àí‚Äâ‚àí‚Äâ1/2‚Äâ+‚ÄâŒµ for some constant Œµ, then the algorithm finds the optimal partition with probability
1‚àíexp(‚àí
n
Œ∏(œµ)
)
1
."
1999,Algorithms for choosing differential gene expression experiments.,"Understanding biological systems at the level of genes and proteins is a major challenge. In this paper we represent the interactions among external environmental inputs and genes in a biological system with a graph-theoretic model called a biological pathway. Our goal is to verify a proposed biological pathway by observing the mRNA levels in the associated biological system under changing external environmental inputs and internal gene perturbations. DNAmicroarrays allow large-scale comparisons of mRNA levels in pairs of cell cultures. A DNA microarray contains thousands of spots, each containing some portion of a gene. In a di erential test, mRNAs from two di erent cell cultures are reverse transcribed to cDNAs, labeled with uorescent dyes of two di erent colors, and applied to the array. The relative hybridization levels of the two cDNAs determine the colors of the spots. These colors form the di erential gene expression data. In this paper we assume that biological pathways can be represented as boolean circuits without feedback, di erential tests can be modeled as perturbations of the external inputs and genes, and di erent classes of genes controlled by the pathway can be associated with different outputs of the boolean circuit. A biological pathway can be veri ed by applying a set of di erential tests and comparing the outcomes of the hybridization experiments with the predicted outputs of the pathway. Thus, selecting an economical set of di erential tests to distinguish all the outputs is essential to the veri cation of biological pathways. In this paper we give an algorithm to construct such a set of tests. We have applied the algorithm to a model of the mating pathway in yeast"
