2013,An inductive characterization of matching in binding bigraphs.,"Abstract
We analyze the matching problem for bigraphs. In particular, we present a sound and complete inductive characterization of matching in bigraphs with binding. Our results yield a specification for a provably correct matching algorithm, as needed by our prototype tool implementing bigraphical reactive systems."
2009,Bigraphical Categories.,"Abstract
Bigraphs are a candidate model that aims to provide a theoretical platform for ubiquitous computing systems. This short paper summarises the categories, and the functors between them, that represent the structure of that theory."
2008,Bigraphs and Their Algebra.,"Abstract
Bigraphs are a framework in which both existing process calculi and new models of behaviour can be formulated, yielding theory that is shared among these models. A short survey of the main features of bigraphs is presented, showing how they can be developed from standard graph theory using elementary category theory. The algebraic manipulation of bigraphs is outlined with the help of illustrations. The treatment of dynamics is then summarised. Finally, origins and some related work are discussed. The paper provides a motivating introduction to bigraphs."
2008,Stochastic Bigraphs.,"Abstract
In this paper we present a stochastic semantics for Bigraphical Reactive Systems. A reduction and a labelled stochastic semantics for bigraphs are defined. As a sanity check, we prove that the two semantics are consistent with each other. We illustrate the expressiveness of the framework with an example of membrane budding in a biological system."
2008,"Categories, Software and Meaning.","Abstract
I am delighted to be able to share in celebrating Ugo’s birthday, if not with a formal paper then at least with some loosely-knit philosophical ideas.
I have worked on ideas similar to Ugo’s for most of our careers. Ugo had much to do with the stream of expert Italians, many now well-known, who travelled from the warmth of Pisa to the romantic but cooler climate of Edinburgh, often to launch their careers with a PhD there. Going further back, I remember with excitement the meeting on parallel processes at Pisa in 1973, organised I believe by Ugo, the first concurrency conference I ever attended."
2007,Local Bigraphs and Confluence: Two Conjectures: (Extended Abstract).,"Abstract
The notion of confluence is studied on the context of bigraphs. Confluence will be important in modelling real-world systems, both natural (as in biology) and artificial (as in pervasive computing). The paper uses bigraphs in which names have multiple locality; this enables a formulation of the lambda calculus with explicit substitutions. The paper reports work in progress, seeking conditions on a bigraphical reactive system that are sufficient to ensure confluence; the conditions must deal with the way that bigraphical redexes can be intricately intertwined. The conditions should also be satisfied by the lambda calculus. After discussion of these issues, two conjectures are put forward."
2007,Matching of Bigraphs.,"Abstract
We analyze the matching problem for bigraphs. In particular, we present a sound and complete inductive characterization of matching of binding bigraphs. Our results pave the way for a provably correct matching algorithm, as needed for an implementation of bigraphical reactive systems."
2006,Ubiquitous Computing: Shall we Understand It?,n/a
2006,Pervasive Process Calculus.,"Abstract
Process calculi with various signatures and reaction rules may provide a theoretical basis for pervasive computing."
2006,Pure bigraphs: Structure and dynamics.,"Abstract
Bigraphs are graphs whose nodes may be nested, representing locality, independently of the edges connecting them. They may be equipped with reaction rules, forming a bigraphical reactive system (Brs) in which bigraphs can reconfigure themselves. Following an earlier paper describing link graphs, a constituent of bigraphs, this paper is a devoted to pure bigraphs, which in turn underlie various more refined forms. Elsewhere it is shown that behavioural analysis for Petri nets, π-calculus and mobile ambients can all be recovered in the uniform framework of bigraphs. The paper first develops the dynamic theory of an abstract structure, a wide reactive system (Wrs), of which a Brs is an instance. In this context, labelled transitions are defined in such a way that the induced bisimilarity is a congruence. This work is then specialised to Brss, whose graphical structure allows many refinements of the theory. The latter part of the paper emphasizes bigraphical theory that is relevant to the treatment of dynamics via labelled transitions. As a running example, the theory is applied to finite pure CCS, whose resulting transition system and bisimilarity are analysed in detail. The paper also mentions briefly the use of bigraphs to model pervasive computing and biological systems."
2006,"Transition systems, link graphs and Petri nets.","A framework is defined within which reactive systems can be studied formally. The framework is based on s-categories, which are a new variety of categories within which reactive systems can be set up in such a way that labelled transition systems can be uniformly extracted. These lead in turn to behavioural preorders and equivalences, such as the failures preorder (treated elsewhere) and bisimilarity, which are guaranteed to be congruential. The theory rests on the notion of relative pushout, which was previously introduced by the authors.

The framework is applied to a particular graphical model, known as link graphs, which encompasses a variety of calculi for mobile distributed processes. The specific theory of link graphs is developed. It is then applied to an established calculus, namely condition-event Petri nets.

In particular, a labelled transition system is derived for condition-event nets, corresponding to a natural notion of observable actions in Petri-net theory. The transition system yields a congruential bisimilarity coinciding with one derived directly from the observable actions. This yields a calibration of the general theory of reactive systems and link graphs against known specific theories."
2006,Journeys in non-classical computation II: initial journeys and waypoints.,n/a
2006,Scientific Foundation for Global Computing.,"Abstract
It is a big honour to be able to speak at one of the most exciting conferences I have been to for 20 years.
I feel in some ways daunted because, although the development of connections between biology and computer science may seem wonderful from outside, we know that they depend crucially on details. We have to believe with confidence that what we have already done justifies bringing the subjects together in this way. I think that’s we are going to see in the later talks. I want to try to anticipate a little bit of that here. But first I want to talk about global computing. We may describe it, fancifully perhaps, as the arrival of a single global computer, which is increasingly pervading lives."
2005,Grand Challenges for Computing Research.,"What are the major research challenges that face the world of computing today? Are there any of them that match the grandeur of well-known challenges in other branches of science? This article is a report on an exercise by the Computing Research Community in the UK to answer these questions, and includes a summary of the outcomes of a BCS-sponsored conference held in Newcastle-upon-Tyne from 29 to 31 March this year.
"
2005,Axioms for bigraphical structure.,"This paper axiomatises the structure of bigraphs, and proves that the resulting theory is complete. Bigraphs are graphs with double structure, representing locality and connectivity. They have been shown to represent dynamic theories for the $\pi$-calculus, mobile ambients and Petri nets in a way that is faithful to each of those models of discrete behaviour. While the main purpose of bigraphs is to understand mobile systems, a prerequisite for this understanding is a well-behaved theory of the structure of states in such systems. The algebra of bigraph structure is surprisingly simple, as this paper demonstrates; this is because bigraphs treat locality and connectivity orthogonally.
"
2005,Journeys in non-classical computation I: A grand challenge for computing research.,n/a
2005,The Spectra of Words.,"Abstract
The k-spectrum of a word is the multiset of its non-contiguous subwords of length k. For given k, how small can n be for a pair of different words of length n to exist, with equal k- spectra? From the Thue-Morse word we find that n is at most 2 k . The construction of this paper decreases this upper bound to θ k , where
≏
is the golden ratio; the construction was found, though not published, over thirty years ago. Recently the bound has been further reduced, but remains considerably greater than the greatest known lower bound."
2005,Embeddings and Contexts for Link Graphs.,"Abstract
Graph-rewriting has been a growing discipline for over three decades. It grew out of the study of graph grammars, in which – analogously to string and tree grammars – a principal interest was to describe the families of graphs that could be generated from a given set of productions. A fundamental contribution was, of course, the double-pushout construction of Ehrig and his colleagues [4]; it made precise how the left-hand side of a production, or rewriting rule, could be found to occur in a host graph, and how it should then be replaced by the right-hand side. This break-through led to many theoretical developments and many applications. It relies firmly upon the treatment of graphs as objects in a category whose arrows are embedding maps."
2004,Theories for the Global Ubiquitous Computer.,"Abstract
This paper describes an initiative to provide theories that can underlie the development of the Global Ubiquitous Computer, the network of ubiquitous computing devices that will pervade the civilised world in the course of the next few decades. We define the goals of the initiative and the criteria for judging whether they are achieved; we then propose a strategy for the exercise. It must combine a bottom-up development of theories in directions that are currently pursued with success, together with a top-down approach in the form of collaborative projects relating these theories to engineered systems that exist or are imminent."
2004,Towards a Broader Theory of Mobile Processes.,"Bigraphs are a topographical model of reactive systems that aim to unify existing theoretical approaches to mobile communicating agents. They combine two structures orthogonally: connectivity and locality. Thus, for example, they represent both ambients and pi-calculus; the topography deals not only with (even physical) locality but also with abstract notions such as the scope of a name. In my talk I shall explain how recent joint work with Jamey Leifer on relative pushouts enables transition systems to be derived for pi-calculus and ambients (in recent work by Ole Jensen), and I shall present condition-event Petri nets as an example."
2003,Bigraphs for Petri Nets.,"Abstract
A simple example is given of the use of bigraphical reactive systems (BRSs). It provides a behavioural semantics for condition-event Petri nets whose interfaces are named condition nodes, using a simple form of BRS equipped with a labelled transition system and its associated bisimilarity equivalence. Both of the latter are derived from the standard net firing rules by a uniform technique in bigraphs, which also ensures that the bisimilarity is a congruence. Furthermore, this bisimilarity is shown to coincide with one induced by a natural notion of experiment on condition-event nets, defined independently of bigraphs.
The paper is intended as a bridge between Petri net theory and bigraphs, as well as a pedagogical exercise in the latter."
2003,Bigraphs and transitions.,"A bigraphical reactive system (BRS) involves bigraphs, in which the nesting of nodes represents locality, independently of the edges connecting them. BRSs represent a wide variety of calculi for mobility, including λ-calculus and ambient calculus. A labelled transition system (LTS) for each BRS is here derived uniformly, adapting previous work of Leifer and Milner, so that under certain conditions the resulting bisimilarity is automatically a congruence. For an asynchronous λ-calculus, this LTS and its bisimilarity agree closely with the standard."
2002,Shallow Linear Action Graphs and their Embeddings.,"Abstract.
Action calculi, which generalise process calculi such as Petri nets, π-calculusand ambient calculus, have been presented in terms of action graphs. We here offer linear action graphs as a primitive basis for action calculi. This paper presents the category of embeddings of undirected linear action graphs without nesting, using a novel form of graphical reasoning which simplifies some otherwise complex manipulations in regular algebra. The results are adapted in a few lines to directed graphs. This work is part of a long-term search for a uniform behavioural theory for process calculi."
2002,Bigraphs as a Model for Mobile Interaction.,"Abstract
A bigraphical reactive system (BRS) involves bigraphs, in which the nesting of nodes represents locality, independently of the edges connecting them. BRSs represent a wide variety of calculi for mobility, including the π-calculus. This short essay explains how bigraphs compose, and uses the π-calculus to illustrate how they already provide elements of a unifying theory for calculi of mobile interactive processes."
2001,The Flux of Interaction.,"Abstract
A graphical model of interactive systems called bigraphs is introduced, resting on the orthogonal treatment of connectivity and locality. The model will be shown to underlie several calculi for mobile systems, in particular the π-calculus and the ambient calculus. Its core behavioural theory will be outlined."
2001,Bigraphical Reactive Systems.,"Abstract
A notion of bigraph is introduced as a model of mobile interaction. A bigraph consists of two independent structures: a topograph representing locality and an edge net representing connectivity. Bigraphs arc equipped with reaction rules to form bigraphical reactive systems (BRSs), which include versions of the π-calculus and the ambient calculus. A behavioural theory is established, using the categorical notion of relative pushout; it allows labelled transition systems to be derived uniformly for a wide variety of BRSs, in such a way that familiar behavioural prcordcrs and equivalences, in particular bisimilarity, are congruential. An example of the derivation is discussed."
2000,Deriving Bisimulation Congruences for Reactive Systems.,"Abstract
The dynamics of reactive systems, e.g. CCS, has often been defined using a labelled transition system (LTS). More recently it has become natural in defining dynamics to use reaction rules - i.e. unlabelled transition rules - together with a structural congruence. But LTSs lead more naturally to behavioural equivalences. So one would like to derive from reaction rules a suitable LTS.
This paper shows how to derive an LTS for a wide range of reactive systems. A label for an agent a is defined to be any context F which intuitively is just large enough so that the agent Fa (“a in context F”) is able to perform a reaction. The key contribution of this paper is a precise definition of “just large enough”, in terms of the categorical notion of relative pushout (RPO), which ensures that bisimilarity is a congruence when sufficient RPOs exist. Two examples - a simplified form of action calculi and term-rewriting - are given, for which it is shown that sufficient RPOs indeed exist. The thrust of this paper is, therefore, towards a general method for achieving useful behavioural congruence relations."
2000,Graphical Theories of Interactive Systems: Can a Proof Assistant Help?,"Abstract
Computer scientists are privileged, or doomed, to deal rigorously with large structures. This happens, of course, with hardware design and verification, and with programs and specifications. Considerable progress has been made with mechanised proof assistance for both. Going further into the back room, programming languages are also big structures. It’s very uncommon to have help from a proof assistant while actually designing a language, probably because the very formalism for writing down what a language means is changing under our feet, so it’s asking too much for those who build proof assistants to keep up with these developments enough to help the designers in real time. All the same, it has been encouraging to see plenty of post hoc verification of properties of Standard ML using its semantic formalism. Perhaps a future language design using “big step structure operational semantics” could be done using proof assistance to check out the sanity of a large set of inference rules before they are frozen into a design."
1997,Graphical Calculi for Interaction (Abstract).,n/a
1997,Strong Normalisation in Higher-Order Action Calculi.,"Abstract
The framework of action calculi accommodates a variety of disciplines of interaction and computation. A general theory of action calculi is under development; each particular action calculus — such as the π-calculus — will possess also a specific theory. It has previously been shown that any action calculus can be extended in a conservative manner to higher-order, thus allowing its actions to be encapsulated and treated as data. The dynamics of each higher-order calculus includes β-reduction, analogous to the λ-calculus. This paper demonstrates that under an assumption on the arities of a higher-order calculus (analogous to the assumption of simple types in the λ-calculus), β-reduction in higher-order action calculi is strongly normalising."
1996,Calculi for Interaction.,n/a
1995,Control Structures: a Model of Interaction.,n/a
1995,Control Structures.,"Abstract:
'Action calculi' are a class of action structures with added structure. Each action calculus AC(/spl Kscr/) is determined by a set /spl Kscr/ of controls, equipped with reaction rules; calculi such as Petri nets, the typed /spl lambda/-calculus and the /spl pi/-calculus are obtained by varying /spl Kscr/. This paper defines for each /spl Kscr/ a category CS(/spl Kscr/), characterized by equational axioms, of action structures with added structure; they are called 'control structures' and provide models of the calculus AC(/spl Kscr/), which is initial in the category. The 'surface' of an action is defined; this is an abstract correlate of the syntactic notion of 'free name'. Three equational characterizations of the surface are found to be equivalent. This permits a non-syntactic treatment of the linkage among the components of an interactive system. Finally, control structures and their morphisms offer a means of classifying the variety of dynamic disciplines in models of concurrency, such as the mobility present in the /spl pi/-calculus but absent in other calculi."
1994,Pi-Nets: A Graphical Form of pi-Calculus.,"Abstract
An, action calculus which closely corresponds to the π-calculus is presented in graphical form, as so-called π -nets. First an elementary form of π-net, with no sequential control, is presented. Then, using a construction by Honda and Tokoro, it is shown informally that by adding a single control construction box to elementary π-nets, the sequential control present in the π-calculus can be recovered. (Another construction, rep, provides replication.) The graphical presentation suggests a few interesting variants of this control regime, which are studied briefly. The main purpose of the paper is to explore informally the power and utility of graphical forms of the π-calculus, in the context of action calculi. It also suggests that graphical forms of other action calculi should be explored."
1994,Computing is Interaction.,n/a
1993,Unique Decomposition of Processes.,"Abstract
In this paper, we examine questions about the prime decomposability of processes, where we define a process to be prime whenever it cannot be decomposed into nontrivial components.
We show that any finite process can be uniquely decomposed into prime processes with respect to bisimulation equivalence, and demonstrate counterexamples to such a result for both failures (testing) equivalence and trace equivalence.
Although we show that prime decompositions cannot exist for arbitrary infinite processes, we motivate but leave as open a conjecture on the unique decomposability of a wide subclass of infinite behaviours."
1993,Modal Logics for Mobile Processes.,"Abstract
In process algebras, bisimulation equivalence is typically defined directly in terms of the operational rules of action; it also has an alternative characterization in terms of a simple modal logic (sometimes called Hennessy-Milner logic). This paper first defines two forms of bisimulation equivalence for the π-calculus, a process algebra which allows dynamic reconfiguration among processes; it then explores a family of possible logics, with different modal operators. It is proven that two of these logics characterize the two bisimulation equivalences. Also, the relative expressive power of all the logics is exhibited as a lattice. The results are applicable to most value-passing process algebras."
1993,Higher-Order Action Calculi.,"Abstract
Action calculi are a broad class of algebraic structures, including a formulation of Petri nets as well as a formulation of the π-calculus. Each action calculus HAC(K) is generated by a particular set K of operators called controls. The purpose of this paper is to extend action calculi in a uniform manner to higher-order. A special case is essentially the extension of the π-calculus to higher order by Sangiorgi. To establish a link between the interactive and functional paradigms of computation, a variety of the λ-calculus is obtained as the extension of the smallest action calculus HAC(θ).
The dynamics of higher-order action calculi is presented, blending communication -for example in process calculi- with reduction as in the λ-calculus. Strong normalisation is obtained for reduction. A set of equational axioms is given for higher-order action calculi. Taking the quotient of HAC(θ) by a single extra axiom η, a cartesian-closed category is obtained.
An ultimate goal of the paper is to combine process calculi and functional calculi, both in their formulation and in their semantics."
1993,An Action Structure for Synchronous pi-Calculus.,"Abstract
After a review of relevant notions, an action structure is presented for the π-calculus. This yields a version of π-calculus which is synchronous in the sense of MEIJE or SCCS, i.e. an arbitrary amount of computation may take place in a single transition. The main new technical result is the construction of an incident set for the action structure, which guarantees a congruential strong bisimilarity for the calculus. The incident set is characterized using a new form of graphical representation for actions."
1993,"Action Calculi, or Syntactic Action Structures.","Abstract
Action structures have previously been proposed as an algebra for both the syntax and the semantics of interactive computation. Here a class of concrete action structures called action calculi is identified, which can serve as a non-linear syntax for a wide variety of models of interactive behaviour. They generalise a previously defined action structure PIC for the π-calculus. One action calculus differs from another only in its generators, called controls.
Several extensions to PIC are given as action calculi, giving essentially the same power as the π-calculus. An action calculus is also outlined for PT nets — a class of Petti nets — parametrized upon their places and transitions.
Finally, action calculi are characterized as the free algebras in a sub-variety of action structures, namely those which satisfy certain additional axioms."
1992,A Compositional Protocol Verification Using Relativized Bisimulation.,"Abstract
The purpose of this paper is to illustrate a compositional proof method for communicating systems; that is, a method in which a property P of a complete system is demonstrated by first decomposing the system, then demonstrating properties of the subsystems which are strong enough to entail property P for the complete system. In any compositional proof method, it is essential that one can abstract away the behavioural aspects of the subsystem which are irrelevant in the context of the complete system. Our method is an extension of the well established notion of bisimulation; it is called relative bisimulation, and was developed specifically to allow for such abstractions. We illustrate the method in a proof of correctness for a version of the Alternating Bit Protocol."
