1992,"A Calculus of Mobile Processes, I.","Abstract
We present the π-calculus, a calculus of communicating systems in which one can naturally express processes which have changing structure. Not only may the component agents of a system be arbitrarily linked, but a communication between neighbours may carry information which changes that linkage. The calculus is an extension of the process algebra CCS, following work by Engberg and Nielsen, who added mobility to CCS while preserving its algebraic properties. The π-calculus gains simplicity by removing all distinction between variables and constants; communication links are identified by names, and computation is represented purely as the communication of names across links. After an illustrated description of how the π-calculus generalises conventional process algebras in treating mobility, several examples exploiting mobility are given in some detail. The important examples are the encoding into the π-calculus of higher-order functions (the λ-calculus and combinatory algebra), the transmission of processes as values, and the representation of data structures as processes. The paper continues by presenting the algebraic theory of strong bisimilarity and strong equivalence, including a new notion of equivalence indexed by distinctions—i.e., assumptions of inequality among names. These theories are based upon a semantics in terms of a labeled transition system and a notion of strong bisimulation, both of which are expounded in detail in a companion paper. We also report briefly on work-in-progress based upon the corresponding notion of weak bisimulation, in which internal actions cannot be observed."
1992,"A Calculus of Mobile Processes, II.","Abstract
This is the second of two papers in which we present the π-calculus, a calculus of mobile processes. We provide a detailed presentation of some of the theory of the calculus developed to date, and in particular we establish most of the results stated in the companion paper."
1992,Functions as Processes.,"This paper exhibits accurate encodings of the ?-calculus in the ?-calculus. The former is canonical for calculation with functions, while the latter is a recent step (Milner et al. 1989) towards a canonical treatment of concurrent processes. With quite simple encodings, two ?-calculus reduction strategies are simulated very closely; each reduction in ?-calculus is mimicked by a short sequence of reductions in ?-calculus. Abramsky's precongruence of applicative bisimulation (Abramsky 1989) over ?-calculus is compared with that induced by the encoding of the lazy ?-calculus into ?-calculus; a similar comparison is made for call-by-value ?-calculus.
"
1992,The Polyadic Pi-calculus (Abstract).,"The ?-calculus is a model of concurrent computation based upon the notion of naming. It is first presented in its simplest and original form, with the help of several illustrative applications. Then it is generalized from monadic to polyadic form. Semantics is done in terms of both a reduction system and a version of labelled transitions called commitment; the known algebraic axiomatization of strong bisimilarity is given in the new setting, and so also is a characterization in modal logic. Some theorems about the replication operator are proved."
1992,"The Problem of ""Weak Bisimulation up to"".","Abstract
“Bisimulation up to” is a technique for reducing the size of the relation needed to define a bisimulalion. It works smoothly in the strong case, where it was first introduced ([4]). But this does not directly generalize to the weak case, as erroneously reported in [4]. To overcome this problem, two new “up-to” techniques are proposed: They are respectively based on the use of expansion ([1]) and of almost-weak bisimulation. The second solution is more general than the first one, but expansion enjoys a nicer mathematical treatment. The usefulness and generality of the solutions is motivated with non-trivial examples: two different implementations of a sorting machine."
1992,Barbed Bisimulation.,"Abstract
We propose in this paper barbed bisimulation as a tool to describe bisimulation-based equivalence uniformly for any calculi possessing (a) a reduction relation and (b) a convergency predicate which simply detects the possibility of performing some observable action. This opens interesting perspectives for the adoption of a reduction semantics in process algebras. As a test-case we prove that strong bisimulation of CCS coincides with the congruence induced by barbed bisimulation."
1992,A Semantics for ML Concurrency Primitives.,"We present a set of concurrency primitives for Standard ML. We define these by giving the transitional semantics of a simple language. We prove that our semantics preserves the expected behaviour of sequential programs. We also show that we can define stores as processes, such that the representation has the same behaviour as a direct definition. These proofs are the first steps towards integrating our semantics with the full definition of Standard ML."
1992,Concurrent Processes as Objects.,"Abstract
The π-calculus is a relatively new algebraic calculus for communicating processes, in the tradition of process algebras [1, 3, 4, 5]. It goes a step further than these in one respect: it models processes whose configuration is dynamically varying. This enrichment gives the calculus status as a general computational model. Its main character is what may be called the object paradigm, since it most directly represents the action and reaction among independently existing agents. It also embraces the function paradigm, since both functions (the λ-calculus) and data can be accurately encoded as processes.
A basic knowledge of process algebra can be got from some of the books referred to above. The π-calculus is most clearly derived from CCS [5]; it evolved through work by Nielsen and Engberg [2], and the best introduction is the two-part paper by Milner, Parrow and Walker [7]. The encoding of λ-calculus is done in detail in [6]."
1991,Co-Induction in Relational Semantics.,"Abstract
An application of the mathematical theory of maximum fixed points of monotonic set operators to relational semantics is presented. It is shown how an important proof method which we call co-induction, a variant of Park's (1969) principle of fixpoint induction, can be used to prove the consistency of the static and the dynamic relational semantics of a small functional programming language with recursive functions."
1991,Modal Logics for Mobile Processes.,"Abstract
In process algebras, bisimulation equivalence is typically defined directly in terms of the operational rules of action; it also has an alternative characterisation in terms of a simple modal logic (sometimes called Hennessy-Milner logic. This paper first defines two forms of bisimulation equivalence for the π-calculus, a process algebra which allows dynamic reconfiguration among processes; it then explores a family of possible logics, with different modal operators. It is proven that two of these logics characterise the two bisimulation equivalences. Also, the relative expressive power of all the logics is exhibited as a lattice."
1991,Concurrent Processes as Objects (Abstract).,n/a
1990,Unique decomposition of processes.,"In this paper, we examine questions about the prime decomposability of processes, where we define a process to be prime whenever it cannot be decomposed into nontrivial components.

We show that any finite process can be uniquely decomposed into prime processes with respect to bisimulation equivalence, and demonstrate counterexamples to such a result for both failures (testing) equivalence and trace equivalence.

Although we show that prime decompositions cannot exist for arbitrary infinite processes, we motivate but leave as open a conjecture on the unique decomposability of a wide subclass of infinite behaviours."
1990,Interpreting one Concurrent Calculus in Another.,n/a
1990,Functions as Processes.,"Abstract
This paper exhibits accurate encodings of the λ-calculus in the π-calculus. The former is canonical for calculation with functions, while the latter is a recent step [15] towards a canonical treatment of concurrent processes. With quite simple encodings, two λ-calculus reduction strategies are simulated very closely; each reduction in λ-calculus is mimicked by a short sequence of reductions in π-calculus. Abramsky's precongruence of applicative simulation [1] over λ-calculus is compared with that induced by the encoding of the lazy λ-calculus into π-calculus; a similar comparison is made for call-by-value λ-calculus.
The part of π-calculus which is needed for the encoding is formulated in a new way, inspired by Berry's and Boudol's Chemical Abstract Machine [5]."
1989,A Complete Axiomatisation for Observational Congruence of Finite-State Behaviors.,"Abstract
Finite state automata, with non-determinism and silent transitions, can be interpreted not as subsets of the free monoid as in classical automata theory, but as congruence classes under a congruence relation based upon the notion of weak bisimulation or observational equivalence due to Park and Milner. In this paper a complete axiomatisation for this congruence is presented. It extends the previously known complete axiomatisation by Hennessy and Milner for the case when all computations are finite; the extension consists of five simple rules for recursion."
1988,Some Directions in Concurrency Theory.,n/a
1988,Interpreting One Concurrent Calculus in Another.,n/a
1987,Is Computing an Experimental Science?,n/a
1987,Verifying a Protocol Using Relativized Bisimulation.,n/a
1987,Dialogue with a Proof System.,n/a
1987,A Type Discipline for Program Modules.,"Abstract
The ML modules system is organized around the notions of structure, signature, and functor. A structure is an encapsulated declaration of data types and values, a signature is a “type” or specification of a structure, and a functor is a function taking structures to structures. We present a static semantics for a fragment of this system in the style of Plotkin's operational semantics. The treatment of structures and signatures has interesting parallels with the type assignment rules for ML given by Damas and Milner. In particular there is a notion of principal typing."
1986,Process Constructors and Interpretations (Invited Paper).,n/a
1985,Algebraic Laws for Nondeterminism and Concurrency.,"Since a nondeterministic and concurrent program may, in general, communicate repeatedly with its environment, its meaning cannot be presented naturally as an input/output function (as is often done in the denotational approach to semantics). In this paper, an alternative is put forth. First, a definition is given of what it is for two programs or program parts to be equivalent for all observers; then two program parts are said to be observation congruent if they are, in all program contexts, equivalent. The behavior of a program part, that is, its meaning, is defined to be its observation congruence class. The paper demonstrates, for a sequence of simple languages expressing finite (terminating) behaviors, that in each case observation congruence can be axiomatized algebraically. Moreover, with the addition of recursion and another simple extension, the algebraic language described here becomes a calculus for writing and specifying concurrent programs and for proving their properties."
1984,A Complete Inference System for a Class of Regular Behaviours.,n/a
1984,A Proposal for Standard ML.,n/a
1983,Calculi for Synchrony and Asynchrony.,"Abstract
A calculus for distributed computation is studied, based upon four combinators. A central idea is an Abelian group of actions which models the interfaces between components of a distributed computing agent. Using a notion of bisimulation, congruence relations are defined over computing agents, and thence an algebraic theory is derived. The calculus models both synchronous and asynchronous computation. In particular, it is shown that the author's Calculus of Communicating Systems (1980), which is an asynchronous model, is derivable from the calculus presented here."
1983,Using Algebra for Concurrency: Some Approaches.,"Abstract
This short introduction to an algebraic approach to concurrency has necessarily omitted some intricate details, as well as paying no attention to other algebraic approaches (for example, Vaughan Pratt has suggested an approach which generalises the Kahn networks in a different manner). What we hope to have shown is that four kinds of operator — namely atomic action (α.), summation (+), product (&β or |) and encapsulation (/β or \β) — together give great expressive power, and moreover satisfy interesting algebraic identities.
In a methodology for proof about particular systems, we almost certainly need more than ""just"" algebra. With algebra, we can typically prove equations between agent expressions; we often wish also to prove that an agent possesses some property which is not expressible by an equation. It is therefore important to look at the relation between such algebras and logics — Temporal or Modal logics — designed to express interesting properties of processes.
Another important relationship to study is between the algebraic approach and Net Theory. The emphases of these models are different; communication is the cornerstone of the algebra (in the present approach), while Net Theory emphasizes causal independence, provides a totally different graphical aid to intuition, and provides different tools for abstraction.
Finally, synchronous systems demand some form of treatment. The author has found one way of integrating the above asynchronous algebra with an algebra of synchronous (clocked) systems; this method has some mathematical simplicity — for example, the algebra becomes more conventional, being at least a semi-ring (with agent sum and product as the semi-ring operations) — but is by no means obviously the best integration possible."
1983,Parallel Combinator Reduction Machine.,n/a
1983,Firing Squad.,n/a
1982,Four Combinators for Concurrency.,"An algebraic calculus of asynchronous parallel computation, called CCS (Calculus of Communicating Systems), was developed in [HM,Mil 1]. CCS can express both the semantics of parallel programming languages and the behaviour of data structures (mailbox, random access memory, buffer) which serve as interfaces between independent agents. The primitive notion is 'handshake' communication. The emphasis is upon (i) synthesis from components and (ii) extensionality (meaning = observable behaviour), in contrast with Petri's Net theory which emphasizes causal independence. Here CCS is broadened to embrace synchrony, or systems which depend critically upon the timing of their components. The extension is not adhoc; it is shown that with just four combinators one may both express synchrony and derive CCS in a precise sense. In fact more is gained; it is shown in [Mil 4] how the dynamic reconfiguration of agent linkage, which was outside the scope of the original calculus, may now be expressed. Moreover the four combinators seem, informally speaking, to represent notions which are fully orthogonal to each other, and so to provide a somewhat deeper and intellectually clearer foundation for distributed computation than CCS (which in turn, at its higher level, has some advantages in manipulation). This foundation does not presume a particular abstract notion of process, which in the author's view is still a contentious matter, but rather allows candidates for such a notion to be defined and compared; each such candidate will be a congruence class for some congruence relation in the calculus."
1982,Principal Type-Schemes for Functional Programs.,n/a
1981,A Modal Characterisation of Observable Machine-Behaviour.,n/a
1980,On Observing Nondeterminism and Concurrency.,n/a
1979,Concurrent Processes and Their Syntax.,"A mathematical model of concurrent computation is presented. Starting from synchronized communication as the only primitive notion, a process is defined as a set of communication capabilities. The domain of processes is built using the weak powerdomain construction of Smyth, which evolved from that of Plotkin. A minimal set of operations for composing processes is defined. These operations suggest a corresponding minimal syntax - the language of flowgraphs - in which to specify these compositions. The concept of flow algebra is defined, processes and flowgraphs are examples of flow algebras. Elsewhere it will be shown that flowgraphs are free (over a set of generators) in the category of flow algebras, here it is shown that processes are a flow algebra, and therefore constitute a suitable semantics for flowgraphs. However, we emphasize that the notion of flowgraph evolved from the notion of process and not the reverse."
1979,Flowgraphs and Flow Algebras.,"An algebra G of flowgraphs or nets is presented. It is shown to be a free algebra of a simple equational system F, which is called the laws of flow. This holds both for the algebra of finite nets, and for the algebra of finite or infinite nets in which certain infinite nets may be described by recursion equations. To demonstrate this fact, some results concerning categories of continuous algebras, which are explicit or implicit in the work of the ADJ group, are presented in a self-contained form. It follows that the algebra of processes which satisfies the laws of flow F, is a suitable semantics for flowgraphs. There are, however, many other interpretations of nets, some of which will be studied in subsequent papers. This paper concludes with some simple examples of infinite nets and informally discusses their possible interpretation."
1979,LCF: A Way of Doing Proofs with a Machine.,n/a
1979,An Algebraic Theory for Synchronization.,n/a
1978,A Theory of Type Polymorphism in Programming.,"Abstract
The aim of this work is largely a practical one. A widely employed style of programming, particularly in structure-processing languages which impose no discipline of types, entails defining procedures which work well on objects of a wide variety. We present a formal type discipline for such polymorphic procedures in the context of a simple programming language, and a compile time type-checking algorithm
which enforces the discipline. A Semantic Soundness Theorem (based on a formal semantics for the language) states that well-type programs cannot “go wrong” and a Syntactic Soundness Theorem states that if
accepts a program then it is well typed. We also discuss extending these results to richer languages; a type-checking algorithm based on
is in fact already implemented and working, for the metalanguage ML in the Edinburgh LCF system."
1978,Synthesis of Communicating Behaviour.,n/a
1978,A Metalanguage for Interactive Proof in LCF.,n/a
1977,Fully Abstract Models of Typed lambda-Calculi.,"Abstract
A semantic interpretation
for a programming language L is fully abstract if, whenever
〚
〛
〚
〛
for two program phrases M,N and for all program contexts
[ ], it follows that
〚
〛
〚
〛
. A model
for the language is fully abstract if the natural interpretation
of L in
is fully abstract.
We show that under certain conditions there exists, for an extended typed λ-calculus, a unique fully abstract model."
1972,A calculus for the mathematical theory of computation.,n/a
1971,An Algebraic Definition of Simulation Between Programs.,"A simulation relation between programs is defined which is a quasi-ordering. Mutual simulation is then an equivalence relation, and by dividing out by it we abstract from a program such details as how the sequencing is controlled and how data is represented. The equivalence classes are approximations to the algorithms which are realized, or expressed, by their member programs. A technique is given and illustrated for proving simulation and equivalence of programs; there is an analogy with Floyd's technique for proving correctness of programs. Finally, necessary and sufficient conditions for simulation are given."
1970,Equivalences on Program Schemes.,"A program scheme may be informally described as a program with the interpretation (i.e., the meaning of the basic instructions or standard functions) left unspecified. This paper studies the equivalence of program schemes under different classes of interpretations, with emphasis on those in which the functions are permitted to be partial. Several different equivalence relations are defined, and their interrelationship and solvability examined both for the class of all program schemes, and for each subclass (n≥1) in which the number of registers is at most n."
1968,String Handling in ALGOL.,"DASH (Dynamic ALGOL String Handling) is a set of procedures designed to extend ALGOL to the expression of non-numerical or partly non-numerical algorithms for which it is normally unsuited.
"
