2003,Security and Privacy Aspects of Low-Cost Radio Frequency Identification Systems.,"Abstract
Like many technologies, low-cost Radio Frequency Identification (RFID) systems will become pervasive in our daily lives when affixed to everyday consumer items as ‚Äùsmart labels‚Äù. While yielding great productivity gains, RFID systems may create new threats to the security and privacy of individuals or organizations. This paper presents a brief description of RFID systems and their operation. We describe privacy and security risks and how they apply to the unique setting of low-cost RFID devices. We propose several security mechanisms and suggest areas for future research."
2002,Tweakable Block Ciphers.,"Abstract
We propose a new cryptographic primitive, the ‚Äútweakable block cipher.‚Äù Such a cipher has not only the usual inputs ‚Äî message and cryptographic key ‚Äî but also a third input, the ‚Äútweak.‚Äù The tweak serves much the same purpose that an initialization vector does for CBC mode or that a nonce does for OCB mode. Our proposal thus brings this feature down to the primitive block-cipher level, instead of incorporating it only at the higher modes-of-operation levels. We suggest that (1) tweakable block ciphers are easy to design, (2) the extra cost of making a block cipher ‚Äútweakable‚Äù is small, and (3) it is easier to design and prove modes of operation based on tweakable block ciphers."
2002,Micropayments Revisited.,"Abstract
We present new micropayment schemes that are more efficient and user friendly than previous ones.
These schemes reduce bank processing costs by several orders of magnitude, while preserving a simple interface for both users and merchants. The schemes utilize a probabilistic deposit protocol that, in some of the schemes, may be entirely hidden from the users."
2002,Transitive Signature Schemes.,"Abstract
We introduce and provide the first example of a transitive digital signature scheme. Informally, this is a way to digitally sign vertices and edges of a dynamically growing, transitively closed, graph G so as to guarantee the following properties:
Given the signatures of edges (u, v) and (v,w), anyone can easily derive the digital signature of the edge (u,w).
It is computationaly hard for any adversary to forge the digital signature of any new vertex or other edge of G, even if he can request the legitimate signer to digitally sign any number of G‚Äôs vertices and edges of his choice in an adaptive fashion (i.e., even if he can choose which vertices and edges the legitimate signer should sign next after he sees the legitimate signatures of the ones requested so far)."
2002,Privacy Tradeoffs: Myth or Reality? Panel.,"Abstract
We discuss tradeoffs between privacy and other attributes such as security, usability, and advances in technology. We discuss whether such tradeoffs are inherent, or if it is possible to ‚Äúhave it all.‚Äù"
2002,The Untrusted Computer Problem and Camera-Based Authentication.,"Abstract
The use of computers in public places is increasingly common in everyday life. In using one of these computers, a user is trusting it to correctly carry out her orders. For many transactions, particularly banking operations, blind trust in a public terminal will not satisfy most users. In this paper the aim is therefore to provide the user with authenticated communication between herself and a remote trusted computer, via the untrusted computer.
After defining the authentication problem that is to be solved, this paper reduces it to a simpler problem. Solutions to the simpler problem are explored in which the user carries a trusted device with her. Finally, a description is given of two camera-based devices that are being developed."
2002,Proxy-based security protocols in networked mobile devices.,"We describe a resource discovery and communication system designed for security and privacy. All objects in the system, e.g., appliances, wearable gadgets, software agents, and users have associated trusted software proxies that either run on the appliance hardware or on a trusted computer. We describe how security and privacy are enforced using two separate protocols: a protocol for secure device-to-proxy communication, and a protocol for secure proxy-to-proxy communication. Using two separate protocols allows us to run a computationally-inexpensive protocol on impoverished devices, and a sophisticated protocol for resource authentication and communication on more powerful devices.We detail the device-to-proxy protocol for lightweight wireless devices and the proxy-to-proxy protocol which is based on SPKI/SDSI (Simple Public Key Infrastructure / Simple Distributed Security Infrastructure). A prototype system has been constructed, which allows for secure, yet efficient, access to networked, mobile devices. We present a quantitative evaluation of this system using various metrics."
2002,Making Mix Nets Robust for Electronic Voting by Randomized Partial Checking.,"We propose a new technique for making mix nets robust, called randomized partial checking (RPC). The basic idea is that rather than providing a proof of completely correct operation, each server provides strong evidence of its correct operation by revealing a pseudo-randomly selected subset of its input/output relations."
2001,Certificate Chain Discovery in SPKI/SDSI.,"SPKI/SDSI is a novel public-key infrastructure emphasizing naming, groups, ease-of-use, and flexible authorization. To access a protected resource, a client must present to the server a proof that the client is authorized; this proof takes the form of a ìcertificate chainî proving that the client's public key is in one of the groups on the resource's ACL, or that the client's public key has been delegated authority (in one or more stages) from a key in one of the groups on the resource's ACL. While finding such a chain can be nontrivial, due to the flexible naming and delegation capabilities of SPKI/SDSI certificates, we present a practical and efficient algorithm for this problem of ìcertificate chain discoveryî. We also present a tight worst-case bound on its running time, which is polynomial in the length of its input. We also present an extension of our algorithm that is capable of handling ìthreshold subjectsî, where several principals are required to co-sign a request to access a protected resource."
2001,How to Leak a Secret.,"Abstract
In this paper we formalize the notion of a ring signature, which makes it possible to specify a set of possible signers without revealing which member actually produced the signature.Unlike group signatures, ring signatures have no group managers, no setup procedures, no revocation procedures, and no coordination:any user can choose any set of possible signers that includes himself,and sign any message by using his secret key and the others‚Äô public keys,without getting their approval or assistance. Ring signatures provide an elegant way to leak authoritativ secrets in an anonymous way, to sign casual email in a way which can only be verified by its intended recipient, and to solve other problems in multiparty computations. The main contribution of this paper is a new construction of such signatures which is unconditionally signer-ambiguous, provably secure in the random oracle model,and exceptionally efficient:adding each ring member increases the cost of signing or verifying by a single modular multiplication and a single symmetric encryption."
2001,The Business of Electronic Voting.,"Abstract
This work reports on a Financial Cryptography 2001 panel where we concentrated on the emerging business of electronic voting."
2000,RC6 as the AES.,"Each of the finalist algorithms appears to offer adequate security, and each offers a considerable number of advantages. Any of the finalists could serve admirably as the AES. However, each algorithm also has one or more areas where it does not fare quite as well as some other algorithm; none of the finalists is outstandingly superior to the rest. ñ Nechvatal, Barker, Bassham, Burr, Dworkin, Foti, Roback [12] "
1999,Piecemeal Graph Exploration by a Mobile Robot.,"Abstract
We study how a mobile robot can learn an unknown environment in a piecemeal manner. The robot's goal is to learn a complete map of its environment, while satisfying the constraint that it must return every so often to its starting position (for refueling, say). The environment is modeled as an arbitrary, undirected graph, which is initially unknown to the robot. We assume that the robot can distinguish vertices and edges that it has already explored. We present a surprisingly efficient algorithm for piecemeal learning an unknown undirected graph G=(V, E) in which the robot explores every vertex and edge in the graph by traversing at most O(E+V1+o(1)) edges. This nearly linear algorithm improves on the best previous algorithm, in which the robot traverses at most O(E+V2) edges. We also give an application of piecemeal learning to the problem of searching a graph for a ‚Äútreasure.‚Äù"
1999,"Translucent Cryptography - An Alternative to Key Escrow, and Its Implementation via Fractional Oblivious Transfer.","We present an alternative to the controversial ``key-escrow'' techniques for enabling law enforcement and national security access to encrypted communications. Our proposal allows such access with probability p for each message, for a parameter p between 0 and 1 to be chosen (say, by Congress) to provide an appropriate balance between concerns for individual privacy, on the one hand, and the need for such access by law enforcement and national security, on the other. (For example, with p=0.4 , a law-enforcement agency conducting an authorized wiretap which records 100 encrypted conversations would expect to be able to decrypt (approximately) 40 of these conversations; the agency would not be able to decrypt the remaining 60 conversations at all.) Our scheme is remarkably simple to implement, as it requires no prior escrowing of keys.

We implement translucent cryptography based on noninteractive oblivious transfer. Extending the schemes of Bellare and Micali [2], who showed how to transfer a message with probability Ω, we provide schemes for noninteractive fractional oblivious transfer, which allow a message to be transmitted with any given probability p . Our protocol is based on the DiffieóHellman assumption and uses just one El Gamal encryption (two exponentiations), regardless of the value of the transfer probability p . This makes the implementation of translucent cryptography competitive, in efficiency of encryption, with current suggestions for software key escrow."
1999,Improved Analysis of Some Simplified Variants of RC6.,"Abstract
RC6 has been submitted as a candidate for the Advanced Encryption Standard (AES). Two important features of RC6 that were absent from its predecessor RC5 are a quadratic function and a fixed rotation. By examining simplified variants that omit these features we clarify their essential contribution to the overall security of RC6."
1999,Pseudonym Systems.,"Abstract
Pseudonym systems allow users to interact with multiple organizations anonymously, using pseudonyms. The pseudonyms cannot be linked, but are formed in such a way that a user can prove to one organization a statement about his relationship with another. Such a statement is called a credential. Previous work in this area did not protect the system against dishonest users who collectively use their pseudonyms and credentials, i.e., share an identity. Previous practical schemes also relied very heavily on the involvement of a trusted center. In the present paper we give a formal definition of pseudonym systems where users are motivated not to share their identity, and in which the trusted center‚Äôs involvement is minimal. We give theoretical constructions for such systems based on any one-way function. We also suggest an efficient and easy-to-implement practical scheme."
1998,Self-Delegation with Controlled Propagation - or - What If You Lose Your Laptop.,"Abstract
We introduce delegation schemes wherein a user may delegate certain rights to himself, but may not safely delegate these rights to others. In our motivating application, a user has a primary (long-term) key that receives some personalized access rights, yet the user may reasonably wish to delegate these rights to new secondary (short-term) keys he creates to use on his laptop when traveling, to avoid having to store his primary secret key on the vulnerable laptop. We propose several cryptographic schemes, both generic ones under general assumptions and more specific practical ones, that fulfill these somewhat conflicting requirements, without relying on special-purpose (e.g., tamper-proof) hardware.
This is an extended abstract of our work [19]."
1998,Can We Eliminate Certificate Revocations Lists?,"Abstract
We briefly consider certificate revocation lists (CRLs), and ask whether they could, and should, be eliminated, in favor of other mechanisms. In most cases, the answer seems to be ‚Äúyes.‚Äù We suggest some possible replacement mechanisms."
1998,On the Design and Security of RC2.,"Abstract
The block cipher RC2 was designed in 1989 by Ron Rivest for RSA Data Security Inc. In this paper we describe both the cipher and preliminary attempts to use both differential and linear cryptanalysis."
1997,"The risks of key recovery, key escrow, and trusted third-party encryption.","A variety of ""key recovery,"" ""key escrow,"" and ""trusted third-party"" encryption requirements have been suggested in recent years by government agencies seeking to conduct covert surveillance within the changing environments brought about by new technologies. This report examines the fundamental properties of these requirements and attempts to outline the technical risks, costs, and implications of deploying systems that provide government access to encryption keys.
"
1997,Perspectives on Financial Cryptography.,"Abstract
I present some debatable propositions about financial systems and financial cryptography. (Warning: the propositions expressed may or may not be believed by the author, and may be phrased in a deliberately provocative manner. They may contradict each other. This paper follows the author's slides closely, and does not have all of the ancillary comments of the author and the audience.)"
1997,Electronic Lottery Tickets as Micropayments.,"Abstract
We present a new micropayment scheme based on the use of ‚Äúelectronic lottery tickets.‚Äù This scheme is exceptionally efficient since the bank handles only winning tickets, instead of handling each micropayment."
1997,All-or-Nothing Encryption and the Package Transform.,"Abstract
We present a new mode of encryption for block ciphers, which we call all-or-nothing encryption. This mode has the interesting defining property that one must decrypt the entire ciphertext before one can determine even one message block. This means that brute-force searches against all-or-nothing encryption are slowed down by a factor equal to the number of blocks in the ciphertext. We give a specific way of implementing all-or-nothing encryption using a ‚Äúpackage transform‚âì as a pre-processing step to an ordinary encryption mode. A package transform followed by ordinary codebook encryption also has the interesting property that it is very efficiently implemented in parallel. All-or-nothing encryption can also provide protection against chosen-plaintext and related-message attacks."
1996,On breaking a Huffman code.,"Abstract:
We examine the problem of deciphering a file that has been Huffman coded, but not otherwise encrypted. We find that a Huffman code can be surprisingly difficult to cryptanalyze. We present a detailed analysis of the situation for a three-symbol source alphabet and present some results for general finite alphabets."
1996,PayWord and MicroMint: Two Simple Micropayment Schemes.,n/a
1995,"Complete Variable-Length ""Fix-Free"" Codes.","A set of codewords is fix-free if it is both prefix-free and suffix-free: no codeword in the set is a prefix or a suffix of any other. A set of codewords {x 1,x 2,...,x n } over at-letter alphabet ? is said to becomplete if it satisfies the Kraft inequality with equality, so that

?1?i?nt?|xi|=1.
The set ?k of all codewords of lengthk is obviously both fix-free and complete. We show, surprisingly, that there are other examples of complete fix-free codes, ones whose codewords have a variety of lengths. We discuss such variable-length (complete) fix-free codes and techniques for constructing them."
1995,Piecemeal Learning of an Unknown Environment.,"Abstract
We introduce a new learning problem: learning a graph bypiecemeal search, in which the learner must return every so often to its starting point (for refueling, say). We present two linear-time piecemeal-search algorithms for learningcity-block graphs: grid graphs with rectangular obstacles."
1995,Picking the Best Expert from a Sequence.,"Abstract
We examine the problem of finding a good expert from a sequence of experts. Each expert has an ‚Äúerror rate‚Äù; we wish to find an expert with a low error rate. However, each expert‚Äôs error rate is unknown and can only be estimated by a sequence of experimental trials. Moreover, the distribution of error rates is also unknown. Given a bound on the total number of trials, there is thus a tradeoff between the number of experts examined and the accuracy of estimating their error rates.
We present a new expert-finding algorithm and prove an upper bound on the expected error rate of the expert found. A second approach, based on the sequential ratio test, gives another expert-finding algorithm that is not provably better but which performs better in our empirical studies."
1995,Being Taught can be Faster than Asking Questions.,"We explore the power of teaching by studying two online learning models: teacher-directed learning and self-directed learning. In both models, the learner tries to identify an unknown concept based on examples of the concept presented one at a time. The learner predicts whether each example is positive or negative with immediate feedback, and the objective is to minimize the number of prediction mistakes. The examples are selected by the teacher in teacher-directed learning and the learner itself in self-directed learning. Roughly, teacher-directed learning represents the scenario in which a teacher teaches a class of learners, and self-directed learning represents the scenario in which a smart learner asks questions and learns by itself. For all previously studied concept classes, the minimum number of mistakes in teacher-directed learning is always larger than that in self-directed learning. This raises an interesting question of whether teaching is helpful for all learners including the smart learner. Assuming the existence of one-way functions, we construct concept classes for which the minimum number of mistakes is linear in teacher-directed learning but superpolynomial in self-directed learning, demonstrating the power of a helpful teacher in a learning process."
1995,Piecemeal Graph Exploration by a Mobile Robot (Extended Abstract).,"We introduce a new learning problem: learning a graph bypiecemeal search, in which the learner must return every so often to its starting point (for refueling, say). We present two linear-time piecemeal-search algorithms for learningcity-block graphs: grid graphs with rectangular obstacles.
"
1994,A Formal Model of Hierarchical Concept Learning.,"Abstract
We show how to learn from examples (Valiant style) any concept representable as a boolean function or circuit, with the help of a teacher who breaks the concept into subconcepts and teaches one subconcept per lesson. Each subconcept corresponds to a gate in the boolean circuit. The learner learns each subconcept from examples which have been randomly drawn according to an arbitrary probability distribution, and labeled as positive or negative instances of the subconcept by the teacher. The learning procedure runs in time polynomial in the size of the circuit. The learner outputs not the unknown boolean circuit, but rather a program that, for any input, either produces the same answer as the unknown boolean circuit, or else says ""I don‚Ä≤t know."" Thus the output of this learning procedure is reliable. Furthermore, with high probability the output program is nearly always useful in that it says ""I don‚Ä≤t know"" very rarely. A key technique is to maintain a hierarchy of explicit ""version spaces."" Our main contribution is thus a learning procedure whose output is reliable and nearly always useful; this has not been previously accomplished within Valiant‚Ä≤s model of learnability."
1994,Diversity-Based Inference of Finite Automata.,"We present new procedures for inferring the structure of a finite-state automaton (FSA) from its input/output behavior, using access to the automaton to perform experiments. Our procedures use a new representation for finite automata, based on the notion of equivalence between tests. We call the number of such equivalence classes the diversity of the automaton; the diversity may be as small as the logarithm of the number of states of the automaton. For the special class of permutation automata, we describe an inference procedure that runs in time polynomial in the diversity and log(1/&dgr;), where &dgr; is a given upper bound on the probability that our procedure returns an incorrect result. (Since our procedure uses randomization to perform experiments, there is a certain controllable chance that it will return an erroneous result.) We also discuss techniques for handling more general automata. We present evidence for the practical efficiency of our approach. For example, our procedure is able to infer the structure of an automaton based on Rubik's Cube (which has approximately 1019 states) in about 2 minutes on a DEC MicroVax. This automaton is many orders of magnitude larger than possible with previous techniques, which would require time proportional at least to the number of global states. (Note that in this example, only a small fraction (10-14) of the global states were even visited.) Finally, we present a new procedure for inferring automata of a special type in which the global state is composed of a vector of binary local state variables, all of which are observable (or visible) to the experimenter. Our inference procedure runs provably in time polynomial in the size of this vector (which happens to be the diversity of the automaton), even though the global state space may be exponentially larger. The procedure plans and executes experiments on the unknown automaton; we show that the number of input symbols given to the automaton during this process is (to within a constant factor) the best possible."
1994,The RC5 Encryption Algorithm.,"Abstract
This document describes the RC5 encryption algorithm, a fast symmetric block cipher suitable for hardware or software implementations. A novel feature of RC5 is the heavy use of data-dependent rotations. RC5 has a variable word size, a variable number of rounds, and a variable-length secret key. The encryption and decryption algorithms are exceptionally simple."
1993,To Tap or not to Tap.,n/a
1993,Inference of Finite Automata Using Homing Sequences.,"Abstract
We present new algorithms for inferring an unknown finite-state automaton from its input/output behavior, even in the absence of a means of resetting the machine to a start state. A key technique used is inference of a homing sequence for the unknown automaton. Our inference procedures experiment with the unknown machine, and from time to time require a teacher to supply counterexamples to incorrect conjectures about the structure of the unknown automaton. In this setting, we describe a learning algorithm that, with probability 1 ‚àí Œ¥, outputs a correct description of the unknown machine in time polynomial in the automaton‚Ä≤s size, the length of the longest counterexample, and log(1/Œ¥). We present an analogous algorithm that makes use of a diversity-based representation of the finite-state system. Our algorithms are the first which are provably effective for these problems, in the absence of a ""reset."" We also present probabilistic algorithms for permutation automata which do not require a teacher to supply counterexamples. For inferring a permutation automaton of diversity D, we improve the best previous time bound by roughly a factor of D3/log D."
