2010,Scantegrity Mock Election at Takoma Park.,"We report on our experiences and lessons learned using Scantegrity II in a mock election held April 11, 2009, in Takoma Park, Maryland (USA). Ninetyfive members of the community participated in our test of this voting system proposed for the November 2009 municipal election. Results helped improve the system for the November binding election."
2010,Scantegrity II Municipal Election at Takoma Park: The First E2E Binding Governmental Election with Ballot Privacy.,"On November 3, 2009, voters in Takoma Park, Maryland, cast ballots for the mayor and city council members using the Scantegrity II voting system--the first time any end-to-end (E2E) voting system with ballot privacy has been used in a binding governmental election. This case study describes the various efforts that went into the election--including the improved design and implementation of the voting system, streamlined procedures, agreements with the city, and assessments of the experiences of voters and poll workers.

The election, with 1728 voters from six wards, involved paper ballots with invisible-ink confirmation codes, instant-runoff voting with write-ins, early and absentee (mail-in) voting, dual-language ballots, provisional ballots, privacy sleeves, any-which-way scanning with parallel conventional desktop scanners, end-to-end verifiability based on optional web-based voter verification of votes cast, a full hand recount, thresholded authorities, three independent outside auditors, fully-disclosed software, and exit surveys for voters and pollworkers.

Despite some glitches, the use of Scantegrity II was a success, demonstrating that E2E cryptographic voting systems can be effectively used and accepted by the general public."
2010,"A Modular Voting Architecture (""Frog Voting"").","Abstract
This paper presents a new framework‚Äìa reference architecture‚Äìfor voting that we feel has many attractive features. It is not a machine design, but rather a framework that will stimulate innovation and design. It is potentially the standard architecture for all future voting equipment. The ideas expressed here are subject to improvement and further research.
An early version of this paper appeared in [2]. This version of the paper is very similar, but contains a postscript (Section 8) providing commentary and discussion of perspectives on this proposal generated during the intervening years between 2001 and 2008."
2009,Guest editorial: special issue on electronic voting.,"Abstract:
The 13 papers in this special issue focus on electronic voting."
2009,Scantegrity II: end-to-end verifiability by voters of optical scan elections through confirmation codes.,"Abstract:
Scantegrity II is an enhancement for existing paper ballot systems. It allows voters to verify election integrity - from their selections on the ballot all the way to the final tally - by noting codes and checking for them online. Voters mark Scantegrity II ballots just as with conventional optical scan, but using a special ballot marking pen. Marking a selection with this pen makes legible an otherwise invisible preprinted confirmation code. Confirmation codes are independent and random for each potential selection on each ballot. To verify that their individual votes are recorded correctly, voters can look up their ballot serial numbers online and verify that their confirmation codes are posted correctly. The confirmation codes do not allow voters to prove how they voted. However, the confirmation codes constitute convincing evidence of error or malfeasance in the event that incorrect codes are posted online. Correctness of the final tally with respect to the published codes is proven by election officials in a manner that can be verified by any interested party. Thus, compromise of either ballot chain of custody or the software systems cannot undetectably affect election integrity. Scantegrity II has been implemented and tested in small elections in which ballots were scanned either at the polling place or centrally. Preparations for its use in a public sector election have commenced."
2009,"Indifferentiability of Permutation-Based Compression Functions and Tree-Based Modes of Operation, with Applications to MD6.","Abstract
MD6 [17] is one of the earliest announced SHA-3 candidates, presented by Rivest at CRYPTO‚Äô08 [16]. Since then, MD6 has received a fair share of attention and has resisted several initial cryptanalytic attempts [1,11].
Given the interest in MD6, it is important to formally verify the soundness of its design from a theoretical standpoint. In this paper, we do so in two ways: once for the MD6 compression function and once for the MD6 mode of operation. Both proofs are based on the indifferentiability framework of Maurer et al. [13](also see [9]).
The first proof demonstrates that the ‚Äúprepend/map/chop‚Äù manner in which the MD6 compression function is constructed yields a compression function that is indifferentiable from a fixed-input-length (FIL), fixed-output-length random oracle.
The second proof demonstrates that the tree-based manner in which the MD6 mode of operation is defined yields a hash function that is indifferentiable from a variable-input-length (VIL), fixed-output-length random oracle.
Both proofs are rather general and apply not only to MD6 but also to other sufficiently similar hash functions.
These results may be interpreted as saying that the MD6 design has no structural flaws that make its input/output behavior clearly distinguishable from that of a VIL random oracle, even for an adversary who has access to inner components of the hash function. It follows that, under plausible assumptions about those inner components, the MD6 hash function may be safely plugged into any application proven secure assuming a monolithic VIL random oracle."
2008,On Auditing Elections When Precincts Have Different Sizes.,"We address the problem of auditing an election when precincts may have different sizes. Prior work in this field has emphasized the simpler case when all precincts have the same size. Using auditing methods developed for use with equal-sized precincts can, however, be inefficient or result in loss of statistical confidence when applied to elections with variable-sized precincts.

We survey, evaluate, and compare a variety of approaches to the variable-sized precinct auditing problem, including the SAFE method [11] which is based on theory developed for equal-sized precincts. We introduce new methods such as the negative-exponential method ""NEGEXP"" that select precincts independently for auditing with predetermined probabilities, and the ""PPEBWR"" method that uses a sequence of rounds to select precincts with replacement according to some predetermined probability distribution that may depend on error bounds for each precinct (hence the name PPEBWR: probability proportional to error bounds, with replacement), where the error bounds may depend on the sizes of the precincts, or on how the votes were cast in each precinct.

We give experimental results showing that NEGEXP and PPEBWR can dramatically reduce (by a factor or two or three) the cost of auditing compared to methods such as SAFE that depend on the use of uniform sampling. Sampling so that larger precincts are audited with appropriately larger probability can yield large reductions in expected number of votes counted in an audit.

We also present the optimal auditing strategy, which is nicely representable as a linear programming problem but only efficiently computable for small elections (fewer than a dozen precincts). We conclude with some recommendations for practice. "
2008,Scantegrity II: End-to-End Verifiability for Optical Scan Election Systems using Invisible Ink Confirmation Codes.,"Scantegrity II is an enhancement for existing paper ballot systems. It allows voters to verify election integrity - from their selections on the ballot all the way to the final tally - by noting codes and checking for them online. Voters mark Scantegrity II ballots just as with conventional optical scan, but using a special ballot marking pen. Marking a selection with this pen makes legible an otherwise invisible preprinted confirmation code. Confirmation codes are independent and random for each potential selection on each ballot. To verify that their individual votes are recorded correctly, voters can look up their ballot serial numbers online and verify that their confirmation codes are posted correctly. The confirmation codes do not allow voters to prove how they voted. However, the confirmation codes constitute convincing evidence of error or malfeasance in the event that incorrect codes are posted online. Correctness of the final tally with respect to the published codes is proven by election officials in a manner that can be verified by any interested party. Thus, compromise of either ballot chain of custody or the software systems cannot undetectably affect election integrity. Scantegrity II has been implemented and tested in small elections in which ballots were scanned either at the polling place or centrally. Preparations for its use in a public sector election have commenced."
2007,Amplifying Collision Resistance: A Complexity-Theoretic Treatment.,"Abstract
We initiate a complexity-theoretic treatment of hardness amplification for collision-resistant hash functions, namely the transformation of weakly collision-resistant hash functions into strongly collision-resistant ones in the standard model of computation. We measure the level of collision resistance by the maximum probability, over the choice of the key, for which an efficient adversary can find a collision. The goal is to obtain constructions with short output, short keys, small loss in adversarial complexity tolerated, and a good trade-off between compression ratio and computational complexity. We provide an analysis of several simple constructions, and show that many of the parameters achieved by our constructions are almost optimal in some sense."
2007,Security of Voting Systems.,n/a
2007,On the Security of the EMV Secure Messaging API (Extended Abstract).,"Abstract
We present new attacks against the EMV financial transaction security system (known in Europe as ‚ÄúChip and PIN‚Äù), specifically on the back-end API support for sending secure messages to EMV smartcards."
2007,Robbing the Bank with a Theorem Prover - (Abstract).,"Abstract
In this work, we present the first automated analysis of security application programming interfaces (security APIs). In particular, we analyze the API of the IBM 4758 CCA, a hardware security module for banking networks. Adapting techniques from formal analyses of security protocols, we model the API purely according its specification and assuming ideal encryption primitives. We then use the automated theorem-prover Otter to analyze this model, combining its standard reasoning strategies with novel techniques of our own (also presented here). In this way, we derive not only all published API-level attacks against the 4758 CCA, but an extension to these attacks as well. Thus, this work represents the first step toward fully-automated, rigorous analyses of security APIs."
2007,On Estimating the Size and Confidence of a Statistical Audit.,"We consider the problem of statistical sampling for auditing elections, and we develop a remarkably simple and easily-calculated upper bound for the sample size necessary for determining with probability at least c if a given set of n objects contains fewer than b ""bad"" objects. While the size of the optimal sample drawn without replacement can be determined with a computer program, our goal is to derive a highly accurate and simple formula that can be used by election officials equipped with only a hand-held calculator. We actually develop several formulae, but the one we recommend for use in practice is: U3(n, b, c) = ?(n - (b - 1)/2) ? (1 - (1 - c)1/b)? = ?(n - (b - 1)/2) ? (1 - exp(ln(1 - c)/b))? As a practical matter, this formula is essentially exact: we prove that it is never too small, and empirical testing for many representative values of n ? 10,000, and b ? n/2, and c ? 0.99 never finds it more than one too large. Theoretically, we show that for all n and b this formula never exceeds the optimal sample size by more than 3 for c ? 0.9975, and by more than (-ln(1 - c))/2 for general c."
2006,How to Leak a Secret: Theory and Applications of Ring Signatures.,"Abstract
In this work we formalize the notion of a ring signature, which makes it possible to specify a set of possible signers without revealing which member actually produced the signature. Unlike group signatures, ring signatures have no group managers, no setup procedures, no revocation procedures, and no coordination: any user can choose any set of possible signers that includes himself, and sign any message by using his secret key and the others‚Äô public keys, without getting their approval or assistance. Ring signatures provide an elegant way to leak authoritative secrets in an anonymous way, to sign casual email in a way that can only be verified by its intended recipient, and to solve other problems in multiparty computations.
Our main contribution lies in the presentation of efficient constructions of ring signatures; the general concept itself (under different terminology) was first introduced by Cramer et al. [CDS94]. Our constructions of such signatures are unconditionally signer-ambiguous, secure in the random oracle model, and exceptionally efficient: adding each ring member increases the cost of signing or verifying by a single modular multiplication and a single symmetric encryption. We also describe a large number of extensions, modifications and applications of ring signatures which were published after the original version of this work (in Asiacrypt 2001)."
2006,Fourth-factor authentication: somebody you know.,"User authentication in computing systems traditionally depends on three factors: something you have (e.g., a hardware token), something you are (e.g., a fingerprint), and something you know (e.g., a password). In this paper, we explore a fourth factor, the social network of the user, that is, somebody you know.Human authentication through mutual acquaintance is an age-old practice. In the arena of computer security, it plays roles in privilege delegation, peer-level certification, help-desk assistance, and reputation networks. As a direct means of logical authentication, though, the reliance of human being on another has little supporting scientific literature or practice.In this paper, we explore the notion of vouching, that is, peer-level, human-intermediated authentication for access control. We explore its use in emergency authentication, when primary authenticators like passwords or hardware tokens become unavailable. We describe a practical, prototype vouching system based on SecurID, a popular hardware authentication token. We address traditional, cryptographic security requirements, but also consider questions of social engineering and user behavior."
2006,Lightweight Email Signatures (Extended Abstract).,"Abstract
We present Lightweight Email Signatures (LES), a simple cryptographic architecture for authenticating email. LES is an extension of DKIM, the recent IETF effort to standardize domain-based email signatures. LES shares DKIM‚Äôs ease of deployment: they both use the DNS to distribute a single public key for each domain. Importantly, LES supports common uses of email that DKIM jeopardizes: multiple email personalities, firewalled ISPs, incoming-only email forwarding services, and other common uses that often require sending email via a third-party SMTP server. In addition, LES does not require DKIM‚Äôs implied intra-domain mechanism for authenticating users when they send email.
LES provides these features using identity-based signatures. Each domain authority generates a master keypair, publishes the public component in the DNS, and stores the private component securely. Using this private component, the authority delivers to each of its users, via email, an individual secret key whose identity string corresponds to the user‚Äôs email address. A sender then signs messages using this individual secret key. A recipient verifies such a signature by querying the appropriate master public key from the DNS, computing the sender‚Äôs public key, and verifying the signature accordingly. As an added bonus, the widespread availability of user-level public keys enables deniable authentication, such as ring signatures. Thus, LES provides email authentication with optional repudiability.
We built a LES prototype to determine its practicality. Basic user tests show that the system is relatively easy to use, and that cryptographic performance, even when using deniable authentication, is well within acceptable range."
2006,Phish and Chips.,"Abstract
This paper surveys existing and new security issues affecting the EMV electronic payments protocol. We first introduce a new price/effort point for the cost of deploying eavesdropping and relay attacks ‚Äì a microcontroller-based interceptor costing less than $100. We look next at EMV protocol failures in the back-end security API, where we describe two new attacks based on chosen-plaintext CBC weaknesses, and on key separation failues. We then consider future modes of attack, specifically looking at combining the phenomenon of phishing (sending unsolicited messages by email, post or phone to trick users into divulging their account details) with chip card sabotage. Our proposed attacks exploit covert channels through the payments network to allow sabotaged cards to signal back their PINS. We hope these new recipes will enliven the debate about the pros and cons of Chip and PIN at both technical and commercial levels."
2006,Scratch & vote: self-contained paper-based cryptographic voting.,"We present Scratch & Vote; (S&V), a cryptographic voting system designed to minimize cost and complexity: (1) ballots are paper-based and can be printed using today's technology, (2) ballots are universally verifiable without electionofficial intervention, and (3) tallying requires only one trustee decryption per race, thanks to homomorphic aggregation. Scratch & Vote combines the multi-candidate election techniques of Baudron et al. with the ballot-casting simplicity of Chaum and Ryan's paper-based techniques. In addition, S&V allows each voter to participate directly in the audit process on election day, prior; to casting their own ballot."
2005,Lightweight Encryption for Email.,"Email encryption techniques have been available for more than a decade, yet none has been widely deployed. The problems of key generation, certification, and distribution have not been pragmatically addressed. We recently proposed a method for implementing a Lightweight Public Key Infrastructure (PKI) for email authentication using recent developments in identitybased cryptography and today's existing Internet infrastructure.

While this solution works well for email authentication, email encryption exhibits a different threat model that requires special treatment. In this work, we discuss how to achieve email encryption and present a realistic deployment and adoption process, while respecting the current functionality and expectations of email."
2004,Access-controlled resource discovery in pervasive networks.,"Networks of the future will be characterized by a variety of computational devices that display a level of dynamism not seen in traditional wired networks. Because of the dynamic nature of these networks, resource discovery is one of the fundamental problems that must be solved. While resource discovery systems are not a novel concept, securing these systems in an efficient and scalable way is challenging. This paper describes the design and implementation of an architecture for access?controlled resource discovery. This system achieves this goal by integrating access control with the Intentional Naming System (INS), a resource discovery and service location system. The integration is scalable, efficient, and fits well within a proxy?based security framework designed for dynamic networks. We provide performance experiments that show how our solution outperforms existing schemes. The result is a system that provides secure, access?controlled resource discovery that can scale to large numbers of resources and users. Copyright © 2004 John Wiley & Sons, Ltd.
"
2004,Peppercoin Micropayments.,"Abstract
We present the ‚ÄùPeppercoin‚Äù method for processing micropayments efficiently. With this method, a fraction of the micropayments received are determined, via a procedure known as ‚Äùcryptographic selection,‚Äù to qualify for upgrade to a macropayment. The merchant deposits the upgraded micropayments as macropayments, and merely logs locally the non-qualifying micropayments. In this manner, the merchant transforms a large collection of small micropayments into a smaller collection of macropayments, of the same total expected value. The merchant pays much less for processing the resulting macropayments, since there are fewer of them. Consumers are billed for exactly the amount they spend, based on auxiliary information recorded in each micropayment. The method is highly secure, and compatible with existing payment mechanisms such as credit cards."
2004,On Permutation Operations in Cipher Design.,"Abstract:
New and emerging applications can change the mix of operations commonly used within computer architectures. It is sometimes surprising when instruction-set architecture (ISA) innovations intended for one purpose are used for other (initially unintended) purposes. We consider recent proposals for the processor support of families of bit-level permutations. From a processor architecture point of view, the ability to support very fast bit-level permutations may be viewed as a further validation of the basic word-orientation of processors, and their ability to support next-generation secure multimedia processing. However, bitwise permutations are also fundamental operations in many cryptographic primitives and we discuss the suitability of these new operations for cryptographic purposes."
2004,On the Notion of Pseudo-Free Groups.,"Abstract
We explore the notion of a pseudo-free group, first introduced by Hohenberger [Hoh03], and provide an alternative stronger definition. We show that if Z
‚àó
n
is a pseudo-free abelian group (as we conjecture), then Z
‚àó
n
also satisfies the Strong RSA Assumption [FO97,CS00,BP97]. Being a ‚Äúpseudo-free abelian group‚Äù may be the strongest natural cryptographic assumption one can make about a group such as Z
‚àó
n
. More generally, we show that a pseudo-free group satisfies several standard cryptographic assumptions, such as the difficulty of computing discrete logarithms."
2003,The blocker tag: selective blocking of RFID tags for consumer privacy.,"We propose the use of ""selective blocking"" by ""blocker tags"" as a way of protecting consumers from unwanted scanning of RFID tags attached to items they may be carrying or wearing.While an ordinary RFID tag is a simple, cheap (e.g. five-cent) passive device intended as an ""electronic bar-code"" for use in supply-chain management, a blocker tag is a cheap passive RFID device that can simulate many ordinary RFID tags simultaneously. When carried by a consumer, a blocker tag thus ""blocks"" RFID readers. It can do so universally by simulating all possible RFID tags. Or a blocker tag can block selectively by simulating only selected subsets of ID codes, such as those by a particular manufacturer, or those in a designated ""privacy zone.We believe that this approach, when used with appropriate care, provides a very attractive alternative for addressing privacy concerns raised by the potential (and likely) widespread use of RFID tags in consumer products.We also discuss possible abuses arising from blocker tags, and means for detecting and dealing with them."
2003,Does Anyone Really Need MicroPayments?,"Abstract
Many cryptographers have tried to develop special technology for transferring tiny amounts of value; the theory being that the computational and/or administrative costs of other payment schemes render them unsuitable for small value transactions. In this panel we discussed two major questions: firstly are the existing systems really not useful for small values and secondly might other models such as flat rate or subscription systems be more suitable anyway, and be possible without the need for small payments?"
2003,Access-Controlled Resource Discovery for Pervasive Networks.,"Networks of the future will be characterized by a variety of computational devices that display a level of dynamism not seen in traditional wired networks. Because of the dynamic nature of these networks, resource discovery is one of the fundamental problems that must be faced. While resource discovery systems are not a novel concept, securing these systems in an efficient and scalable way is challenging. This paper describes the design and implementation of an architecture for access-controlled resource discovery. This system achieves this goal by integrating access control with the Intentional Naming System (INS), a resource discovery and service location system. The integration is scalable, efficient, and fits well within a proxy-based security framework designed for dynamic networks. We provide performance experiments that show how our solution outperforms existing schemes. The result is a system that provides secure, access-controlled resource discovery that can scale to large numbers of resources and users."
