1988,Training a 3-Node Neural Network is NP-Complete.,"We consider a 2-layer, 3-node, n-input neural network whose nodes compute linear threshold functions of their inputs. We show that it is NP-complete to decide whether there exist weights and thresholds for the three nodes of this network so that it will produce output consistent with a given set of training examples. We extend the result to other simple networks. This result suggests that those looking for perfect training algorithms cannot escape inherent computational difficulties just by considering only simple or very regular networks. It also suggests the importance, given a training problem, of finding an appropriate network and input encoding for that problem. It is left as an open problem to extend our result to nodes with non-linear functions such as sigmoids."
1988,A New Model for Inductive Inference.,"We introduce a new model for inductive inference, by combining a Bayesian approach for representing the current state of knowledge with a simple model for the computational cost of making predictions from theories. We investigate the optimization problem: how should a scientist divide his time between doing experiments and deducing predictions for promising theories. We propose an answer to this question, as a function of the relative costs of making predictions versus performing experiments. We believe our model captures many of the qualitative characteristics of ""real"" science.

We believe that this model makes two important contributions. First, it allows us to study how a scientist might go about acquiring knowledge in a world where (as in real life) there are costs associated with both performing experiments and with computing the predictions of various theories.

This model also lays the groundwork for a rigorous treatment of a machine-implementable notion of ""subjective probability"". Subjective probability is at the heart of probability theory [5]. Previous treatments have not been able to handle the difficulty that subjective probabilities can change as the result of ""pure thinking""; our model captures this (and other effects) in a realistic manner. In addition, we begin to provide an answer to the question of how to trade-off ""thinking"" versus ""doing""---a question that is fundamental for computers that must exist in the world and learn from their experience. "
1987,Game Tree Searching by Min/Max Approximation.,"Abstract
We present an iterative method for searching min/max game trees based on the idea of approximating the ‚Äúmin‚Äù and ‚Äúmax‚Äù operators by generalized mean-valued operators. This approximation is used to guide the selection of the next leaf node to expand, since the approximations allow one to select efficiently that leaf node upon whose value the (approximate) value at the root most highly depends. Experimental results from almost 1,000 games of Connect-Four1 suggest that our scheme is superior to minimax search with alpha-beta pruning, for the same number of calls to the move routine. However, our scheme has higher overhead, so that further work is needed before it becomes competitive when CPU time per turn is the limiting resource."
1987,Global Wire Routing in Two-Dimensional Arrays.,"We examine the problem of routing wires on a VLSI chip, where the pins to be connected are arranged in a regular rectangular array. We obtain tight bounds for the worst-case ""channel-width"" needed to route an n ◊ n array, and develop provably good heuristics for the general case. An interesting ""rounding algorithm"" for obtaining integral approximations to solutions of linear equations is used to show the near-optimality of single-turn routings in the worst-case. "
1987,Learning Decision Lists.,"Abstract
This paper introduces a new representation for Boolean functions, called decision lists, and shows that they are efficiently learnable from examples. More precisely, this result is established for k-DL the set of decision lists with conjunctive clauses of size k at each decision. Since k-DL properly includes other well-known techniques for representing Boolean functions such as k-CNF (formulae in conjunctive normal form with at most k literals per clause), k-DNF (formulae in disjunctive normal form with at most k literals per term), and decision trees of depth k, our result strictly increases the set of functions that are known to be polynomially learnable, in the sense of Valiant (1984). Our proof is constructive: we present an algorithm that can efficiently construct an element of k-DL consistent with a given set of examples, if one exists."
1987,Network control by Bayesian broadcast.,"Abstract:
A transmission control strategy is described for slotted-ALOHA-type broadcast channels with ternary feedback. At each time slot, each station estimates the probability that n stations are ready to transmit a packet for each n , using Bayes' rule and the observed history of collisions, successful transmissions, and holes (empty slots). A station transmits a packet in a probabilistic manner based on these estimates. This strategy is called Bayesian broadcast. An elegant and very practical strategy--pseudo-Bayesian broadcast--is then derived by approximating the probability estimates with a Poisson distribution with mean \nu and further simplifying. Each station keeps a copy of \nu , transmits a packet with probability 1/\nu , and then updates \nu in two steps: For collisions, increment \nu by (e-2)^{-l}=1.39221 \cdots . For successes and holes, decrement \nu by 1 . Set \nu to \max (\nu + \hat{\lambda}, 1) , where \hat{\lambda} is an estimate of the arrival rate \lambda of new packets into the system. Simulation results are presented showing that pseudo-Bayesian broadcast performs well in practice, and methods that can be used to prove that certain versions of pseudo-Bayesian broadcast are stable for \lambda < e^{-1} are discussed."
1987,Diversity-Based Inference of Finite Automata (Extended Abstract).,"Abstract:
We present a new procedure for inferring the structure of a finitestate automaton (FSA) from its input/output behavior, using access to the automaton to perform experiments. Our procedure uses a new representation for FSA's, based on the notion of equivalence between testa. We call the number of such equivalence classes the diversity of the automaton; the diversity may be as small as the logarithm of the number of states of the automaton. The size of our representation of the FSA, and the running time of our procedure (in some case provably, in others conjecturally) is polynomial in the diversity and ln(1/Œµ), where Œµ is a given upper bound on the probability that our procedure returns an incorrect result. (Since our procedure uses randomization to perform experiments, there is a certain controllable chance that it will return an erroneous result.) We also present some evidence for the practical efficiency of our approach. For example, our procedure is able to infer the structure of an automaton based on Rubik's Cube (which has approximately 1019 states) in about 2 minutes on a DEC Micro Vax. This automaton is many orders of magnitude larger than possible with previous techniques, which would require time proportional at least to the number of global states. (Note that in this example, only a small fraction (10-14) of the global states were even visited.)"
1986,An application of number theory to the organization of raster-graphics memory.,"A high-resolution raster-graphics display is usually combined with processing power and a memory organization that facilitates basic graphics operations. For many applications, including interactive text processing, the ability to quickly move or copy small rectangles of pixels is essential. This paper proposes a novel organization of raster-graphics memory that permits all small rectangles to be moved efficiently. The memory organization is based on a doubly periodic assignment of pixels to M memory chips according to a ‚ÄúFibonacci‚Äù lattice. The memory organization guarantees that, if a rectilinearly oriented rectangle contains fewer than M/ @@@@5 pixels, then all pixels will reside in different memory chips and thus can be accessed simultaneously. Moreover, any M consecutive pixels, arranged either horizontally or vertically, can be accessed simultaneously. We also define a continuous analog of the problem, which can be posed as: ‚ÄúWhat is the maximum density of a set of points in the plane such that no two points are contained in the interior of a rectilinearly oriented rectangle of unit area?‚Äù We show the existence of such a set with density 1/ @@@@5, and prove this is optimal by giving a matching upper bound."
1986,Estimating a probability using finite memory.,"Abstract:
Let \{X_{i}\}_{i=1}^{\infty} be a sequence of independent Bernoulli random variables with probability p that X_{i} = 1 and probability q=1-p that X_{i} = 0 for all i \geq 1 . Time-invariant finite-memory (i.e., finite-state) estimation procedures for the parameter p are considered which take X_{1}, \cdots as an input sequence. In particular, an n-state deterministic estimation procedure is described which can estimate p with mean-square error O(\log n/n) and an n -state probabilistic estimation procedure which can estimate p with mean-square error O(1/n) . It is proved that the O(1/n) bound is optimal to within a constant factor. In addition, it is shown that linear estimation procedures are just as powerful (up to the measure of mean-square error) as arbitrary estimation procedures. The proofs are based on an analog of the well-known matrix tree theorem that is called the Markov chain tree theorem."
1986,A non-iterative maximum entropy algorithm.,"We present a new algorithm for computing the maximum entropy probability distribution satisfying a set of constraints. Unlike previous approaches, our method is integrated with the planning of data collection and tabulation. We show how adding constraints and performing the associated additional tabulations can substantially speed up computation by replacing the usual iterative techniques with a non-iterative computation. We note, however, that the constraints added may contain significantly more variables than any of the original constraints so there may not be enough data to collect meaningful statistics. These extra constraints are shown to correspond to the intermediate tables in Cheeseman's method. Furthermore, we prove that acyclic hypergraphs and decomposable models are equivalent, and discuss the similarities and differences between our algorithm and Spiegelhalter's algorithm. Finally, we compare our work to Kim and Pearl's work on singly-connected networks."
1985,Is DES a Pure Cipher? (Results of More Cycling Experiments on DES).,"Abstract
During summer 1985, we performed eight cycling experiments on the Data Encryption Standard (DES) to see if DES has certain algebraic weaknesses. Using special-purpose hardware, we applied the cycling closure test described in our Eurocrypt 85 paper to determine whether DES is a pure cipher. We also carried out a stronger version of this test. (A cipher is pure if, for any keys i, j, k, there exists some key l such that T i T j ‚àí1 T k = T l, where T w denotes encryption under key w.) In addition, we followed the orbit of a randomly chosen DES transformation for 236 steps, as well as the orbit of the composition of two of the ‚Äúweak key‚Äù transformations. Except for the weak key experiment, our results are consistent with the hypothesis that DES acts like a set of randomly chosen permutations. In particular, our results show with overwhelming confidence that DES is not pure. The weak key experiment produced a short cycle of about 233 steps, the consequence of hitting a fixed point for each weak key."
1985,Efficient Factoring Based on Partial Information.,"Abstract
Many recently proposed cryptosystems are based on the assumption that factoring large composite integers is computationally difficult. In this paper we examine this assumption when the cryptanalyst has ‚Äúside information‚Äù available."
1985,Is the Data Encryption Standard a Group? (Preliminary Abstract).,"Abstract
The Data Encryption Standard (DES) defines an indexed set of permutations acting on the message space M = {0,1}64. If this set of permutations were closed under functional composition, then DES would be vulnerable to a known-plaintext attack that runs in 228 steps, on the average. It is unknown in the open literature whether or not DES has this weakness.
We describe two statistical tests for determining if an indexed set of permutations acting on a finite message space forms a group under functional composition. The first test is a ‚Äúmeet-in-the-middle‚Äù algorithm which uses O(‚àöK) time and space, where K is the size of the key space. The second test, a novel cycling algorithm, uses the same amount of time but only a small constant amount of space. Each test yields a known-plaintext attack against any finite, deterministic cryptosystem that generates a small group.
The cycling test takes a pseudo-random walk in the message space until a cycle is detected. For each step of the pseudo-random walk, the previous ciphertext is encrypted under a key chosen by a pseudo-random function of the previous ciphertext. Results of the test are asymmetrical: long cycles are overwhelming evidence that the set of permutations is not a group; short cycles are strong evidence that the set of permutations has a structure different from that expected from a set of randomly chosen permutations.
Using a combination of software and special-purpose hardware, we applied the cycling test to DES. Our experiments show, with a high degree of confidence, that DES is not a group."
1985,A Fair Protocol for Signing Contracts (Extended Abstract).,"Abstract
Assume that two parties, A and B, want to sign a contract over a communication network, i.e. they want to exchange their ‚Äúcommitments‚Äú to the contract. We consider a contract signing protocol to be fair if, at any stage in its execution, the following hold: the conditional probability that party A obtains B's signature to the contract given that B has obtained A's signature to the contract, is close to 1. (Symmetrically, when switching the roles of A and B).
Contract signing protocols cannot be fair without relying on a trusted third party. We present a fair, cryptographic protocol for signing contracts that makes use of the weakest possible form of a trusted third party (judge). If both A and B are honest, the judge will never be called upon. Otherwise, the judge rules by performing a simple computation, without referring to previous verdicts. Thus, no bookkeeping is required from the judge. Our protocol is fair even if A and B have very different computing powers. Its fairness is proved under the very general cryptographic assumption that functions that are one-way in a weak sense exist. Our protocol is also optimal with respect to the number of messages exchanged."
1984,How to Expose an Eavesdropper.,We present a new protocol for establishing secure communications over an insecure communications charmel in the absence of trusted third parties or authenticated keys. The protocol is an improvement over the simpler protocol in which the communicating parties exchanged their public encryption keys and used them to encrypt messages. It forces a potential eavesdropper--if he wants to understand the messages--to reveal his existence by modifying and seriously garbling the communication. 
1984,A Knapsack Type Public Key Cryptosystem Based On Arithmetic in Finite Fields.,"Abstract
We introduce a new knapsack type public key cryptosystem. The system is based on a novel application of arithmetic in finite fields, following a construction by Bose and Chowla. Appropriately choosing the parameters, we can control the density of the resulting knapsack. In particular, the density can be made high enough to foil ‚Äúlow density‚Äù attacks against our system. At the moment, we do not know of any attacks capable of ‚Äúbreaking‚Äù this system in a reasonable amount of time."
1984,"A ""Paradoxical'""Solution to the Signature Problem (Abstract).","Brief Abstract
We present a general signature scheme which uses any pair of trap-door permutations (f0, f1) for which it is infeasible to find any x, y with f0(x) = f1(y). The scheme possesses the novel property of being robust against an adaptive chosen message attack: no adversary who first asks for and then receives sgnatures for messages of his choice (which may depend on previous signatures seen) can later forge the signature of even a singl additional message.
For specific instance of our general scheme, we prove that
(1)
forging signatures is provably equivalent to factoring (i.e., factoring is polynomial-time reducible to forging signatures, and vice versa) while
 (2)
forging an additional signature, after an adaptive chosen message attack is still equivalent to factoring.
  Such scheme is ‚Äúparadoxical‚Äù since the above two properties were believed (and even ‚Äúproven‚Äù in the folklore) to be contradictory.
The new scheme is potentially practical: signing and verifying signatures are reasonably fast, and signatures are not too long."
1984,RSA Chips (Past/Present/Future).,"Abstract
We review the issues involved in building a special-purpose chip for performing RSA encryption/decryption, and review a few of the current implementation efforts."
1984,"A ""Paradoxical"" Solution to the Signature Problem (Extended Abstract).","We present a general signature scheme which uses any pair of trap-door permutations (f0, f1) for which it is infeasible to find any x, y with f0(x) = f1(y). The scheme possesses the novel property of being robust against an adaptive chosen message attack: no adversary who first asks for and then receives sgnatures for messages of his choice (which may depend on previous signatures seen) can later forge the signature of even a singl additional message. "
1983,A Method for Obtaining Digital Signatures and Public-Key Cryptosystems (Reprint).,"An encryption method is presented with the novel property that publicly revealing an encryption key does not thereby reveal the corresponding decryption key. This has two important consequences: Couriers or other secure means are not needed to transmit keys, since a message can be enciphered using an encryption key publicly revealed by the intended recipient. Only he can decipher the message, since only he knows the corresponding decryption key. A message can be ‚Äúsigned‚Äù using a privately held decryption key. Anyone can verify this signature using the corresponding publicly revealed encryption key. Signatures cannot be forged, and a signer cannot later deny the validity of his signature. This has obvious applications in ‚Äúelectronic mail‚Äù and ‚Äúelectronic funds transfer‚Äù systems. A message is encrypted by representing it as a number M, raising M to a publicly specified power e, and then taking the remainder when the result is divided by the publicly specified product, n, of two large secret prime numbers p and q. Decryption is similar; only a different, secret, power d is used, where e * d = 1(mod (p - 1) * (q - 1)). The security of the system rests in part on the difficulty of factoring the published divisor, n."
1983,Estimating a Probability Using Finite Memory (Extended Abstract).,"Abstract
Let {Xi i=1 ‚àû } be a sequence of independent Bernoulli random variables with probability p that X i =1 and probability q=1 ‚àí p that X i =0 for all i‚â•1. We consider time-invariant finite-memory (i.e., finite-state) estimation procedures for the parameter p which take X1, ... as an input sequence. In particular, we describe an n-state deterministic estimation procedure that can estimate p with mean-square error O(log n/n) and an n-state probabilistic estimation procedure that can estimate p with mean-square error O(1/n). We prove that the O(1/n) bound is optimal to within a constant factor. In addition, we show that linear estimation procedures are just as powerful (up to the measure of mean-square error) as arbitrary estimation procedures. The proofs are based on the Markov Chain Tree Theorem."
1983,Global Wire Routing in Two-Dimensional Arrays (Extended Abstract).,"Abstract:
We examine the problem of routing wires on a VLSI chip, where the pins to be connected are arranged in a regular rectangular array. We obtain tight bounds for the worst-case ""channel-width"" needed to route an n √ó n array, and develop provably good heuristics for the general case. An interesting ""rounding algorithm"" for obtaining integral approximations to solutions of linear equations is used to show the near-optimality of single-turn routings in the worst-case."
1982,"How to Reuse a ""Write-Once"" Memory.","Storage media such as digital optical disks, PROMS, or paper tape consist of a number of ‚Äúwrite-once‚âì bit positions (wits); each wit initially contains a ‚Äú0‚âì that may later be irreversibly overwritten with a ‚Äú1.‚âì It is demonstrated that such ‚Äúwrite-once memories‚âì (woms) can be ‚Äúrewritten‚âì to a surprising degree. For example, only 3 wits suffice to represent any 2-bit value in a way that can later be updated to represent any other 2-bit value. For large k, 1.29‚Ä¶ ¬∑ k wits suffice to represent a k-bit value in a way that can be similarly updated. Most surprising, allowing t writes of a k-bit value requires only t + o(t) wits, for any fixed k. For fixed t, approximately k ¬∑ t/log(t) wits are required as k ‚Üí ‚àû. An n-wit WOM is shown to have a ‚Äúcapacity‚âì (i.e., k ¬∑ t when writing a k-bit value t times) of up to n ¬∑ log(n) bits."
1982,Randomized Encryption Techniques.,"Abstract
A randomized encryption procedure enciphers a message by randomly choosing a ciphertext from a set of ciphertexts corresponding to the message under the current encryption key. At the cost of increasing the required bandwidth, such procedures may achieve greater cryptographic security than their deterministic counterparts by increasing the apparent size of the message space, eliminating the threat of chosen plaintext attacks, and improving the a priori statistics for the inputs to the encryption algorithms. In this paper we explore various ways of using randomization in encryption."
1982,A Short Report on the RSA Chip.,"Abstract
The nMOS ‚ÄúRSA chip‚Äù described in our article [1] was initially fabricated by Hewlett-Packard. Testing revealed that while the control portion of the chip worked correctly, the arithmetic section suffered from transient errors and was usually too unreliable to complete a full encryption. We tested a number of chips and found the same problem, enough to convonce us that the cause was probably a design error and not a fabrication problem."
1982,"A ""greedy"" channel router.","We present a new, ‚Äúgreedy‚Äù, channel-router that is quick, simple, and highly effective. It always succeeds, usually using no more than one track more than required by channel density. (It may be forced in rare cases to make a few connections ‚Äúoff the end‚Äù of the channel, in order to succeed.) It assumes that all pins and wiring lie on a common grid, and that vertical wires are on one layer, horizontal on another. The greedy router wires up the channel in a left-to-right, column-by-column manner, wiring each column completely before starting the next. Within each column the router tries to maximize the utility of the wiring produced, using simple, ‚Äúgreedy‚Äù heuristics. It may place a net on more than one track for a few columns, and ‚Äúcollapse‚Äù the net to a single track later on, using a vertical jog. It may also use a jog to move a net to a track closer to its pin in some future column. The router may occasionally add a new track to the channel, to avoid ‚Äúgetting stuck‚Äù."
1982,"The ""PI"" (placement and interconnect) system.","‚ÄúPI‚Äù is an advanced LISP-based placement and interconnect system for custom NMOS or CMOS (single-layer metal) designs. When fully implemented, PI will handle placement of arbitrarily-sized rectangular modules, routing of power and ground, signal routing, and compaction. In this paper we briefly review the structure of PI, and present details on the signal-routing heuristics, focusing on the definition of ‚Äúchannels‚Äù, the global router, the ‚Äúcrossing placer‚Äù, and the channel routers. The signal router is fully operational; the rest of PI is currently being coded and will be more fully described in later papers and theses."
