2018,From Battlefields to Elections: Winning Strategies of Blotto and Auditing Games.,"Mixed strategies are often evaluated based on the expected payoff that they guarantee. This is not always desirable. In this paper, we consider games for which maximizing the expected payoff deviates from the actual goal of the players. To address this issue, we introduce the notion of a (u,p)-maxmin strategy which ensures receiving a minimum utility of u with probability at least p. We then give approximation algorithms for the problem of finding a (u, p)-maxmin strategy for these games.

The first game that we consider is Colonel Blotto, a well-studied game that was introduced in 1921. In the Colonel Blotto game, two colonels divide their troops among a set of battlefields. Each battlefield is won by the colonel that puts more troops in it. The payoff of each colonel is the weighted number of battlefields that she wins. We show that maximizing the expected payoff of a player does not necessarily maximize her winning probability for certain applications of Colonel Blotto. For example, in presidential elections, the playersí goal is to maximize the probability of winning more than half of the votes, rather than maximizing the expected number of votes that they get. We give an exact algorithm for a natural variant of continuous version of this game. More generally, we provide constant and logarithmic approximation algorithms for finding (u, p)-maxmin strategies.

We also introduce a security game version of Colonel Blotto which we call auditing game. It is played between two players, a defender and an attacker. The goal of the defender is to prevent the attacker from changing the outcome of an instance of Colonel Blotto. Again, maximizing the expected payoff of the defender is not necessarily optimal. Therefore we give a constant approximation for (u, p)-maxmin strategies.
"
2017,When Is an Election Verifiable?,"Abstract:
Verifiable elections currently require voter-verifiable paper ballots, demonstrably adequate custody of those ballots, and well-designed audits of the results based on manual inspection of those ballots."
2017,BatchVote: Voting Rules Designed for Auditability.,"Abstract
We propose a family of novel social choice functions. Our goal is to explore social choice functions for which ease of auditing is a primary design goal, instead of being ignored or left as a puzzle to solve later.
Our proposal, ‚ÄúBatchVote,‚Äù creates a social choice function f from an arbitrary ‚Äúinner‚Äù social choice function g, such as instant-runoff voting (IRV), and an integer B, the number of batches.
We aim to preserve flexibility by allowing g to be arbitrary, while providing the ease of auditing of a plurality election.
To compute the winner of an election of n votes, the social choice function f partitions the votes into B batches of roughly the same size, pseudorandomly. The social choice function g is applied to each batch. The election winner, according to f, is the weighted plurality winner for the B outcomes, where the weight of each batch is the number of votes it contains. The social choice function f may be viewed as an ‚Äúinterpolation‚Äù between plurality (which is easily auditable) and g (which need not be).
Auditing is simple by design: we can view f as being a (weighted) plurality election by B ‚Äúsupervoters,‚Äù where the bth supervoter‚Äôs vote is determined by applying g to the votes in batch b, and the weight of her vote is the number of votes in her batch. Since plurality elections are easy to audit, the election output can be audited by checking a random sample of ‚Äúsupervotes‚Äù against the corresponding paper records."
2017,Marked Mix-Nets.,"Abstract
We propose a variant mix-net method, which we call a ‚Äúmarked mix-net‚Äù. Marked mix-nets avoid the extra cost associated with verifiability (producing a proof of correct mixing operation), while offering additional assurances about the privacy of the messages, compared to a non-verifiable mix-net.
With a marked mix-net, each mix-server adds an extra secret mark in each ciphertext, and the input ciphertexts are made non-malleable but still re-randomizable (RCCA).
Marked mix-nets appear to be a good fit for the mix-net requirements of voting systems that need a mix-net for anonymity but where correctness is guaranteed through independent mechanisms. Our work investigates applications to STAR-Vote, but other applications could be explored, e.g., in Pr√™t-√†-Voter, Selene or Wombat."
2017,Time-Space Trade-offs in Population Protocols.,"Population protocols are a popular model of distributed computing, in which randomly-interacting agents with little computational power cooperate to jointly perform computational tasks. Inspired by developments in molecular computation, and in particular DNA computing, recent algorithmic work has focused on the complexity of solving simple yet fundamental tasks in the population model, such as leader election (which requires convergence to a single agent in a special ìleaderî state), and majority (in which agents must converge to a decision as to which of two possible initial states had higher initial count). Known results point towards an inherent trade-off between the time complexity of such algorithms, and the space complexity, i.e. size of the memory available to each agent.

In this paper, we explore this trade-off and provide new upper and lower bounds for majority and leader election. First, we prove a unified lower bound, which relates the space available per node with the time complexity achievable by a protocol: for instance, our result implies that any protocol solving either of these tasks for n agents using O(log log n) states must take ?(n/polylogn) expected time. This is the first result to characterize time complexity for protocols which employ super-constant number of states per node, and proves that fast, poly-logarithmic running times require protocols to have relatively large space costs.

On the positive side, we give algorithms showing that fast, poly-logarithmic convergence time can be achieved using O (log2 n) space per node, in the case of both tasks. Overall, our results highlight a time complexity separation between O (log log n) and ?(log2 n) state space size for both majority and leader election in population protocols, and introduce new techniques, which should be applicable more broadly.
"
2017,Public Evidence from Secret Ballots.,"Abstract
Elections seem simple‚Äîaren‚Äôt they just about counting? But they have a unique, challenging combination of security and privacy requirements. The stakes are high; the context is adversarial; the electorate needs to be convinced that the results are correct; and the secrecy of the ballot must be ensured. They also have practical constraints: time is of the essence, and voting systems need to be affordable and maintainable, as well as usable by voters, election officials, and pollworkers. It is thus not surprising that voting is a rich research area spanning theory, applied cryptography, practical systems analysis, usable security, and statistics. Election integrity involves two key concepts: convincing evidence that outcomes are correct and privacy, which amounts to convincing assurance that there is no evidence about how any given person voted. These are obviously in tension. We examine how current systems walk this tightrope."
2015,Keys under doormats.,Mandating insecurity by requiring government access to all data and communications.
2015,Keys under doormats: mandating insecurity by requiring government access to all data and communications.,"Twenty years ago, law enforcement organizations lobbied to require data and communication services to engineer their products to guarantee law enforcement access to all data. After lengthy debate and vigorous predictions of enforcement channels ìgoing dark,î these attempts to regulate security technologies on the emerging Internet were abandoned. In the intervening years, innovation on the Internet flourished, and law enforcement agencies found new and more effective means of accessing vastly larger quantities of data. Today, there are again calls for regulation to mandate the provision of exceptional access mechanisms. In this article, a group of computer scientists and security experts, many of whom participated in a 1997 study of these same topics, has convened to explore the likely effects of imposing extraordinary access mandates.

We have found that the damage that could be caused by law enforcement exceptional access requirements would be even greater today than it would have been 20 years ago. In the wake of the growing economic and social cost of the fundamental insecurity of todayís Internet environment, any proposals that alter the security dynamics online should be approached with caution. Exceptional access would force Internet system developers to reverse ìforward secrecyî design practices that seek to minimize the impact on user privacy when systems are breached. The complexity of todayís Internet environment, with millions of apps and globally connected services, means that new law enforcement requirements are likely to introduce unanticipated, hard to detect security flaws. Beyond these and other technical vulnerabilities, the prospect of globally deployed exceptional access systems raises difficult problems about how such an environment would be governed and how to ensure that such systems would respect human rights and the rule of law."
2014,Picture-Hanging Puzzles.,"Abstract
We show how to hang a picture by wrapping rope around n nails, making a polynomial number of twists, such that the picture falls whenever any k out of the n nails get removed, and the picture remains hanging when fewer than k nails get removed. This construction makes for some fun mathematical magic performances. More generally, we characterize the possible Boolean functions characterizing when the picture falls in terms of which nails get removed as all monotone Boolean functions. This construction requires an exponential number of twists in the worst case, but exponential complexity is almost always necessary for general functions."
2013,"FlipIt: The Game of ""Stealthy Takeover"".","Recent targeted attacks have increased significantly in sophistication, undermining the fundamental assumptions on which most cryptographic primitives rely for security. For instance, attackers launching an Advanced Persistent Threat (APT) can steal full cryptographic keys, violating the very secrecy of ìsecretî keys that cryptographers assume in designing secure protocols. In this article, we introduce a game-theoretic framework for modeling various computer security scenarios prevalent today, including targeted attacks. We are particularly interested in situations in which an attacker periodically compromises a system or critical resource completely, learns all its secret information and is not immediately detected by the system owner or defender. We propose a two-player game between an attacker and defender called FlipIt or The Game of ìStealthy Takeover.î In FlipIt, players compete to control a shared resource. Unlike most existing games, FlipIt allows players to move at any given time, taking control of the resource. The identity of the player controlling the resource, however, is not revealed until a player actually moves. To move, a player pays a certain move cost. The objective of each player is to control the resource a large fraction of time, while minimizing his total move cost. FlipIt provides a simple and elegant framework in which we can formally reason about the interaction between attackers and defenders in practical scenarios. In this article, we restrict ourselves to games in which one of the players (the defender) plays with a renewal strategy, one in which the intervals between consecutive moves are chosen independently and uniformly at random from a fixed probability distribution. We consider attacker strategies ranging in increasing sophistication from simple periodic strategies (with moves spaced at equal time intervals) to more complex adaptive strategies, in which moves are determined based on feedback received during the game. For different classes of strategies employed by the attacker, we determine strongly dominant strategies for both players (when they exist), strategies that achieve higher benefit than all other strategies in a particular class. When strongly dominant strategies do not exist, our goal is to characterize the residual game consisting of strategies that are not strongly dominated by other strategies. We also prove equivalence or strict inclusion of certain classes of strategies under different conditions. Our analysis of different FlipIt variants teaches cryptographers, system designers, and the community at large some valuable lessons:
1.
Systems should be designed under the assumption of repeated total compromise, including theft of cryptographic keys. FlipIt provides guidance on how to implement a cost-effective defensive strategy.

 
2.
Aggressive play by one player can motivate the opponent to drop out of the game (essentially not to play at all). Therefore, moving fast is a good defensive strategy, but it can only be implemented if move costs are low. We believe that virtualization has a huge potential in this respect.

 
3.
Close monitoring of oneís resources is beneficial in detecting potential attacks faster, gaining insight into attackerís strategies, and scheduling defensive moves more effectively.

 
Interestingly, FlipIt finds applications in other security realms besides modeling of targeted attacks. Examples include cryptographic key rotation, password changing policies, refreshing virtual machines, and cloud auditing."
2013,Honeywords: making password-cracking detectable.,"We propose a simple method for improving the security of hashed passwords: the maintenance of additional ``honeywords'' (false passwords) associated with each user's account. An adversary who steals a file of hashed passwords and inverts the hash function cannot tell if he has found the password or a honeyword. The attempted use of a honeyword for login sets off an alarm. An auxiliary server (the ``honeychecker'') can distinguish the user password from honeywords for the login routine, and will set off an alarm if a honeyword is submitted."
2013,Drifting Keys: Impersonation detection for constrained devices.,"Abstract:
We introduce Drifting Keys (DKs), a simple new approach to detecting device impersonation. DKs enable detection of complete compromise by an attacker of the device and its secret state, e.g., cryptographic keys. A DK evolves within a device randomly over time. Thus an attacker will create DKs that randomly diverge from those in the original, valid device over time, alerting a trusted verifier to the attack. DKs may be transmitted unidirectionally from a device, eliminating interaction between the device and verifier. Device emissions of DK values can be quite compact - even just a single bit - and DK evolution and emission require minimal computation. Thus DKs are well suited for highly constrained devices, such as sensors and hardware authentication tokens. We offer a formal adversarial model for DKs, and present a simple scheme that we prove essentially optimal (undominated) for a natural class of attack timelines. We explore application of this scheme to one-time passcode authentication tokens. Using the logs of a large enterprise, we experimentally study the effectiveness of DKs in detecting the compromise of such tokens."
2012,"Information, Data, Security in a Networked Future.","The digital information revolution begins as giants such as Alan Turing, Claude Shannon and John von neumann, among many others, recognize the power of digital representations and programmable computers. Although rooted in the technology of his time, Vannevar Bush's portrait of the information revolution has emerged and fl ourished especially in the form of the World Wide Web resting atop the global Internet.
The panelists will explore some specifi cs of the digital information revolution, notably theory and practice in securing, authenticating and maintaining the integrity of information (Cerf); and roots of modern cryptography and current topics in this area (rivest and Shamir). They will also gain insight into the long-term problem of identifying, fi nding, and assuring the integrity of digital objects in the most general sense of that term (Kahn). Finally, they look at how our understanding of computer science is changing (Hopcroft) and how that evolution will affect the digital world in which are we spending an increasing fraction of our daily lives."
2012,Hourglass schemes: how to prove that cloud files are encrypted.,"We consider the following challenge: How can a cloud storage provider prove to a tenant that it's encrypting files at rest, when the provider itself holds the corresponding encryption keys? Such proofs demonstrate sound encryption policies and file confidentiality. (Cheating, cost-cutting, or misconfigured providers may bypass the computation/management burdens of encryption and store plaintext only.)
To address this problem, we propose hourglass schemes, protocols that prove correct encryption of files at rest by imposing a resource requirement (e.g., time, storage or computation) on the process of translating files from one encoding domain (i.e., plaintext) to a different, target domain (i.e., ciphertext). Our more practical hourglass schemes exploit common cloud infrastructure characteristics, such as limited file-system parallelism and the use of rotational hard drives for at-rest files. For files of modest size, we describe an hourglass scheme that exploits trapdoor one-way permutations to prove correct file encryption whatever the underlying storage medium.
We also experimentally validate the practicality of our proposed schemes, the fastest of which incurs minimal overhead beyond the cost of encryption. As we show, hourglass schemes can be used to verify properties other than correct encryption, e.g., embedding of ""provenance tags"" in files for tracing the source of leaked files. Of course, even if a provider is correctly storing a file as ciphertext, it could also store a plaintext copy to service tenant requests more efficiently. Hourglass schemes cannot guarantee ciphertext-only storage, a problem inherent when the cloud manages keys. By means of experiments in Amazon EC2, however, we demonstrate that hourglass schemes provide strong incentives for economically rational cloud providers against storage of extra plaintext file copies."
2012,Picture-Hanging Puzzles.,"Abstract
We show how to hang a picture by wrapping rope around n nails, making a polynomial number of twists, such that the picture falls whenever any k out of the n nails get removed, and the picture remains hanging when fewer than k nails get removed. This construction makes for some fun mathematical magic performances. More generally, we characterize the possible Boolean functions characterizing when the picture falls in terms of which nails get removed as all monotone Boolean functions. This construction requires an exponential number of twists in the worst case, but exponential complexity is almost always necessary for general functions."
2012,Defending against the Unknown Enemy: Applying FlipIt to System Security.,"Abstract
Most cryptographic systems carry the basic assumption that entities are able to preserve the secrecy of their keys. With attacks today showing ever increasing sophistication, however, this tenet is eroding. ‚ÄúAdvanced Persistent Threats‚Äù (APTs), for instance, leverage zero-day exploits and extensive system knowledge to achieve full compromise of cryptographic keys and other secrets. Such compromise is often silent, with defenders failing to detect the loss of private keys critical to protection of their systems. The growing virulence of today‚Äôs threats clearly calls for new models of defenders‚Äô goals and abilities.
In this paper, we explore applications of FlipIt, a novel game-theoretic model of system defense introduced in [14]. In FlipIt, an attacker periodically gains complete control of a system, with the unique feature that system compromises are stealthy, i.e., not immediately detected by the system owner, called the defender. We distill out several lessons from our study of FlipIt and demonstrate their application to several real-world problems, including password reset policies, key rotation, VM refresh and cloud auditing."
2012,A Bayesian Method for Auditing Elections.,"We propose an approach to post-election auditing based on Bayesian principles, and give experimental evidence for its efficiency and effectiveness. We call such an audit a ìBayes auditî. It aims to control the probability of miscertification (certifying a wrong election outcome). The miscertification probability is computed using a Bayesian model based on information gathered by the audit so far.

A Bayes audit is a single-ballot audit method applicable to any voting system (e.g. plurality, approval, IRV, Borda, Schulze, etc.) as long as the number of ballot types is not too large. The method requires only the ability to randomly sample single ballots and the ability to compute the election outcome for a profile of ballots. A Bayes audit does not require the computation of a ìmargin of victoryî in order to get started.

Bayes audits are applicable both to ballot-polling audits, which work just from the paper ballots, and to comparison audits, which work by comparing the paper ballots to their electronic representations. The procedure is quite simple and can be described on a single page. The Bayes audit uses an efficient method (which may be based on the use of gamma variates or on PÛlya's Urn) for simulating a Bayesian posterior distribution on the tally of a profile of ballots.

A Bayes audit is very similar to single-ballot risk-limiting audits. However, since Bayes audits are based on different principles, the precise relationship between risk-limiting audits and Bayes audits remains open. We provide some initial experimental results indicating that Bayes audits are quite efficient, requiring few ballots to be examined, and that the miscertification rate is indeed kept small, even for very close elections.

We provide some initial experimental results indicating that Bayes audits are quite efficient, requiring few ballots to be examined, and that the miscertification rate is indeed kept small, even for very close elections."
2011,The invertibility of the XOR of rotations of a binary word.,"We prove the following result regarding operations on a binary word whose length is a power of two: computing the exclusive-or of a number of rotated versions of the word is an invertible (one-to-one) operation if and only if the number of versions combined is odd. (This result is not new; there is at least one earlier proof, due to Thomsen [Cryptographic hash functions, PhD thesis, Technical University of Denmark, 28 November 2008]. Our proof may be new.)
"
2011,Tweakable Block Ciphers.,"Abstract
A common trend in applications of block ciphers over the past decades has been to employ block ciphers as one piece of a ‚Äúmode of operation‚Äù‚Äîpossibly, a way to make a secure symmetric-key cryptosystem, but more generally, any cryptographic application. Most of the time, these modes of operation use a wide variety of techniques to achieve a subgoal necessary for their main goal: instantiation of ‚Äúessentially different‚Äù instances of the block cipher.
We formalize a cryptographic primitive, the ‚Äútweakable block cipher.‚Äù Such a cipher has not only the usual inputs‚Äîmessage and cryptographic key‚Äîbut also a third input, the ‚Äútweak.‚Äù The tweak serves much the same purpose that an initialization vector does for CBC mode or that a nonce does for OCB mode. Our abstraction brings this feature down to the primitive block-cipher level, instead of incorporating it only at the higher modes-of-operation levels. We suggest that (1) tweakable block ciphers are easy to design, (2) the extra cost of making a block cipher ‚Äútweakable‚Äù is small, and (3) it is easier to design and prove the security of applications of block ciphers that need this variability using tweakable block ciphers."
2011,How to tell if your cloud files are vulnerable to drive crashes.,"This paper presents a new challenge--verifying that a remote server is storing a file in a fault-tolerant manner, i.e., such that it can survive hard-drive failures. We describe an approach called the Remote Assessment of Fault Tolerance (RAFT). The key technique in a RAFT is to measure the time taken for a server to respond to a read request for a collection of file blocks. The larger the number of hard drives across which a file is distributed, the faster the read-request response. Erasure codes also play an important role in our solution. We describe a theoretical framework for RAFTs and offer experimental evidence that RAFTs can work in practice in several settings of interest."
2010,Corrections to scantegrity II: end-to-end verifiability by voters of optical scan elections through confirmation codes.,"Abstract:
In the above titled paper (ibid., vol. 4, no. 4, pp. 611-627, Dec. 09), due to a production error, the affiliations of two of the authors were listed incorrectly. The correct affiliations are presented here. Also, the name of the last author in the affiliations footnote was printed incorrectly. The correct name is P. Y. A. Ryan."
