2014,Understanding Deep Architectures using a Recursive Convolutional Network.,"A key challenge in designing convolutional network models is sizing them appropriately. Many factors are involved in these decisions, including number of layers, feature maps, kernel sizes, etc. Complicating this further is the fact that each of these influence not only the numbers and dimensions of the activation units, but also the total number of parameters. In this paper we focus on assessing the independent contributions of three of these linked variables: The numbers of layers, feature maps, and parameters. To accomplish this, we employ a recursive convolutional network whose weights are tied between layers; this allows us to vary each of the three factors in a controlled setting. We find that while increasing the numbers of layers and parameters each have clear benefit, the number of feature maps (and hence dimensionality of the representation) appears ancillary, and finds most of its benefit through the introduction of more weights. Our results (i) empirically confirm the notion that adding layers alone increases computational power, within the context of convolutional layers, and (ii) suggest that precise sizing of convolutional feature map dimensions is itself of little concern; more attention should be paid to the number of parameters in these layers instead."
2014,Fast Training of Convolutional Networks through FFTs.,"Convolutional networks are one of the most widely employed architectures in computer vision and machine learning. In order to leverage their ability to learn complex functions, large amounts of data are required for training. Training a large convolutional network to produce state-of-the-art results can take weeks, even when using modern GPUs. Producing labels using a trained network can also be costly when dealing with web-scale datasets. In this work, we present a simple algorithm which accelerates training and inference by a significant factor, and can yield improvements of over an order of magnitude compared to existing state-of-the-art implementations. This is done by computing convolutions as pointwise products in the Fourier domain while reusing the same transformed feature map many times. The algorithm is implemented on a GPU architecture and addresses a number of related challenges."
2014,"OverFeat: Integrated Recognition, Localization and Detection using Convolutional Networks.","We present an integrated framework for using Convolutional Networks for classification, localization and detection. We show how a multiscale and sliding window approach can be efficiently implemented within a ConvNet. We also introduce a novel deep learning approach to localization by learning to predict object boundaries. Bounding boxes are then accumulated rather than suppressed in order to increase detection confidence. We show that different tasks can be learned simultaneously using a single shared network. This integrated framework is the winner of the localization task of the ImageNet Large Scale Visual Recognition Challenge 2013 (ILSVRC2013) and obtained very competitive results for the detection and classifications tasks. In post-competition work, we establish a new state of the art for the detection task. Finally, we release a feature extractor from our best model called OverFeat."
2013,Feature learning and deep architectures: new directions for music informatics.,"As we look to advance the state of the art in content-based music informatics, there is a general sense that progress is decelerating throughout the field. On closer inspection, performance trajectories across several applications reveal that this is indeed the case, raising some difficult questions for the discipline: why are we slowing down, and what can we do about it? Here, we strive to address both of these concerns. First, we critically review the standard approach to music signal analysis and identify three specific deficiencies to current methods: hand-crafted feature design is sub-optimal and unsustainable, the power of shallow architectures is fundamentally limited, and short-time analysis cannot encode musically meaningful structure. Acknowledging breakthroughs in other perceptual AI domains, we offer that deep learning holds the potential to overcome each of these obstacles. Through conceptual arguments for feature learning and deeper processing architectures, we demonstrate how deep processing models are more powerful extensions of current methods, and why now is the time for this paradigm shift. Finally, we conclude with a discussion of current challenges and the potential impact to further motivate an exploration of this promising research area.
"
2013,Learning Hierarchical Features for Scene Labeling.,"Abstract:
Scene labeling consists of labeling each pixel in an image with the category of the object it belongs to. We propose a method that uses a multiscale convolutional network trained from raw pixels to extract dense feature vectors that encode regions of multiple sizes centered on each pixel. The method alleviates the need for engineered features, and produces a powerful representation that captures texture, shape, and contextual information. We report results using multiple postprocessing methods to produce the final labeling. Among those, we propose a technique to automatically retrieve, from a pool of segmentation components, an optimal set of components that best explain the scene; these components are arbitrary, for example, they can be taken from a segmentation tree or from any family of oversegmentations. The system yields record accuracies on the SIFT Flow dataset (33 classes) and the Barcelona dataset (170 classes) and near-record accuracy on Stanford background dataset (eight classes), while being an order of magnitude faster than competing approaches, producing a 320√ó240 image labeling in less than a second, including feature extraction."
2013,Preface.,"A human-level artificially intelligent agent must be able to represent and reason about the world, at some level, in terms of high-level concepts such as entities and relations. The problem of acquiring these rich high-level representations, known as the knowledge acquisition bottleneck, has long been an obstacle for achieving human-level AI. A popular approach to this problem is to handcraft these high-level representations, but this has had limited success. An alternate approach is for rich representations to be learned autonomously from low-level sensor data. Potentially, the latter approach may yield more robust representations, and should rely less on human knowledge-engineering. The papers in this workshop present work and strategies in this latter approach."
2013,Pedestrian Detection with Unsupervised Multi-stage Feature Learning.,"Abstract:
Pedestrian detection is a problem of considerable practical interest. Adding to the list of successful applications of deep learning methods to vision, we report state-of-the-art and competitive results on all major pedestrian datasets with a convolutional network model. The model uses a few new twists, such as multi-stage features, connections that skip layers to integrate global shape information with local distinctive motif information, and an unsupervised method based on convolutional sparse coding to pre-train the filters at each stage."
2013,Causal graph-based video segmentation.,"Abstract:
Among the different methods producing superpixel segmentations of an image, the graph-based approach of Felzenszwalb and Huttenlocher is broadly employed. One of its interesting properties is that the regions are computed in a greedy manner in quasi-linear time by using a minimum spanning tree. The algorithm may be trivially extended to video segmentation by considering a video as a 3D volume, however, this can not be the case for causal segmentation, when subsequent frames are unknown. In a framework exploiting minimum spanning trees all along, we propose an efficient video segmentation approach that computes temporally consistent pixels in a causal manner, filling the need for causal and real time applications."
2013,No more pesky learning rates.,"The performance of stochastic gradient descent (SGD) depends critically on how learning rates are tuned and decreased over time. We propose a method to automatically adjust multiple learning rates so as to minimize the expected error at any one time. The method relies on local gradient variations across samples. In our approach, learning rates can increase as well as decrease, making it suitable for non-stationary problems. Using a number of convex and non-convex learning tasks, we show that the resulting algorithm matches the performance of the best settings obtained through systematic search, and effectively removes the need for learning rate tuning."
2013,Regularization of Neural Networks using DropConnect.,"We introduce DropConnect, a generalization of DropOut, for regularizing large fully-connected layers within neural networks. When training with Dropout, a randomly selected subset of activations are set to zero within each layer. DropConnect instead sets a randomly selected subset of weights within the network to zero. Each unit thus receives input from a random subset of units in the previous layer. We derive a bound on the generalization performance of both Dropout and DropConnect. We then evaluate DropConnect on a range of datasets, comparing to Dropout, and show state-of-the-art results on several image recoginition benchmarks can be obtained by aggregating multiple DropConnect-trained models."
2013,Pushing Stochastic Gradient towards Second-Order Methods - Backpropagation Learning with Transformations in Nonlinearities.,"Abstract
Recently, we proposed to transform the outputs of each hidden neuron in a multi-layer perceptron network to have zero output and zero slope on average, and use separate shortcut connections to model the linear dependencies instead. We continue the work by firstly introducing a third transformation to normalize the scale of the outputs of each hidden neuron, and secondly by analyzing the connections to second order optimization methods. We show that the transformations make a simple stochastic gradient behave closer to second-order optimization methods and thus speed up learning. This is shown both in theory and with experiments. The experiments on the third transformation show that while it further increases the speed of learning, it can also hurt performance by converging to a worse local optimum, where both the inputs and outputs of many hidden neurons are close to zero."
2013,Pushing Stochastic Gradient towards Second-Order Methods -- Backpropagation Learning with Transformations in Nonlinearities.,"Recently, we proposed to transform the outputs of each hidden neuron in a multi-layer perceptron network to have zero output and zero slope on average, and use separate shortcut connections to model the linear dependencies instead. We continue the work by firstly introducing a third transformation to normalize the scale of the outputs of each hidden neuron, and secondly by analyzing the connections to second order optimization methods. We show that the transformations make a simple stochastic gradient behave closer to second-order optimization methods and thus speed up learning. This is shown both in theory and with experiments. The experiments on the third transformation show that while it further increases the speed of learning, it can also hurt performance by converging to a worse local optimum, where both the inputs and outputs of many hidden neurons are close to zero."
2013,Learning Stable Group Invariant Representations with Convolutional Networks.,"Transformation groups, such as translations or rotations, effectively express part of the variability observed in many recognition problems. The group structure enables the construction of invariant signal representations with appealing mathematical properties, where convolutions, together with pooling operators, bring stability to additive and geometric perturbations of the input. Whereas physical transformation groups are ubiquitous in image and audio applications, they do not account for all the variability of complex signal classes.
We show that the invariance properties built by deep convolutional networks can be cast as a form of stable group invariance. The network wiring architecture determines the invariance group, while the trainable filter coefficients characterize the group action. We give explanatory examples which illustrate how the network architecture controls the resulting invariance group. We also explore the principle by which additional convolutional layers induce a group factorization enabling more abstract, powerful invariant representations."
2013,Indoor Semantic Segmentation using depth information.,"This work addresses multi-class segmentation of indoor scenes with RGB-D inputs. While this area of research has gained much attention recently, most works still rely on hand-crafted features. In contrast, we apply a multiscale convolutional network to learn features directly from the images and the depth information. We obtain state-of-the-art on the NYU-v2 depth dataset with an accuracy of 64.5%. We illustrate the labeling of indoor scenes in videos sequences that could be processed in real-time using appropriate hardware such as an FPGA."
2013,Saturating Auto-Encoder.,"We introduce a simple new regularizer for auto-encoders whose hidden-unit activation functions contain at least one zero-gradient (saturated) region. This regularizer explicitly encourages activations in the saturated region(s) of the corresponding activation function. We call these Saturating Auto-Encoders (SATAE). We show that the saturation regularizer explicitly limits the SATAE's ability to reconstruct inputs which are not near the data manifold. Furthermore, we show that a wide variety of features can be learned when different activation functions are used. Finally, connections are established with the Contractive and Sparse Auto-Encoders."
2013,"Adaptive learning rates and parallelization for stochastic, sparse, non-smooth gradients.","Recent work has established an empirically successful framework for adapting learning rates for stochastic gradient descent (SGD). This effectively removes all needs for tuning, while automatically reducing learning rates over time on stationary problems, and permitting learning rates to grow appropriately in non-stationary tasks. Here, we extend the idea in three directions, addressing proper minibatch parallelization, including reweighted updates for sparse or orthogonal gradients, improving robustness on non-smooth loss functions, in the process replacing the diagonal Hessian estimation procedure that may not always be available by a robust finite-difference approximation. The final algorithm integrates all these components, has linear complexity and is hyper-parameter free."
2013,Discriminative Recurrent Sparse Auto-Encoders.,"We present the discriminative recurrent sparse auto-encoder model, comprising a recurrent encoder of rectified linear units, unrolled for a fixed number of iterations, and connected to two linear decoders that reconstruct the input and predict its supervised classification. Training via backpropagation-through-time initially minimizes an unsupervised sparse reconstruction error; the loss function is then augmented with a discriminative term on the supervised classification. The depth implicit in the temporally-unrolled form allows the system to exhibit all the power of deep networks, while substantially reducing the number of trainable parameters.
From an initially unstructured network the hidden units differentiate into categorical-units, each of which represents an input prototype with a well-defined class; and part-units representing deformations of these prototypes. The learned organization of the recurrent encoder is hierarchical: part-units are driven directly by the input, whereas the activity of categorical-units builds up over time through interactions with the part-units. Even using a small number of hidden units per layer, discriminative recurrent sparse auto-encoders achieve excellent performance on MNIST."
2012,Fast Approximations to Structured Sparse Coding and Applications to Object Classification.,"Abstract
We describe a method for fast approximation of sparse coding. A given input vector is passed through a binary tree. Each leaf of the tree contains a subset of dictionary elements. The coefficients corresponding to these dictionary elements are allowed to be nonzero and their values are calculated quickly by multiplication with a precomputed pseudoinverse. The tree parameters, the dictionary, and the subsets of the dictionary corresponding to each leaf are learned. In the process of describing this algorithm, we discuss the more general problem of learning the groups in group structured sparse modeling. We show that our method creates good sparse representations by using it in the object recognition framework of [1,2]. Implementing our own fast version of the SIFT descriptor the whole system runs at 20 frames per second on 321 √ó481 sized images on a laptop with a quad-core cpu, while sacrificing very little accuracy on the Caltech 101, Caltech 256, and 15 scenes benchmarks."
2012,Road Scene Segmentation from a Single Image.,"Abstract
Road scene segmentation is important in computer vision for different applications such as autonomous driving and pedestrian detection. Recovering the 3D structure of road scenes provides relevant contextual information to improve their understanding.
In this paper, we use a convolutional neural network based algorithm to learn features from noisy labels to recover the 3D scene layout of a road image. The novelty of the algorithm relies on generating training labels by applying an algorithm trained on a general image dataset to classify on‚Äìboard images. Further, we propose a novel texture descriptor based on a learned color plane fusion to obtain maximal uniformity in road areas. Finally, acquired (off‚Äìline) and current (on‚Äìline) information are combined to detect road areas in single images.
From quantitative and qualitative experiments, conducted on publicly available datasets, it is concluded that convolutional neural networks are suitable for learning 3D scene layout from noisy labels and provides a relative improvement of 7% compared to the baseline. Furthermore, combining color planes provides a statistical description of road areas that exhibits maximal uniformity and provides a relative improvement of 8% compared to the baseline. Finally, the improvement is even bigger when acquired and current information from a single image are combined."
2012,Learning Invariant Feature Hierarchies.,"Abstract
Fast visual recognition in the mammalian cortex seems to be a hierarchical process by which the representation of the visual world is transformed in multiple stages from low-level retinotopic features to high-level, global and invariant features, and to object categories. Every single step in this hierarchy seems to be subject to learning. How does the visual cortex learn such hierarchical representations by just looking at the world? How could computers learn such representations from data? Computer vision models that are weakly inspired by the visual cortex will be described. A number of unsupervised learning algorithms to train these models will be presented, which are based on the sparse auto-encoder concept. The effectiveness of these algorithms for learning invariant feature hierarchies will be demonstrated with a number of practical tasks such as scene parsing, pedestrian detection, and object classification."
2012,Semantic Road Segmentation via Multi-scale Ensembles of Learned Features.,"Abstract
Semantic segmentation refers to the process of assigning an object label (e.g., building, road, sidewalk, car, pedestrian) to every pixel in an image. Common approaches formulate the task as a random field labeling problem modeling the interactions between labels by combining local and contextual features such as color, depth, edges, SIFT or HoG. These models are trained to maximize the likelihood of the correct classification given a training set. However, these approaches rely on hand‚Äìdesigned features (e.g., texture, SIFT or HoG) and a higher computational time required in the inference process.
Therefore, in this paper, we focus on estimating the unary potentials of a conditional random field via ensembles of learned features. We propose an algorithm based on convolutional neural networks to learn local features from training data at different scales and resolutions. Then, diversification between these features is exploited using a weighted linear combination. Experiments on a publicly available database show the effectiveness of the proposed method to perform semantic road scene segmentation in still images. The algorithm outperforms appearance based methods and its performance is similar compared to state‚Äìof‚Äìthe‚Äìart methods using other sources of information such as depth, motion or stereo."
2012,"Scene parsing with Multiscale Feature Learning, Purity Trees, and Optimal Covers.","Scene parsing consists in labeling each pixel in an image with the category of the object it belongs to. We propose a method that uses a multiscale convolutional network trained from raw pixels to extract dense feature vectors that encode regions of multiple sizes centered on each pixel. The method alleviates the need for engineered features. In parallel to feature extraction, a tree of segments is computed from a graph of pixel dissimilarities. The feature vectors associated with the segments covered by each node in the tree are aggregated and fed to a classifier which produces an estimate of the distribution of object categories contained in the segment. A subset of tree nodes that cover the image are then selected so as to maximize the average ""purity"" of the class distributions, hence maximizing the overall likelihood that each segment will contain a single object. The system yields record accuracies on the the Sift Flow Dataset (33 classes) and the Barcelona Dataset (170 classes) and near-record accuracy on the Stanford Background Dataset (8 classes), while being an order of magnitude faster than competing approaches, producing a 320 ◊ 240 image labeling in less than 1 second, including feature extraction."
2012,Convolutional neural networks applied to house numbers digit classification.,"Abstract:
We classify digits of real-world house numbers using convolutional neural networks (ConvNets). Con-vNets are hierarchical feature learning neural networks whose structure is biologically inspired. Unlike many popular vision approaches that are hand-designed, ConvNets can automatically learn a unique set of features optimized for a given task. We augmented the traditional ConvNet architecture by learning multi-stage features and by using Lp pooling and establish a new state-of-the-art of 95.10% accuracy on the SVHN dataset (48% error improvement). Furthermore, we analyze the benefits of different pooling methods and multi-stage features in ConvNets. The source code and a tutorial are available at eblearn.sf.net."
2012,Moving Beyond Feature Design: Deep Architectures and Automatic Feature Learning in Music Informatics.,"The short history of content-based music informatics research is dominated by hand-crafted feature design, and our community has grown admittedly complacent with a few de facto standards. Despite commendable progress in many areas, it is increasingly apparent that our efforts are yielding diminishing returns. This deceleration is largely due to the tandem of heuristic feature design and shallow processing architectures. We systematically discard hopefully irrelevant information while simultaneously calling upon creativity, intuition, or sheer luck to craft useful representations, gradually evolving complex, carefully tuned systems to address specific tasks. While other disciplines have seen the benefits of deep learning, it has only recently started to be explored in our field. By reviewing deep architectures and feature learning, we hope to raise awareness in our community about alternative approaches to solving MIR challenges, new and old alike."
2012,Deep Learning Made Easier by Linear Transformations in Perceptrons.,"We transform the outputs of each hidden neuron in a multi-layer perceptron network to have zero activation and zero slope on average, and use separate shortcut connections to model the linear dependencies instead. This transformation aims at separating the problems of learning the linear and nonlinear parts of the whole input-output mapping, which has many benefits. We study the theoretical properties of the transformation by noting that they make the Fisher information matrix closer to a diagonal matrix, and thus standard gradient closer to the natural gradient. We experimentally confirm the usefulness of the transformations by noting that they make basic stochastic gradient learning competitive with state-of-the-art learning algorithms in speed, and that they seem also to help find solutions that generalize better. The experiments include both classification of small images and learning a low-dimensional representation for images by using a deep unsupervised auto-encoder network. The transformations were beneficial in all cases, with and without regularization and with networks from two to five hidden layers."
2011,Concerto for violin and Markov model: technical perspective.,n/a
