2009,Dynamic Factor Graphs for Time Series Modeling.,"Abstract
This article presents a method for training Dynamic Factor Graphs (DFG) with continuous latent state variables. A DFG includes factors modeling joint probabilities between hidden and observed variables, and factors modeling dynamical constraints on hidden variables. The DFG assigns a scalar energy to each configuration of hidden and observed variables. A gradient-based inference procedure finds the minimum-energy state sequence for a given observation sequence. Because the factors are designed to ensure a constant partition function, they can be trained by minimizing the expected energy over training sequences with respect to the factors‚Äô parameters. These alternated inference and parameter updates can be seen as a deterministic EM-like procedure. Using smoothing regularizers, DFGs are shown to reconstruct chaotic attractors and to separate a mixture of independent oscillatory sources perfectly. DFGs outperform the best known algorithm on the CATS competition benchmark for time series prediction. DFGs also successfully reconstruct missing motion capture data."
2008,Editorial.,n/a
2008,Deep belief net learning in a long-range vision system for autonomous off-road driving.,"Abstract:
We present a learning-based approach for long-range vision that is able to accurately classify complex terrain at distances up to the horizon, thus allowing high-level strategic planning. A deep belief network is trained with unsupervised data and a reconstruction criterion to extract features from an input image, and the features are used to train a realtime classifier to predict traversability. The online supervision is given by a stereo module that provides robust labels for nearby areas up to 12 meters distant. The approach was developed and tested on the LAGR mobile robot."
2008,Mapping and planning under uncertainty in mobile robots with long-range perception.,"Abstract:
Recent advances in self-supervised learning have enabled very long-range visual detection of obstacles and pathways (to 100 meters or more). Unfortunately, the category and range of regions at such large distances come with a considerable amount of uncertainty. We present a mapping and planning system that accurately represents range and category uncertainties, and accumulates the evidence from multiple frames in a principled way. The system relies on a hyperbolicpolar map centered on the robot with a 200 m radius. Map cells are histograms that accumulate evidence obtained from a self-supervised object classifier operating on image windows. The performance of the system is demonstrated on the LAGR off-road robot platform."
2007,Synergistic Face Detection and Pose Estimation with Energy-Based Models.,"We describe a novel method for simultaneously detecting faces and estimating their pose in real time. The method employs a convolutional network to map images of faces to points on a low-dimensional manifold parametrized by pose, and images of non-faces to points far away from that manifold. Given an image, detecting a face and estimating its pose is viewed as minimizing an energy function with respect to the face/non-face binary variable and the continuous pose parameters. The system is trained to minimize a loss function that drives correct combinations of labels and pose to be associated with lower energy values than incorrect ones.

The system is designed to handle very large range of poses without retraining. The performance of the system was tested on three standard data sets---for frontal views, rotated faces, and profiles---is comparable to previous systems that are designed to handle a single one of these data sets.

We show that a system trained simuiltaneously for detection and pose estimation is more accurate on both tasks than similar systems trained for each task separately."
2007,The Need for Open Source Software in Machine Learning.,"Open source tools have recently reached a level of maturity which makes them suitable for building large-scale real-world systems. At the same time, the field of machine learning has developed a large body of powerful learning algorithms for diverse applications. However, the true potential of these methods is not used, since existing implementations are not openly shared, resulting in software with low usability, and weak interoperability. We argue that this situation can be significantly improved by increasing incentives for researchers to publish their software under an open source model. Additionally, we outline the problems authors are faced with when trying to publish algorithmic implementations of machine learning methods. We believe that a resource of peer reviewed software accompanied by short articles would be highly valuable to both the machine learning and the general scientific community.
"
2007,Automatic recognition of biological particles in microscopic images.,"Abstract
A simple and general-purpose system to recognize biological particles is presented. It is composed of four stages: First (if necessary) promising locations in the image are detected and small regions containing interesting samples are extracted using a feature finder. Second, differential invariants of the brightness are computed at multiple scales of resolution. Third, after point-wise non-linear mappings to a higher dimensional feature space, this information is averaged over the whole region thus producing a vector of features for each sample that is invariant with respect to rotation and translation. Fourth, each sample is classified using a classifier obtained from a mixture-of-Gaussians generative model.
This system was developed to classify 12 categories of particles found in human urine; it achieves a 93.2% correct classification rate in this application. It was subsequently trained and tested on a challenging set of images of airborne pollen grains where it achieved an 83% correct classification rate for the three categories found during one month of observation. Pollen classification is challenging even for human experts and this performance is considered good."
2007,Time-Delay Neural Networks and Independent Component Analysis for EEG-Based Prediction of Epileptic Seizures Propagation.,"This research focuses on the development of a machine learning technique based on Time-Delay Neural Networks (TDNN) and Independent Component Analysis (ICA), to analyze EEG signal dynamics related to the initiation and propagation of epileptic seizures. We aim at designing a generative model to simulate EEG time-series after alteration of specific localized channels (electrodes) in order to explore the effects of brain surgery ex-vivo.
"
2007,Unsupervised Learning of Invariant Feature Hierarchies with Applications to Object Recognition.,"Abstract:
We present an unsupervised method for learning a hierarchy of sparse feature detectors that are invariant to small shifts and distortions. The resulting feature extractor consists of multiple convolution filters, followed by a feature-pooling layer that computes the max of each filter output within adjacent windows, and a point-wise sigmoid non-linearity. A second level of larger and more invariant features is obtained by training the same algorithm on patches of features from the first level. Training a supervised classifier on these features yields 0.64% error on MNIST, and 54% average recognition rate on Caltech 101 with 30 training samples per category. While the resulting architecture is similar to convolutional networks, the layer-wise unsupervised training procedure alleviates the over-parameterization problems that plague purely supervised learning procedures, and yields good performance with very few labeled training samples."
2007,Energy-Based Models in Document Recognition and Computer Vision.,"Abstract:
The machine learning and pattern recognition communities are facing two challenges: solving the normalization problem, and solving the deep learning problem. The normalization problem is related to the difficulty of training probabilistic models over large spaces while keeping them properly normalized. In recent years, the ML and natural language communities have devoted considerable efforts to circumventing this problem by developing ""un-normalized"" learning models for tasks in which the output is highly structured (e.g. English sentences). This class of models was in fact originally developed during the 90's in the handwriting recognition community, and includes graph transformer networks, conditional random fields, hidden Markov SVMs, and maximum margin Markov networks. We describe these models within the unifying framework of ""energy-based models"" (EBM). The deep learning problem is related to the issue of training all the levels of a recognition system (e.g. segmentation, feature extraction, recognition, etc) in an integrated fashion. We first consider "" traditional"" methods for deep learning, such as convolutional networks and back-propagation, and show that, although they produce very low error rates for handwriting and object recognition, they require many training samples. We show that using unsupervised learning to initialize the layers of a deep network dramatically reduces the required number of training samples, particularly for such tasks as the recognition of everyday objects at the category level."
2007,A Sparse and Locally Shift Invariant Feature Extractor Applied to Document Images.,"Abstract:
We describe an unsupervised learning algorithm for extracting sparse and locally shift-invariant features. We also devise a principled procedure for learning hierarchies of invariant features. Each feature detector is composed of a set of trainable convolutional filters followed by a max-pooling layer over non-overlapping windows, and a point-wise sigmoid non-linearity. A second stage of more invariant features is fed with patches provided by the first stage feature extractor, and is trained in the same way. The method is used to pre-train the first four layers of a deep convolutional network which achieves state-of-the-art performance on the MNIST dataset of handwritten digits. The final testing error rate is equal to 0.42%. Preliminary experiments on compression of bitonal document images show very promising results in terms of compression ratio and reconstruction error."
2007,Adaptive long range vision in unstructured terrain.,"Abstract:
A novel probabilistic online learning framework for autonomous off-road robot navigation is proposed. The system is purely vision-based and is particularly designed for predicting traversability in unknown or rapidly changing environments. It uses self-supervised learning to quickly adapt to novel terrains after processing a small number of frames, and it can recognize terrain elements such as paths, man-made structures, and natural obstacles at ranges up to 30 meters. The system is developed on the LAGR mobile robot platform and the performance is evaluated using multiple metrics, including ground truth."
2007,Discovering the hidden structure of house prices with a non-parametric latent manifold model.,"In many regression problems, the variable to be predicted depends not only on a sample-specific feature vector, but also on an unknown (latent) manifold that must satisfy known constraints. An example is house prices, which depend on the characteristics of the house, and on the desirability of the neighborhood, which is not directly measurable. The proposed method comprises two trainable components. The first one is a parametric model that predicts the ""intrinsic"" price of the house from its description. The second one is a smooth, non-parametric model of the latent ""desirability"" manifold. The predicted price of a house is the product of its intrinsic price and desirability. The two components are trained simultaneously using a deterministic form of the EM algorithm. The model was trained on a large dataset of houses from Los Angeles county. It produces better predictions than pure parametric and non-parametric models. It also produces useful estimates of the desirability surface at each location.
"
2007,Sparse Feature Learning for Deep Belief Networks.,"Unsupervised learning algorithms aim to discover the structure hidden in the data, and to learn representations that are more suitable as input to a supervised machine than the raw input. Many unsupervised methods are based on reconstructing the input from the representation, while constraining the representation to have certain desirable properties (e.g. low dimension, sparsity, etc). Others are based on approximating density by stochastically reconstructing the input from the representation. We describe a novel and efficient algorithm to learn sparse representations, and compare it theoretically and experimentally with a similar machines trained probabilistically, namely a Restricted Boltzmann Machine. We propose a simple criterion to compare and select different unsupervised machines based on the trade-off between the reconstruction error and the information content of the representation. We demonstrate this method by extracting features from a dataset of handwritten numerals, and from a dataset of natural image patches. We show that by stacking multiple levels of such machines and by training sequentially, high-order dependencies between the input variables can be captured."
2007,Online Learning for Offroad Robots: Spatial Label Propagation to Learn Long-Range Traversability.,"We present a solution to the problem of long-range obstacle/path recognition in autonomous robots. The system uses sparse traversability information from a stereo module to train a classifier online. The trained classifier can then predict the traversability of the entire scene. A distance-normalized image pyramid makes it possible to efficiently train on each frame seen by the robot, using large windows that contain contextual information as well as shape, color, and texture. Traversability labels are initially obtained for each target using a stereo module, then propagated to other views of the same target using temporal and spatial concurrences, thus training the classifier to be view-invariant. A ring buffer simulates short-term memory and ensures that the discriminative learning is balanced and consistent. This long-range obstacle detection system sees obstacles and paths at 30-40 meters, far beyond the maximum stereo range of 12 meters, and adapts very quickly to new environments. Experiments were run on the LAGR robot platform."
2007,A Unified Energy-Based Framework for Unsupervised Learning.,"We introduce a view of unsupervised learning that integrates probabilistic and nonprobabilistic methods for clustering, dimensionality reduction, and feature extraction in a unified framework. In this framework, an energy function associates low energies to input points that are similar to training samples, and high energies to unobserved points. Learning consists in minimizing the energies of training samples while ensuring that the energies of unobserved ones are higher. Some traditional methods construct the architecture so that only a small number of points can have low energy, while other methods explicitly ‚Äúpull up‚Äù on the energies of unobserved points. In probabilistic methods the energy of unobserved points is pulled by minimizing the log partition function, an expensive, and sometimes intractable process. We explore different and more efficient methods using an energy-based approach. In particular, we show that a simple solution is to restrict the amount of information contained in codes that represent the data. We demonstrate such a method by training it on natural image patches and by applying to image denoising."
2006,Synergistic Face Detection and Pose Estimation with Energy-Based Models.,"Abstract
We describe a novel method for real-time, simultaneous multi-view face detection and facial pose estimation. The method employs a convolutional network to map face images to points on a manifold, parametrized by pose, and non-face images to points far from that manifold. This network is trained by optimizing a loss function of three variables: image, pose, and face/non-face label. We test the resulting system, in a single configuration, on three standard data sets ‚Äì one for frontal pose, one for rotated faces, and one for profiles ‚Äì and find that its performance on each set is comparable to previous multi-view face detectors that can only handle one form of pose variation. We also show experimentally that the system‚Äôs accuracy on both face detection and pose estimation is improved by training for the two tasks together."
2006,Large-scale Learning with SVM and Convolutional for Generic Object Categorization.,"Abstract:
The detection and recognition of generic object categories with invariance to viewpoint, illumination, and clutter requires the combination of a feature extractor and a classifier. We show that architectures such as convolutional networks are good at learning invariant features, but not always optimal for classification, while Support Vector Machines are good at producing decision surfaces from wellbehaved feature vectors, but cannot learn complicated invariances. We present a hybrid system where a convolutional network is trained to detect and recognize generic objects, and a Gaussian-kernel SVM is trained from the features learned by the convolutional network. Results are given on a large generic object recognition task with six categories (human figures, four-legged animals, airplanes, trucks, cars, and ""none of the above""), with multiple instances of each object category under various poses, illuminations, and backgrounds. On the test set, which contains different object instances than the training set, an SVM alone yields a 43.3% error rate, a convolutional net alone yields 7.2% and an SVM on top of features produced by the convolutional net yields 5.9%."
2006,Dimensionality Reduction by Learning an Invariant Mapping.,"Abstract:
Dimensionality reduction involves mapping a set of high dimensional input points onto a low dimensional manifold so that 'similar"" points in input space are mapped to nearby points on the manifold. We present a method - called Dimensionality Reduction by Learning an Invariant Mapping (DrLIM) - for learning a globally coherent nonlinear function that maps the data evenly to the output manifold. The learning relies solely on neighborhood relationships and does not require any distancemeasure in the input space. The method can learn mappings that are invariant to certain transformations of the inputs, as is demonstrated with a number of experiments. Comparisons are made to other techniques, in particular LLE."
2006,Efficient Learning of Sparse Representations with an Energy-Based Model.,"We describe a novel unsupervised method for learning sparse, overcomplete features. The model uses a linear encoder, and a linear decoder preceded by a sparsifying non-linearity that turns a code vector into a quasi-binary sparse code vector. Given an input, the optimal code minimizes the distance between the output of the decoder and the input patch while being as similar as possible to the encoder output. Learning proceeds in a two-phase EM-like fashion: (1) compute the minimum-energy code vector, (2) adjust the parameters of the encoder and decoder so as to decrease the energy. The model produces ""stroke detectors"" when trained on handwritten numerals, and Gabor-like filters when trained on natural image patches. Inference and learning are very fast, requiring no preprocessing, and no expensive sampling. Using the proposed unsupervised method to initialize the first layer of a convolutional network, we achieved an error rate slightly lower than the best reported result on the MNIST dataset. Finally, an extension of the method is described to learn topographical filter maps."
2005,Toward Automatic Phenotyping of Developing Embryos From Videos.,"Abstract:
We describe a trainable system for analyzing videos of developing C. elegans embryos. The system automatically detects, segments, and locates cells and nuclei in microscopic images. The system was designed as the central component of a fully automated phenotyping system. The system contains three modules 1) a convolutional network trained to classify each pixel into five categories: cell wall, cytoplasm, nucleus membrane, nucleus, outside medium; 2) an energy-based model, which cleans up the output of the convolutional network by learning local consistency constraints that must be satisfied by label images; 3) a set of elastic models of the embryo at various stages of development that are matched to the label images."
2005,Loss Functions for Discriminative Training of Energy-Based Models.,"Probabilistic graphical models associate a probability to each configuration of the relevant variables. Energy-based models (EBM) associate an energy to those configurations, eliminating the need for proper normalization of probability distributions. Making a decision (an inference) with an EBM consists in comparing the energies associated with various configurations of the variable to be predicted, and choosing the one with the smallest energy. Such systems must be trained discriminatively to associate low energies to the desired configurations and higher energies to undesired configurations. A wide variety of loss function can be used for this purpose. We give sufficient conditions that a loss function should satisfy so that its minimization will cause the system to approach to desired behavior. We give many specific examples of suitable loss functions, and show an application to object recognition in images"
2005,"Learning a Similarity Metric Discriminatively, with Application to Face Verification.","Abstract:
We present a method for training a similarity metric from data. The method can be used for recognition or verification applications where the number of categories is very large and not known during training, and where the number of training samples for a single category is very small. The idea is to learn a function that maps input patterns into a target space such that the L/sub 1/ norm in the target space approximates the ""semantic"" distance in the input space. The method is applied to a face verification task. The learning process minimizes a discriminative loss function that drives the similarity metric to be small for pairs of faces from the same person, and large for pairs from different persons. The mapping from raw to the target space is a convolutional network whose architecture is designed for robustness to geometric distortions. The system is tested on the Purdue/AR face database which has a very high degree of variability in the pose, lighting, expression, position, and artificial occlusions such as dark glasses and obscuring scarves."
2005,Off-Road Obstacle Avoidance through End-to-End Learning.,"We describe a vision-based obstacle avoidance system for off-road mobile robots. The system is trained from end to end to map raw input images to steering angles. It is trained in supervised mode to predict the steering angles provided by a human driver during training runs collected in a wide variety of terrains, weather conditions, lighting conditions, and obstacle types. The robot is a 50cm off-road truck, with two forward-pointing wireless color cameras. A remote computer processes the video and controls the robot via radio. The learning system is a large 6-layer convolutional network whose input is a single left/right pair of unprocessed low-resolution images. The robot exhibits an excellent ability to detect obstacles and navigate around them in real time at speeds of 2 m/s."
2004,Learning Methods for Generic Object Recognition with Invariance to Pose and Lighting.,"We assess the applicability of several popular learning methods for the problem of recognizing generic visual categories with invariance to pose, lighting, and surrounding clutter. A large dataset comprising stereo image pairs of 50 uniform-colored toys under 36 azimuths, 9 elevations, and 6 lighting conditions was collected (for a total of 194,400 individual images). The objects were 10 instances of 5 generic categories: four-legged animals, human figures, airplanes, trucks, and cars. Five instances of each category were used for training, and the other five for testing. Low-resolution grayscale images of the objects with various amounts of variability and surrounding clutter were used for training and testing. Nearest Neighbor methods, Support Vector Machines, and Convolutional Networks, operating on raw pixels or on PCA-derived features were tested. Test error rates for unseen object instances placed on uniform backgrounds were around 13% for SVM and 7% for Convolutional Nets. On a segmentation/recognition task with highly cluttered images, SVM proved impractical, while Convolutional nets yielded 16/7% error. A real-time version of the system was implemented that can detect and classify objects in natural scenes at around 10 frames per second."
