2019,Unsupervised Image Matching and Object Discovery as Optimization.,"Learning with complete or partial supervision is power- ful but relies on ever-growing human annotation efforts. As a way to mitigate this serious problem, as well as to serve specific applications, unsupervised learning has emerged as an important field of research. In computer vision, unsu- pervised learning comes in various guises. We focus here on the unsupervised discovery and matching of object cate- gories among images in a collection, following the work of Cho et al. [12]. We show that the original approach can be reformulated and solved as a proper optimization problem. Experiments on several benchmarks establish the merit of our approach."
2019,Model-Predictive Policy Learning with Uncertainty Regularization for Driving in Dense Traffic.,"Learning a policy using only observational data is challenging because the distribution of states it induces at execution time may differ from the distribution observed during training. In this work, we propose to train a policy while explicitly penalizing the mismatch between these two distributions over a fixed time horizon. We do this by using a learned model of the environment dynamics which is unrolled for multiple time steps, and training a policy network to minimize a differentiable cost over this rolled-out trajectory. This cost contains two terms: a policy cost which represents the objective the policy seeks to optimize, and an uncertainty cost which represents its divergence from the states it is trained on. We propose to measure this second cost by using the uncertainty of the dynamics model about its own predictions, using recent ideas from uncertainty estimation for deep networks. We evaluate our approach using a large-scale observational dataset of driving behavior recorded from traffic cameras, and show that we are able to learn effective driving policies from purely observational data, with no environment interaction. "
2019,The role of over-parametrization in generalization of neural networks.,"Despite existing work on ensuring generalization of neural networks in terms of scale sensitive complexity measures, such as norms, margin and sharpness, these complexity measures do not offer an explanation of why neural networks generalize better with over-parametrization. In this work we suggest a novel complexity measure based on unit-wise capacities resulting in a tighter generalization bound for two layer ReLU networks. Our capacity bound correlates with the behavior of test error with increasing network sizes (within the range reported in the experiments), and could partly explain the improvement in generalization with over-parametrization. We further present a matching lower bound for the Rademacher complexity that improves over previous capacity lower bounds for neural networks. "
2019,"Deep Learning Hardware: Past, Present, and Future.","Abstract:
Historically, progress in neural networks and deep learning research has been greatly influenced by the available hardware and software tools. This paper identifies trends in deep learning research that will influence hardware architectures and software platforms of the future."
2018,A Closer Look at Spatiotemporal Convolutions for Action Recognition.,"In this paper we discuss several forms of spatiotemporal convolutions for video analysis and study their effects on action recognition. Our motivation stems from the observation that 2D CNNs applied to individual frames of the video have remained solid performers in action recognition. In this work we empirically demonstrate the accuracy advantages of 3D CNNs over 2D CNNs within the framework of residual learning. Furthermore, we show that factorizing the 3D convolutional filters into separate spatial and temporal components yields significantly gains in accuracy. Our empirical study leads to the design of a new spatiotemporal convolutional block ``R(2+1)D'' which produces CNNs that achieve results comparable or superior to the state-of-the-art on Sports-1M, Kinetics, UCF101, and HMDB51."
2018,DesIGN: Design Inspiration from Generative Networks.,"Abstract
Can an algorithm create original and compelling fashion designs to serve as an inspirational assistant? To help answer this question, we design and investigate different image generation models associated with different loss functions to boost novelty in fashion generation. The dimensions of our explorations include: (i) different Generative Adversarial Networks architectures that start from noise vectors to generate fashion items, (ii) a new loss function that encourages novelty, and (iii) a generation process following the key elements of fashion design (disentangling shape and texture). A key challenge of this study is the evaluation of generated designs and the retrieval of best ones, hence we put together an evaluation protocol associating automatic metrics and human experimental studies. We show that our proposed creativity loss yields better overall appreciation than the one employed in Creative Adversarial Networks. In the end, about 61% of our images are thought to be created by human designers rather than by a computer while also being considered original per our human subject experiments, and our proposed loss scores the highest compared to existing losses in both novelty and likability."
2018,Predicting Future Instance Segmentation by Forecasting Convolutional Features.,"Abstract
Anticipating future events is an important prerequisite towards intelligent behavior. Video forecasting has been studied as a proxy task towards this goal. Recent work has shown that to predict semantic segmentation of future frames, forecasting at the semantic level is more effective than forecasting RGB frames and then segmenting these. In this paper we consider the more challenging problem of future instance segmentation, which additionally segments out individual objects. To deal with a varying number of output labels per image, we develop a predictive model in the space of fixed-sized convolutional features of the Mask R-CNN instance segmentation model. We apply the ‚Äúdetection head‚Äù of Mask R-CNN on the predicted features to produce the instance segmentation of future frames. Experiments show that this approach significantly improves over strong baselines based on optical flow and repurposed instance segmentation architectures."
2018,Comparing Dynamics: Deep Neural Networks versus Glassy Systems.,"We analyze numerically the training dynamics of deep neural networks (DNN) by using methods developed in statistical physics of glassy systems. The two main issues we address are the complexity of the loss-landscape and of the dynamics within it, and to what extent DNNs share similarities with glassy systems. Our findings, obtained for different architectures and data-sets, suggest that during the training process the dynamics slows down because of an increasingly large number of flat directions. At large times, when the loss is approaching zero, the system diffuses at the bottom of the landscape. Despite some similarities with the dynamics of mean-field glassy systems, in particular, the absence of barrier crossing, we find distinctive dynamical behaviors in the two cases, thus showing that the statistical properties of the corresponding loss and energy landscapes are different. In contrast, when the network is under-parametrized we observe a typical glassy behavior, thus suggesting the existence of different phases depending on whether the network is under-parametrized or over-parametrized."
2018,Adversarially Regularized Autoencoders.,"Deep latent variable models, trained using variational autoencoders or generative adversarial networks, are now a key technique for representation learning of continuous structures. However, applying similar methods to discrete structures, such as text sequences or discretized images, has proven to be more challenging. In this work, we propose a more flexible method for training deep latent variable models of discrete structures. Our approach is based on the recently proposed Wasserstein Autoencoder (WAE) which formalizes adversarial autoencoders as an optimal transport problem. We first extend this framework to model discrete sequences, and then further explore different learned priors targeting a controllable representation. Unlike many other latent variable generative models for text, this adversarially regularized autoencoder (ARAE) allows us to generate fluent textual outputs as well as perform manipulations in the latent space to induce change in the output space. Finally we show that the latent representation can be trained to perform unaligned textual style transfer, giving improvements both in automatic measures and human evaluation."
2018,GLoMo: Unsupervised Learning of Transferable Relational Graphs.,"Modern deep transfer learning approaches have mainly focused on learning generic feature vectors from one task that are transferable to other tasks, such as word embeddings in language and pretrained convolutional features in vision. However, these approaches usually transfer unary features and largely ignore more structured graphical representations. This work explores the possibility of learning generic latent relational graphs that capture dependencies between pairs of data units (e.g., words or pixels) from large-scale unlabeled data and transferring the graphs to downstream tasks. Our proposed transfer learning framework improves performance on various tasks including question answering, natural language inference, sentiment analysis, and image classification. We also show that the learned graphs are generic enough to be transferred to different embeddings on which the graphs have not been trained (including GloVe embeddings, ELMo embeddings, and task-specific RNN hidden units), or embedding-free units such as image pixels."
2017,Geometric Deep Learning: Going beyond Euclidean data.,"Abstract:
Geometric deep learning is an umbrella term for emerging techniques attempting to generalize (structured) deep neural models to non-Euclidean domains, such as graphs and manifolds. The purpose of this article is to overview different examples of geometric deep-learning problems and present available solutions, key difficulties, applications, and future research directions in this nascent field."
2017,Universum Prescription: Regularization Using Unlabeled Data.,"This paper shows that simply prescribing ""none of the above"" labels to unlabeled data has a beneficial regularization effect to supervised learning. We call it universum prescription by the fact that the prescribed labels cannot be one of the supervised labels. In spite of its simplicity, universum prescription obtained competitive results in training deep convolutional networks for CIFAR-10, CIFAR-100, STL-10 and ImageNet datasets. A qualitative justification of these approaches using Rademacher complexity is presented. The effect of a regularization parameter ó probability of sampling from unlabeled data ó is also studied empirically."
2017,Very Deep Convolutional Networks for Text Classification.,"The dominant approach for many NLP tasks are recurrent neural networks, in particular LSTMs, and convolutional neural networks. However, these architectures are rather shallow in comparison to the deep convolutional networks which have pushed the state-of-the-art in computer vision. We present a new architecture (VDCNN) for text processing which operates directly at the character level and uses only small convolutions and pooling operations. We are able to show that the performance of this model increases with the depth: using up to 29 convolutional layers, we report improvements over the state-of-the-art on several public text classification tasks. To the best of our knowledge, this is the first time that very deep convolutional nets have been applied to text processing."
2017,Predicting Deeper into the Future of Semantic Segmentation.,"Abstract:
The ability to predict and therefore to anticipate the future is an important attribute of intelligence. It is also of utmost importance in real-time systems, e.g. in robotics or autonomous driving, which depend on visual scene understanding for decision making. While prediction of the raw RGB pixel values in future video frames has been studied in previous work, here we introduce the novel task of predicting semantic segmentations of future frames. Given a sequence of video frames, our goal is to predict segmentation maps of not yet observed video frames that lie up to a second or further in the future. We develop an autoregressive convolutional neural network that learns to iteratively generate multiple frames. Our results on the Cityscapes dataset show that directly predicting future segmentations is substantially better than predicting and then segmenting future RGB frames. Prediction results up to half a second in the future are visually convincing and are much more accurate than those of a baseline based on warping semantic segmentations using optical flow."
2017,Entropy-SGD: Biasing Gradient Descent Into Wide Valleys.,"This paper proposes a new optimization algorithm called Entropy-SGD for training deep neural networks that is motivated by the local geometry of the energy landscape. Local extrema with low generalization error have a large proportion of almost-zero eigenvalues in the Hessian with very few positive or negative eigenvalues. We leverage upon this observation to construct a local-entropy-based objective function that favors well-generalizable solutions lying in large flat regions of the energy landscape, while avoiding poorly-generalizable solutions located in the sharp valleys. Conceptually, our algorithm resembles two nested loops of SGD where we use Langevin dynamics in the inner loop to compute the gradient of the local entropy before each update of the weights. We show that the new objective has a smoother energy landscape and show improved generalization over SGD using uniform stability, under certain assumptions. Our experiments on convolutional and recurrent neural networks demonstrate that Entropy-SGD compares favorably to state-of-the-art techniques in terms of generalization error and training time."
2017,Tracking the World State with Recurrent Entity Networks.,"We introduce a new model, the Recurrent Entity Network (EntNet). It is equipped
with a dynamic long-term memory which allows it to maintain and update a rep-
resentation of the state of the world as it receives new data. For language under-
standing tasks, it can reason on-the-fly as it reads text, not just when it is required
to answer a question or respond as is the case for a Memory Network (Sukhbaatar
et al., 2015). Like a Neural Turing Machine or Differentiable Neural Computer
(Graves et al., 2014; 2016) it maintains a fixed size memory and can learn to
perform location and content-based read and write operations. However, unlike
those models it has a simple parallel architecture in which several memory loca-
tions can be updated simultaneously. The EntNet sets a new state-of-the-art on
the bAbI tasks, and is the first method to solve all the tasks in the 10k training
examples setting. We also demonstrate that it can solve a reasoning task which
requires a large number of supporting facts, which other methods are not able to
solve, and can generalize past its training horizon. It can also be practically used
on large scale datasets such as Childrenís Book Test, where it obtains competitive
performance, reading the story in a single pass."
2017,Energy-based Generative Adversarial Networks.,"We introduce the ""Energy-based Generative Adversarial Network"" model (EBGAN) which views the discriminator as an energy function that attributes low energies to the regions near the data manifold and higher energies to other regions. Similar to the probabilistic GANs, a generator is seen as being trained to produce contrastive samples with minimal energies, while the discriminator is trained to assign high energies to these generated samples. Viewing the discriminator as an energy function allows to use a wide variety of architectures and loss functionals in addition to the usual binary classifier with logistic output. Among them, we show one instantiation of EBGAN framework as using an auto-encoder architecture, with the energy being the reconstruction error, in place of the discriminator. We show that this form of EBGAN exhibits more stable behavior than regular GANs during training. We also show that a single-scale architecture can be trained to generate high-resolution images."
2017,Tunable Efficient Unitary Neural Networks (EUNN) and their application to RNNs.,"Using unitary (instead of general) matrices in artificial neural networks (ANNs) is a promising way to solve the gradient explosion/vanishing problem, as well as to enable ANNs to learn long-term correlations in the data. This approach appears particularly promising for Recurrent Neural Networks (RNNs). In this work, we present a new architecture for implementing an Efficient Unitary Neural Network (EUNNs); its main advantages can be summarized as follows. Firstly, the representation capacity of the unitary space in an EUNN is fully tunable, ranging from a subspace of SU(N) to the entire unitary space. Secondly, the computational complexity for training an EUNN is merely
O(1)
O
per parameter. Finally, we test the performance of EUNNs on the standard copying task, the pixel-permuted MNIST digit recognition benchmark as well as the Speech Prediction Test (TIMIT). We find that our architecture significantly outperforms both other state-of-the-art unitary RNNs and the LSTM architecture, in terms of the final performance and/or the wall-clock training speed. EUNNs are thus promising alternatives to RNNs and LSTMs for a wide variety of applications."
2016,Stereo Matching by Training a Convolutional Neural Network to Compare Image Patches.,"We present a method for extracting depth information from a rectified image pair. Our approach focuses on the first stage of many stereo algorithms: the matching cost computation. We approach the problem by learning a similarity measure on small image patches using a convolutional neural network. Training is carried out in a supervised manner by constructing a binary classification data set with examples of similar and dissimilar pairs of patches. We examine two network architectures for this task: one tuned for speed, the other for accuracy. The output of the convolutional neural network is used to initialize the stereo matching cost. A series of post-processing steps follow: cross-based cost aggregation, semiglobal matching, a left-right consistency check, subpixel enhancement, a median filter, and a bilateral filter. We evaluate our method on the KITTI 2012, KITTI 2015, and Middlebury stereo data sets and show that it outperforms other approaches on all three data sets.
"
2016,A Mathematical Motivation for Complex-Valued Convolutional Networks.,"A complex-valued convolutional network (convnet) implements the repeated application of the following composition of three operations, recursively applying the composition to an input vector of nonnegative real numbers: (1) convolution with complex-valued vectors, followed by (2) taking the absolute value of every entry of the resulting vectors, followed by (3) local averaging. For processing real-valued random vectors, complex-valued convnets can be viewed as data-driven multiscale windowed power spectra, data-driven multiscale windowed absolute spectra, data-driven multiwavelet absolute values, or (in their most general configuration) data-driven nonlinear multiwavelet packets. Indeed, complex-valued convnets can calculate multiscale windowed spectra when the convnet filters are windowed complex-valued exponentials. Standard real-valued convnets, using rectified linear units (ReLUs), sigmoidal (e.g., logistic or tanh) nonlinearities, or max pooling, for example, do not obviously exhibit the same exact correspondence with data-driven wavelets (whereas for complex-valued convnets, the correspondence is much more than just a vague analogy). Courtesy of the exact correspondence, the remarkably rich and rigorous body of mathematical analysis for wavelets applies directly to (complex-valued) convnets.
"
2016,Very deep multilingual convolutional neural networks for LVCSR.,"Abstract:
Convolutional neural networks (CNNs) are a standard component of many current state-of-the-art Large Vocabulary Continuous Speech Recognition (LVCSR) systems. However, CNNs in LVCSR have not kept pace with recent advances in other domains where deeper neural networks provide superior performance. In this paper we propose a number of architectural advances in CNNs for LVCSR. First, we introduce a very deep convolutional network architecture with up to 14 weight layers. There are multiple convolutional layers before each pooling layer, with small 3√ó3 kernels, inspired by the VGG Imagenet 2014 architecture. Then, we introduce multilingual CNNs with multiple untied layers. Finally, we introduce multi-scale input features aimed at exploiting more context at negligible computational cost. We evaluate the improvements first on a Babel task for low resource speech recognition, obtaining an absolute 5.77% WER improvement over the baseline PLP DNN by training our CNN on the combined data of six different languages. We then evaluate the very deep CNNs on the Hub5'00 benchmark (using the 262 hours of SWB-1 training data) achieving a word error rate of 11.8% after cross-entropy training, a 1.4% WER improvement (10.6% relative) over the best published CNN result so far."
2016,Binary embeddings with structured hashed projections.,"We consider the hashing mechanism for constructing binary embeddings, that involves pseudo-random projections followed by nonlinear (sign function) mappings. The pseudo-random projection is described by a matrix, where not all entries are independent random variables but instead a fixed ‚Äúbudget of randomness‚Äù is distributed across the matrix. Such matrices can be edfficiently stored in sub-quadratic or even linear space, provide reduction in randomness usage (i.e. number of required random values), and very often lead to computational speed ups. We prove several theoretical results showing that projections via various structured matrices followed by nonlinear mappings accurately preserve the angular distance between input high-dimensional vectors. To the best of our knowledge, these results are the first that give theoretical ground for the use of general structured matrices in the nonlinear setting. We empirically verify our theoretical findings and show the dependence of learning via structured hashed projections on the performance of neural network as well as nearest neighbor classifier."
2016,Recurrent Orthogonal Networks and Long-Memory Tasks.,"Although RNNs have been shown to be power- ful tools for processing sequential data, finding architectures or optimization strategies that al- low them to model very long term dependencies is still an active area of research. In this work, we carefully analyze two synthetic datasets orig- inally outlined in (Hochreiter & Schmidhuber, 1997) which are used to evaluate the ability of RNNs to store information over many time steps. We explicitly construct RNN solutions to these problems, and using these constructions, illumi- nate both the problems themselves and the way in which RNNs store different types of information in their hidden states. These constructions fur- thermore explain the success of recent methods that specify unitary initializations or constraints on the transition matrices."
2016,Disentangling factors of variation in deep representation using adversarial training.,"We propose a deep generative model for learning to distill the hidden factors of variation within a set of labeled observations into two complementary codes. One code describes the factors of variation relevant to solving a specified task. The other code describes the remaining factors of variation that are irrelevant to solving this task. The only available source of supervision during the training process comes from our ability to distinguish among different observations belonging to the same category. Concrete examples include multiple images of the same object from different viewpoints, or multiple speech samples from the same speaker. In both of these instances, the factors of variation irrelevant to classification are implicitly expressed by intra-class variabilities, such as the relative position of an object in an image, or the linguistic content of an utterance. Most existing approaches for solving this problem rely heavily on having access to pairs of observations only sharing a single factor of variation, e.g. different objects observed in the exact same conditions. This assumption is often not encountered in realistic settings where data acquisition is not controlled and labels for the uninformative components are not available. In this work, we propose to overcome this limitation by augmenting deep convolutional autoencoders with a form of adversarial training. Both factors of variation are implicitly captured in the organization of the learned embedding space, and can be used for solving single-image analogies. Experimental results on synthetic and real datasets show that the proposed method is capable of disentangling the influences of style and content factors using a flexible representation, as well as generalizing to unseen styles or content classes."
