2011,Hardware accelerated visual attention algorithm.,"Abstract:
We present a hardware-accelerated implementation of a bottom-up visual attention algorithm. This algorithm generates a multi-scale saliency map from differences in image intensity, color, presence of edges and presence of motion. The visual attention algorithm is computed on a custom-designed FPGA-based dataflow computer for general-purpose state-of-the-art vision algorithms. The vision algorithm is accelerated by our hardware platform and reports √ó4 speedup when compared to a standard laptop with a 2.26 GHz Intel Dual Core processor and for image sizes of 480 √ó 480 pixels. We developed a real time demo application running at >; 12 frames per second with the same size images. We also compared the results of the hardware implementation of the algorithm to the eye fixation points of different subjects on six video sequences. We find that our implementation achieves precisions of fixation predictions of up to 1/14th of the size of the video frames."
2011,NeuFlow: A runtime reconfigurable dataflow processor for vision.,"Abstract:
In this paper we present a scalable dataflow hardware architecture optimized for the computation of general-purpose vision algorithms - neuFlow - and a dataflow compiler - luaFlow - that transforms high-level flow-graph representations of these algorithms into machine code for neuFlow. This system was designed with the goal of providing real-time detection, categorization and localization of objects in complex scenes, while consuming 10 Watts when implemented on a Xilinx Virtex 6 FPGA platform, or about ten times less than a laptop computer, and producing speedups of up to 100 times in real-world applications. We present an application of the system on street scene analysis, segmenting 20 categories on 500 √ó 375 frames at 12 frames per second on our custom hardware neuFlow."
2011,Ask the locals: Multi-way local pooling for image recognition.,"Abstract:
Invariant representations in object recognition systems are generally obtained by pooling feature vectors over spatially local neighborhoods. But pooling is not local in the feature vector space, so that widely dissimilar features may be pooled together if they are in nearby locations. Recent approaches rely on sophisticated encoding methods and more specialized codebooks (or dictionaries), e.g., learned on subsets of descriptors which are close in feature space, to circumvent this problem. In this work, we argue that a common trait found in much recent work in image recognition or retrieval is that it leverages locality in feature space on top of purely spatial locality. We propose to apply this idea in its simplest form to an object recognition system based on the spatial pyramid framework, to increase the performance of small dictionaries with very little added engineering. State-of-the-art results on several object recognition benchmarks show the promise of this approach."
2011,Traffic sign recognition with multi-scale Convolutional Networks.,"Abstract:
We apply Convolutional Networks (ConvNets) to the task of traffic sign classification as part of the GTSRB competition. ConvNets are biologically-inspired multi-stage architectures that automatically learn hierarchies of invariant features. While many popular vision approaches use hand-crafted features such as HOG or SIFT, ConvNets learn features at every level from data that are tuned to the task at hand. The traditional ConvNet architecture was modified by feeding 1 st stage features in addition to 2 nd stage features to the classifier. The system yielded the 2nd-best accuracy of 98.97% during phase I of the competition (the best entry obtained 98.98%), above the human performance of 98.81%, using 32√ó32 color input images. Experiments conducted after phase 1 produced a new record of 99.17% by increasing the network capacity, and by using greyscale images instead of color. Interestingly, random features still yielded competitive results (97.33%)."
2011,Unsupervised Learning of Sparse Features for Scalable Audio Classification.,"In this work we present a system to automatically learn features from audio in an unsupervised manner. Our method first learns an overcomplete dictionary which can be used to sparsely decompose log-scaled spectrograms. It then trains an efficient encoder which quickly maps new inputs to approximations of their sparse representations using the learned dictionary. This avoids expensive iterative procedures usually required to infer sparse codes. We then use these sparse codes as inputs for a linear Support Vector Machine (SVM). Our system achieves 83.4% accuracy in predicting genres on the GTZAN dataset, which is competitive with current state-of-the-art approaches. Furthermore, the use of a simple linear classifier combined with a fast feature extraction system allows our approach to scale well to large datasets."
2011,Structured sparse coding via lateral inhibition.,"This work describes a conceptually simple method for structured sparse coding and dictionary design. Supposing a dictionary with K atoms, we introduce a structure as a set of penalties or interactions between every pair of atoms. We describe modifications of standard sparse coding algorithms for inference in this setting, and describe experiments showing that these algorithms are efficient. We show that interesting dictionaries can be learned for interactions that encode tree structures or locally connected structures. Finally, we show that our framework allows us to learn the values of the interactions from the data, rather than having them pre-specified."
2010,Learning mid-level features for recognition.,"Abstract:
Many successful models for scene or object recognition transform low-level descriptors (such as Gabor filter responses, or SIFT descriptors) into richer representations of intermediate complexity. This process can often be broken down into two steps: (1) a coding step, which performs a pointwise transformation of the descriptors into a representation better adapted to the task, and (2) a pooling step, which summarizes the coded features over larger neighborhoods. Several combinations of coding and pooling schemes have been proposed in the literature. The goal of this paper is threefold. We seek to establish the relative importance of each step of mid-level feature extraction through a comprehensive cross evaluation of several types of coding modules (hard and soft vector quantization, sparse coding) and pooling schemes (by taking the average, or the maximum), which obtains state-of-the-art performance or better on several recognition benchmarks. We show how to improve the best performing coding scheme by learning a supervised discriminative dictionary for sparse coding. We provide theoretical and empirical insight into the remarkable performance of max pooling. By teasing apart components shared by modern mid-level feature extractors, our approach aims to facilitate the design of better recognition architectures."
2010,Convolutional Learning of Spatio-temporal Features.,"Abstract
We address the problem of learning good features for understanding video data. We introduce a model that learns latent representations of image sequences from pairs of successive images. The convolutional architecture of our model allows it to scale to realistic image sizes whilst using a compact parametrization. In experiments on the NORB dataset, we show our model extracts latent ‚Äúflow fields‚Äù which correspond to the transformation between the pair of input frames. We also use our model to extract low-level motion features in a multi-stage architecture for action recognition, demonstrating competitive performance on both the KTH and Hollywood2 datasets."
2010,A Theoretical Analysis of Feature Pooling in Visual Recognition.,"Many modern visual recognition algorithms incorporate a step of spatial 'pooling', where the outputs of several nearby feature detectors are combined into a local or global 'bag of features', in a way that preserves task-related information while removing irrelevant details. Pooling is used to achieve invariance to image transformations, more compact representations, and better robustness to noise and clutter. Several papers have shown that the details of the pooling operation can greatly influence the performance, but studies have so far been purely empirical. In this paper, we show that the reasons underlying the performance of various pooling methods are obscured by several confounding factors, such as the link between the sample cardinality in a spatial pool and the resolution at which low-level features have been extracted. We provide a detailed theoretical analysis of max pooling and average pooling, and give extensive empirical comparisons for object recognition tasks."
2010,Learning Fast Approximations of Sparse Coding.,"In Sparse Coding (SC), input vectors are reconstructed using a sparse linear combination of basis vectors. SC has become a popular method for extracting features from data. For a given input, SC minimizes a quadratic reconstruction error with an L1 penalty term on the code. The process is often too slow for applications such as real-time pattern recognition. We proposed two versions of a very fast algorithm that produces approximate estimates of the sparse code that can be used to compute good visual features, or to initialize exact iterative algorithms. The main idea is to train a non-linear, feed-forward predictor with a specific architecture and a fixed depth to produce the best possible approximation of the sparse code. A version of the method, which can be seen as a trainable version of Li and Osher's coordinate descent method, is shown to produce approximate solutions with 10 times less computation than Li and Os-her's for the same approximation error. Unlike previous proposals for sparse code predictors, the system allows a kind of approximate ""explaining away"" to take place during inference. The resulting predictor is differentiable and can be included into globally-trained recognition systems."
2010,Hybrid hessians for flexible optimization of pose graphs.,"Abstract:
We present a novel ‚Äúhybrid Hessian‚Äù six-degrees-of-freedom simultaneous localization and mapping (SLAM) algorithm. Our method allows for the smooth trade-off of accuracy for efficiency and for the incorporation of GPS measurements during real-time operation, thereby offering significant advantages over other SLAM solvers. Like other stochastic SLAM methods, such as SGD and TORO, our technique is robust to local minima and eliminates the need for costly relinearizations of the map. Unlike other stochastic methods, but similar to exact solvers, such as iSAM, our technique is able to process position-only constraints, such as GPS measurements, without introducing systematic distortions in the map. We present results from the Google Street View database, and compare our method with results from TORO. We show that our solver is able to achieve higher accuracy while operating within real-time bounds. In addition, as far as we are aware, this is the first stochastic SLAM solver capable of processing GPS constraints in real-time."
2010,Convolutional networks and applications in vision.,"Abstract:
Intelligent tasks, such as visual perception, auditory perception, and language understanding require the construction of good internal representations of the world (or ""features"")? which must be invariant to irrelevant variations of the input while, preserving relevant information. A major question for Machine Learning is how to learn such good features automatically. Convolutional Networks (ConvNets) are a biologically-inspired trainable architecture that can learn invariant features. Each stage in a ConvNets is composed of a filter bank, some nonlinearities, and feature pooling layers. With multiple stages, a ConvNet can learn multi-level hierarchies of features. While ConvNets have been successfully deployed in many commercial applications from OCR to video surveillance, they require large amounts of labeled training samples. We describe new unsupervised learning algorithms, and new non-linear stages that allow ConvNets to be trained with very few labeled samples. Applications to visual object recognition and vision navigation for off-road mobile robots are described."
2010,Hardware accelerated convolutional neural networks for synthetic vision systems.,"Abstract:
In this paper we present a scalable hardware architecture to implement large-scale convolutional neural networks and state-of-the-art multi-layered artificial vision systems. This system is fully digital and is a modular vision engine with the goal of performing real-time detection, recognition and segmentation of mega-pixel images. We present a performance comparison between a software, FPGA and ASIC implementation that shows a speed up in custom hardware implementations."
2010,Learning Convolutional Feature Hierarchies for Visual Recognition.,"We propose an unsupervised method for learning multi-stage hierarchies of sparse convolutional features. While sparse coding has become an increasingly popular method for learning visual features, it is most often trained at the patch level. Applying the resulting filters convolutionally results in highly redundant codes because overlapping patches are encoded in isolation. By training convolutionally over large image windows, our method reduces the redudancy between feature vectors at neighboring locations and improves the efficiency of the overall representation. In addition to a linear decoder that reconstructs the image from sparse features, our method trains an efficient feed-forward encoder that predicts quasi-sparse features from the input. While patch-based training rarely produces anything but oriented edge detectors, we show that convolutional training produces highly diverse filters, including center-surround filters, corner detectors, cross detectors, and oriented grating detectors. We show that using these filters in multi-stage convolutional network architecture improves performance on a number of visual recognition and detection tasks."
2010,Regularized estimation of image statistics by Score Matching.,"Score Matching is a recently-proposed criterion for training high-dimensional density models for which maximum likelihood training is intractable. It has been applied to learning natural image statistics but has so-far been limited to simple models due to the difficulty of differentiating the loss with respect to the model parameters. We show how this differentiation can be automated with an extended version of the double-backpropagation algorithm. In addition, we introduce a regularization term for the Score Matching loss that enables its use for a broader range of problem by suppressing instabilities that occur with finite training sample sizes and quantized input values. Results are reported for image denoising and super-resolution."
2009,A multirange architecture for collision-free off-road robot navigation.,"We present a multilayered mapping, planning, and command execution system developed and tested on the LAGR mobile robot. Key to robust performance under uncertainty is the combination of a short?range perception system operating at high frame rate and low resolution and a long?range, adaptive vision system operating at lower frame rate and higher resolution. The short?range module performs local planning and obstacle avoidance with fast reaction times, whereas the long?range module performs strategic visual planning. Probabilistic traversability labels provided by the perception modules are combined and accumulated into a robot?centered hyperbolic?polar map with a 200?m effective range. Instead of using a dynamical model of the robot for short?range planning, the system uses a large lookup table of physically possible trajectory segments recorded on the robot in a wide variety of driving conditions. Localization is performed using a combination of global positioning system, wheel odometry, inertial measurement unit, and a high?speed, low?complexity rotational visual odometry module. The end?to?end system was developed and tested on the LAGR mobile robot and was verified in independent government tests. © 2008 Wiley Periodicals, Inc.
"
2009,Learning long-range vision for autonomous off-road driving.,"Most vision?based approaches to mobile robotics suffer from the limitations imposed by stereo obstacle detection, which is short range and prone to failure. We present a self?supervised learning process for long?range vision that is able to accurately classify complex terrain at distances up to the horizon, thus allowing superior strategic planning. The success of the learning process is due to the self?supervised training data that are generated on every frame: robust, visually consistent labels from a stereo module; normalized wide?context input windows; and a discriminative and concise feature representation. A deep hierarchical network is trained to extract informative and meaningful features from an input image, and the features are used to train a real?time classifier to predict traversability. The trained classifier sees obstacles and paths from 5 to more than 100 m, far beyond the maximum stereo range of 12 m, and adapts very quickly to new environments. The process was developed and tested on the LAGR (Learning Applied to Ground Robots) mobile robot. Results from a ground truth data set, as well as field test results, are given.
"
2009,Learning invariant features through topographic filter maps.,"Abstract:
Several recently-proposed architectures for high-performance object recognition are composed of two main stages: a feature extraction stage that extracts locally-invariant feature vectors from regularly spaced image patches, and a somewhat generic supervised classifier. The first stage is often composed of three main modules: (1) a bank of filters (often oriented edge detectors); (2) a non-linear transform, such as a point-wise squashing functions, quantization, or normalization; (3) a spatial pooling operation which combines the outputs of similar filters over neighboring regions. We propose a method that automatically learns such feature extractors in an unsupervised fashion by simultaneously learning the filters and the pooling units that combine multiple filter outputs together. The method automatically generates topographic maps of similar filters that extract features of orientations, scales, and positions. These similar filters are pooled together, producing locally-invariant outputs. The learned feature descriptors give comparable results as SIFT on image recognition tasks for which SIFT is well suited, and better results than SIFT on tasks for which SIFT is less well suited."
2009,CNP: An FPGA-based processor for Convolutional Networks.,"Abstract:
Convolutional networks (ConvNets) are biologically inspired hierarchical architectures that can be trained to perform a variety of detection, recognition and segmentation tasks. ConvNets have a feed-forward architecture consisting of multiple linear convolution filters interspersed with pointwise non-linear squashing functions. This paper presents an efficient implementation of ConvNets on a low-end DSP-oriented field programmable gate array (FPGA). The implementation exploits the inherent parallelism of ConvNets and takes full advantage of multiple hardware multiply accumulate units on the FPGA. The entire system uses a single FPGA with an external memory module, and no extra parts. A network compiler software was implemented, which takes a description of a trained ConvNet and compiles it into a sequence of instructions for the ConvNet Processor (CNP). A ConvNet face detection system was implemented and tested. Face detection on a 512 times 384 frame takes 100 ms (10 frames per second), which corresponds to an average performance of 3.4 times 10 9 connections per second for this 340 million connection network. The design can be used for low-power, lightweight embedded vision systems for micro-UAVs and other small robots."
2009,What is the best multi-stage architecture for object recognition?,"Abstract:
In many recent object recognition systems, feature extraction stages are generally composed of a filter bank, a non-linear transformation, and some sort of feature pooling layer. Most systems use only one stage of feature extraction in which the filters are hard-wired, or two stages where the filters in one or both stages are learned in supervised or unsupervised mode. This paper addresses three questions: 1. How does the non-linearities that follow the filter banks influence the recognition accuracy? 2. does learning the filter banks in an unsupervised or supervised manner improve the performance over random filters or hardwired filters? 3. Is there any advantage to using an architecture with two stages of feature extraction, rather than one? We show that using non-linearities that include rectification and local contrast normalization is the single most important ingredient for good accuracy on object recognition benchmarks. We show that two stages of feature extraction yield better accuracy than one. Most surprisingly, we show that a two-stage system with random filters can yield almost 63% recognition rate on Caltech-101, provided that the proper non-linearities and pooling layers are used. Finally, we show that with supervised refinement, the system achieves state-of-the-art performance on NORB dataset (5.6%) and unsupervised pre-training followed by supervised refinement produces good accuracy on Caltech-101 (> 65%), and the lowest known error rate on the undistorted, unprocessed MNIST dataset (0.53%)."
2009,An FPGA-based stream processor for embedded real-time vision with Convolutional Networks.,"Abstract:
Many recent visual recognition systems can be seen as being composed of multiple layers of convolutional filter banks, interspersed with various types of non-linearities. This includes Convolutional Networks, HMAX-type architectures, as well as systems based on dense SIFT features or Histogram of Gradients. This paper describes a highly-compact and low power embedded system that can run such vision systems at very high speed. A custom board built around a Xilinx Virtex-4 FPGA was built and tested. It measures 70 √ó 80 mm, and the complete system-FPGA, camera, memory chips, flash-consumes 15 watts in peak, and is capable of more than 4 √ó 10 9 multiply-accumulate operations per second in real vision application. This enables real-time implementations of object detection, object recognition, and vision-based navigation algorithms in small-size robots, micro-UAVs, and hand-held devices. Real-time face detection is demonstrated, with speeds of 10 frames per second at VGA resolution."
2009,Efficient off-road localization using visually corrected odometry.,"Abstract:
We describe an efficient, low-cost, low-overhead system for robot localization in complex visual environments. Our system augments wheel odometry with visual orientation tracking to yield localization accuracy comparable with ldquopurerdquo visual odometry at a fraction of the cost. Such a system is well-suited to consumer-level robots, small form-factor robots, extraterrestrial rovers, and other platforms with limited computational resources. Our system also benefits high-end multiprocessor robots by leaving ample processor time on all camera-computer pairs to perform other critical visual tasks, such as obstacle detection. Experimental results are shown for outdoor, off-road loops on the order of 200 meters. Comparisons are made with corresponding results from a state-of-the-art pure visual odometer."
2009,EBLearn: Open-Source Energy-Based Learning in C++.,"Abstract:
Energy-based learning (EBL) is a general framework to describe supervised and unsupervised training methods for probabilistic and non-probabilistic factor graphs. An energy-based model associates a scalar energy to configurations of inputs, outputs, and latent variables. Learning machines can be constructed by assembling modules and loss functions. Gradient-based learning procedures are easily implemented through semi-automatic differentiation of complex models constructed by assembling predefined modules. We introduce an open-source and cross-platform C++ library called EBLearn to enable the construction of energy-based learning models. EBLearn is composed of two major components, libidx: an efficient and flexible multi-dimensional tensor library, and libeblearn: an object-oriented library of trainable modules and learning algorithms. The latter has facilities for such models as convolutional networks, as well as for image processing. It also provides graphical display functions."
