2009,A Hybrid Pareto Mixture for Conditional Asymmetric Fat-Tailed Distributions.,"Abstract:
In many cases, we observe some variables X that contain predictive information over a scalar variable of interest Y, with (X, Y) pairs observed in a training set. We can take advantage of this information to estimate the conditional density p(Y|X=x). In this paper, we propose a conditional mixture model with hybrid Pareto components to estimate p(Y|X=x). The hybrid Pareto is a Gaussian whose upper tail has been replaced by a generalized Pareto tail. A third parameter, in addition to the location and spread parameters of the Gaussian, controls the heaviness of the upper tail. Using the hybrid Pareto in a mixture model results in a nonparametric estimator that can adapt to multimodality, asymmetry, and heavy tails. A conditional density estimator is built by modeling the parameters of the mixture estimator as functions of X. We use a neural network to implement these functions. Such conditional density estimators have important applications in many domains such as finance and insurance. We show experimentally that this novel approach better models the conditional density in terms of likelihood, compared to competing algorithms: conditional mixture models with other types of components and a classical kernel-based nonparametric model."
2009,Workshop summary: Workshop on learning feature hierarchies.,"ABSTRACT
No abstract available."
2009,Curriculum learning.,"ABSTRACT
Humans and animals learn much better when the examples are not randomly presented but organized in a meaningful order which illustrates gradually more concepts, and gradually more complex ones. Here, we formalize such training strategies in the context of machine learning, and call them ""curriculum learning"". In the context of recent research studying the difficulty of training in the presence of non-convex training criteria (for deep deterministic and stochastic neural networks), we explore curriculum learning in various set-ups. The experiments show that significant improvements in generalization can be achieved. We hypothesize that curriculum learning has both an effect on the speed of convergence of the training process to a minimum and, in the case of non-convex criteria, on the quality of the local minima obtained: curriculum learning can be seen as a particular form of continuation method (a general strategy for global optimization of non-convex functions)."
2009,Quadratic Features and Deep Architectures for Chunking.,"We experiment with several chunking models. Deeper architectures achieve better generalization. Quadratic filters, a simplification of a theoretical model of V1 complex cells, reliably increase accuracy. In fact, logistic regression with quadratic filters outperforms a standard single hidden layer neural network. Adding quadratic filters to logistic regression is almost as effective as feature engineering. Despite predicting each output label independently, our model is competitive with ones that use previous decisions."
2009,"Slow, Decorrelated Features for Pretraining Complex Cell-like Networks.","We introduce a new type of neural network activation function based on recent physiological rate models for complex cells in visual area V1. A single-hidden-layer neural network of this kind of model achieves 1.5% error on MNIST. We also introduce an existing criterion for learning slow, decorrelated features as a pretraining strategy for image models. This pretraining strategy results in orientation-selective features, similar to the receptive fields of complex cells. With this pretraining, the same single-hidden-layer model achieves better generalization error, even though the pretraining sample distribution is very different from the fine-tuning distribution. To implement this pretraining strategy, we derive a fast algorithm for online learning of decorrelated features such that each iteration of the algorithm runs in linear time with respect to the number of features."
2009,An Infinite Factor Model Hierarchy Via a Noisy-Or Mechanism.,"The Indian Buffet Process is a Bayesian nonparametric approach that models objects as arising from an infinite number of latent factors. Here we extend the latent factor model framework to two or more unbounded layers of latent factors. From a generative perspective, each layer defines a conditional \emph{factorial} prior distribution over the binary latent variables of the layer below via a noisy-or mechanism. We explore the properties of the model with two empirical studies, one digit recognition task and one music tag data experiment."
2009,The Difficulty of Training Deep Architectures and the Effect of Unsupervised Pre-Training.,"Whereas theoretical work suggests that deep architectures might be more efficient at representing highly-varying functions, training deep architectures was unsuccessful until the recent advent of algorithms based on unsupervised pretraining. Even though these new algorithms have enabled training deep models, many questions remain as to the nature of this difficult learning problem. Answering these questions is important if learning in deep architectures is to be further improved. We attempt to shed some light on these questions through extensive simulations. The experiments confirm and clarify the advantage of unsupervised pre-training. They demonstrate the robustness of the training procedure with respect to the random initialization, the positive effect of pre-training in terms of optimization and its role as a kind of regularizer. We show the influence of architecture depth, model capacity, and number of training examples."
2008,Representational Power of Restricted Boltzmann Machines and Deep Belief Networks.,"Deep belief networks (DBN) are generative neural network models with many layers of hidden explanatory factors, recently introduced by Hinton, Osindero, and Teh (2006) along with a greedy layer-wise unsupervised learning algorithm. The building block of a DBN is a probabilistic model called a restricted Boltzmann machine (RBM), used to represent one layer of the model. Restricted Boltzmann machines are interesting because inference is easy in them and because they have been successfully used as building blocks for training deeper models. We first prove that adding hidden units yields strictly improved modeling power, while a second theorem shows that RBMs are universal approximators of discrete distributions. We then study the question of whether DBNs with more layers are strictly more powerful in terms of representational power. This suggests a new and less greedy criterion for training RBMs within DBNs.
"
2008,Neural net language models.,n/a
2008,Adaptive Importance Sampling to Accelerate Training of a Neural Probabilistic Language Model.,"Abstract:
Previous work on statistical language modeling has shown that it is possible to train a feedforward neural network to approximate probabilities over sequences of words, resulting in significant error reduction when compared to standard baseline models based on n-grams. However, training the neural network model with the maximum-likelihood criterion requires computations proportional to the number of words in the vocabulary. In this paper, we introduce adaptive importance sampling as a way to accelerate training of the model. The idea is to use an adaptive n-gram model to track the conditional distributions produced by the neural network. We show that a very significant speedup can be obtained on standard problems."
2008,Zero-data Learning of New Tasks.,"We introduce the problem of zero-data learning, where a model must generalize to classes or tasks for which no training data are available and only a description of the classes or tasks are provided. Zero-data learning is useful for problems where the set of classes to distinguish or tasks to solve is very large and is not entirely covered by the training data. The main contributions of this work lie in the presentation of a general formalization of zero-data learning, in an experimental analysis of its properties and in empirical evidence showing that generalization is possible and significant in this context. The experimental work of this paper addresses two classification problems of character recognition and a multi-task ranking problem in the context of drug discovery. Finally, we conclude by discussing how this new framework could lead to a novel perspective on how to extend machine learning towards AI, where an agent can be given a specification for a learning problem before attempting to solve it (with very few or even zero examples).
"
2008,Classification using discriminative restricted Boltzmann machines.,"ABSTRACT
Recently, many applications for Restricted Boltzmann Machines (RBMs) have been developed for a large variety of learning problems. However, RBMs are usually used as feature extractors for another learning algorithm or to provide a good initialization for deep feed-forward neural network classifiers, and are not considered as a standalone solution to classification problems. In this paper, we argue that RBMs provide a self-contained framework for deriving competitive non-linear classifiers. We present an evaluation of different learning algorithms for RBMs which aim at introducing a discriminative component to RBM training and improve their performance as classifiers. This approach is simple in that RBMs are used directly to build a classifier, rather than as a stepping stone. Finally, we demonstrate how discriminative RBMs can also be successfully employed in a semi-supervised setting."
2008,Extracting and composing robust features with denoising autoencoders.,"ABSTRACT
Previous work has shown that the difficulties in learning deep generative or discriminative models can be overcome by an initial unsupervised learning step that maps inputs to useful intermediate representations. We introduce and motivate a new training principle for unsupervised learning of a representation based on the idea of making the learned representations robust to partial corruption of the input pattern. This approach can be used to train autoencoders, and these denoising autoencoders can be stacked to initialize deep architectures. The algorithm can be motivated from a manifold learning and information theoretic perspective or from a generative model perspective. Comparative experiments clearly show the surprising advantage of corrupting the input of autoencoders on a pattern classification benchmark suite."
2007,Noisy K Best-Paths for Approximate Dynamic Programming with Application to Portfolio Optimization.,"We describe a general method to transform a non-Markovian sequential decision problem into a supervised learning problem using a K-best-paths algorithm. We consider an application in financial portfolio management where we can train a controller to directly optimize a Sharpe Ratio (or other risk-averse non-additive) utility function. We illustrate the approach by demonstrating experimental results using a kernel-based controller architecture that would not normally be considered in traditional reinforcement learning or approximate dynamic programming. We further show that using a non-additive criterion (incremental Sharpe Ratio) yields a noisy K-best-paths extraction problem, that can give substantially improved performance."
2007,An empirical evaluation of deep architectures on problems with many factors of variation.,"ABSTRACT
Recently, several learning algorithms relying on models with deep architectures have been proposed. Though they have demonstrated impressive performance, to date, they have only been evaluated on relatively simple problems such as digit recognition in a controlled environment, for which many machine learning algorithms already report reasonable results. Here, we present a series of experiments which indicate that these models show promise in solving harder learning problems that exhibit many factors of variation. These models are compared with well-established algorithms such as Support Vector Machines and single hidden-layer feed-forward neural networks."
2007,Augmented Functional Time Series Representation and Forecasting with Gaussian Processes.,"We introduce a functional representation of time series which allows forecasts to be performed over an unspecified horizon with progressively-revealed information sets. By virtue of using Gaussian processes, a complete covariance matrix between forecasts at several time-steps is available. This information is put to use in an application to actively trade price spreads between commodity futures contracts. The approach delivers impressive out-of-sample risk-adjusted returns after transaction costs on a portfolio of 30 spreads. "
2007,Learning the 2-D Topology of Images.,"We study the following question: is the two-dimensional structure of images a very strong prior or is it something that can be learned with a few examples of natural images? If someone gave us a learning task involving images for which the two-dimensional topology of pixels was not known, could we discover it automatically and exploit it? For example suppose that the pixels had been permuted in a fixed but unknown way, could we recover the relative two-dimensional location of pixels on images? The surprising result presented here is that not only the answer is yes but that about as few as a thousand images are enough to approximately recover the relative locations of about a thousand pixels. This is achieved using a manifold learning algorithm applied to pixels associated with a measure of distributional similarity between pixel intensities. We compare different topology-extraction approaches and show how having the two-dimensional topology can be exploited."
2007,Topmoumoute Online Natural Gradient Algorithm.,"Guided by the goal of obtaining an optimization algorithm that is both fast and yielding good generalization, we study the descent direction maximizing the decrease in generalization error or the probability of not increasing generalization error. The surprising result is that from both the Bayesian and frequentist perspectives this can yield the natural gradient direction. Although that direction can be very expensive to compute we develop an efficient, general, online approximation to the natural gradient descent which is suited to large scale problems. We report experimental results showing much faster convergence in computation time and in number of iterations with TONGA (Topmoumoute Online natural Gradient Algorithm) than with stochastic gradient descent, even on very large datasets."
2007,A Hybrid Pareto Model for Conditional Density Estimation of Asymmetric Fat-Tail Data.,"We propose an estimator for the conditional density p(Y |X) that can adapt for asymmetric heavy tails which might depend on X. Such estimators have important applications in nance and insurance. We draw from Extreme Value Theory the tools to build a hybrid unimodal density having a parameter controlling the heaviness of the upper tail. This hybrid is a Gaussian whose upper tail has been replaced by a generalized Pareto tail. We use this hybrid in a multi-modal mixture in order to obtain a nonparametric density estimator that can easily adapt for heavy tailed data. To obtain a conditional density estimator, the parameters of the mixture estimator can be seen as functions of X and these functions learned. We show experimentally that this approach better models the conditional density in terms of likelihood than compared competing algorithms : conditional mixture models with other types of components and multivariate nonparametric models."
2007,Continuous Neural Networks.,"This article extends neural networks to the case of an uncountable number of hidden units, in several ways. In the first approach proposed, a finite parametrization is possible, allowing gradient-based learning. While having the same number of parameters as an ordinary neural network, its internal structure suggests that it can represent some smooth functions much more compactly. Under mild assumptions, we also find better error bounds than with ordinary neural networks. Furthermore, this parametrization may help reducing the problem of saturation of the neurons. In a second approach, the input-to-hidden weights are fully nonparametric, yielding a kernel machine for which we demonstrate a simple kernel formula. Interestingly, the resulting kernel machine can be made hyperparameter-free and still generalizes in spite of an absence of explicit regularization."
2006,Collaborative Filtering on a Family of Biological Targets.,"Building a QSAR model of a new biological target for which few screening data are available is a statistical challenge. However, the new target may be part of a bigger family, for which we have more screening data. Collaborative filtering or, more generally, multi-task learning, is a machine learning approach that improves the generalization performance of an algorithm by using information from related tasks as an inductive bias. We use collaborative filtering techniques for building predictive models that link multiple targets to multiple examples. The more commonalities between the targets, the better the multi-target model that can be built. We show an example of a multi-target neural network that can use family information to produce a predictive model of an undersampled target. We evaluate JRank, a kernel-based method designed for collaborative filtering. We show their performance on compound prioritization for an HTS campaign and the underlying shared representation between targets. JRank outperformed the neural network both in the single- and multi-target models.
"
2006,Nonlocal Estimation of Manifold Structure.,"We claim and present arguments to the effect that a large class of manifold learning algorithms that are essentially local and can be framed as kernel learning algorithms will suffer from the curse of dimensionality, at the dimension of the true underlying manifold. This observation invites an exploration of nonlocal manifold learning algorithms that attempt to discover shared structure in the tangent planes at different positions. A training criterion for such an algorithm is proposed, and experiments estimating a tangent plane prediction function are presented, showing its advantages with respect to local manifold learning algorithms: it is able to generalize very far from training data (on learning handwritten character image rotations), where local nonparametric methods fail.
"
2006,The K Best-Paths Approach to Approximate Dynamic Programming with Application to Portfolio Optimization.,"Abstract
We describe a general method to transform a non-markovian sequential decision problem into a supervised learning problem using a K-best-paths algorithm. We consider an application in financial portfolio management where we can train a controller to directly optimize a Sharpe Ratio (or other risk-averse non-additive) utility function. We illustrate the approach by demonstrating experimental results using a kernel-based controller architecture that would not normally be considered in traditional reinforcement learning or approximate dynamic programming."
2006,Greedy Layer-Wise Training of Deep Networks.,"Complexity theory of circuits strongly suggests that deep architectures can be much more ef cient (sometimes exponentially) than shallow architectures, in terms of computational elements required to represent some functions. Deep multi-layer neural networks have many levels of non-linearities allowing them to compactly represent highly non-linear and highly-varying functions. However, until recently it was not clear how to train such deep networks, since gradient-based optimization starting from random initialization appears to often get stuck in poor solutions. Hinton et al. recently introduced a greedy layer-wise unsupervised learning algorithm for Deep Belief Networks (DBN), a generative model with many layers of hidden causal variables. In the context of the above optimization problem, we study this algorithm empirically and explore variants to better understand its success and extend it to cases where the inputs are continuous or where the structure of the input distribution is not revealing enough about the variable to be predicted in a supervised task. Our experiments also confirm the hypothesis that the greedy layer-wise unsupervised training strategy mostly helps the optimization, by initializing weights in a region near a good local minimum, giving rise to internal distributed representations that are high-level abstractions of the input, bringing better generalization. "
2005,Efficient Non-Parametric Function Induction in Semi-Supervised Learning.,"There has been an increase of interest for semi-supervised learning recently, because of the many datasets with large amounts of unlabeled examples and only a few labeled ones. This paper follows up on proposed non-parametric algorithms which provide an estimated continuous label for the given unlabelled examples. First, it extends them to function induction algorithms that minimize a regularization criterion applied to an out-of-sample example, and happen to have the form of Parzen windows regressors. This allows to predict test labels without solving again a linear system of dimension n, which can cost O(n^3). Second, this function induction procedure gives rise to an efficient approximation of the training process, reducing the linear system to be solved to m << n unknowns, using only a subset of m examples. An improvement of O(n^2/m^2) in time can thus be obtained. Comparative experiments are presented, showing the good performance of the induction formula and approximation algorithm."
2005,Hierarchical Probabilistic Neural Network Language Model.,"In recent years, variants of a neural network architecture for statistical language modeling have been proposed and successfully applied, e.g. in the language modeling component of speech recognizers. The main advantage of these architectures is that they learn an embedding for words (or other symbols) in a continuous space that helps to smooth the language model and provide good generalization even when the number of training examples is insufficient. However, these models are extremely slow in comparison to the more commonly used n-gram models, both for training and recognition. As an alternative to an importance sampling method proposed to speed-up training, we introduce a hierarchical decomposition of the conditional probabilities that yields a speed-up of about 200 both during training and recognition. The hierarchical decomposition is a binary hierarchical clustering constrained by the prior knowledge extracted from the WordNet semantic hierarchy. "
2005,Greedy Spectral Embedding.,"Spectral dimensionality reduction methods and spectral clustering methods require computation of the principal eigenvectors of an n × n matrix where n is the number of examples. Following up on previously proposed techniques to speed-up kernel methods by focusing on a subset of m examples, we study a greedy selection procedure for this subset, based on the featurespace distance between a candidate example and the span of the previously chosen ones. In the case of kernel PCA or spectral clustering this reduces computation to O(m 2 n). For the same computational complexity, we can also compute the feature space projection of the non-selected examples on the subspace spanned by the selected examples, to estimate the embedding function based on all the data, which yields considerably better estimation of the embedding function. This algorithm can be formulated in an online setting and we can bound the error on the approximation of the Gram matrix."
2005,Semi-supervised Learning by Entropy Minimization.,"We consider the semi-supervised learning problem, where a decision rule is to be learned from labeled and unlabeled data. In this framework, we motivate minimum entropy regularization, which enables to incorporate unlabeled data in the standard supervised learning. Our approach includes other approaches to the semi-supervised problem as particular or limiting cases. A series of experiments illustrates that the proposed solution benefits from unlabeled data. The method challenges mixture models when the data are sampled from the distribution class spanned by the generative model. The performances are definitely in favor of minimum entropy regularization when generative models are misspecified, and the weighting of unlabeled data provides robustness to the violation of the ""cluster assumption"". Finally, we also illustrate that the method can also be far superior to manifold learning in high dimension spaces."
