2019,Equivalence of Equilibrium Propagation and Recurrent Backpropagation.,"Recurrent backpropagation and equilibrium propagation are supervised learning algorithms for fixed-point recurrent neural networks, which differ in their second phase. In the first phase, both algorithms converge to a fixed point that corresponds to the configuration where the prediction is made. In the second phase, equilibrium propagation relaxes to another nearby fixed point corresponding to smaller prediction error, whereas recurrent backpropagation uses a side network to compute error derivatives iteratively. In this work, we establish a close connection between these two algorithms. We show that at every moment in the second phase, the temporal derivatives of the neural activities in equilibrium propagation are equal to the error derivatives computed iteratively by recurrent backpropagation in the side network. This work shows that it is not required to have a side network for the computation of error derivatives and supports the hypothesis that in biological neural networks, temporal derivatives of neural activities may code for error signals.
"
2019,Gated Orthogonal Recurrent Units: On Learning to Forget.,"We present a novel recurrent neural network (RNN)–based model that combines the remembering ability of unitary evolution RNNs with the ability of gated RNNs to effectively forget redundant or irrelevant information in its memory. We achieve this by extending restricted orthogonal evolution RNNs with a gating mechanism similar to gated recurrent unit RNNs with a reset gate and an update gate. Our model is able to outperform long short-term memory, gated recurrent units, and vanilla unitary or orthogonal RNNs on several long-term-dependency benchmark tasks. We empirically show that both orthogonal and unitary RNNs lack the ability to forget. This ability plays an important role in RNNs. We provide competitive results along with an analysis of our model on many natural sequential tasks, including question answering, speech spectrum prediction, character-level language modeling, and synthetic tasks that involve long-term dependencies such as algorithmic, denoising, and copying tasks.
"
2019,Depth with nonlinearity creates no bad local minima in ResNets.,"Abstract
In this paper, we prove that depth with nonlinearity creates no bad local minima in a type of arbitrarily deep ResNets with arbitrary nonlinear activation functions, in the sense that the values of all local minima are no worse than the global minimum value of corresponding classical machine-learning models, and are guaranteed to further improve via residual representations. As a result, this paper provides an affirmative answer to an open question stated in a paper in the conference on Neural Information Processing Systems 2018. This paper advances the optimization theory of deep learning only for ResNets and not for other network architectures."
2019,Towards Non-Saturating Recurrent Units for Modelling Long-Term Dependencies.,"Abstract
Modelling long-term dependencies is a challenge for recurrent neural networks. This is primarily due to the fact that gradients vanish during training, as the sequence length increases. Gradients can be attenuated by transition operators and are attenuated or dropped by activation functions. Canonical architectures like LSTM alleviate this issue by skipping information through a memory mechanism. We propose a new recurrent architecture (Non-saturating Recurrent Unit; NRU) that relies on a memory mechanism but forgoes both saturating activation functions and saturating gates, in order to further alleviate vanishing gradients. In a series of synthetic and real world tasks, we demonstrate that the proposed model is the only model that performs among the top 2 models across all tasks with and without long-term dependencies, when compared against a range of other architectures."
2019,Combined Reinforcement Learning via Abstract Representations.,"In the quest for efficient and robust reinforcement learning methods, both model-free and model-based approaches offer advantages. In this paper we propose a new way of explicitly bridging both approaches via a shared low-dimensional learned encoding of the environment, meant to capture summarizing abstractions. We show that the modularity brought by this approach leads to good generalization while being computationally efficient, with planning happening in a smaller latent state space. In addition, this approach recovers a sufficient low-dimensional representation of the environment, which opens up new strategies for interpretable AI, exploration and transfer learning.
"
2019,Do Neural Dialog Systems Use the Conversation History Effectively? An Empirical Study.,"Abstract
Neural generative models have been become increasingly popular when building conversational agents. They offer flexibility, can be easily adapted to new domains, and require minimal domain engineering. A common criticism of these systems is that they seldom understand or use the available dialog history effectively. In this paper, we take an empirical approach to understanding how these models use the available dialog history by studying the sensitivity of the models to artificially introduced unnatural changes or perturbations to their context at test time. We experiment with 10 different types of perturbations on 4 multi-turn dialog datasets and find that commonly used neural dialog architectures like recurrent and transformer-based seq2seq models are rarely sensitive to most perturbations such as missing or reordering utterances, shuffling words, etc. Also, by open-sourcing our code, we believe that it will serve as a useful diagnostic tool for evaluating dialog systems in the future."
2019,Interpolated Adversarial Training: Achieving Robust Neural Networks Without Sacrificing Too Much Accuracy.,"Adversarial robustness has become a central goal in deep learning, both in theory and in practice. However, successful methods to improve the adversarial robustness (such as adversarial training) greatly hurt generalization performance on the unperturbed data. This could have a major impact on how achieving adversarial robustness affects real world systems (i.e. many may opt to forego robustness if it can improve accuracy on the unperturbed data). We propose Interpolated Adversarial Training, which employs recently proposed interpolation based training methods in the framework of adversarial training. On CIFAR-10, adversarial training increases the standard test error (when there is no adversary) from 4.43% to 12.32%, whereas with our Interpolated adversarial training we retain adversarial robustness while achieving a standard test error of only 6.45%. With our technique, the relative increase in the standard error for the robust model is reduced from 178.1% to just 45.5%.
"
2019,Interactive Language Learning by Question Answering.,"Abstract
Humans observe and interact with the world to acquire knowledge. However, most existing machine reading comprehension (MRC) tasks miss the interactive, information-seeking component of comprehension. Such tasks present models with static documents that contain all necessary information, usually concentrated in a single short substring. Thus, models can achieve strong performance through simple word- and phrase-based pattern matching. We address this problem by formulating a novel text-based question answering task: Question Answering with Interactive Text (QAit). In QAit, an agent must interact with a partially observable text-based environment to gather information required to answer questions. QAit poses questions about the existence, location, and attributes of objects found in the environment. The data is built using a text-based game generator that defines the underlying dynamics of interaction with the environment. We propose and evaluate a set of baseline models for the QAit task that includes deep reinforcement learning agents. Experiments show that the task presents a major challenge for machine reading systems, while humans solve it with relative ease."
2019,How Transferable Are Features in Convolutional Neural Network Acoustic Models across Languages?,"Abstract:
Characterization of the representations learned in intermediate layers of deep networks can provide valuable insight into the nature of a task and can guide the development of well-tailored learning strategies. Here we study convolutional neural network (CNN)-based acoustic models in the context of automatic speech recognition. Adapting a method proposed by [1], we measure the transferability of each layer between English, Dutch and German to assess their language-specificity. We observed three distinct regions of transferability: (1) the first two layers were entirely transferable between languages, (2) layers 2-8 were also highly transferable but we found some evidence of language specificity, (3) the subsequent fully connected layers were more language specific but could be successfully finetuned to the target language. To further probe the effect of weight freezing, we performed follow-up experiments using freeze-training [2]. Our results are consistent with the observation that CNNs converge `bottom up' during training and demonstrate the benefit of freeze training, especially for transfer learning."
2019,A Highly Adaptive Acoustic Model for Accurate Multi-dialect Speech Recognition.,"Abstract:
Despite the success of deep learning in speech recognition, multi-dialect speech recognition remains a difficult problem. Although dialect-specific acoustic models are known to perform well in general, they are not easy to maintain when dialect-specific data is scarce and the number of dialects for each language is large. Therefore, a single unified acoustic model (AM) that generalizes well for many dialects has been in demand. In this paper, we propose a novel acoustic modeling technique for accurate multi-dialect speech recognition with a single AM. Our proposed AM is dynamically adapted based on both dialect information and its internal representation, which results in a highly adaptive AM for handling multiple dialects simultaneously. We also propose a simple but effective training method to deal with unseen dialects. The experimental results on large scale speech datasets show that the proposed AM outperforms all the previous ones, reducing word error rates (WERs) by 8.11% relative compared to a single all-dialects AM and by 7.31% relative compared to dialect-specific AMs."
2019,Representation Mixing for TTS Synthesis.,"Abstract:
Recent character and phoneme-based parametric TTS systems using deep learning have shown strong performance in natural speech generation. However, the choice between character or phoneme input can create serious limitations for practical deployment, as direct control of pronunciation is crucial in certain cases. We demonstrate a simple method for combining multiple types of linguistic information in a single encoder, named representation mixing, enabling flexible choice between character, phoneme, or mixed representations during inference. Experiments and user studies on a public audiobook corpus show the efficacy of our approach."
2019,The Pytorch-kaldi Speech Recognition Toolkit.,"Abstract:
The availability of open-source software is playing a remarkable role in the popularization of speech recognition and deep learning. Kaldi, for instance, is nowadays an established framework used to develop state-of-the-art speech recognizers. PyTorch is used to build neural networks with the Python language and has recently spawn tremendous interest within the machine learning community thanks to its simplicity and flexibility. The PyTorch-Kaldi project aims to bridge the gap between these popular toolkits, trying to inherit the efficiency of Kaldi and the flexibility of PyTorch. PyTorch-Kaldi is not only a simple interface between these software, but it embeds several useful features for developing modern speech recognizers. For instance, the code is specifically designed to naturally plug-in user-defined acoustic models. As an alternative, users can exploit several pre-implemented neural networks that can be customized using intuitive configuration files. PyTorch-Kaldi supports multiple feature and label streams as well as combinations of neural networks, enabling the use of complex neural architectures. The toolkit is publicly-released along with a rich documentation and is designed to properly work locally or on HPC clusters. Experiments, that are conducted on several datasets and tasks, show that PyTorch-Kaldi can effectively be used to develop modern state-of-the-art speech recognizers."
2019,BabyAI: A Platform to Study the Sample Efficiency of Grounded Language Learning.,"Allowing humans to interactively train artificial agents to understand language instructions is desirable for both practical and scientific reasons.  Though, given  the lack of sample efficiency in current learning methods, reaching this goal may require substantial research efforts. We introduce the BabyAI research platform, with the goal of supporting investigations towards including humans in the loop for grounded language learning. The BabyAI platform comprises an extensible suite of 19 levels of increasing difficulty. Each level gradually leads the agent towards acquiring a combinatorially rich synthetic language, which is a proper subset of English. The platform also provides a hand-crafted bot agent, which simulates a human teacher.  We report estimated amount of supervision required for training neural reinforcement and behavioral-cloning agents on some BabyAI levels. We put forward strong evidence that current deep learning methods are not yet sufficiently sample-efficient in the context of learning a language with compositional properties."
2019,Adversarial Domain Adaptation for Stable Brain-Machine Interfaces.,"Brain-Machine Interfaces (BMIs) have recently emerged as a clinically viable option
to restore voluntary movements after paralysis. These devices are based on the
ability to extract information about movement intent from neural signals recorded
using multi-electrode arrays chronically implanted in the motor cortices of the
brain. However, the inherent loss and turnover of recorded neurons requires repeated
recalibrations of the interface, which can potentially alter the day-to-day
user experience. The resulting need for continued user adaptation interferes with
the natural, subconscious use of the BMI. Here, we introduce a new computational
approach that decodes movement intent from a low-dimensional latent representation
of the neural data. We implement various domain adaptation methods
to stabilize the interface over significantly long times. This includes Canonical
Correlation Analysis used to align the latent variables across days; this method
requires prior point-to-point correspondence of the time series across domains.
Alternatively, we match the empirical probability distributions of the latent variables
across days through the minimization of their Kullback-Leibler divergence.
These two methods provide a significant and comparable improvement in the performance
of the interface. However, implementation of an Adversarial Domain
Adaptation Network trained to match the empirical probability distribution of the
residuals of the reconstructed neural signals outperforms the two methods based
on latent variables, while requiring remarkably few data points to solve the domain
adaptation problem."
2019,Recall Traces: Backtracking Models for Efficient Reinforcement Learning.,"In many environments only a tiny subset of all states yield high reward.  In these cases, few of the interactions with the environment provide a relevant learning signal. Hence, we may want to preferentially train on those high-reward states and the probable trajectories leading to them. 
To this end, we advocate for the use of a \textit{backtracking model} that predicts the preceding states that terminate at a given high-reward state.  We can train a model which, starting from a high value state (or one that is estimated to have high value), predicts and samples which (state, action)-tuples may have led to that high value state. These traces of (state, action) pairs, which we refer to as Recall Traces, sampled from this backtracking model starting from a high value state, are informative as they terminate in good states, and hence we can use these traces to improve a policy. We provide a variational interpretation for this idea and a practical algorithm in which the backtracking model samples from an approximate posterior distribution over trajectories which lead to large rewards. Our method improves the sample efficiency of both on- and off-policy RL algorithms across several environments and tasks.  "
2019,InfoBot: Transfer and Exploration via the Information Bottleneck.,"A central challenge in reinforcement learning is discovering effective policies for tasks where rewards are sparsely distributed. We postulate that in the absence of useful reward signals, an effective exploration strategy should seek out {\it decision states}. These states lie at critical junctions in the state space from where the agent can transition to new, potentially unexplored regions. We propose to learn about decision states from prior experience. By training a goal-conditioned model with an information bottleneck, we can identify decision states by examining where the model accesses the goal state through the bottleneck. We find that this simple mechanism effectively identifies decision states, even in partially observed settings. In effect, the model learns the sensory cues that correlate with potential subgoals. In new environments, this model can then identify novel subgoals for further exploration, guiding the agent through a sequence of potential decision  states and through new regions of the state space."
2019,Learning deep representations by mutual information estimation and maximization.,"This work investigates unsupervised learning of representations by maximizing mutual information between an input and the output of a deep neural network encoder. Importantly, we show that structure matters: incorporating knowledge about locality in the input into the objective can significantly improve a representation's suitability for downstream tasks. We further control characteristics of the representation by matching to a prior distribution adversarially. Our method, which we call Deep InfoMax (DIM), outperforms a number of popular unsupervised learning methods and compares favorably with fully-supervised learning on several classification tasks in with some standard architectures. DIM opens new avenues for unsupervised learning of representations and is an important step towards flexible formulations of representation learning objectives for specific end-goals."
2019,On the Relation Between the Sharpest Directions of DNN Loss and the SGD Step Length.,"The training of deep neural networks with Stochastic Gradient Descent (SGD) with a large learning rate or a small batch-size typically ends in flat regions of the weight space, as indicated by small eigenvalues of the Hessian of the training loss. This was found to correlate with a good final generalization performance.  In this paper we extend previous work by investigating the curvature of the loss surface along the whole training trajectory, rather than only at the endpoint. We find that initially SGD visits increasingly sharp regions, reaching a maximum sharpness determined by both the learning rate and the batch-size of SGD. At this peak value SGD starts to fail to minimize the loss along directions in the loss surface corresponding to the largest curvature (sharpest directions). To further investigate the effect of these dynamics in the training process, we study a variant of SGD using a reduced learning rate along the sharpest directions which we show can improve training speed while finding both sharper and better generalizing solution, compared to vanilla SGD. Overall, our results show that the SGD dynamics in the subspace of the sharpest directions influence the regions that SGD steers to (where larger learning rate or smaller batch size result in wider regions visited), the overall training speed, and the generalization ability of the final model."
2019,h-detach: Modifying the LSTM Gradient Towards Better Optimization.,"Recurrent neural networks are known for their notorious exploding and vanishing gradient problem (EVGP). This problem becomes more evident in tasks where the information needed to correctly solve them exist over long time scales, because EVGP prevents important gradient components from being back-propagated adequately over a large number of steps. We introduce a simple stochastic algorithm (\textit{h}-detach) that is specific to LSTM optimization and targeted towards addressing this problem. Specifically, we show that when the LSTM weights are large, the gradient components through the linear path (cell state) in the LSTM computational graph get suppressed. Based on the hypothesis that these components carry information about long term dependencies (which we show empirically), their suppression can prevent LSTMs from capturing them. Our algorithm\footnote{Our code is available at https://github.com/bhargav104/h-detach.} prevents gradients flowing through this path from getting suppressed, thus allowing the LSTM to capture such dependencies better. We show significant improvements over vanilla LSTM gradient based training in terms of convergence speed, robustness to seed and learning rate, and generalization using our modification of LSTM gradient on various benchmark datasets."
2019,Modeling the Long Term Future in Model-Based Reinforcement Learning.,"In model-based reinforcement learning, the agent interleaves between model learning and planning.  These two components are  inextricably intertwined. If the model is not able to provide sensible long-term prediction, the executed planer would exploit model flaws, which can yield catastrophic failures. This paper focuses on building a model that reasons about the long-term future and demonstrates how to use this for efficient planning and exploration. To this end, we build a latent-variable autoregressive model by leveraging recent ideas in variational inference. We argue that forcing latent variables to carry future information through an auxiliary task substantially improves long-term predictions. Moreover, by planning in the latent space, the planner's solution is ensured to be within regions where the model is valid. An exploration strategy can be devised by searching for unlikely trajectories under the model. Our methods achieves higher reward faster compared to baselines on a variety of tasks and environments in both the imitation learning and model-based reinforcement learning settings. "
2019,Quaternion Recurrent Neural Networks.,"Recurrent neural networks (RNNs) are powerful architectures to model sequential data, due to their capability to learn short and long-term dependencies between the basic elements of a sequence. Nonetheless, popular tasks such as speech or images recognition, involve multi-dimensional input features that are characterized by strong internal dependencies between the dimensions of the input vector. We propose a novel quaternion recurrent neural network (QRNN), alongside with a quaternion long-short term memory neural network (QLSTM), that take into account both the external relations and these internal structural dependencies with the quaternion algebra. Similarly to capsules, quaternions allow the QRNN to code internal dependencies by composing and processing multidimensional features as single entities, while the recurrent operation reveals correlations between the elements composing the sequence. We show that both QRNN and QLSTM achieve better performances than RNN and LSTM in a realistic application of automatic speech recognition. Finally, we show that QRNN and QLSTM reduce by a maximum factor of 3.3x the number of free parameters needed, compared to real-valued RNNs and LSTMs to reach better results, leading to a more compact representation of the relevant information."
2019,Probabilistic Planning with Sequential Monte Carlo methods.,"In this work, we propose a novel formulation of planning which views it as a probabilistic inference problem over future optimal trajectories. This enables us to use sampling methods, and thus, tackle planning in continuous domains using a fixed computational budget.   We design a new algorithm,  Sequential Monte Carlo Planning, by leveraging classical methods in Sequential Monte Carlo and Bayesian smoothing in the context of control as inference. Furthermore, we show that Sequential Monte Carlo Planning can capture multimodal policies and can quickly learn continuous control tasks."
2019,An Empirical Study of Example Forgetting during Deep Neural Network Learning.,"Inspired by the phenomenon of catastrophic forgetting, we investigate the learning dynamics of neural networks as they train on single classification tasks. Our goal is to understand whether a related phenomenon occurs when data does not undergo a clear distributional shift. We define a ``forgetting event'' to have occurred when an individual training example transitions from being classified correctly to incorrectly over the course of learning. Across several benchmark data sets, we find that: (i) certain examples are forgotten with high frequency, and some not at all; (ii) a data set's (un)forgettable examples generalize across neural architectures; and (iii) based on forgetting dynamics, a significant fraction of examples can be omitted from the training data set while still maintaining state-of-the-art generalization performance."
