2017,Plug & Play Generative Networks: Conditional Iterative Generation of Images in Latent Space.,"Abstract:
Generating high-resolution, photo-realistic images has been a long-standing goal in machine learning. Recently, Nguyen et al. [37] showed one interesting way to synthesize novel images by performing gradient ascent in the latent space of a generator network to maximize the activations of one or multiple neurons in a separate classifier network. In this paper we extend this method by introducing an additional prior on the latent code, improving both sample quality and sample diversity, leading to a state-of-the-art generative model that produces high quality images at higher resolutions (227 Ã— 227) than previous generative models, and does so for all 1000 ImageNet categories. In addition, we provide a unified probabilistic interpretation of related activation maximization methods and call the general class of models Plug and Play Generative Networks. PPGNs are composed of 1) a generator network G that is capable of drawing a wide range of image types and 2) a replaceable condition network C that tells the generator what to draw. We demonstrate the generation of images conditioned on a class (when C is an ImageNet or MIT Places classification network) and also conditioned on a caption (when C is an image captioning network). Our method also improves the state of the art of Multifaceted Feature Visualization [40], which generates the set of synthetic inputs that activate a neuron in order to better understand how deep neural networks operate. Finally, we show that our model performs reasonably well at the task of image inpainting. While image models are used in this paper, the approach is modality-agnostic and can be applied to many types of data."
2017,On random weights for texture generation in one layer CNNS.,"Abstract:
Recent work in the literature has shown experimentally that one can use the lower layers of a trained convolutional neural network (CNN) to model natural textures. More interestingly, it has also been experimentally shown that only one layer with random filters can also model textures although with less variability. In this paper we ask the question as to why one layer CNNs with random filters are so effective in generating textures? We theoretically show that one layer convolutional architectures (without a non-linearity) paired with the an energy function used in previous literature, can in fact preserve and modulate frequency coefficients in a manner so that random weights and pretrained weights will generate the same type of images. Based on the results of this analysis we question whether similar properties hold in the case where one uses one convolution layer with a non-linearity. We show that in the case of ReLu non-linearity there are situations where only one input will give the minimum possible energy whereas in the case of no nonlinearity, there are always infinite solutions that will give the minimum possible energy. Thus we can show that in certain situations adding a ReLu non-linearity generates less variable images."
2017,A network of deep neural networks for Distant Speech Recognition.,"Abstract:
Despite the remarkable progress recently made in distant speech recognition, state-of-the-art technology still suffers from a lack of robustness, especially when adverse acoustic conditions characterized by non-stationary noises and reverberation are met. A prominent limitation of current systems lies in the lack of matching and communication between the various technologies involved in the distant speech recognition process. The speech enhancement and speech recognition modules are, for instance, often trained independently. Moreover, the speech enhancement normally helps the speech recognizer, but the output of the latter is not commonly used, in turn, to improve the speech enhancement. To address both concerns, we propose a novel architecture based on a network of deep neural networks, where all the components are jointly trained and better cooperate with each other thanks to a full communication scheme between them. Experiments, conducted using different datasets, tasks and acoustic conditions, revealed that the proposed framework can overtake other competitive solutions, including recent joint training approaches."
2017,Count-ception: Counting by Fully Convolutional Redundant Counting.,"Abstract:
Counting objects in digital images is a process that should be replaced by machines. This tedious task is time consuming and prone to errors due to fatigue of human annotators. The goal is to have a system that takes as input an image and returns a count of the objects inside and justification for the prediction in the form of object localization. We repose a problem, originally posed by Lempitsky and Zisserman, to instead predict a count map which contains redundant counts based on the receptive field of a smaller regression network. The regression network predicts a count of the objects that exist inside this frame. By processing the image in a fully convolutional way each pixel is going to be accounted for some number of times, the number of windows which include it, which is the size of each window, (i.e., 32x32 = 1024). To recover the true count we take the average over the redundant predictions. Our contribution is redundant counting instead of predicting a density map in order to average over errors. We also propose a novel deep neural network architecture adapted from the Inception family of networks called the Count-ception network. Together our approach results in a 20% relative improvement (2.9 to 2.3 MAE) over the state of the art method by Xie, Noble, and Zisserman in 2016."
2017,Understanding intermediate layers using linear classifier probes.,"Neural network models have a reputation for being black boxes.
We propose a new method to better understand the roles and dynamics
of the intermediate layers.

Our method uses linear classifiers, referred to as ""probes"",
where a probe can only use the hidden units of a given intermediate layer
as discriminating features.
Moreover, these probes cannot affect the training phase of a model,
and they are generally added after training.

We demonstrate how this can be used to develop a better intuition
about models and to diagnose potential problems."
2017,An Actor-Critic Algorithm for Sequence Prediction.,"We present an approach to training neural networks to generate sequences using actor-critic methods from reinforcement learning (RL). Current log-likelihood training methods are limited by the discrepancy between their training and testing modes, as models must generate tokens conditioned on their previous guesses rather than the ground-truth tokens. We address this problem by introducing a textit{critic} network that is trained to predict the value of an output token, given the policy of an textit{actor} network. This results in a training procedure that is much closer to the test phase, and allows us to directly optimize for a task-specific score such as BLEU. Crucially, since we leverage these techniques in the supervised learning setting rather than the traditional RL setting, we condition the critic network on the ground-truth output. We show that our method leads to improved performance on both a synthetic task, and for German-English machine translation. Our analysis paves the way for such methods to be applied in natural language generation tasks, such as machine translation, caption generation, and dialogue modelling. "
2017,Mode Regularized Generative Adversarial Networks.,"Although Generative Adversarial Networks achieve state-of-the-art results on a
variety of generative tasks, they are regarded as highly unstable and prone to miss
modes. We argue that these bad behaviors of GANs are due to the very particular
functional shape of the trained discriminators in high dimensional spaces, which
can easily make training stuck or push probability mass in the wrong direction,
towards that of higher concentration than that of the data generating distribution.
We introduce several ways of regularizing the objective, which can dramatically
stabilize the training of GAN models. We also show that our regularizers can help
the fair distribution of probability mass across the modes of the data generating
distribution during the early phases of training, thus providing a unified solution
to the missing modes problem."
2017,Hierarchical Multiscale Recurrent Neural Networks.,"Learning both hierarchical and temporal representation has been among the long- standing challenges of recurrent neural networks. Multiscale recurrent neural networks have been considered as a promising approach to resolve this issue, yet there has been a lack of empirical evidence showing that this type of models can actually capture the temporal dependencies by discovering the latent hierarchical structure of the sequence. In this paper, we propose a novel multiscale approach, called the hierarchical multiscale recurrent neural network, that can capture the latent hierarchical structure in the sequence by encoding the temporal dependencies with different timescales using a novel update mechanism. We show some evidence that the proposed model can discover underlying hierarchical structure in the sequences without using explicit boundary information. We evaluate our proposed model on character-level language modelling and handwriting sequence generation."
2017,Mollifying Networks.,"The optimization of deep neural networks can be more challenging than the traditional convex optimization problems due to highly non-convex nature of the loss function, e.g. it can involve pathological landscapes such as saddle-surfaces that can be difficult to escape from for algorithms based on simple gradient descent. In this paper, we attack the problem of optimization of highly non-convex neural networks objectives by starting with a smoothed -- or mollified -- objective function which becomes more complex as the training proceeds.  Our proposition is inspired by the recent studies in continuation methods: similarly to curriculum methods, we begin by learning an easier (possibly convex) objective function and let it evolve during training until it eventually becomes the original, difficult to optimize objective function. The complexity of the mollified networks is controlled by a single hyperparameter that is annealed during training. We show improvements on various difficult optimization tasks and establish a relationship between recent works on continuation methods for neural networks and mollifiers."
2017,Zoneout: Regularizing RNNs by Randomly Preserving Hidden Activations.,"We propose zoneout, a novel method for regularizing RNNs.
At each timestep, zoneout stochastically forces some hidden units to maintain their previous values.
Like dropout, zoneout uses random noise to train a pseudo-ensemble, improving generalization.
But by preserving instead of dropping hidden units, gradient information and state information are more readily propagated through time, as in feedforward stochastic depth networks.
We perform an empirical investigation of various RNN regularizers, and find that zoneout gives significant performance improvements across tasks. We achieve competitive results with relatively simple models in character- and word-level language modelling on the Penn Treebank and Text8 datasets, and combining with recurrent batch normalization yields state-of-the-art results on permuted sequential MNIST."
2017,A Structured Self-Attentive Sentence Embedding.,"This paper proposes a new model for extracting an interpretable sentence embedding by introducing self-attention. Instead of using a vector, we use a 2-D matrix to represent the embedding, with each row of the matrix attending on a different part of the sentence. We also propose a self-attention mechanism and a special regularization term for the model. As a side effect, the embedding comes with an easy way of visualizing what specific parts of the sentence are encoded into the embedding. We evaluate our model on 3 different tasks: author profiling, sentiment classification and textual entailment. Results show that our model yields a significant performance gain compared to other sentence embedding methods in all of the 3 tasks."
2017,Towards an automatic Turing test: Learning to evaluate dialogue responses.,"Automatically evaluating the quality of dialogue responses for unstructured domains is a challenging problem.   Unfortunately,  existing automatic evaluation metrics are biased and correlate very poorly with human judgements of response quality (Liu et al., 2016). Yet having an accurate automatic evaluation procedure is crucial for dialogue research, as it allows rapid prototyping and testing of new models with fewer expensive human evaluations. In response to this challenge, we formulate automatic dialogue evaluation as a learning problem. We present an evaluation model (ADEM) that learns to predict human-like scores to input responses, using a new dataset of human response scores. We show that the ADEM modelâ€™s predictions correlate significantly, and at level much higher than word-overlap metrics such as BLEU, with human judgements at both the utterance and system-level.We also show that ADEM can generalize to evaluating dialogue models unseen during training, an important step for automatic dialogue evaluation."
2017,SampleRNN: An Unconditional End-to-End Neural Audio Generation Model.,"In this paper we propose a novel model for unconditional audio generation task that generates one audio sample at a time. We show that our model which profits from combining memory-less modules, namely autoregressive multilayer perceptron, and stateful recurrent neural networks in a hierarchical structure is de facto powerful to capture the underlying sources of variations in temporal domain for very long time on three datasets of different nature. Human evaluation on the generated samples indicate that our model is preferred over competing models. We also show how each component of the model contributes to the exhibited performance."
2017,Generalizable Features From Unsupervised Learning.,"Humans learn a predictive model of the world and use this model to reason about future events and the consequences of actions. In contrast to most machine predictors, we exhibit an impressive ability to generalize to unseen scenarios and reason intelligently in these settings.  One important aspect of this ability is physical intuition(Lake et al., 2016). In this work, we explore the potential of unsupervised learning to find features that promote better generalization to settings outside the supervised training distribution.  Our task is predicting the stability of towers of square blocks. We demonstrate that an unsupervised model, trained to predict future frames of a video sequence of stable and unstable block configurations, can yield features that support extrapolating stability prediction to blocks configurations outside the training set distribution"
2017,Diet Networks: Thin Parameters for Fat Genomics.,"Learning tasks such as those involving genomic data often poses a serious challenge: the number of input features can be orders of magnitude larger than the number of training examples, making it difficult to avoid overfitting, even when using the known regularization techniques. We focus here on tasks in which the input is a description of the genetic variation specific to a patient, the single nucleotide polymorphisms (SNPs), yielding millions of ternary inputs. Improving the ability of deep learning to handle such datasets could have an important impact in medical research, more specifically in precision medicine, where high-dimensional data regarding a particular patient is used to make predictions of interest. Even though the amount of data for such tasks is increasing, this mismatch between the number of examples and the number of inputs remains a concern. Naive implementations of classifier neural networks involve a huge number of free parameters in their first layer (number of input features times number of hidden units): each input feature is associated with as many parameters as there are hidden units. We propose a novel neural network parametrization which considerably reduces the number of free parameters. It is based on the idea that we can first learn or provide a distributed representation for each input feature (e.g. for each position in the genome where variations are observed in data), and then learn (with another neural network called the parameter prediction network) how to map a feature's distributed representation (based on the feature's identity not its value) to the vector of parameters specific to that feature in the classifier neural network (the weights which link the value of the feature to each of the hidden units). This approach views the problem of producing the parameters associated with each feature as a multi-task learning problem. We show experimentally on a population stratification task of interest to medical studies that the proposed approach can significantly reduce both the number of parameters and the error rate of the classifier."
2017,Char2Wav: End-to-End Speech Synthesis.,"We present Char2Wav, an end-to-end model for speech synthesis. Char2Wav has two components: a reader and a neural vocoder. The reader is an encoder-decoder model with attention. The encoder is a bidirectional recurrent neural network that accepts text or phonemes as inputs, while the decoder is a recurrent neural network (RNN) with attention that produces vocoder acoustic features. Neural vocoder refers to a conditional extension of SampleRNN which generates raw waveform samples from intermediate representations. Unlike traditional models for speech synthesis, Char2Wav learns to produce audio directly from text."
2017,Improving Generative Adversarial Networks with Denoising Feature Matching.,"We propose an augmented training procedure for generative adversarial networks designed to address shortcomings of the original by directing the generator towards probable configurations of abstract discriminator features. We estimate and track the distribution of these features, as computed from data, with a denoising auto-encoder, and use it to propose high-level targets for the generator. We combine this new loss with the original and evaluate the hybrid criterion on the task of unsupervised image synthesis from datasets comprising a diverse set of visual categories, noting a qualitative and quantitative improvement in the ``objectness'' of the resulting samples."
2017,A Closer Look at Memorization in Deep Networks.,"We examine the role of memorization in deep learning, drawing connections to capacity, generalization, and adversarial robustness. While deep networks are capable of memorizing noise data, our results suggest that they tend to prioritize learning simple patterns first. In our experiments, we expose qualitative differences in gradient-based optimization of deep neural networks (DNNs) on noise vs.~real data. We also demonstrate that for appropriately tuned explicit regularization (e.g.,~dropout) we can degrade DNN training performance on noise datasets without compromising generalization on real data. Our analysis suggests that the notions of effective capacity which are dataset independent are unlikely to explain the generalization performance of deep networks when trained with gradient based methods because training data itself plays an important role in determining the degree of memorization."
2017,Sharp Minima Can Generalize For Deep Nets.,"Despite their overwhelming capacity to overfit, deep learning architectures tend to generalize relatively well to unseen data, allowing them to be deployed in practice. However, explaining why this is the case is still an open area of research. One standing hypothesis that is gaining popularity, e.g.\ Hochreiter \& Schmidhuber (1997); Keskar et al.\ (2017), is that the flatness of minima of the loss function found by stochastic gradient based methods results in good generalization. This paper argues that most notions of flatness are problematic for deep models and can not be directly applied to explain generalization. Specifically, when focusing on deep networks with rectifier units, we can exploit the particular geometry of parameter space induced by the inherent symmetries that these architectures exhibit to build equivalent models corresponding to arbitrarily sharper minima. Or, depending on the definition of flatness, it is the same for any given minimum. Furthermore, if we allow to reparametrize a function, the geometry of its parameters can change drastically without affecting its generalization properties."
2017,A robust adaptive stochastic gradient method for deep learning.,"Abstract:
Stochastic gradient algorithms are the main focus of large-scale optimization problems and led to important successes in the recent advancement of the deep learning algorithms. The convergence of SGD depends on the careful choice of learning rate and the amount of the noise in stochastic estimates of the gradients. In this paper, we propose an adaptive learning rate algorithm, which utilizes stochastic curvature information of the loss function for automatically tuning the learning rates. The information about the element-wise curvature of the loss function is estimated from the local statistics of the stochastic first order gradients. We further propose a new variance reduction technique to speed up the convergence. In our experiments with deep neural networks, we obtained better performance compared to the popular stochastic gradient algorithms."
2017,Improving Speech Recognition by Revising Gated Recurrent Units.,"Speech recognition is largely taking advantage of deep learning, showing that substantial benefits can be obtained by modern Recurrent Neural Networks (RNNs). The most popular RNNs are Long Short-Term Memory (LSTMs), which typically reach state-of-the-art performance in many tasks thanks to their ability to learn long-term dependencies and robustness to vanishing gradients. Nevertheless, LSTMs have a rather complex design with three multiplicative gates, that might impair their efficient implementation. An attempt to simplify LSTMs has recently led to Gated Recurrent Units (GRUs), which are based on just two multiplicative gates.

This paper builds on these efforts by further revising GRUs and proposing a simplified architecture potentially more suitable for speech recognition. The contribution of this work is two-fold. First, we suggest to remove the reset gate in the GRU design, resulting in a more efficient single-gate architecture. Second, we propose to replace tanh with ReLU activations in the state update equations. Results show that, in our implementation, the revised architecture reduces the per-epoch training time with more than 30% and consistently improves recognition performance across different tasks, input features, and noisy conditions when compared to a standard GRU."
2017,Dynamic Layer Normalization for Adaptive Neural Acoustic Modeling in Speech Recognition.,"Layer normalization is a recently introduced technique for normalizing the activities of neurons in deep neural networks to improve the training speed and stability. In this paper, we introduce a new layer normalization technique called Dynamic Layer Normalization (DLN) for adaptive neural acoustic modeling in speech recognition. By dynamically generating the scaling and shifting parameters in layer normalization, DLN adapts neural acoustic models to the acoustic variability arising from various factors such as speakers, channel noises, and environments. Unlike other adaptive acoustic models, our proposed approach does not require additional adaptation data or speaker information such as i-vectors. Moreover, the model size is fixed as it dynamically generates adaptation parameters. We apply our proposed DLN to deep bidirectional LSTM acoustic models and evaluate them on two benchmark datasets for large vocabulary ASR experiments: WSJ and TED-LIUM release 2. The experimental results show that our DLN improves neural acoustic models in terms of transcription accuracy by dynamically adapting to various speakers and environments.
"
2017,Towards more hardware-friendly deep learning.,n/a
